"","file_id","newspaper_name1","news_address","news_location.lon","news_location.lat","city1","newspaper_state","date","year","month","day","page","URL","lynch_address1","lynch_address2","lynch_address3","city_lynch1","state_lynch1","city_lynch2","state_lynch2","city_lynch3","state_lynch3","Comments or notes?","index","sn","lynching1.lon","lynching1.lat","lynching2.lon","lynching2.lat","lynching3.lon","lynching3.lat"
"1", 8126,"The Houston daily post ","Houston, Texas", -95.36980, 29.760427,"Houston","Texas","8/25/1897",1897, 8,25,"seq-5","https://articleextractor.org/pages/8126/txdn_delta_ver01/sn86071197/1897/08/25/ed-1/seq-5/1","Abbeyville, AL","Sealy, TX","NA, NA","Abbeyville","AL","Sealy","TX",NA,NA,NA,2485,"sn86071197", -85.250489,  31.571835, -96.15718,  29.78079,NA,NA
"2", 8126,"The Houston daily post ","Houston, Texas", -95.36980, 29.760427,"Houston","Texas","8/25/1897",1897, 8,25,"seq-5","https://articleextractor.org/pages/8126/txdn_delta_ver01/sn86071197/1897/08/25/ed-1/seq-5/1","Abbeyville, AL","Sealy, TX","NA, NA","Abbeyville","AL","Sealy","TX",NA,NA,NA,2485,"sn86071197", -85.250489,  31.571835, -96.15718,  29.78079,NA,NA
"3", 8127,"Evening journal ","Wilmington, Delaware", -75.54839, 39.744655,"Wilmington","Delaware","6/25/1912",1912, 6,25,"seq-7","https://articleextractor.org/pages/8127/deu_edgemoor_ver01/sn85042354/1912/06/25/ed-1/seq-7/1","Pinehurst, GA","NA, NA","NA, NA","Pinehurst","GA",NA,NA,NA,NA,NA,2486,"sn85042354", -83.762953,  32.195997,NA,NA,NA,NA
"4", 8127,"Evening journal ","Wilmington, Delaware", -75.54839, 39.744655,"Wilmington","Delaware","6/25/1912",1912, 6,25,"seq-7","https://articleextractor.org/pages/8127/deu_edgemoor_ver01/sn85042354/1912/06/25/ed-1/seq-7/1","Pinehurst, GA","NA, NA","NA, NA","Pinehurst","GA",NA,NA,NA,NA,NA,2486,"sn85042354", -83.762953,  32.195997,NA,NA,NA,NA
"5", 8129,NA,"NA, Maryland", -76.64127, 39.045755,NA,"Maryland","2/7/1896",1896, 2, 7,"seq-6","https://articleextractor.org/pages/8129/mdu_frederick_ver03/sn89060092/1896/02/07/ed-1/seq-6/1","Frederick, MD","NA, NA","NA, NA","Frederick","MD",NA,NA,NA,NA,NA,2487,"sn89060092", -77.410541,  39.414269,NA,NA,NA,NA
"6", 8129,NA,"NA, Maryland", -76.64127, 39.045755,NA,"Maryland","2/7/1896",1896, 2, 7,"seq-6","https://articleextractor.org/pages/8129/mdu_frederick_ver03/sn89060092/1896/02/07/ed-1/seq-6/1","Fredrick, MD","NA, NA","NA, NA","Fredrick","MD",NA,NA,NA,NA,NA,2487,"sn89060092", -77.410541,  39.414269,NA,NA,NA,NA
"7", 8137,"Ladysmith news-budget ","Ladysmith, Wisconsin", -91.10404, 45.463023,"Ladysmith","Wisconsin","3/7/1913",1913, 3, 7,"seq-6","https://articleextractor.org/pages/8137/whi_knarl_ver02/sn85040245/1913/03/07/ed-1/seq-6/1","Cornelia, GA","NA, NA","NA, NA","Cornelia","GA",NA,NA,NA,NA,"Mob lynched 2 men at the same time",2488,"sn85040245", -83.527117,  34.511488,NA,NA,NA,NA
"8", 8149,"The Salt Lake herald ","Salt Lake City , Utah",-111.89105, 40.760779,"Salt Lake City ","Utah","1/3/1908",1908, 1, 3,"seq-2","https://articleextractor.org/pages/8149/uuml_five_ver01/sn85058130/1908/01/03/ed-1/seq-2/1","Brook Haven, MI","NA, NA","NA, NA","Brook Haven","MI",NA,NA,NA,NA,"""First lynching of the year"" mob lassoed the man away from police and hung him",2489,"sn85058130", -85.602364,  44.314844,NA,NA,NA,NA
"9", 8153,"The Waco evening news ","Waco, Texas", -97.14667, 31.549333,"Waco","Texas","9/21/1893",1893, 9,21,"seq-3","https://articleextractor.org/pages/8153/txdn_argentina_ver01/sn86088201/1893/09/21/ed-1/seq-3/1","Roanoke, VA","Roanoke, VA","NA, NA","Roanoke","VA","Roanoke","VA",NA,NA,NA,2490,"sn86088201", -79.941427,  37.270970, -79.94143,  37.27097,NA,NA
"10", 8153,"The Waco evening news ","Waco, Texas", -97.14667, 31.549333,"Waco","Texas","9/21/1893",1893, 9,21,"seq-3","https://articleextractor.org/pages/8153/txdn_argentina_ver01/sn86088201/1893/09/21/ed-1/seq-3/1","Roanoke, VA","Roanoke, VA","NA, NA","Roanoke","VA","Roanoke","VA",NA,NA,NA,2491,"sn86088201", -79.941427,  37.270970, -79.94143,  37.27097,NA,NA
"11", 8155,"The Hope pioneer ","Hope, North Dakota", -97.72232, 47.322210,"Hope","North Dakota","8/4/1893",1893, 8, 4,"seq-2","https://articleextractor.org/pages/8155/ndhi_argon_ver01/sn87096037/1893/08/04/ed-1/seq-2/1","Dallas, TX","Calera, VA","Montgomery, TX","Dallas","TX","Calera","VA","Montgomery","TX",NA,2492,"sn87096037", -96.796988,  32.776664, -86.75360,  33.10290, -95.69634,  30.38826
"12", 8155,"The Hope pioneer ","Hope, North Dakota", -97.72232, 47.322210,"Hope","North Dakota","8/4/1893",1893, 8, 4,"seq-2","https://articleextractor.org/pages/8155/ndhi_argon_ver01/sn87096037/1893/08/04/ed-1/seq-2/1","Gaston, SC","Gaston, SC","NA, NA","Gaston","SC","Gaston","SC",NA,NA,NA,2492,"sn87096037", -81.100929,  33.817097, -81.10093,  33.81710,NA,NA
"13", 8155,"The Hope pioneer ","Hope, North Dakota", -97.72232, 47.322210,"Hope","North Dakota","8/4/1893",1893, 8, 4,"seq-2","https://articleextractor.org/pages/8155/ndhi_argon_ver01/sn87096037/1893/08/04/ed-1/seq-2/1","Roanoke, VA","Jefferson Parish, LA","NA, NA","Roanoke","VA","Jefferson Parish","LA",NA,NA,NA,2492,"sn87096037", -79.941427,  37.270970, -90.11207,  29.64987,NA,NA
"14", 8155,"The Hope pioneer ","Hope, North Dakota", -97.72232, 47.322210,"Hope","North Dakota","8/4/1893",1893, 8, 4,"seq-2","https://articleextractor.org/pages/8155/ndhi_argon_ver01/sn87096037/1893/08/04/ed-1/seq-2/1","Dallas, TX","Calera, VA","Montgomery, TX","Dallas","TX","Calera","VA","Montgomery","TX",NA,2493,"sn87096037", -96.796988,  32.776664, -86.75360,  33.10290, -95.69634,  30.38826
"15", 8155,"The Hope pioneer ","Hope, North Dakota", -97.72232, 47.322210,"Hope","North Dakota","8/4/1893",1893, 8, 4,"seq-2","https://articleextractor.org/pages/8155/ndhi_argon_ver01/sn87096037/1893/08/04/ed-1/seq-2/1","Gaston, SC","Gaston, SC","NA, NA","Gaston","SC","Gaston","SC",NA,NA,NA,2493,"sn87096037", -81.100929,  33.817097, -81.10093,  33.81710,NA,NA
"16", 8155,"The Hope pioneer ","Hope, North Dakota", -97.72232, 47.322210,"Hope","North Dakota","8/4/1893",1893, 8, 4,"seq-2","https://articleextractor.org/pages/8155/ndhi_argon_ver01/sn87096037/1893/08/04/ed-1/seq-2/1","Roanoke, VA","Jefferson Parish, LA","NA, NA","Roanoke","VA","Jefferson Parish","LA",NA,NA,NA,2493,"sn87096037", -79.941427,  37.270970, -90.11207,  29.64987,NA,NA
"17", 8155,"The Hope pioneer ","Hope, North Dakota", -97.72232, 47.322210,"Hope","North Dakota","8/4/1893",1893, 8, 4,"seq-2","https://articleextractor.org/pages/8155/ndhi_argon_ver01/sn87096037/1893/08/04/ed-1/seq-2/1","Dallas, TX","Calera, VA","Montgomery, TX","Dallas","TX","Calera","VA","Montgomery","TX",NA,2494,"sn87096037", -96.796988,  32.776664, -86.75360,  33.10290, -95.69634,  30.38826
"18", 8155,"The Hope pioneer ","Hope, North Dakota", -97.72232, 47.322210,"Hope","North Dakota","8/4/1893",1893, 8, 4,"seq-2","https://articleextractor.org/pages/8155/ndhi_argon_ver01/sn87096037/1893/08/04/ed-1/seq-2/1","Gaston, SC","Gaston, SC","NA, NA","Gaston","SC","Gaston","SC",NA,NA,NA,2494,"sn87096037", -81.100929,  33.817097, -81.10093,  33.81710,NA,NA
"19", 8155,"The Hope pioneer ","Hope, North Dakota", -97.72232, 47.322210,"Hope","North Dakota","8/4/1893",1893, 8, 4,"seq-2","https://articleextractor.org/pages/8155/ndhi_argon_ver01/sn87096037/1893/08/04/ed-1/seq-2/1","Roanoke, VA","Jefferson Parish, LA","NA, NA","Roanoke","VA","Jefferson Parish","LA",NA,NA,NA,2494,"sn87096037", -79.941427,  37.270970, -90.11207,  29.64987,NA,NA
"20", 8155,"The Hope pioneer ","Hope, North Dakota", -97.72232, 47.322210,"Hope","North Dakota","8/4/1893",1893, 8, 4,"seq-2","https://articleextractor.org/pages/8155/ndhi_argon_ver01/sn87096037/1893/08/04/ed-1/seq-2/1","Dallas, TX","Calera, VA","Montgomery, TX","Dallas","TX","Calera","VA","Montgomery","TX",NA,2495,"sn87096037", -96.796988,  32.776664, -86.75360,  33.10290, -95.69634,  30.38826
"21", 8155,"The Hope pioneer ","Hope, North Dakota", -97.72232, 47.322210,"Hope","North Dakota","8/4/1893",1893, 8, 4,"seq-2","https://articleextractor.org/pages/8155/ndhi_argon_ver01/sn87096037/1893/08/04/ed-1/seq-2/1","Gaston, SC","Gaston, SC","NA, NA","Gaston","SC","Gaston","SC",NA,NA,NA,2495,"sn87096037", -81.100929,  33.817097, -81.10093,  33.81710,NA,NA
"22", 8155,"The Hope pioneer ","Hope, North Dakota", -97.72232, 47.322210,"Hope","North Dakota","8/4/1893",1893, 8, 4,"seq-2","https://articleextractor.org/pages/8155/ndhi_argon_ver01/sn87096037/1893/08/04/ed-1/seq-2/1","Roanoke, VA","Jefferson Parish, LA","NA, NA","Roanoke","VA","Jefferson Parish","LA",NA,NA,NA,2495,"sn87096037", -79.941427,  37.270970, -90.11207,  29.64987,NA,NA
"23", 8173,NA,"NA, Nebraska", -99.90181, 41.492537,NA,"Nebraska","10/10/1891",1891,10,10,"seq-1","https://articleextractor.org/pages/8173/nbu_beatrice_ver01/sn99021999/1891/10/10/ed-1/seq-1/1","Downtown Omaha, NE","NA, NA","NA, NA","Downtown Omaha","NE",NA,NA,NA,NA,"Lynching victim was accused of assaulting a young girl, but the paper states that the boy was happy and healthy and that there was no foundation for the initial report of the crime. Mob of 10,000 people, police where there but did nothing",2500,"sn99021999", -95.937129,  41.263720,NA,NA,NA,NA
"24", 8176,"Waterbury evening Democrat ","Waterbury, Connecticut", -73.05150, 41.558152,"Waterbury","Connecticut","10/30/1891",1891,10,30,"seq-1","https://articleextractor.org/pages/8176/ct_gum_ver01/sn94053256/1891/10/30/ed-1/seq-1/1","Covington, LA","NA, NA","NA, NA","Covington","LA",NA,NA,NA,NA,NA,2501,"sn94053256", -90.100911,  30.475470,NA,NA,NA,NA
"25", 8180,"The Hope pioneer ","Hope, North Dakota", -97.72232, 47.322210,"Hope","North Dakota","11/4/1892",1892,11, 4,"seq-2","https://articleextractor.org/pages/8180/ndhi_argon_ver01/sn87096037/1892/11/04/ed-2/seq-2/1","New Monroeville, AL","Greensboro, NC","NA, NA","New Monroeville","AL","Greensboro","NC",NA,NA,NA,2502,"sn87096037", -87.324708,  31.527940, -79.79198,  36.07264,NA,NA
"26", 8181,"St. Paul daily globe ","Saint Paul, Minnesota", -93.08996, 44.953703,"Saint Paul","Minnesota","10/4/1891",1891,10, 4,"seq-1","https://articleextractor.org/pages/8181/mnhi_faribault_ver01/sn90059522/1891/10/04/ed-1/seq-1/1","Marianna, AK","NA, NA","NA, NA","Marianna","AK",NA,NA,NA,NA,"2 men lynched",2503,"sn90059522", -90.772254,  34.774620,NA,NA,NA,NA
"27", 8183,"The Grenada sentinel ","Grenada, Mississippi", -89.80842, 33.769005,"Grenada","Mississippi","9/21/1889",1889, 9,21,"seq-2","https://articleextractor.org/pages/8183/msar_eyelet_ver02/sn85034375/1889/09/21/ed-1/seq-2/1","Morgantown, NC","NA, NA","NA, NA","Morgantown","NC",NA,NA,NA,NA,"2 men lynched",2504,"sn85034375", -81.684819,  35.745407,NA,NA,NA,NA
"28", 8186,"The enterprise ","Wellington, Ohio", -82.21793, 41.168942,"Wellington","Ohio","9/27/1893",1893, 9,27,"seq-6","https://articleextractor.org/pages/8186/ohi_cousteau_ver02/sn84028272/1893/09/27/ed-1/seq-6/1","Roanoke, VA","NA, NA","NA, NA","Roanoke","VA",NA,NA,NA,NA,"turned into a riot, lynching did not occur (possible lynching victim was secreted) but many people died in a shooting",2505,"sn84028272", -79.941427,  37.270970,NA,NA,NA,NA
"29", 8187,"Arizona republican ","Phoenix, Arizona",-112.07404, 33.448377,"Phoenix","Arizona","1/15/1892",1892, 1,15,"seq-5","https://articleextractor.org/pages/8187/az_coyote_ver01/sn84020558/1892/01/15/ed-1/seq-5/1","Shreveport, LA","NA, NA","NA, NA","Shreveport","LA",NA,NA,NA,NA,NA,2506,"sn84020558", -93.750179,  32.525152,NA,NA,NA,NA
"30", 8189,NA,"NA, Texas", -99.90181, 31.968599,NA,"Texas","2/3/1887",1887, 2, 3,"seq-6","https://articleextractor.org/pages/8189/txdn_echo_ver03/sn86064205/1887/02/03/ed-1/seq-6/1","Brenham, TX","NA, NA","NA, NA","Brenham","TX",NA,NA,NA,NA,"3 men lynched",2508,"sn86064205", -96.397744,  30.166883,NA,NA,NA,NA
"31", 8190,"The Topeka state journal ","Topeka, Kansas", -95.67516, 39.047345,"Topeka","Kansas","9/3/1910",1910, 9, 3,"seq-12","https://articleextractor.org/pages/8190/khi_edelbrock_ver01/sn82016014/1910/09/03/ed-1/seq-12/1","Not specified, MI","NA, NA","NA, NA","Not specified","MI",NA,NA,NA,NA,NA,2509,"sn82016014",NA,NA,NA,NA,NA,NA
"32", 8191,"St. Paul daily globe ","Saint Paul, Minnesota", -93.08996, 44.953703,"Saint Paul","Minnesota","8/29/1893",1893, 8,29,"seq-4","https://articleextractor.org/pages/8191/mnhi_gonvick_ver01/sn90059522/1893/08/29/ed-1/seq-4/1","Louisville, KY","NA, NA","NA, NA","Louisville","KY",NA,NA,NA,NA,NA,2510,"sn90059522", -85.758456,  38.252665,NA,NA,NA,NA
"33", 8192,"The Salt Lake herald ","Salt Lake City , Utah",-111.89105, 40.760779,"Salt Lake City ","Utah","7/28/1887",1887, 7,28,"seq-1","https://articleextractor.org/pages/8192/uuml_griffith_ver01/sn85058130/1887/07/28/ed-1/seq-1/1","Atlanta, GA","NA, NA","NA, NA","Atlanta","GA",NA,NA,NA,NA,NA,2511,"sn85058130", -84.387684,  33.748752,NA,NA,NA,NA
"34", 8196,NA,"NA, District of Columbia", -77.02361, 38.894206,NA,"District of Columbia","6/14/1887",1887, 6,14,"seq-1","https://articleextractor.org/pages/8196/dlc_chester_ver02/sn86053573/1887/06/14/ed-1/seq-1/2","Zenia, OH","NA, NA","NA, NA","Zenia","OH",NA,NA,NA,NA,"""Whether hung by the mob or by his own hand can not be determined""",2514,"sn86053573", -83.929653,  39.684782,NA,NA,NA,NA
"35", 8197,"The Russellville Democrat ","Russellville, Arkansas", -93.13370, 35.278116,"Russellville","Arkansas","11/30/1893",1893,11,30,"seq-2","https://articleextractor.org/pages/8197/arhi_igglybuff_ver01/sn84023017/1893/11/30/ed-1/seq-2/1","Varner, Lincoln County, AR","NA, NA","NA, NA","Varner, Lincoln County","AR",NA,NA,NA,NA,NA,2515,"sn84023017", -91.618890,  34.038330,NA,NA,NA,NA
"36", 8200,"Tensas gazette ","St. Joseph, Louisiana", -91.23349, 31.918368,"St. Joseph","Louisiana","4/30/1909",1909, 4,30,"seq-4","https://articleextractor.org/pages/8200/lu_roulette_ver01/sn87090131/1909/04/30/ed-1/seq-4/1","Birmingham, AL","NA, NA","NA, NA","Birmingham","AL",NA,NA,NA,NA,NA,2516,"sn87090131", -86.810357,  33.518589,NA,NA,NA,NA
"37", 8201,"The News-Herald ","Hillsboro, Ohio", -83.61159, 39.202287,"Hillsboro","Ohio","2/10/1887",1887, 2,10,"seq-2","https://articleextractor.org/pages/8201/ohi_india_ver01/sn85038161/1887/02/10/ed-1/seq-2/1","Atlanta, GA","NA, NA","NA, NA","Atlanta","GA",NA,NA,NA,NA,NA,2517,"sn85038161", -84.387684,  33.748752,NA,NA,NA,NA
"38", 8202,"The Emporia weekly news ","Emporia, Kansas", -96.18166, 38.403903,"Emporia","Kansas","7/2/1885",1885, 7, 2,"seq-1","https://articleextractor.org/pages/8202/khi_brown_ver01/sn85030221/1885/07/02/ed-1/seq-1/1","Gainsville, TX","NA, NA","NA, NA","Gainsville","TX",NA,NA,NA,NA,NA,2518,"sn85030221", -97.133345,  33.625941,NA,NA,NA,NA
"39", 8204,"The Cheyenne daily leader ","Cheyenne, Wyoming",-104.82025, 41.139981,"Cheyenne","Wyoming","10/28/1888",1888,10,28,"seq-1","https://articleextractor.org/pages/8204/wyu_calpet_ver02/sn86072173/1888/10/28/ed-1/seq-1/2","Woodlawn Mills, Nashville, TN","NA, NA","NA, NA","Woodlawn Mills, Nashville","TN",NA,NA,NA,NA,NA,2519,"sn86072173", -86.781602,  36.162664,NA,NA,NA,NA
"40", 8213,"The Brookhaven leader ","Brookhaven, Mississippi", -90.44065, 31.579059,"Brookhaven","Mississippi","6/21/1888",1888, 6,21,"seq-2","https://articleextractor.org/pages/8213/msar_agate_ver01/sn86074058/1888/06/21/ed-1/seq-2/3","Natchez, MI","NA, NA","NA, NA","Natchez","MI",NA,NA,NA,NA,"Said ""near Natchez,"" didn't give exact location. 2 men lynched",2522,"sn86074058", -91.403171,  31.560444,NA,NA,NA,NA
"41", 8220,"The Indianapolis journal ","Indianapolis , Indiana", -86.15807, 39.768403,"Indianapolis ","Indiana","7/22/1897",1897, 7,22,"seq-5","https://articleextractor.org/pages/8220/in_bradlaugh_ver02/sn82015679/1897/07/22/ed-1/seq-5/2","New Iberia, LA","Florence, AL","NA, NA","New Iberia","LA","Florence","AL",NA,NA,NA,2525,"sn82015679", -91.818728,  30.003536, -87.67725,  34.79981,NA,NA
"42", 8222,"Los Angeles herald ","Los Angeles , California",-118.24264, 34.054908,"Los Angeles ","California","11/1/1890",1890,11, 1,"seq-2","https://articleextractor.org/pages/8222/curiv_lovelock_ver01/sn84025968/1890/11/01/ed-1/seq-2/2","Dalton, GA","Macon, GA","NA, NA","Dalton","GA","Macon","GA",NA,NA,"2 men lynched",2526,"sn84025968", -84.970223,  34.769802, -83.63240,  32.84069,NA,NA
"43", 8237,NA,"NA, Nebraska", -99.90181, 41.492537,NA,"Nebraska","2/12/1897",1897, 2,12,"seq-6","https://articleextractor.org/pages/8237/nbu_indianola_ver01/sn94056415/1897/02/12/ed-1/seq-6/2","Bowling Green, KY","NA, NA","NA, NA","Bowling Green","KY",NA,NA,NA,NA,NA,2529,"sn94056415", -86.480804,  36.968522,NA,NA,NA,NA
"44", 8240,"Los Angeles herald ","Los Angeles , California",-118.24264, 34.054908,"Los Angeles ","California","7/4/1910",1910, 7, 4,"seq-1","https://articleextractor.org/pages/8240/curiv_rubidoux_ver01/sn85042462/1910/07/04/ed-1/seq-1/1","Charleston, MO","NA, NA","NA, NA","Charleston","MO",NA,NA,NA,NA,NA,2530,"sn85042462", -89.350631,  36.920885,NA,NA,NA,NA
"45", 8241,"Semi-weekly interior journal ","Stanford, Kentucky", -84.66189, 37.531190,"Stanford","Kentucky","10/8/1886",1886,10, 8,"seq-2","https://articleextractor.org/pages/8241/kyu_hairspray_ver01/sn85052020/1886/10/08/ed-1/seq-2/1","Steelville, MO","NA, NA","NA, NA","Steelville","MO",NA,NA,NA,NA,NA,2531,"sn85052020", -91.354868,  37.968100,NA,NA,NA,NA
"46", 8242,NA,"NA, Georgia", -82.90712, 32.157435,NA,"Georgia","6/4/1909",1909, 6, 4,"seq-1","https://articleextractor.org/pages/8242/gu_graco_ver01/sn86090947/1909/06/04/ed-1/seq-1/1","Frankfort, KY","NA, NA","NA, NA","Frankfort","KY",NA,NA,NA,NA,NA,2532,"sn86090947", -84.873284,  38.200905,NA,NA,NA,NA
"47", 8245,"The Wichita daily eagle ","Wichita, Kansas", -97.33005, 37.687176,"Wichita","Kansas","9/4/1890",1890, 9, 4,"seq-2","https://articleextractor.org/pages/8245/khi_ingalls_ver02/sn82014635/1890/09/04/ed-1/seq-2/1","Poplar Bluff, MO","NA, NA","NA, NA","Poplar Bluff","MO",NA,NA,NA,NA,NA,2534,"sn82014635", -90.392888,  36.756999,NA,NA,NA,NA
"48", 8245,"The Wichita daily eagle ","Wichita, Kansas", -97.33005, 37.687176,"Wichita","Kansas","9/4/1890",1890, 9, 4,"seq-2","https://articleextractor.org/pages/8245/khi_ingalls_ver02/sn82014635/1890/09/04/ed-1/seq-2/1","Poplar Bluff, MO","NA, NA","NA, NA","Poplar Bluff","MO",NA,NA,NA,NA,NA,2535,"sn82014635", -90.392888,  36.756999,NA,NA,NA,NA
"49", 8248,"River Falls journal ","River Falls, Wisconsin", -92.62381, 44.861356,"River Falls","Wisconsin","1/3/1884",1884, 1, 3,"seq-2","https://articleextractor.org/pages/8248/whi_galky_ver01/sn85033255/1884/01/03/ed-1/seq-2/1","Yazoo, MI","NA, NA","NA, NA","Yazoo","MI",NA,NA,NA,NA,"4 people lynched",2538,"sn85033255", -85.602364,  44.314844,NA,NA,NA,NA
"50", 8248,"River Falls journal ","River Falls, Wisconsin", -92.62381, 44.861356,"River Falls","Wisconsin","1/3/1884",1884, 1, 3,"seq-2","https://articleextractor.org/pages/8248/whi_galky_ver01/sn85033255/1884/01/03/ed-1/seq-2/1","Yazoo, MI","NA, NA","NA, NA","Yazoo","MI",NA,NA,NA,NA,"4 people lynched",2539,"sn85033255", -85.602364,  44.314844,NA,NA,NA,NA
"51", 8248,"River Falls journal ","River Falls, Wisconsin", -92.62381, 44.861356,"River Falls","Wisconsin","1/3/1884",1884, 1, 3,"seq-2","https://articleextractor.org/pages/8248/whi_galky_ver01/sn85033255/1884/01/03/ed-1/seq-2/1","Yazoo, MI","NA, NA","NA, NA","Yazoo","MI",NA,NA,NA,NA,"4 people lynched",2540,"sn85033255", -85.602364,  44.314844,NA,NA,NA,NA
"52", 8250,"The Forrest City times ","Forrest City, Arkansas", -90.78523, 35.009258,"Forrest City","Arkansas","5/20/1892",1892, 5,20,"seq-1","https://articleextractor.org/pages/8250/arhi_alakazam_ver01/sn84022960/1892/05/20/ed-1/seq-1/1","Little Rock, AR","NA, NA","NA, NA","Little Rock","AR",NA,NA,NA,NA,NA,2541,"sn84022960", -92.288016,  34.744462,NA,NA,NA,NA
"53", 8250,"The Forrest City times ","Forrest City, Arkansas", -90.78523, 35.009258,"Forrest City","Arkansas","5/20/1892",1892, 5,20,"seq-1","https://articleextractor.org/pages/8250/arhi_alakazam_ver01/sn84022960/1892/05/20/ed-1/seq-1/1","Little Rock, AR","NA, NA","NA, NA","Little Rock","AR",NA,NA,NA,NA,NA,2542,"sn84022960", -92.288016,  34.744462,NA,NA,NA,NA
"54", 8252,"The Birmingham age-herald ","Birmingham, Alabama", -86.81036, 33.518589,"Birmingham","Alabama","7/5/1910",1910, 7, 5,"seq-1","https://articleextractor.org/pages/8252/au_gaston_ver01/sn85038485/1910/07/05/ed-1/seq-1/1","Charleston, MO","Lake Providence, LA","NA, NA","Charleston","MO","Lake Providence","LA",NA,NA,"double lynching",2543,"sn85038485", -89.350631,  36.920885, -91.17011,  32.80430,NA,NA
"55", 8252,"The Birmingham age-herald ","Birmingham, Alabama", -86.81036, 33.518589,"Birmingham","Alabama","7/5/1910",1910, 7, 5,"seq-1","https://articleextractor.org/pages/8252/au_gaston_ver01/sn85038485/1910/07/05/ed-1/seq-1/1","Charleston, MO","Lake Providence, LA","NA, NA","Charleston","MO","Lake Providence","LA",NA,NA,"double lynching",2544,"sn85038485", -89.350631,  36.920885, -91.17011,  32.80430,NA,NA
"56", 8252,"The Birmingham age-herald ","Birmingham, Alabama", -86.81036, 33.518589,"Birmingham","Alabama","7/5/1910",1910, 7, 5,"seq-1","https://articleextractor.org/pages/8252/au_gaston_ver01/sn85038485/1910/07/05/ed-1/seq-1/1","Charleston, MO","Lake Providence, LA","NA, NA","Charleston","MO","Lake Providence","LA",NA,NA,"double lynching",2545,"sn85038485", -89.350631,  36.920885, -91.17011,  32.80430,NA,NA
"57", 8252,"The Birmingham age-herald ","Birmingham, Alabama", -86.81036, 33.518589,"Birmingham","Alabama","7/5/1910",1910, 7, 5,"seq-1","https://articleextractor.org/pages/8252/au_gaston_ver01/sn85038485/1910/07/05/ed-1/seq-1/1","Charleston, MO","Lake Providence, LA","NA, NA","Charleston","MO","Lake Providence","LA",NA,NA,"double lynching",2546,"sn85038485", -89.350631,  36.920885, -91.17011,  32.80430,NA,NA
"58", 8252,"The Birmingham age-herald ","Birmingham, Alabama", -86.81036, 33.518589,"Birmingham","Alabama","7/5/1910",1910, 7, 5,"seq-1","https://articleextractor.org/pages/8252/au_gaston_ver01/sn85038485/1910/07/05/ed-1/seq-1/1","Charleston, MO","Lake Providence, LA","NA, NA","Charleston","MO","Lake Providence","LA",NA,NA,"double lynching",2547,"sn85038485", -89.350631,  36.920885, -91.17011,  32.80430,NA,NA
"59", 8253,"The Magnolia gazette ","Magnolia, Mississippi", -90.45871, 31.143233,"Magnolia","Mississippi","6/25/1892",1892, 6,25,"seq-3","https://articleextractor.org/pages/8253/msar_ikat_ver01/sn85034447/1892/06/25/ed-1/seq-3/1","M'Comb City, MI","NA, NA","NA, NA","M'Comb City","MI",NA,NA,NA,NA,NA,2548,"sn85034447", -82.958895,  42.700963,NA,NA,NA,NA
"60", 8254,"The Mankato free press ","Mankato, Minnesota", -93.99940, 44.163578,"Mankato","Minnesota","5/6/1892",1892, 5, 6,"seq-6","https://articleextractor.org/pages/8254/mnhi_fencing_ver02/sn83016589/1892/05/06/ed-1/seq-6/1","Nashville, TN","NA, NA","NA, NA","Nashville","TN",NA,NA,NA,NA,"attempted lynching stopped",2549,"sn83016589", -86.781602,  36.162664,NA,NA,NA,NA
"61", 8254,"The Mankato free press ","Mankato, Minnesota", -93.99940, 44.163578,"Mankato","Minnesota","5/6/1892",1892, 5, 6,"seq-6","https://articleextractor.org/pages/8254/mnhi_fencing_ver02/sn83016589/1892/05/06/ed-1/seq-6/1","Nashville, TN","NA, NA","NA, NA","Nashville","TN",NA,NA,NA,NA,"attempted lynching stopped",2550,"sn83016589", -86.781602,  36.162664,NA,NA,NA,NA
"62", 8256,NA,"NA, Wisconsin", -88.78787, 43.784440,NA,"Wisconsin","10/15/1892",1892,10,15,"seq-2","https://articleextractor.org/pages/8256/whi_jane_ver01/sn86086770/1892/10/15/ed-1/seq-2/1","Dunsmir, CA","NA, NA","NA, NA","Dunsmir","CA",NA,NA,NA,NA,NA,2551,"sn86086770",-122.271953,  41.208209,NA,NA,NA,NA
"63", 8256,NA,"NA, Wisconsin", -88.78787, 43.784440,NA,"Wisconsin","10/15/1892",1892,10,15,"seq-2","https://articleextractor.org/pages/8256/whi_jane_ver01/sn86086770/1892/10/15/ed-1/seq-2/1","Dunsmir, CA","NA, NA","NA, NA","Dunsmir","CA",NA,NA,NA,NA,NA,2552,"sn86086770",-122.271953,  41.208209,NA,NA,NA,NA
"64", 8257,NA,"NA, Tennessee", -86.58045, 35.517491,NA,"Tennessee","2/27/1886",1886, 2,27,"seq-4","https://articleextractor.org/pages/8257/tu_gordon_ver01/sn93063896/1886/02/27/ed-1/seq-4/1","Savannah, GA","NA, NA","NA, NA","Savannah","GA",NA,NA,NA,NA,"2 boys found lynched (8 and 10 years old). Bound at their hands and their feet",2553,"sn93063896", -81.091203,  32.080899,NA,NA,NA,NA
"65", 8258,"People's voice ","Wellington, Kansas", -97.37171, 37.265300,"Wellington","Kansas","5/12/1893",1893, 5,12,"seq-6","https://articleextractor.org/pages/8258/khi_goodnow_ver01/sn85032801/1893/05/12/ed-1/seq-6/1","Albuquerque, NM","NA, NA","NA, NA","Albuquerque","NM",NA,NA,NA,NA,"3 men lynched",2554,"sn85032801",-106.650422,  35.084386,NA,NA,NA,NA
"66", 8259,NA,"NA, Missouri", 101.75239, 20.924080,NA,"Missouri","2/18/1892",1892, 2,18,"seq-4","https://articleextractor.org/pages/8259/mohi_flash_ver02/sn89067453/1892/02/18/ed-1/seq-4/1","Roanoke, VA","NA, NA","NA, NA","Roanoke","VA",NA,NA,NA,NA,NA,2555,"sn89067453", -79.941427,  37.270970,NA,NA,NA,NA
"67", 8260,NA,"NA, Missouri", 101.75239, 20.924080,NA,"Missouri","2/9/1893",1893, 2, 9,"seq-4","https://articleextractor.org/pages/8260/mohi_flash_ver02/sn89067453/1893/02/09/ed-1/seq-4/1","Richland, VA","NA, NA","NA, NA","Richland","VA",NA,NA,NA,NA,"4 men lynched",2556,"sn89067453", -81.793727,  37.093169,NA,NA,NA,NA
"68", 8262,NA,"NA, Missouri", 101.75239, 20.924080,NA,"Missouri","10/22/1892",1892,10,22,"seq-1","https://articleextractor.org/pages/8262/mohi_jerome_ver01/sn89066818/1892/10/22/ed-1/seq-1/1","Monroeville, AL","Palmyra, VA","NA, NA","Monroeville","AL","Palmyra","VA",NA,NA,"lynched 4 men",2557,"sn89066818", -87.324708,  31.527940, -78.26334,  37.86099,NA,NA
"69", 8262,NA,"NA, Missouri", 101.75239, 20.924080,NA,"Missouri","10/22/1892",1892,10,22,"seq-1","https://articleextractor.org/pages/8262/mohi_jerome_ver01/sn89066818/1892/10/22/ed-1/seq-1/1","Monroeville, AL","Palmyra, VA","NA, NA","Monroeville","AL","Palmyra","VA",NA,NA,"lynched 4 men",2558,"sn89066818", -87.324708,  31.527940, -78.26334,  37.86099,NA,NA
"70", 8263,NA,"NA, North Dakota",-101.00201, 47.551493,NA,"North Dakota","5/28/1892",1892, 5,28,"seq-2","https://articleextractor.org/pages/8263/ndhi_lawrencium_ver01/sn88076679/1892/05/28/ed-1/seq-2/1","Mobile, AL","NA, NA","NA, NA","Mobile","AL",NA,NA,NA,NA,NA,2559,"sn88076679", -88.039891,  30.695366,NA,NA,NA,NA
"71", 8264,"The Washington bee ","Washington, District of Columbia", -77.03687, 38.907192,"Washington","District of Columbia","5/7/1887",1887, 5, 7,"seq-1","https://articleextractor.org/pages/8264/dlc_grover_ver01/sn84025891/1887/05/07/ed-1/seq-1/1","no city or town specified, VA","NA, NA","NA, NA","no city or town specified","VA",NA,NA,NA,NA,NA,2560,"sn84025891", -78.656894,  37.431573,NA,NA,NA,NA
"72", 8264,"The Washington bee ","Washington, District of Columbia", -77.03687, 38.907192,"Washington","District of Columbia","5/7/1887",1887, 5, 7,"seq-1","https://articleextractor.org/pages/8264/dlc_grover_ver01/sn84025891/1887/05/07/ed-1/seq-1/1","no city or town specified, VA","NA, NA","NA, NA","no city or town specified","VA",NA,NA,NA,NA,NA,2561,"sn84025891", -78.656894,  37.431573,NA,NA,NA,NA
"73", 8264,"The Washington bee ","Washington, District of Columbia", -77.03687, 38.907192,"Washington","District of Columbia","5/7/1887",1887, 5, 7,"seq-1","https://articleextractor.org/pages/8264/dlc_grover_ver01/sn84025891/1887/05/07/ed-1/seq-1/1","no city or town specified, VA","NA, NA","NA, NA","no city or town specified","VA",NA,NA,NA,NA,NA,2562,"sn84025891", -78.656894,  37.431573,NA,NA,NA,NA
"74", 8268,NA,"NA, Illinois", -89.39853, 40.633125,NA,"Illinois","6/28/1884",1884, 6,28,"seq-3","https://articleextractor.org/pages/8268/iune_archives_ver01/sn87082573/1884/06/28/ed-1/seq-3/1","Mound City, IL","NA, NA","NA, NA","Mound City","IL",NA,NA,NA,NA,NA,2563,"sn87082573", -89.162573,  37.085329,NA,NA,NA,NA
"75", 8269,"The morning news ","Savannah, Georgia", -81.09120, 32.080899,"Savannah","Georgia","3/21/1890",1890, 3,21,"seq-2","https://articleextractor.org/pages/8269/gu_columbo_ver02/sn86063034/1890/03/21/ed-1/seq-2/1","cincinnati, OH","Charlottesville, VA","NA, NA","cincinnati","OH","Charlottesville","VA",NA,NA,"Charlottesville --> protecting to stop a possible lynching",2564,"sn86063034", -84.512020,  39.103118, -78.47668,  38.02931,NA,NA
"76", 8269,"The morning news ","Savannah, Georgia", -81.09120, 32.080899,"Savannah","Georgia","3/21/1890",1890, 3,21,"seq-2","https://articleextractor.org/pages/8269/gu_columbo_ver02/sn86063034/1890/03/21/ed-1/seq-2/1","cincinnati, OH","Charlottesville, VA","NA, NA","cincinnati","OH","Charlottesville","VA",NA,NA,"Charlottesville --> protecting to stop a possible lynching",2565,"sn86063034", -84.512020,  39.103118, -78.47668,  38.02931,NA,NA
"77", 8273,"The evening times ","Washington, District of Columbia", -77.03687, 38.907192,"Washington","District of Columbia","2/18/1901",1901, 2,18,"seq-6","https://articleextractor.org/pages/8273/dlc_november_ver01/sn84024441/1901/02/18/ed-1/seq-6/1","Jasper, AL","NA, NA","NA, NA","Jasper","AL",NA,NA,NA,NA,"Precautions are already being put into place to prevent a lynching before the man is in jail",2567,"sn84024441", -87.277505,  33.831218,NA,NA,NA,NA
"78", 8276,NA,"NA, South Dakota", -99.90181, 43.969515,NA,"South Dakota","8/6/1909",1909, 8, 6,"seq-6","https://articleextractor.org/pages/8276/sdhi_dagger_ver01/sn96090259/1909/08/06/ed-1/seq-6/1","Platte City, MO","NA, NA","NA, NA","Platte City","MO",NA,NA,NA,NA,NA,2569,"sn96090259", -94.782461,  39.370277,NA,NA,NA,NA
"79", 8278,"The morning news ","Savannah, Georgia", -81.09120, 32.080899,"Savannah","Georgia","10/18/1887",1887,10,18,"seq-1","https://articleextractor.org/pages/8278/gu_bobbsey_ver02/sn86063034/1887/10/18/ed-1/seq-1/1","Charleston, WV","NA, NA","NA, NA","Charleston","WV",NA,NA,NA,NA,NA,2570,"sn86063034", -81.632623,  38.349820,NA,NA,NA,NA
"80", 8280,"St. Paul daily globe ","Saint Paul, Minnesota", -93.08996, 44.953703,"Saint Paul","Minnesota","8/15/1887",1887, 8,15,"seq-2","https://articleextractor.org/pages/8280/mnhi_sebeka_ver01/sn90059522/1887/08/15/ed-1/seq-2/1","Jersey City, NJ","NA, NA","NA, NA","Jersey City","NJ",NA,NA,NA,NA,"Attempted lynching of innocent man, was not followed through",2571,"sn90059522", -74.043143,  40.717754,NA,NA,NA,NA
"81", 8288,NA,"NA, Michigan", -85.60236, 44.314844,NA,"Michigan","1/26/1900",1900, 1,26,"seq-11","https://articleextractor.org/pages/8288/mimtptc_baldwin_ver01/sn98066406/1900/01/26/ed-1/seq-11/1","Fort Scott, KS","NA, NA","NA, NA","Fort Scott","KS",NA,NA,NA,NA,"2 men lynched, mob of 400 people",2572,"sn98066406", -94.708295,  37.839763,NA,NA,NA,NA
"82", 8289,NA,"NA, Mississippi", -89.39853, 32.354668,NA,"Mississippi","8/1/1917",1917, 8, 1,"seq-1","https://articleextractor.org/pages/8289/msar_damask_ver02/sn89065008/1917/08/01/ed-1/seq-1/1","Butte, MT","NA, NA","NA, NA","Butte","MT",NA,NA,NA,NA,"Prominent labor leader at the time lynched",2573,"sn89065008",-112.534778,  46.003823,NA,NA,NA,NA
"83", 8290,"The news & observer ","Raleigh, North Carolina", -78.63818, 35.779590,"Raleigh","North Carolina","4/19/1899",1899, 4,19,"seq-2","https://articleextractor.org/pages/8290/ncu_ford_ver02/sn85042104/1899/04/19/ed-1/seq-2/1","Henderson, TN","NA, NA","NA, NA","Henderson","TN",NA,NA,NA,NA,NA,2574,"sn85042104", -88.641441,  35.439244,NA,NA,NA,NA
"84", 8292,NA,"NA, Oregon",-120.55420, 43.804133,NA,"Oregon","7/17/1914",1914, 7,17,"seq-1","https://articleextractor.org/pages/8292/oru_bobolink_ver01/sn99063957/1914/07/17/ed-1/seq-1/1","Whitney, OR","NA, NA","NA, NA","Whitney","OR",NA,NA,NA,NA,NA,2575,"sn99063957",NA,NA,NA,NA,NA,NA
"85", 8301,NA,"NA, Illinois", -89.39853, 40.633125,NA,"Illinois","5/5/1891",1891, 5, 5,"seq-4","https://articleextractor.org/pages/8301/iune_deckle_ver01/sn92053945/1891/05/05/ed-1/seq-4/1","West Denver, CO","NA, NA","NA, NA","West Denver","CO",NA,NA,NA,NA,NA,2581,"sn92053945",-105.024788,  39.711047,NA,NA,NA,NA
"86", 8303,"The Globe-republican ","Dodge City, Kansas",-100.01708, 37.752798,"Dodge City","Kansas","4/15/1891",1891, 4,15,"seq-2","https://articleextractor.org/pages/8303/khi_cessna_ver01/sn84029853/1891/04/15/ed-1/seq-2/1","Kenton, OR","Zealandi, WA","NA, NA","Kenton","OR","Zealandi","WA",NA,NA,"for the Zealandi lynching (2 men were shot in jail), I could not find anything on the incident/the place where it says it happened. Print is clear but I'm not finding anything on location",2582,"sn84029853", -83.609652,  40.646998,-120.74014,  47.75107,NA,NA
"87", 8303,"The Globe-republican ","Dodge City, Kansas",-100.01708, 37.752798,"Dodge City","Kansas","4/15/1891",1891, 4,15,"seq-2","https://articleextractor.org/pages/8303/khi_cessna_ver01/sn84029853/1891/04/15/ed-1/seq-2/1","Kenton, OH","Sumter, SC","NA, NA","Kenton","OH","Sumter","SC",NA,NA,NA,2582,"sn84029853", -83.609652,  40.646998, -80.34147,  33.92044,NA,NA
"88", 8303,"The Globe-republican ","Dodge City, Kansas",-100.01708, 37.752798,"Dodge City","Kansas","4/15/1891",1891, 4,15,"seq-2","https://articleextractor.org/pages/8303/khi_cessna_ver01/sn84029853/1891/04/15/ed-1/seq-2/1","Kenton, OR","Zealandi, WA","NA, NA","Kenton","OR","Zealandi","WA",NA,NA,"for the Zealandi lynching (2 men were shot in jail), I could not find anything on the incident/the place where it says it happened. Print is clear but I'm not finding anything on location",2583,"sn84029853", -83.609652,  40.646998,-120.74014,  47.75107,NA,NA
"89", 8303,"The Globe-republican ","Dodge City, Kansas",-100.01708, 37.752798,"Dodge City","Kansas","4/15/1891",1891, 4,15,"seq-2","https://articleextractor.org/pages/8303/khi_cessna_ver01/sn84029853/1891/04/15/ed-1/seq-2/1","Kenton, OH","Sumter, SC","NA, NA","Kenton","OH","Sumter","SC",NA,NA,NA,2583,"sn84029853", -83.609652,  40.646998, -80.34147,  33.92044,NA,NA
"90", 8304,NA,"NA, Nebraska", -99.90181, 41.492537,NA,"Nebraska","7/28/1887",1887, 7,28,"seq-4","https://articleextractor.org/pages/8304/nbu_chadron_ver01/sn99021999/1887/07/28/ed-1/seq-4/1","Nebraska City, NE","NA, NA","NA, NA","Nebraska City","NE",NA,NA,NA,NA,NA,2584,"sn99021999", -95.859362,  40.676575,NA,NA,NA,NA
"91", 8305,"New Ulm weekly review ","New Ulm, Minnesota", -94.45930, 44.314439,"New Ulm","Minnesota","3/18/1891",1891, 3,18,"seq-3","https://articleextractor.org/pages/8305/mnhi_audi_ver01/sn89064939/1891/03/18/ed-1/seq-3/1","New Orleans, LA","NA, NA","NA, NA","New Orleans","LA",NA,NA,NA,NA,NA,2585,"sn89064939", -90.071532,  29.951066,NA,NA,NA,NA
"92", 8305,"New Ulm weekly review ","New Ulm, Minnesota", -94.45930, 44.314439,"New Ulm","Minnesota","3/18/1891",1891, 3,18,"seq-3","https://articleextractor.org/pages/8305/mnhi_audi_ver01/sn89064939/1891/03/18/ed-1/seq-3/1","New Orleans, LA","NA, NA","NA, NA","New Orleans","LA",NA,NA,NA,NA,NA,2586,"sn89064939", -90.071532,  29.951066,NA,NA,NA,NA
"93", 8308,"Grant County herald ","Lancaster, Wisconsin", -90.71068, 42.847490,"Lancaster","Wisconsin","12/5/1889",1889,12, 5,"seq-4","https://articleextractor.org/pages/8308/whi_jyme_ver01/sn85033133/1889/12/05/ed-1/seq-4/1","Preston, WI","NA, NA","NA, NA","Preston","WI",NA,NA,NA,NA,NA,2587,"sn85033133", -89.794289,  44.038771,NA,NA,NA,NA
"94", 8314,"The Chanute times ","Chanute, Kansas", -95.45720, 37.679214,"Chanute","Kansas","6/18/1897",1897, 6,18,"seq-2","https://articleextractor.org/pages/8314/khi_isabel_ver01/sn85030529/1897/06/18/ed-1/seq-2/2","Somerset County, MD","NA, NA","NA, NA","Somerset County","MD",NA,NA,NA,NA,NA,2588,"sn85030529", -75.853395,  38.086233,NA,NA,NA,NA
"95", 8316,NA,"NA, Virginia", -57.59659,-25.309101,NA,"Virginia","6/21/1911",1911, 6,21,"seq-6","https://articleextractor.org/pages/8316/vi_oldenburg_ver01/sn90052005/1911/06/21/ed-1/seq-6/1","Valentine, NE","NA, NA","NA, NA","Valentine","NE",NA,NA,NA,NA,NA,2590,"sn90052005",-100.550967,  42.872783,NA,NA,NA,NA
"96", 8321,NA,"NA, Minnesota", -94.68590, 46.729553,NA,"Minnesota","11/13/1912",1912,11,13,"seq-3","https://articleextractor.org/pages/8321/mnhi_buick_ver01/sn89081128/1912/11/13/ed-1/seq-3/3","Kidder County, ND","NA, NA","NA, NA","Kidder County","ND",NA,NA,NA,NA,NA,2592,"sn89081128", -99.750686,  46.876631,NA,NA,NA,NA
"97", 8325,"River Falls journal ","River Falls, Wisconsin", -92.62381, 44.861356,"River Falls","Wisconsin","1/5/1888",1888, 1, 5,"seq-2","https://articleextractor.org/pages/8325/whi_galky_ver01/sn85033255/1888/01/05/ed-1/seq-2/3","Black Hills, NA","St Francis, AK","Harrisonburg, VA","Black Hills",NA,"St Francis","AK","Harrisonburg","VA",NA,2595,"sn85033255",-103.771769,  43.993948,NA,NA, -78.86892,  38.44957
"98", 8325,"River Falls journal ","River Falls, Wisconsin", -92.62381, 44.861356,"River Falls","Wisconsin","1/5/1888",1888, 1, 5,"seq-2","https://articleextractor.org/pages/8325/whi_galky_ver01/sn85033255/1888/01/05/ed-1/seq-2/3","St Francis County, AK","NA, NA","NA, NA","St Francis County","AK",NA,NA,NA,NA,NA,2595,"sn85033255", -90.715275,  34.992653,NA,NA,NA,NA
"99", 8325,"River Falls journal ","River Falls, Wisconsin", -92.62381, 44.861356,"River Falls","Wisconsin","1/5/1888",1888, 1, 5,"seq-2","https://articleextractor.org/pages/8325/whi_galky_ver01/sn85033255/1888/01/05/ed-1/seq-2/3","Black Hills, NA","St Francis, AK","Harrisonburg, VA","Black Hills",NA,"St Francis","AK","Harrisonburg","VA",NA,2596,"sn85033255",-103.771769,  43.993948,NA,NA, -78.86892,  38.44957
"100", 8325,"River Falls journal ","River Falls, Wisconsin", -92.62381, 44.861356,"River Falls","Wisconsin","1/5/1888",1888, 1, 5,"seq-2","https://articleextractor.org/pages/8325/whi_galky_ver01/sn85033255/1888/01/05/ed-1/seq-2/3","St Francis County, AK","NA, NA","NA, NA","St Francis County","AK",NA,NA,NA,NA,NA,2596,"sn85033255", -90.715275,  34.992653,NA,NA,NA,NA
"101", 8325,"River Falls journal ","River Falls, Wisconsin", -92.62381, 44.861356,"River Falls","Wisconsin","1/5/1888",1888, 1, 5,"seq-2","https://articleextractor.org/pages/8325/whi_galky_ver01/sn85033255/1888/01/05/ed-1/seq-2/3","Black Hills, NA","St Francis, AK","Harrisonburg, VA","Black Hills",NA,"St Francis","AK","Harrisonburg","VA",NA,2597,"sn85033255",-103.771769,  43.993948,NA,NA, -78.86892,  38.44957
"102", 8325,"River Falls journal ","River Falls, Wisconsin", -92.62381, 44.861356,"River Falls","Wisconsin","1/5/1888",1888, 1, 5,"seq-2","https://articleextractor.org/pages/8325/whi_galky_ver01/sn85033255/1888/01/05/ed-1/seq-2/3","St Francis County, AK","NA, NA","NA, NA","St Francis County","AK",NA,NA,NA,NA,NA,2597,"sn85033255", -90.715275,  34.992653,NA,NA,NA,NA
"103", 8325,"River Falls journal ","River Falls, Wisconsin", -92.62381, 44.861356,"River Falls","Wisconsin","1/5/1888",1888, 1, 5,"seq-2","https://articleextractor.org/pages/8325/whi_galky_ver01/sn85033255/1888/01/05/ed-1/seq-2/3","Black Hills, NA","St Francis, AK","Harrisonburg, VA","Black Hills",NA,"St Francis","AK","Harrisonburg","VA",NA,2598,"sn85033255",-103.771769,  43.993948,NA,NA, -78.86892,  38.44957
"104", 8325,"River Falls journal ","River Falls, Wisconsin", -92.62381, 44.861356,"River Falls","Wisconsin","1/5/1888",1888, 1, 5,"seq-2","https://articleextractor.org/pages/8325/whi_galky_ver01/sn85033255/1888/01/05/ed-1/seq-2/3","St Francis County, AK","NA, NA","NA, NA","St Francis County","AK",NA,NA,NA,NA,NA,2598,"sn85033255", -90.715275,  34.992653,NA,NA,NA,NA
"105", 8325,"River Falls journal ","River Falls, Wisconsin", -92.62381, 44.861356,"River Falls","Wisconsin","1/5/1888",1888, 1, 5,"seq-2","https://articleextractor.org/pages/8325/whi_galky_ver01/sn85033255/1888/01/05/ed-1/seq-2/3","Black Hills, NA","St Francis, AK","Harrisonburg, VA","Black Hills",NA,"St Francis","AK","Harrisonburg","VA",NA,2599,"sn85033255",-103.771769,  43.993948,NA,NA, -78.86892,  38.44957
"106", 8325,"River Falls journal ","River Falls, Wisconsin", -92.62381, 44.861356,"River Falls","Wisconsin","1/5/1888",1888, 1, 5,"seq-2","https://articleextractor.org/pages/8325/whi_galky_ver01/sn85033255/1888/01/05/ed-1/seq-2/3","St Francis County, AK","NA, NA","NA, NA","St Francis County","AK",NA,NA,NA,NA,NA,2599,"sn85033255", -90.715275,  34.992653,NA,NA,NA,NA
"107", 8325,"River Falls journal ","River Falls, Wisconsin", -92.62381, 44.861356,"River Falls","Wisconsin","1/5/1888",1888, 1, 5,"seq-2","https://articleextractor.org/pages/8325/whi_galky_ver01/sn85033255/1888/01/05/ed-1/seq-2/3","Black Hills, NA","St Francis, AK","Harrisonburg, VA","Black Hills",NA,"St Francis","AK","Harrisonburg","VA",NA,2600,"sn85033255",-103.771769,  43.993948,NA,NA, -78.86892,  38.44957
"108", 8325,"River Falls journal ","River Falls, Wisconsin", -92.62381, 44.861356,"River Falls","Wisconsin","1/5/1888",1888, 1, 5,"seq-2","https://articleextractor.org/pages/8325/whi_galky_ver01/sn85033255/1888/01/05/ed-1/seq-2/3","St Francis County, AK","NA, NA","NA, NA","St Francis County","AK",NA,NA,NA,NA,NA,2600,"sn85033255", -90.715275,  34.992653,NA,NA,NA,NA
"109", 8325,"River Falls journal ","River Falls, Wisconsin", -92.62381, 44.861356,"River Falls","Wisconsin","1/5/1888",1888, 1, 5,"seq-2","https://articleextractor.org/pages/8325/whi_galky_ver01/sn85033255/1888/01/05/ed-1/seq-2/3","Black Hills, NA","St Francis, AK","Harrisonburg, VA","Black Hills",NA,"St Francis","AK","Harrisonburg","VA",NA,2601,"sn85033255",-103.771769,  43.993948,NA,NA, -78.86892,  38.44957
"110", 8325,"River Falls journal ","River Falls, Wisconsin", -92.62381, 44.861356,"River Falls","Wisconsin","1/5/1888",1888, 1, 5,"seq-2","https://articleextractor.org/pages/8325/whi_galky_ver01/sn85033255/1888/01/05/ed-1/seq-2/3","St Francis County, AK","NA, NA","NA, NA","St Francis County","AK",NA,NA,NA,NA,NA,2601,"sn85033255", -90.715275,  34.992653,NA,NA,NA,NA
"111", 8327,"The Salt Lake herald ","Salt Lake City , Utah",-111.89105, 40.760779,"Salt Lake City ","Utah","11/2/1889",1889,11, 2,"seq-1","https://articleextractor.org/pages/8327/uuml_griffith_ver01/sn85058130/1889/11/02/ed-1/seq-1/2","Milton, WV","NA, NA","NA, NA","Milton","WV",NA,NA,NA,NA,NA,2602,"sn85058130", -82.132364,  38.434532,NA,NA,NA,NA
"112", 8328,"The Globe-republican ","Dodge City, Kansas",-100.01708, 37.752798,"Dodge City","Kansas","8/18/1898",1898, 8,18,"seq-7","https://articleextractor.org/pages/8328/khi_cessna_ver01/sn84029853/1898/08/18/ed-1/seq-7/2","Little Rock, AK","NA, NA","NA, NA","Little Rock","AK",NA,NA,NA,NA,"3 men 5 women",2603,"sn84029853", -92.288016,  34.744462,NA,NA,NA,NA
"113", 8329,"The herald ","Los Angeles , California",-118.24264, 34.054908,"Los Angeles ","California","5/21/1895",1895, 5,21,"seq-1","https://articleextractor.org/pages/8329/curiv_ogilby_ver01/sn85042461/1895/05/21/ed-1/seq-1/2","Lafayette County, MS","NA, NA","NA, NA","Lafayette County","MS",NA,NA,NA,NA,"Flayed and burned 3 men alive",2604,"sn85042461", -89.474218,  34.418699,NA,NA,NA,NA
"114", 8330,"The daily morning Astorian ","Astoria, Oregon",-123.83125, 46.187884,"Astoria","Oregon","12/20/1889",1889,12,20,"seq-3","https://articleextractor.org/pages/8330/oru_hufnagel_ver02/sn96061150/1889/12/20/ed-1/seq-3/2","Owensboro, KY","NA, NA","NA, NA","Owensboro","KY",NA,NA,NA,NA,NA,2605,"sn96061150", -87.111168,  37.771907,NA,NA,NA,NA
"115", 8331,"Democratic Northwest ","Napoleon, Ohio", -84.12522, 41.392273,"Napoleon","Ohio","5/30/1889",1889, 5,30,"seq-7","https://articleextractor.org/pages/8331/ohi_ingstad_ver01/sn84028296/1889/05/30/ed-1/seq-7/3","Columbia, LA","NA, NA","NA, NA","Columbia","LA",NA,NA,NA,NA,NA,2606,"sn84028296", -92.077913,  32.105157,NA,NA,NA,NA
"116", 8332,"Evening journal ","Wilmington, Delaware", -75.54839, 39.744655,"Wilmington","Delaware","1/9/1897",1897, 1, 9,"seq-6","https://articleextractor.org/pages/8332/deu_bear_ver01/sn85042354/1897/01/09/ed-1/seq-6/2","Sumter, SC","NA, NA","NA, NA","Sumter","SC",NA,NA,NA,NA,NA,2607,"sn85042354", -80.341469,  33.920435,NA,NA,NA,NA
"117", 8332,"Evening journal ","Wilmington, Delaware", -75.54839, 39.744655,"Wilmington","Delaware","1/9/1897",1897, 1, 9,"seq-6","https://articleextractor.org/pages/8332/deu_bear_ver01/sn85042354/1897/01/09/ed-1/seq-6/2","Sumter, SC","NA, NA","NA, NA","Sumter","SC",NA,NA,NA,NA,NA,2608,"sn85042354", -80.341469,  33.920435,NA,NA,NA,NA
"118", 8335,"The Wichita daily eagle ","Wichita, Kansas", -97.33005, 37.687176,"Wichita","Kansas","8/27/1895",1895, 8,27,"seq-1","https://articleextractor.org/pages/8335/khi_jennison_ver01/sn82014635/1895/08/27/ed-1/seq-1/4","Yreka, CA","Springfield, KY","NA, NA","Yreka","CA","Springfield","KY",NA,NA,NA,2609,"sn82014635",-122.634471,  41.735419, -85.22218,  37.68534,NA,NA
"119", 8336,"Daily inter mountain ","Butte, Montana",-112.53478, 46.003823,"Butte","Montana","1/15/1901",1901, 1,15,"seq-8","https://articleextractor.org/pages/8336/mthi_kestrel_ver02/sn85053057/1901/01/15/ed-1/seq-8/2","Leavenworth, KS","Topeka, KS","NA, NA","Leavenworth","KS","Topeka","KS",NA,NA,"Topeka was an attempted lynching",2610,"sn85053057", -94.927937,  39.310352, -95.67516,  39.04735,NA,NA
"120", 8336,"Daily inter mountain ","Butte, Montana",-112.53478, 46.003823,"Butte","Montana","1/15/1901",1901, 1,15,"seq-8","https://articleextractor.org/pages/8336/mthi_kestrel_ver02/sn85053057/1901/01/15/ed-1/seq-8/2","Leavenworth, KS","Topeka, KS","NA, NA","Leavenworth","KS","Topeka","KS",NA,NA,"Topeka was an attempted lynching",2611,"sn85053057", -94.927937,  39.310352, -95.67516,  39.04735,NA,NA
"121", 8339,"The Paducah daily sun ","Paducah, Kentucky", -88.60005, 37.083389,"Paducah","Kentucky","12/28/1896",1896,12,28,"seq-2","https://articleextractor.org/pages/8339/kyu_batman_ver01/sn85052118/1896/12/28/ed-1/seq-2/2","Owensboro, KY","NA, NA","NA, NA","Owensboro","KY",NA,NA,NA,NA,NA,2613,"sn85052118", -87.111168,  37.771907,NA,NA,NA,NA
"122", 8339,"The Paducah daily sun ","Paducah, Kentucky", -88.60005, 37.083389,"Paducah","Kentucky","12/28/1896",1896,12,28,"seq-2","https://articleextractor.org/pages/8339/kyu_batman_ver01/sn85052118/1896/12/28/ed-1/seq-2/2","Owensboro, KY","NA, NA","NA, NA","Owensboro","KY",NA,NA,NA,NA,NA,2614,"sn85052118", -87.111168,  37.771907,NA,NA,NA,NA
"123", 8340,NA,"NA, South Dakota", -99.90181, 43.969515,NA,"South Dakota","8/8/1901",1901, 8, 8,"seq-2","https://articleextractor.org/pages/8340/sdhi_jicama_ver01/sn98062949/1901/08/08/ed-1/seq-2/3","DeKalb County, TN","NA, NA","NA, NA","DeKalb County","TN",NA,NA,NA,NA,NA,2615,"sn98062949", -85.807660,  35.972836,NA,NA,NA,NA
"124", 8342,"The Manitowoc pilot ","Manitowoc, Wisconsin", -87.65758, 44.088606,"Manitowoc","Wisconsin","9/10/1896",1896, 9,10,"seq-3","https://articleextractor.org/pages/8342/whi_grace_ver01/sn85033139/1896/09/10/ed-1/seq-3/3","Glencoe, MN","NA, NA","NA, NA","Glencoe","MN",NA,NA,NA,NA,NA,2616,"sn85033139", -94.151752,  44.769044,NA,NA,NA,NA
"125", 8346,"The Birmingham age-herald ","Birmingham, Alabama", -86.81036, 33.518589,"Birmingham","Alabama","3/17/1907",1907, 3,17,"seq-2","https://articleextractor.org/pages/8346/au_evans_ver01/sn85038485/1907/03/17/ed-1/seq-2/2","Monroe, LA","NA, NA","NA, NA","Monroe","LA",NA,NA,NA,NA,NA,2620,"sn85038485", -92.119301,  32.509311,NA,NA,NA,NA
"126", 8348,"Tulsa daily world ","Tulsa, Oklahoma", -95.99277, 36.153982,"Tulsa","Oklahoma","11/12/1911",1911,11,12,"seq-27","https://articleextractor.org/pages/8348/okhi_apache_ver02/sn85042344/1911/11/12/ed-1/seq-27/2","Somerset, PA","NA, NA","NA, NA","Somerset","PA",NA,NA,NA,NA,"2 attempted lynchings",2622,"sn85042344", -79.078083,  40.008411,NA,NA,NA,NA
"127", 8349,"The news & observer ","Raleigh, North Carolina", -78.63818, 35.779590,"Raleigh","North Carolina","3/15/1901",1901, 3,15,"seq-2","https://articleextractor.org/pages/8349/ncu_griffin_ver01/sn85042104/1901/03/15/ed-1/seq-2/3","Bryan, GA","NA, NA","NA, NA","Bryan","GA",NA,NA,NA,NA,NA,2623,"sn85042104", -81.471839,  32.023658,NA,NA,NA,NA
"128", 8350,"The Adair County news ","Columbia, Kentucky", -85.30635, 37.102841,"Columbia","Kentucky","8/5/1908",1908, 8, 5,"seq-4","https://articleextractor.org/pages/8350/kyu_charo_ver01/sn86069496/1908/08/05/ed-1/seq-4/2","Russellville, AK","NA, NA","NA, NA","Russellville","AK",NA,NA,NA,NA,NA,2624,"sn86069496", -93.133701,  35.278116,NA,NA,NA,NA
"129", 8351,"The Paducah daily sun ","Paducah, Kentucky", -88.60005, 37.083389,"Paducah","Kentucky","8/23/1897",1897, 8,23,"seq-1","https://articleextractor.org/pages/8351/kyu_casablanca_ver01/sn85052118/1897/08/23/ed-1/seq-1/2","Williamsburg, KY","Mayfield, KY","NA, NA","Williamsburg","KY","Mayfield","KY",NA,NA,NA,2625,"sn85052118", -84.159656,  36.743417, -88.63672,  36.74172,NA,NA
"130", 8355,"Daily public ledger ","Maysville, Kentucky", -83.74437, 38.641185,"Maysville","Kentucky","7/15/1908",1908, 7,15,"seq-3","https://articleextractor.org/pages/8355/kyu_hairspray_ver01/sn86069117/1908/07/15/ed-1/seq-3/3","Middleton, TN","NA, NA","NA, NA","Middleton","TN",NA,NA,NA,NA,NA,2626,"sn86069117", -88.890892,  35.064532,NA,NA,NA,NA
"131", 8355,"Daily public ledger ","Maysville, Kentucky", -83.74437, 38.641185,"Maysville","Kentucky","7/15/1908",1908, 7,15,"seq-3","https://articleextractor.org/pages/8355/kyu_hairspray_ver01/sn86069117/1908/07/15/ed-1/seq-3/3","Middleton, TN","NA, NA","NA, NA","Middleton","TN",NA,NA,NA,NA,NA,2627,"sn86069117", -88.890892,  35.064532,NA,NA,NA,NA
"132", 8356,"Red Lodge picket ","Red Lodge, Montana",-109.24682, 45.185778,"Red Lodge","Montana","6/19/1897",1897, 6,19,"seq-1","https://articleextractor.org/pages/8356/mthi_moose_ver01/sn84036276/1897/06/19/ed-1/seq-1/2","Kemper County, MS","Princess Anne, MD","NA, NA","Kemper County","MS","Princess Anne","MD",NA,NA,"5 people lynched",2628,"sn84036276", -88.710896,  32.801845, -75.69243,  38.20290,NA,NA
"133", 8357,"Eagle River review ","Eagle River, Wisconsin", -89.24430, 45.917176,"Eagle River","Wisconsin","6/23/1898",1898, 6,23,"seq-2","https://articleextractor.org/pages/8357/whi_arbutus_ver01/sn85040614/1898/06/23/ed-1/seq-2/2","Great Bend, KS","Wetumpka, AL","Devils Lake, ND","Great Bend","KS","Wetumpka","AL","Devils Lake","ND","Mob of 500 people, Devils Lake was attempted lynching",2629,"sn85040614", -98.764807,  38.364457, -86.21191,  32.54374, -98.86512,  48.11278
"134", 8357,"Eagle River review ","Eagle River, Wisconsin", -89.24430, 45.917176,"Eagle River","Wisconsin","6/23/1898",1898, 6,23,"seq-2","https://articleextractor.org/pages/8357/whi_arbutus_ver01/sn85040614/1898/06/23/ed-1/seq-2/2","Great Bend, KS","Wetumpka, AL","Devils Lake, ND","Great Bend","KS","Wetumpka","AL","Devils Lake","ND","Mob of 500 people, Devils Lake was attempted lynching",2630,"sn85040614", -98.764807,  38.364457, -86.21191,  32.54374, -98.86512,  48.11278
"135", 8358,"Los Angeles herald ","Los Angeles , California",-118.24264, 34.054908,"Los Angeles ","California","11/5/1891",1891,11, 5,"seq-5","https://articleextractor.org/pages/8358/curiv_lovelock_ver01/sn84025968/1891/11/05/ed-1/seq-5/2","Bastrop, LA","NA, NA","NA, NA","Bastrop","LA",NA,NA,NA,NA,NA,2631,"sn84025968", -91.872350,  32.756246,NA,NA,NA,NA
"136", 8360,"The evening world ","New York, New York", -74.00597, 40.712775,"New York","New York","7/6/1892",1892, 7, 6,"seq-5","https://articleextractor.org/pages/8360/nn_goethe_ver01/sn83030193/1892/07/06/ed-5/seq-5/2","Vicksburg, MS","Wheeling, WV","NA, NA","Vicksburg","MS","Wheeling","WV",NA,NA,"mob of 700",2632,"sn83030193", -90.877882,  32.352646, -80.72091,  40.06396,NA,NA
"137", 8361,"Grant County herald ","Lancaster, Wisconsin", -90.71068, 42.847490,"Lancaster","Wisconsin","9/17/1891",1891, 9,17,"seq-2","https://articleextractor.org/pages/8361/whi_jyme_ver01/sn85033133/1891/09/17/ed-1/seq-2/2","Nearland, NC","Sellersburg, IN","NA, NA","Nearland","NC","Sellersburg","IN",NA,NA,NA,2633,"sn85033133", -79.019300,  35.759573, -85.75496,  38.39812,NA,NA
"138", 8362,NA,"NA, Delaware", -75.52767, 38.910832,NA,"Delaware","8/10/1893",1893, 8,10,"seq-3","https://articleextractor.org/pages/8362/deu_horcrux_ver01/sn88053046/1893/08/10/ed-1/seq-3/2","Owensburg, KY","NA, NA","NA, NA","Owensburg","KY",NA,NA,NA,NA,NA,2634,"sn88053046", -87.111168,  37.771907,NA,NA,NA,NA
"139", 8363,"Barton County democrat ","Great Bend, Kansas", -98.76481, 38.364457,"Great Bend","Kansas","9/24/1896",1896, 9,24,"seq-2","https://articleextractor.org/pages/8363/khi_finney_ver02/sn83040198/1896/09/24/ed-1/seq-2/2","Watonga, OK","Florence, AL","NA, NA","Watonga","OK","Florence","AL",NA,NA,NA,2635,"sn83040198", -98.413128,  35.844765, -87.67725,  34.79981,NA,NA
"140", 8364,NA,"NA, Missouri", 101.75239, 20.924080,NA,"Missouri","8/3/1893",1893, 8, 3,"seq-6","https://articleextractor.org/pages/8364/mohi_flash_ver02/sn89067453/1893/08/03/ed-1/seq-6/2","Denver, CO","Calera, AL","NA, NA","Denver","CO","Calera","AL",NA,NA,NA,2636,"sn89067453",-104.990251,  39.739236, -86.75360,  33.10290,NA,NA
"141", 8366,"The times ","Washington , District of Columbia", -77.03687, 38.907192,"Washington ","District of Columbia","8/27/1897",1897, 8,27,"seq-3","https://articleextractor.org/pages/8366/dlc_dutch_ver02/sn85054468/1897/08/27/ed-1/seq-3/2","Belleville, TX","NA, NA","NA, NA","Belleville","TX",NA,NA,NA,NA,NA,2637,"sn85054468", -96.257186,  29.950225,NA,NA,NA,NA
"142", 8367,NA,"NA, District of Columbia", -77.02361, 38.894206,NA,"District of Columbia","5/1/1891",1891, 5, 1,"seq-1","https://articleextractor.org/pages/8367/dlc_harry_ver01/sn87062228/1891/05/01/ed-1/seq-1/2","Franklin, TN","NA, NA","NA, NA","Franklin","TN",NA,NA,NA,NA,NA,2638,"sn87062228", -86.868890,  35.925064,NA,NA,NA,NA
"143", 8368,"The World ","Martinsburg, West Virginia", -77.96389, 39.456210,"Martinsburg","West Virginia","9/29/1891",1891, 9,29,"seq-1","https://articleextractor.org/pages/8368/wvu_hogan_ver01/sn85059538/1891/09/29/ed-1/seq-1/2","Deland, FL","New York, NY","NA, NA","Deland","FL","New York","NY",NA,NA,"NY is attempted lynching by mob, stopped",2639,"sn85059538", -81.303118,  29.028318, -74.00597,  40.71278,NA,NA
"144", 8371,"The morning news ","Savannah, Georgia", -81.09120, 32.080899,"Savannah","Georgia","9/10/1894",1894, 9,10,"seq-1","https://articleextractor.org/pages/8371/gu_drew_ver02/sn86063034/1894/09/10/ed-1/seq-1/1","Minden, LA","NA, NA","NA, NA","Minden","LA",NA,NA,NA,NA,NA,2641,"sn86063034", -93.286835,  32.615428,NA,NA,NA,NA
"145", 8372,NA,"NA, Missouri", 101.75239, 20.924080,NA,"Missouri","8/21/1895",1895, 8,21,"seq-1","https://articleextractor.org/pages/8372/mohi_marmaduke_ver02/sn90061371/1895/08/21/ed-1/seq-1/1","Fulton, MO","NA, NA","NA, NA","Fulton","MO",NA,NA,NA,NA,NA,2642,"sn90061371", -91.947959,  38.846708,NA,NA,NA,NA
"146", 8373,NA,"NA, Delaware", -75.52767, 38.910832,NA,"Delaware","3/5/1896",1896, 3, 5,"seq-6","https://articleextractor.org/pages/8373/deu_horcrux_ver01/sn88053046/1896/03/05/ed-1/seq-6/1","Wachita Falls, TX","NA, NA","NA, NA","Wachita Falls","TX",NA,NA,NA,NA,NA,2643,"sn88053046", -98.493387,  33.913708,NA,NA,NA,NA
"147", 8375,"Reporter and farmer ","Webster, South Dakota", -97.52009, 45.332180,"Webster","South Dakota","12/31/1896",1896,12,31,"seq-10","https://articleextractor.org/pages/8375/sdhi_leek_ver02/sn99068116/1896/12/31/ed-1/seq-10/1","Woodstock, AL","NA, NA","NA, NA","Woodstock","AL",NA,NA,NA,NA,NA,2644,"sn99068116", -87.149996,  33.206784,NA,NA,NA,NA
"148", 8378,"Evening journal ","Wilmington, Delaware", -75.54839, 39.744655,"Wilmington","Delaware","8/17/1915",1915, 8,17,"seq-4","https://articleextractor.org/pages/8378/deu_fairfax_ver01/sn85042354/1915/08/17/ed-1/seq-4/1","Atlanta, GA","NA, NA","NA, NA","Atlanta","GA",NA,NA,NA,NA,NA,2646,"sn85042354", -84.387684,  33.748752,NA,NA,NA,NA
"149", 8379,"Evening star ","Washington, District of Columbia", -77.03687, 38.907192,"Washington","District of Columbia","3/14/1895",1895, 3,14,"seq-2","https://articleextractor.org/pages/8379/dlc_havanese_ver01/sn83045462/1895/03/14/ed-1/seq-2/1","Forsyth, GA","NA, NA","NA, NA","Forsyth","GA",NA,NA,NA,NA,NA,2647,"sn83045462", -83.938242,  33.034297,NA,NA,NA,NA
"150", 8382,"Vernon County censor ","Viroqua, Wisconsin", -90.88874, 43.556917,"Viroqua","Wisconsin","11/7/1900",1900,11, 7,"seq-2","https://articleextractor.org/pages/8382/whi_clabbert_ver01/sn85040451/1900/11/07/ed-1/seq-2/1","Rulo, NE","Brazil, IN","NA, NA","Rulo","NE","Brazil","IN",NA,NA,"attempted lynching w/ mob, (brazil, in) attempted lynching w/ mob 500",2649,"sn85040451", -95.429276,  40.052462, -87.12502,  39.52365,NA,NA
"151", 8382,"Vernon County censor ","Viroqua, Wisconsin", -90.88874, 43.556917,"Viroqua","Wisconsin","11/7/1900",1900,11, 7,"seq-2","https://articleextractor.org/pages/8382/whi_clabbert_ver01/sn85040451/1900/11/07/ed-1/seq-2/1","Rulo, NE","Brazil, IN","NA, NA","Rulo","NE","Brazil","IN",NA,NA,"attempted lynching w/ mob, (brazil, in) attempted lynching w/ mob 500",2650,"sn85040451", -95.429276,  40.052462, -87.12502,  39.52365,NA,NA
"152", 8383,"The Waxahachie daily light ","Waxahachie, Texas", -96.84833, 32.386531,"Waxahachie","Texas","9/20/1911",1911, 9,20,"seq-1","https://articleextractor.org/pages/8383/txdn_eastland_ver01/sn86090369/1911/09/20/ed-1/seq-1/1","Okomulgee, OK","NA, NA","NA, NA","Okomulgee","OK",NA,NA,NA,NA,"mob killed 3 in attempt to lynch prisoners",2651,"sn86090369", -95.951540,  35.626696,NA,NA,NA,NA
"153", 8386,"Americus times-recorder ","Americus, Georgia", -84.23269, 32.072386,"Americus","Georgia","9/24/1913",1913, 9,24,"seq-6","https://articleextractor.org/pages/8386/gu_bootes_ver01/sn89053204/1913/09/24/ed-1/seq-6/1","Louisville, MI","NA, NA","NA, NA","Louisville","MI",NA,NA,NA,NA,NA,2654,"sn89053204", -85.758456,  38.252665,NA,NA,NA,NA
"154", 8388,"Evening bulletin ","Maysville , Kentucky", -83.74437, 38.641185,"Maysville ","Kentucky","6/14/1882",1882, 6,14,"seq-2","https://articleextractor.org/pages/8388/kyu_ishtar_ver01/sn86069125/1882/06/14/ed-1/seq-2/1","No town/city given, SC","Monroe, MS","NA, NA","No town/city given","SC","Monroe","MS",NA,NA,NA,2656,"sn86069125", -81.163725,  33.836081, -88.55653,  33.87736,NA,NA
"155", 8388,"Evening bulletin ","Maysville , Kentucky", -83.74437, 38.641185,"Maysville ","Kentucky","6/14/1882",1882, 6,14,"seq-2","https://articleextractor.org/pages/8388/kyu_ishtar_ver01/sn86069125/1882/06/14/ed-1/seq-2/1","No town/city given, SC","Monroe, MS","NA, NA","No town/city given","SC","Monroe","MS",NA,NA,NA,2657,"sn86069125", -81.163725,  33.836081, -88.55653,  33.87736,NA,NA
"156", 8389,"The farmer and mechanic ","Raleigh, North Carolina", -78.63818, 35.779590,"Raleigh","North Carolina","6/28/1882",1882, 6,28,"seq-1","https://articleextractor.org/pages/8389/ncu_grandfather_ver01/sn85042098/1882/06/28/ed-1/seq-1/1","Booneville, MS","Winchester, TN","NA, NA","Booneville","MS","Winchester","TN",NA,NA,NA,2658,"sn85042098", -88.566704,  34.658160, -86.11221,  35.18592,NA,NA
"157", 8389,"The farmer and mechanic ","Raleigh, North Carolina", -78.63818, 35.779590,"Raleigh","North Carolina","6/28/1882",1882, 6,28,"seq-1","https://articleextractor.org/pages/8389/ncu_grandfather_ver01/sn85042098/1882/06/28/ed-1/seq-1/1","Booneville, MS","Winchester, TN","NA, NA","Booneville","MS","Winchester","TN",NA,NA,NA,2659,"sn85042098", -88.566704,  34.658160, -86.11221,  35.18592,NA,NA
"158", 8477,"Lynchburg daily Virginian ","Lynchburg , Virginia", -79.14225, 37.413754,"Lynchburg ","Virginia","9/8/1853",1853, 9, 8,"seq-2","https://articleextractor.org/pages/8477/vi_exmoor_ver01/sn85034360/1853/09/08/ed-1/seq-2/1","Boon County, MO","NA, NA","NA, NA","Boon County","MO",NA,NA,NA,NA,NA,2739,"sn85034360", -92.381362,  39.046855,NA,NA,NA,NA
"159", 8479,NA,"NA, South Dakota", -99.90181, 43.969515,NA,"South Dakota","4/24/1890",1890, 4,24,"seq-2","https://articleextractor.org/pages/8479/sdhi_imbe_ver01/sn98062948/1890/04/24/ed-1/seq-2/1","Auburn, KY","Birmingham, AL","NA, NA","Auburn","KY","Birmingham","AL",NA,NA,NA,2740,"sn98062948", -86.710273,  36.864209, -86.81036,  33.51859,NA,NA
"160", 8479,NA,"NA, South Dakota", -99.90181, 43.969515,NA,"South Dakota","4/24/1890",1890, 4,24,"seq-2","https://articleextractor.org/pages/8479/sdhi_imbe_ver01/sn98062948/1890/04/24/ed-1/seq-2/1","Auburn, KY","Birmingham, AL","NA, NA","Auburn","KY","Birmingham","AL",NA,NA,NA,2741,"sn98062948", -86.710273,  36.864209, -86.81036,  33.51859,NA,NA
"161", 8482,"The Atlanta constitution ","Atlanta, Georgia", -84.38768, 33.748752,"Atlanta","Georgia","10/4/1892",1892,10, 4,"seq-12","https://articleextractor.org/pages/8482/gu_fornax_ver01/sn89053706/1892/10/04/ed-1/seq-12/1","Augusta, GA","NA, NA","NA, NA","Augusta","GA",NA,NA,NA,NA,"attempted lynching",2743,"sn89053706", -82.010515,  33.473498,NA,NA,NA,NA
"162", 8483,"The Sedalia weekly bazoo ","Sedalia, Missouri", -93.22826, 38.704461,"Sedalia","Missouri","5/24/1892",1892, 5,24,"seq-2","https://articleextractor.org/pages/8483/mohi_berenice_ver01/sn90061066/1892/05/24/ed-1/seq-2/1","Atlanta, GA","NA, NA","NA, NA","Atlanta","GA",NA,NA,NA,NA,"3 men lynched",2744,"sn90061066", -84.387684,  33.748752,NA,NA,NA,NA
"163", 8488,"The pioneer express ","Pembina, North Dakota", -97.24368, 48.966377,"Pembina","North Dakota","10/22/1897",1897,10,22,"seq-3","https://articleextractor.org/pages/8488/ndhi_almont_ver01/sn88076741/1897/10/22/ed-1/seq-3/1","Barataria, LA","NA, NA","NA, NA","Barataria","LA",NA,NA,NA,NA,NA,2745,"sn88076741", -90.123685,  29.723267,NA,NA,NA,NA
"164", 8495,"Urbana union ","Urbana, Ohio", -83.75243, 40.108391,"Urbana","Ohio","10/25/1871",1871,10,25,"seq-1","https://articleextractor.org/pages/8495/ohi_borachio_ver02/sn85026309/1871/10/25/ed-1/seq-1/1","New York City, NY","NA, NA","NA, NA","New York City","NY",NA,NA,NA,NA,"just a headline, states ""Lynch law threatened in New York City by an office seeker""",2749,"sn85026309", -74.005973,  40.712775,NA,NA,NA,NA
"165", 8496,"The Manitowoc pilot ","Manitowoc, Wisconsin", -87.65758, 44.088606,"Manitowoc","Wisconsin","2/24/1870",1870, 2,24,"seq-1","https://articleextractor.org/pages/8496/whi_grace_ver01/sn85033139/1870/02/24/ed-1/seq-1/1","Benton Harbor, MI","NA, NA","NA, NA","Benton Harbor","MI",NA,NA,NA,NA,"lynch law threatened",2750,"sn85033139", -86.454189,  42.116706,NA,NA,NA,NA
"166", 8498,"The Fairfield herald ","Winnsboro, South Carolina", -81.08648, 34.380701,"Winnsboro","South Carolina","4/12/1871",1871, 4,12,"seq-1","https://articleextractor.org/pages/8498/scu_drinksmall_ver01/sn84026923/1871/04/12/ed-1/seq-1/1","NA, NA","NA, NA","NA, NA",NA,NA,NA,NA,NA,NA,"Past cases of lynchings are mentioned vaguely without specific location - MB",2751,"sn84026923",NA,NA,NA,NA,NA,NA
"167", 8499,"Brownsville herald ","Brownsville, Texas", -97.49748, 25.901747,"Brownsville","Texas","4/20/1934",1934, 4,20,"seq-12","https://articleextractor.org/pages/8499/txdn_gomez_ver01/sn86063730/1934/04/20/ed-1/seq-12/1","Marietta, GA","NA, NA","NA, NA","Marietta","GA",NA,NA,NA,NA,"the story isn't about the lynching, it's about a man who was part of a past lynching that was saved from a mob - MB",2752,"sn86063730", -84.549933,  33.952602,NA,NA,NA,NA
"168", 8500,"The Omaha guide ","Omaha, Nebraska", -95.93450, 41.256537,"Omaha","Nebraska","3/18/1944",1944, 3,18,"seq-4","https://articleextractor.org/pages/8500/nbu_fourtusker_ver01/sn93062828/1944/03/18/ed-1/seq-4/1","NA, MS","Baker County, GA","NA, NA",NA,"MS","Baker County","GA",NA,NA,"the article is a review of poetry which talks about the life of farm workers in MS, including lynching - MB, the second article is about a sheriff and deputies from Baker County, GA who were sentenced for violating the law in connection with a lynching",2753,"sn93062828",NA,NA, -84.48026,  31.28160,NA,NA
"169", 8500,"The Omaha guide ","Omaha, Nebraska", -95.93450, 41.256537,"Omaha","Nebraska","3/18/1944",1944, 3,18,"seq-4","https://articleextractor.org/pages/8500/nbu_fourtusker_ver01/sn93062828/1944/03/18/ed-1/seq-4/1","NA, MS","Baker County, GA","NA, NA",NA,"MS","Baker County","GA",NA,NA,"the article is a review of poetry which talks about the life of farm workers in MS, including lynching - MB, the second article is about a sheriff and deputies from Baker County, GA who were sentenced for violating the law in connection with a lynching",2754,"sn93062828",NA,NA, -84.48026,  31.28160,NA,NA
"170", 8501,NA,"NA, Missouri", 101.75239, 20.924080,NA,"Missouri","7/12/1888",1888, 7,12,"seq-2","https://articleextractor.org/pages/8501/mohi_beetlebailey_ver01/sn88068010/1888/07/12/ed-1/seq-2/1","Nodaway County, MO","NA, NA","NA, NA","Nodaway County","MO",NA,NA,NA,NA,"not sure if the victim of the lynching is Black - MB",2755,"sn88068010", -94.810595,  40.290728,NA,NA,NA,NA
"171", 8502,"The Kenosha telegraph ","Kenosha, Wisconsin", -87.82118, 42.584742,"Kenosha","Wisconsin","9/28/1888",1888, 9,28,"seq-1","https://articleextractor.org/pages/8502/whi_engledinger_ver02/sn85033123/1888/09/28/ed-1/seq-1/1","Cuba, MO","NA, NA","NA, NA","Cuba","MO",NA,NA,NA,NA,"not sure if lynching victim is Black - MB",2756,"sn85033123", -91.403483,  38.062823,NA,NA,NA,NA
"172", 8503,"Idaho semi-weekly world ","Idaho City, Idaho",-115.83455, 43.828505,"Idaho City","Idaho","5/18/1888",1888, 5,18,"seq-2","https://articleextractor.org/pages/8503/idhi_eliot_ver01/sn84022135/1888/05/18/ed-1/seq-2/1","Bessemer, AL","NA, NA","NA, NA","Bessemer","AL",NA,NA,NA,NA,NA,2757,"sn84022135", -86.954437,  33.401777,NA,NA,NA,NA
"173", 8504,"Chicago tribune ","Chicago, Illinois", -87.62980, 41.878114,"Chicago","Illinois","5/8/1870",1870, 5, 8,"seq-2","https://articleextractor.org/pages/8504/dlc_lake_ver02/sn82014064/1870/05/08/ed-1/seq-2/1","NA, KY","NA, NA","NA, NA",NA,"KY",NA,NA,NA,NA,"not specific case, but article says a tree in Kentucky has been the location of four lynchings in the past year",2758,"sn82014064", 106.150007,  22.726562,NA,NA,NA,NA
"174", 8505,NA,"NA, Illinois", -89.39853, 40.633125,NA,"Illinois","11/13/1872",1872,11,13,"seq-1","https://articleextractor.org/pages/8505/iune_juliet_ver01/sn88074142/1872/11/13/ed-1/seq-1/1","NA, NA","NA, NA","NA, NA",NA,NA,NA,NA,NA,NA,"says it was near Charleston bridge, no other location indication except that the paper is based in Cairo, Illinois",2759,"sn88074142",NA,NA,NA,NA,NA,NA
"175", 8507,"Barton County democrat ","Great Bend, Kansas", -98.76481, 38.364457,"Great Bend","Kansas","1/12/1888",1888, 1,12,"seq-6","https://articleextractor.org/pages/8507/khi_finney_ver02/sn83040198/1888/01/12/ed-1/seq-6/1","Oakdale, CA","Alamosa, CA","Charleston, MS","Oakdale","CA","Alamosa","CA","Charleston","MS","4th - Rives, TN, 5th - Owensboro, FL, 6th - Flemington, FL",2760,"sn83040198",-120.847031,  37.766626,-119.41793,  36.77826, -90.05676,  34.00678
"176", 8507,"Barton County democrat ","Great Bend, Kansas", -98.76481, 38.364457,"Great Bend","Kansas","1/12/1888",1888, 1,12,"seq-6","https://articleextractor.org/pages/8507/khi_finney_ver02/sn83040198/1888/01/12/ed-1/seq-6/1","Oakdale, CA","Alamosa, CA","Charleston, MS","Oakdale","CA","Alamosa","CA","Charleston","MS","4th - Rives, TN, 5th - Owensboro, FL, 6th - Flemington, FL",2761,"sn83040198",-120.847031,  37.766626,-119.41793,  36.77826, -90.05676,  34.00678
"177", 8507,"Barton County democrat ","Great Bend, Kansas", -98.76481, 38.364457,"Great Bend","Kansas","1/12/1888",1888, 1,12,"seq-6","https://articleextractor.org/pages/8507/khi_finney_ver02/sn83040198/1888/01/12/ed-1/seq-6/1","Oakdale, CA","Alamosa, CA","Charleston, MS","Oakdale","CA","Alamosa","CA","Charleston","MS","4th - Rives, TN, 5th - Owensboro, FL, 6th - Flemington, FL",2762,"sn83040198",-120.847031,  37.766626,-119.41793,  36.77826, -90.05676,  34.00678
"178", 8507,"Barton County democrat ","Great Bend, Kansas", -98.76481, 38.364457,"Great Bend","Kansas","1/12/1888",1888, 1,12,"seq-6","https://articleextractor.org/pages/8507/khi_finney_ver02/sn83040198/1888/01/12/ed-1/seq-6/1","Oakdale, CA","Alamosa, CA","Charleston, MS","Oakdale","CA","Alamosa","CA","Charleston","MS","4th - Rives, TN, 5th - Owensboro, FL, 6th - Flemington, FL",2763,"sn83040198",-120.847031,  37.766626,-119.41793,  36.77826, -90.05676,  34.00678
"179", 8507,"Barton County democrat ","Great Bend, Kansas", -98.76481, 38.364457,"Great Bend","Kansas","1/12/1888",1888, 1,12,"seq-6","https://articleextractor.org/pages/8507/khi_finney_ver02/sn83040198/1888/01/12/ed-1/seq-6/1","Oakdale, CA","Alamosa, CA","Charleston, MS","Oakdale","CA","Alamosa","CA","Charleston","MS","4th - Rives, TN, 5th - Owensboro, FL, 6th - Flemington, FL",2764,"sn83040198",-120.847031,  37.766626,-119.41793,  36.77826, -90.05676,  34.00678
"180", 8507,"Barton County democrat ","Great Bend, Kansas", -98.76481, 38.364457,"Great Bend","Kansas","1/12/1888",1888, 1,12,"seq-6","https://articleextractor.org/pages/8507/khi_finney_ver02/sn83040198/1888/01/12/ed-1/seq-6/1","Oakdale, CA","Alamosa, CA","Charleston, MS","Oakdale","CA","Alamosa","CA","Charleston","MS","4th - Rives, TN, 5th - Owensboro, FL, 6th - Flemington, FL",2765,"sn83040198",-120.847031,  37.766626,-119.41793,  36.77826, -90.05676,  34.00678
"181", 8511,"The Portland daily press ","Portland, Maine", -70.25682, 43.659099,"Portland","Maine","8/2/1888",1888, 8, 2,"seq-1","https://articleextractor.org/pages/8511/me_graftonnotch_ver01/sn83016025/1888/08/02/ed-1/seq-1/1","Omaha, NE","NA, NA","NA, NA","Omaha","NE",NA,NA,NA,NA,NA,2766,"sn83016025", -95.934503,  41.256537,NA,NA,NA,NA
"182", 8513,"The morning news ","Savannah, Georgia", -81.09120, 32.080899,"Savannah","Georgia","8/6/1889",1889, 8, 6,"seq-6","https://articleextractor.org/pages/8513/gu_columbo_ver02/sn86063034/1889/08/06/ed-1/seq-6/1","August, GA","NA, NA","NA, NA","August","GA",NA,NA,NA,NA,"lynch law threatened - MB",2767,"sn86063034", -82.010515,  33.473498,NA,NA,NA,NA
"183", 8514,"Indian chieftain ","Vinita, Oklahoma", -95.15413, 36.638694,"Vinita","Oklahoma","2/2/1888",1888, 2, 2,"seq-1","https://articleextractor.org/pages/8514/okhi_comanche_ver01/sn83025010/1888/02/02/ed-1/seq-1/1","St Joseph, MO","Plymouth, NC","NA, NA","St Joseph","MO","Plymouth","NC",NA,NA,"threat of lynching",2768,"sn83025010", -94.846681,  39.767458, -76.74856,  35.86683,NA,NA
"184", 8514,"Indian chieftain ","Vinita, Oklahoma", -95.15413, 36.638694,"Vinita","Oklahoma","2/2/1888",1888, 2, 2,"seq-1","https://articleextractor.org/pages/8514/okhi_comanche_ver01/sn83025010/1888/02/02/ed-1/seq-1/1","St Joseph, MO","Plymouth, NC","NA, NA","St Joseph","MO","Plymouth","NC",NA,NA,"threat of lynching",2769,"sn83025010", -94.846681,  39.767458, -76.74856,  35.86683,NA,NA
"185", 8517,"The Evansville journal ","Evansville, Indiana", -87.57109, 37.971559,"Evansville","Indiana","2/7/1868",1868, 2, 7,"seq-2","https://articleextractor.org/pages/8517/in_julian_ver02/sn82014296/1868/02/07/ed-1/seq-2/1","Frankfort, IN","NA, NA","NA, NA","Frankfort","IN",NA,NA,NA,NA,NA,2770,"sn82014296", -86.510835,  40.279481,NA,NA,NA,NA
"186", 8518,"The Donaldsonville chief ","Donaldsonville, Louisiana", -90.99288, 30.101032,"Donaldsonville","Louisiana","7/29/1882",1882, 7,29,"seq-1","https://articleextractor.org/pages/8518/lu_bolivar_ver01/sn85034248/1882/07/29/ed-1/seq-1/1","Perham, MN","NA, NA","NA, NA","Perham","MN",NA,NA,NA,NA,NA,2771,"sn85034248", -95.573009,  46.595344,NA,NA,NA,NA
"187", 8519,NA,"NA, South Dakota", -99.90181, 43.969515,NA,"South Dakota","12/14/1888",1888,12,14,"seq-8","https://articleextractor.org/pages/8519/sdhi_goshawk_ver03/sn2001063112/1888/12/14/ed-1/seq-8/1","Birmingham, AL","NA, NA","NA, NA","Birmingham","AL",NA,NA,NA,NA,"attempted lynching - MB",2772,"sn2001063112", -86.810357,  33.518589,NA,NA,NA,NA
"188", 8520,"Martinsburg herald ","Martinsburg, West Virginia", -77.96389, 39.456210,"Martinsburg","West Virginia","7/23/1892",1892, 7,23,"seq-1","https://articleextractor.org/pages/8520/wvu_boros_ver02/sn85059533/1892/07/23/ed-1/seq-1/1","Halley, AK","Franklin, KY","NA, NA","Halley","AK","Franklin","KY",NA,NA,"2nd article - murder before the man who was lynched went to jail was in the city, not sure of exact lynching location",2773,"sn85059533",NA,NA, -86.57856,  36.71879,NA,NA
"189", 8520,"Martinsburg herald ","Martinsburg, West Virginia", -77.96389, 39.456210,"Martinsburg","West Virginia","7/23/1892",1892, 7,23,"seq-1","https://articleextractor.org/pages/8520/wvu_boros_ver02/sn85059533/1892/07/23/ed-1/seq-1/1","Halley, AK","Franklin, KY","NA, NA","Halley","AK","Franklin","KY",NA,NA,"2nd article - murder before the man who was lynched went to jail was in the city, not sure of exact lynching location",2774,"sn85059533",NA,NA, -86.57856,  36.71879,NA,NA
"190", 8521,NA,"NA, South Carolina", -81.96511, 33.501803,NA,"South Carolina","10/28/1885",1885,10,28,"seq-4","https://articleextractor.org/pages/8521/scu_kikideville_ver02/sn93067760/1885/10/28/ed-1/seq-4/1","Edgefield, SC","NA, NA","NA, NA","Edgefield","SC",NA,NA,NA,NA,NA,2775,"sn93067760", -81.929558,  33.789577,NA,NA,NA,NA
"191", 8522,"Salt Lake evening Democrat ","Salt Lake City, Utah",-111.89105, 40.760779,"Salt Lake City","Utah","6/9/1885",1885, 6, 9,"seq-1","https://articleextractor.org/pages/8522/uuml_layden_ver01/sn85058117/1885/06/09/ed-1/seq-1/1","Live Oak, FL","Bonham, TX","NA, NA","Live Oak","FL","Bonham","TX",NA,NA,NA,2776,"sn85058117", -82.984020,  30.294946, -96.17831,  33.57733,NA,NA
"192", 8522,"Salt Lake evening Democrat ","Salt Lake City, Utah",-111.89105, 40.760779,"Salt Lake City","Utah","6/9/1885",1885, 6, 9,"seq-1","https://articleextractor.org/pages/8522/uuml_layden_ver01/sn85058117/1885/06/09/ed-1/seq-1/1","Live Oak, FL","Bonham, TX","NA, NA","Live Oak","FL","Bonham","TX",NA,NA,NA,2777,"sn85058117", -82.984020,  30.294946, -96.17831,  33.57733,NA,NA
"193", 8525,NA,"NA, New Mexico",-105.03236, 34.972730,NA,"New Mexico","9/23/1885",1885, 9,23,"seq-1","https://articleextractor.org/pages/8525/nmu_elk_ver01/sn90051703/1885/09/23/ed-1/seq-1/1","Johnston, VA","Lewiston, ID","NA, NA","Johnston","VA","Lewiston","ID",NA,NA,"I believe this same lynching was mentioned in another paper that I already made a form for but a different location was listed - MB, the second article is about the lynching of Chinese men, which is the first example I've seen of that - MB",2778,"sn90051703", -78.656894,  37.431573,-117.00119,  46.40041,NA,NA
"194", 8525,NA,"NA, New Mexico",-105.03236, 34.972730,NA,"New Mexico","9/23/1885",1885, 9,23,"seq-1","https://articleextractor.org/pages/8525/nmu_elk_ver01/sn90051703/1885/09/23/ed-1/seq-1/1","Johnston, VA","Lewiston, ID","NA, NA","Johnston","VA","Lewiston","ID",NA,NA,"I believe this same lynching was mentioned in another paper that I already made a form for but a different location was listed - MB, the second article is about the lynching of Chinese men, which is the first example I've seen of that - MB",2779,"sn90051703", -78.656894,  37.431573,-117.00119,  46.40041,NA,NA
"195", 8527,"Semi-weekly interior journal ","Stanford, Kentucky", -84.66189, 37.531190,"Stanford","Kentucky","8/21/1888",1888, 8,21,"seq-2","https://articleextractor.org/pages/8527/kyu_casablanca_ver01/sn85052020/1888/08/21/ed-1/seq-2/1","Mt. Sterling, KY","Louisville, KY","NA, AL","Mt. Sterling","KY","Louisville","KY",NA,"AL","threat of lynching in all three articles - MB",2782,"sn85052020", -83.943256,  38.056468, -85.75846,  38.25266,NA,NA
"196", 8527,"Semi-weekly interior journal ","Stanford, Kentucky", -84.66189, 37.531190,"Stanford","Kentucky","8/21/1888",1888, 8,21,"seq-2","https://articleextractor.org/pages/8527/kyu_casablanca_ver01/sn85052020/1888/08/21/ed-1/seq-2/1","Mt. Sterling, KY","Louisville, KY","NA, AL","Mt. Sterling","KY","Louisville","KY",NA,"AL","threat of lynching in all three articles - MB",2783,"sn85052020", -83.943256,  38.056468, -85.75846,  38.25266,NA,NA
"197", 8527,"Semi-weekly interior journal ","Stanford, Kentucky", -84.66189, 37.531190,"Stanford","Kentucky","8/21/1888",1888, 8,21,"seq-2","https://articleextractor.org/pages/8527/kyu_casablanca_ver01/sn85052020/1888/08/21/ed-1/seq-2/1","Mt. Sterling, KY","Louisville, KY","NA, AL","Mt. Sterling","KY","Louisville","KY",NA,"AL","threat of lynching in all three articles - MB",2784,"sn85052020", -83.943256,  38.056468, -85.75846,  38.25266,NA,NA
"198", 8527,"Semi-weekly interior journal ","Stanford, Kentucky", -84.66189, 37.531190,"Stanford","Kentucky","8/21/1888",1888, 8,21,"seq-2","https://articleextractor.org/pages/8527/kyu_casablanca_ver01/sn85052020/1888/08/21/ed-1/seq-2/1","Mt. Sterling, KY","Louisville, KY","NA, AL","Mt. Sterling","KY","Louisville","KY",NA,"AL","threat of lynching in all three articles - MB",2785,"sn85052020", -83.943256,  38.056468, -85.75846,  38.25266,NA,NA
"199", 8528,"The Iola register ","Iola, Kansas", -95.39998, 37.924480,"Iola","Kansas","11/13/1885",1885,11,13,"seq-2","https://articleextractor.org/pages/8528/khi_dole_ver01/sn83040340/1885/11/13/ed-1/seq-2/1","Dooly County, GA","NA, NA","NA, NA","Dooly County","GA",NA,NA,NA,NA,NA,2786,"sn83040340", -83.804868,  32.159345,NA,NA,NA,NA
"200", 8529,"Alexandria gazette ","Alexandria, District of Columbia", -77.04692, 38.804836,"Alexandria","District of Columbia","1/20/1880",1880, 1,20,"seq-2","https://articleextractor.org/pages/8529/vi_gabbana_ver01/sn85025007/1880/01/20/ed-1/seq-2/1","Warrenton, VA","NA, NA","NA, NA","Warrenton","VA",NA,NA,NA,NA,NA,2787,"sn85025007", -77.795271,  38.713452,NA,NA,NA,NA
"201", 8530,"Evening star ","Washington, District of Columbia", -77.03687, 38.907192,"Washington","District of Columbia","1/6/1880",1880, 1, 6,"seq-3","https://articleextractor.org/pages/8530/dlc_yorkie_ver01/sn83045462/1880/01/06/ed-1/seq-3/1","Amherst, VA","NA, NA","NA, NA","Amherst","VA",NA,NA,NA,NA,"he was lynched on the way to Amherst jail - MB",2788,"sn83045462", -79.051413,  37.585141,NA,NA,NA,NA
"202", 8531,NA,"NA, Texas", -99.90181, 31.968599,NA,"Texas","6/9/1888",1888, 6, 9,"seq-7","https://articleextractor.org/pages/8531/txdn_hotel_ver02/sn86064205/1888/06/09/ed-1/seq-7/1","Lansing Switch, TX","NA, NA","NA, NA","Lansing Switch","TX",NA,NA,NA,NA,NA,2789,"sn86064205", -94.625575,  32.481168,NA,NA,NA,NA
"203", 8532,"Knoxville daily chronicle ","Knoxville, Tennessee", -83.92074, 35.960638,"Knoxville","Tennessee","4/22/1879",1879, 4,22,"seq-1","https://articleextractor.org/pages/8532/tu_jimmy_ver02/sn85033437/1879/04/22/ed-1/seq-1/1","Frederick, MD","NA, NA","NA, NA","Frederick","MD",NA,NA,NA,NA,NA,2790,"sn85033437", -77.410541,  39.414269,NA,NA,NA,NA
"204", 8535,"The Lake Charles echo ","Lake Charles, Louisiana", -93.21738, 30.226595,"Lake Charles","Louisiana","12/18/1880",1880,12,18,"seq-2","https://articleextractor.org/pages/8535/lu_lapras_ver01/sn86053696/1880/12/18/ed-1/seq-2/1","Clarendon County, SC","NA, NA","NA, NA","Clarendon County","SC",NA,NA,NA,NA,NA,2792,"sn86053696", -80.187506,  33.673424,NA,NA,NA,NA
"205", 8536,"Morning journal and courier ","New Haven , Connecticut", -72.92788, 41.308274,"New Haven ","Connecticut","3/23/1880",1880, 3,23,"seq-3","https://articleextractor.org/pages/8536/ct_elm_ver01/sn82015483/1880/03/23/ed-1/seq-3/1","Honeyville, VA","NA, NA","NA, NA","Honeyville","VA",NA,NA,NA,NA,NA,2793,"sn82015483", -78.562234,  38.578733,NA,NA,NA,NA
"206", 8537,"The Canton advocate ","Canton, South Dakota", -99.90181, 43.969515,"Canton","South Dakota","12/18/1884",1884,12,18,"seq-3","https://articleextractor.org/pages/8537/mnhi_volvo_ver01/sn83025440/1884/12/18/ed-1/seq-3/1","Maryville, MO","NA, NA","NA, NA","Maryville","MO",NA,NA,NA,NA,NA,2794,"sn83025440", -94.872471,  40.346102,NA,NA,NA,NA
"207", 8541,NA,"NA, Louisiana", -93.08628, 31.760720,NA,"Louisiana","12/18/1913",1913,12,18,"seq-2","https://articleextractor.org/pages/8541/lu_arminius_ver01/sn88064469/1913/12/18/ed-1/seq-2/1","Blanchard, LA","NA, NA","NA, NA","Blanchard","LA",NA,NA,NA,NA,NA,2796,"sn88064469", -93.892681,  32.580983,NA,NA,NA,NA
"208", 8542,NA,"NA, Missouri", 101.75239, 20.924080,NA,"Missouri","10/1/1914",1914,10, 1,"seq-2","https://articleextractor.org/pages/8542/mohi_henri_ver01/sn89067273/1914/10/01/ed-1/seq-2/1","Rochelle, GA","NA, NA","NA, NA","Rochelle","GA",NA,NA,NA,NA,NA,2797,"sn89067273", -83.456274,  31.951010,NA,NA,NA,NA
"209", 8545,"The Daily Ardmoreite ","Ardmore, Oklahoma", -97.14363, 34.174261,"Ardmore","Oklahoma","2/8/1914",1914, 2, 8,"seq-2","https://articleextractor.org/pages/8545/okhi_foss_ver01/sn85042303/1914/02/08/ed-1/seq-2/2","Oklahoma City, OK","NA, NA","NA, NA","Oklahoma City","OK",NA,NA,NA,NA,"Long governor's statement about lynchings, how many there have been, and the ethics of mob violence - note on article",2798,"sn85042303", -97.516428,  35.467560,NA,NA,NA,NA
"210", 8548,"The Madison daily leader ","Madison, South Dakota", -97.11395, 44.006085,"Madison","South Dakota","11/28/1914",1914,11,28,"seq-1","https://articleextractor.org/pages/8548/sdhi_hawaii_ver01/sn99062034/1914/11/28/ed-1/seq-1/1","Bysalia, MS","NA, NA","NA, NA","Bysalia","MS",NA,NA,NA,NA,NA,2800,"sn99062034", -89.690640,  34.872318,NA,NA,NA,NA
"211", 8552,NA,"NA, Florida", -81.51575, 27.664827,NA,"Florida","11/13/1914",1914,11,13,"seq-1","https://articleextractor.org/pages/8552/fu_graham_ver01/sn87062268/1914/11/13/ed-1/seq-1/1","St. Petersburg, FL","NA, NA","NA, NA","St. Petersburg","FL",NA,NA,NA,NA,NA,2801,"sn87062268", -82.638445,  27.767127,NA,NA,NA,NA
"212", 8553,NA,"NA, Nebraska", -99.90181, 41.492537,NA,"Nebraska","2/12/1900",1900, 2,12,"seq-1","https://articleextractor.org/pages/8553/nbu_emerson_ver01/sn99021999/1900/02/12/ed-1/seq-1/1","Port Arthur, TX","NA, NA","NA, NA","Port Arthur","TX",NA,NA,NA,NA,NA,2802,"sn99021999", -93.939947,  29.884950,NA,NA,NA,NA
"213", 8554,NA,"NA, Maryland", -76.64127, 39.045755,NA,"Maryland","12/17/1888",1888,12,17,"seq-1","https://articleextractor.org/pages/8554/mdu_galena_ver02/sn88065721/1888/12/17/ed-1/seq-1/3","Benton County, IN","Jamestown, NY","Indianapolis, IN","Benton County","IN","Jamestown","NY","Indianapolis","IN","first article - attempted lynching, second, third and fourth (fourth is in Columbus, OH) all mention ""White Caps"" and killings associated with them according to note on paper - MB",2803,"sn88065721", -87.341360,  40.644786, -79.23533,  42.09700, -86.15807,  39.76840
"214", 8554,NA,"NA, Maryland", -76.64127, 39.045755,NA,"Maryland","12/17/1888",1888,12,17,"seq-1","https://articleextractor.org/pages/8554/mdu_galena_ver02/sn88065721/1888/12/17/ed-1/seq-1/3","Benton County, IN","Jamestown, NY","Indianapolis, IN","Benton County","IN","Jamestown","NY","Indianapolis","IN","first article - attempted lynching, second, third and fourth (fourth is in Columbus, OH) all mention ""White Caps"" and killings associated with them according to note on paper - MB",2804,"sn88065721", -87.341360,  40.644786, -79.23533,  42.09700, -86.15807,  39.76840
"215", 8554,NA,"NA, Maryland", -76.64127, 39.045755,NA,"Maryland","12/17/1888",1888,12,17,"seq-1","https://articleextractor.org/pages/8554/mdu_galena_ver02/sn88065721/1888/12/17/ed-1/seq-1/3","Benton County, IN","Jamestown, NY","Indianapolis, IN","Benton County","IN","Jamestown","NY","Indianapolis","IN","first article - attempted lynching, second, third and fourth (fourth is in Columbus, OH) all mention ""White Caps"" and killings associated with them according to note on paper - MB",2805,"sn88065721", -87.341360,  40.644786, -79.23533,  42.09700, -86.15807,  39.76840
"216", 8554,NA,"NA, Maryland", -76.64127, 39.045755,NA,"Maryland","12/17/1888",1888,12,17,"seq-1","https://articleextractor.org/pages/8554/mdu_galena_ver02/sn88065721/1888/12/17/ed-1/seq-1/3","Benton County, IN","Jamestown, NY","Indianapolis, IN","Benton County","IN","Jamestown","NY","Indianapolis","IN","first article - attempted lynching, second, third and fourth (fourth is in Columbus, OH) all mention ""White Caps"" and killings associated with them according to note on paper - MB",2806,"sn88065721", -87.341360,  40.644786, -79.23533,  42.09700, -86.15807,  39.76840
"217", 8555,"Barton County democrat ","Great Bend, Kansas", -98.76481, 38.364457,"Great Bend","Kansas","5/4/1893",1893, 5, 4,"seq-2","https://articleextractor.org/pages/8555/khi_finney_ver02/sn83040198/1893/05/04/ed-1/seq-2/1","Morrillton, AK","Denmark, SC","Bonham, TX","Morrillton","AK","Denmark","SC","Bonham","TX","unclear whether third article is lynching or judicial execution - MB",2807,"sn83040198", -92.743784,  35.152616, -81.14232,  33.32265, -96.17831,  33.57733
"218", 8555,"Barton County democrat ","Great Bend, Kansas", -98.76481, 38.364457,"Great Bend","Kansas","5/4/1893",1893, 5, 4,"seq-2","https://articleextractor.org/pages/8555/khi_finney_ver02/sn83040198/1893/05/04/ed-1/seq-2/1","Morrillton, AK","Denmark, SC","Bonham, TX","Morrillton","AK","Denmark","SC","Bonham","TX","unclear whether third article is lynching or judicial execution - MB",2808,"sn83040198", -92.743784,  35.152616, -81.14232,  33.32265, -96.17831,  33.57733
"219", 8555,"Barton County democrat ","Great Bend, Kansas", -98.76481, 38.364457,"Great Bend","Kansas","5/4/1893",1893, 5, 4,"seq-2","https://articleextractor.org/pages/8555/khi_finney_ver02/sn83040198/1893/05/04/ed-1/seq-2/1","Morrillton, AK","Denmark, SC","Bonham, TX","Morrillton","AK","Denmark","SC","Bonham","TX","unclear whether third article is lynching or judicial execution - MB",2809,"sn83040198", -92.743784,  35.152616, -81.14232,  33.32265, -96.17831,  33.57733
"220", 8556,NA,"NA, Tennessee", -86.58045, 35.517491,NA,"Tennessee","11/13/1879",1879,11,13,"seq-2","https://articleextractor.org/pages/8556/tu_isaac_ver01/sn86053488/1879/11/13/ed-1/seq-2/1","Luray, MO","NA, NA","NA, NA","Luray","MO",NA,NA,NA,NA,NA,2810,"sn86053488", -91.881837,  40.453093,NA,NA,NA,NA
"221", 8556,NA,"NA, Tennessee", -86.58045, 35.517491,NA,"Tennessee","11/13/1879",1879,11,13,"seq-2","https://articleextractor.org/pages/8556/tu_isaac_ver01/sn86053488/1879/11/13/ed-1/seq-2/1","Luray, MO","NA, NA","NA, NA","Luray","MO",NA,NA,NA,NA,NA,2811,"sn86053488", -91.881837,  40.453093,NA,NA,NA,NA
"222", 8557,"The Seattle post-intelligencer ","Seattle, Washington",-122.33285, 47.606139,"Seattle","Washington","11/16/1889",1889,11,16,"seq-2","https://articleextractor.org/pages/8557/wa_entiat_ver01/sn83045604/1889/11/16/ed-1/seq-2/1","McComb, MS","NA, NA","NA, NA","McComb","MS",NA,NA,NA,NA,NA,2812,"sn83045604", -90.453153,  31.243787,NA,NA,NA,NA
"223", 8558,"Eureka daily sentinel ","Eureka, Nevada",-115.96078, 39.512486,"Eureka","Nevada","9/18/1886",1886, 9,18,"seq-2","https://articleextractor.org/pages/8558/nvln_sparks_ver01/sn84022044/1886/09/18/ed-1/seq-2/1","Millen, GA","NA, NA","NA, NA","Millen","GA",NA,NA,NA,NA,NA,2813,"sn84022044", -81.949281,  32.804051,NA,NA,NA,NA
"224", 8560,NA,"NA, South Dakota", -99.90181, 43.969515,NA,"South Dakota","6/11/1886",1886, 6,11,"seq-1","https://articleextractor.org/pages/8560/sdhi_goshawk_ver03/sn2001063112/1886/06/11/ed-1/seq-1/1","Lexington, NC","NA, NA","NA, NA","Lexington","NC",NA,NA,NA,NA,NA,2814,"sn2001063112", -80.253384,  35.824027,NA,NA,NA,NA
"225", 8561,"San Marcos free press ","San Marcos, Texas", -97.94139, 29.883275,"San Marcos","Texas","7/20/1878",1878, 7,20,"seq-2","https://articleextractor.org/pages/8561/txdn_ferrari_ver02/sn86088181/1878/07/20/ed-1/seq-2/1","Vine Grove, KY","NA, NA","NA, NA","Vine Grove","KY",NA,NA,NA,NA,NA,2815,"sn86088181", -85.981352,  37.810067,NA,NA,NA,NA
"226", 8562,"The Wheeling daily intelligencer ","Wheeling, West Virginia", -80.72092, 40.063962,"Wheeling","West Virginia","9/4/1877",1877, 9, 4,"seq-1","https://articleextractor.org/pages/8562/wvu_denmark_ver01/sn84026844/1877/09/04/ed-1/seq-1/1","Oxford, OH","NA, NA","NA, NA","Oxford","OH",NA,NA,NA,NA,NA,2816,"sn84026844", -84.745231,  39.506997,NA,NA,NA,NA
"227", 8565,"The weekly Arizona miner ","Prescott, Arizona",-112.46850, 34.540024,"Prescott","Arizona","9/6/1878",1878, 9, 6,"seq-2","https://articleextractor.org/pages/8565/az_apachetrout_ver01/sn82014897/1878/09/06/ed-1/seq-2/1","Sandusky, OH","NA, NA","NA, NA","Sandusky","OH",NA,NA,NA,NA,NA,2817,"sn82014897", -82.711682,  41.456175,NA,NA,NA,NA
"228", 8566,"New York dispatch ","New York , New York", -74.00597, 40.712775,"New York ","New York","9/26/1875",1875, 9,26,"seq-4","https://articleextractor.org/pages/8566/dlc_eliot_ver01/sn85026214/1875/09/26/ed-1/seq-4/1","Bellefontaine, OH","NA, NA","NA, NA","Bellefontaine","OH",NA,NA,NA,NA,NA,2818,"sn85026214", -83.759656,  40.361164,NA,NA,NA,NA
"229", 8567,"Helena weekly herald ","Helena, Montana",-112.03911, 46.589145,"Helena","Montana","3/20/1873",1873, 3,20,"seq-3","https://articleextractor.org/pages/8567/mthi_harrier_ver01/sn84036143/1873/03/20/ed-1/seq-3/1","Monterey, CA","NA, NA","NA, NA","Monterey","CA",NA,NA,NA,NA,"it's a short line that says the people of the city condemn the hanging by a mob of a person - MB",2819,"sn84036143",-121.894676,  36.600238,NA,NA,NA,NA
"230", 8572,"The Manitowoc pilot ","Manitowoc, Wisconsin", -87.65758, 44.088606,"Manitowoc","Wisconsin","6/29/1866",1866, 6,29,"seq-2","https://articleextractor.org/pages/8572/whi_grace_ver01/sn85033139/1866/06/29/ed-1/seq-2/1","Seaconk, RI","NA, NA","NA, NA","Seaconk","RI",NA,NA,NA,NA,"threat of lynch law - MB",2820,"sn85033139", -71.376499,  41.846379,NA,NA,NA,NA
"231", 8575,"The Omaha guide ","Omaha, Nebraska", -95.93450, 41.256537,"Omaha","Nebraska","1/26/1935",1935, 1,26,"seq-3","https://articleextractor.org/pages/8575/nbu_fourtusker_ver01/sn93062828/1935/01/26/ed-1/seq-3/1","Franklinton, LA","NA, NA","NA, NA","Franklinton","LA",NA,NA,NA,NA,"second article on page is not about lynching incident but it is ""argument from a letter to the president saying he should use his influence to end lynching"" (from note) - MB",2821,"sn93062828", -90.153141,  30.847128,NA,NA,NA,NA
"232", 8575,"The Omaha guide ","Omaha, Nebraska", -95.93450, 41.256537,"Omaha","Nebraska","1/26/1935",1935, 1,26,"seq-3","https://articleextractor.org/pages/8575/nbu_fourtusker_ver01/sn93062828/1935/01/26/ed-1/seq-3/1","Franklinton, LA","NA, NA","NA, NA","Franklinton","LA",NA,NA,NA,NA,"second article on page is not about lynching incident but it is ""argument from a letter to the president saying he should use his influence to end lynching"" (from note) - MB",2822,"sn93062828", -90.153141,  30.847128,NA,NA,NA,NA
"233", 8578,"The New Orleans daily Democrat ","New Orleans, Louisiana", -90.07153, 29.951066,"New Orleans","Louisiana","3/28/1877",1877, 3,28,"seq-2","https://articleextractor.org/pages/8578/lu_nejat_ver01/sn83026413/1877/03/28/ed-1/seq-2/1","Johnsonville, MS","NA, NA","NA, NA","Johnsonville","MS",NA,NA,NA,NA,NA,2823,"sn83026413", -90.595368,  33.419564,NA,NA,NA,NA
"234", 8581,"Knoxville daily chronicle ","Knoxville, Tennessee", -83.92074, 35.960638,"Knoxville","Tennessee","7/14/1881",1881, 7,14,"seq-1","https://articleextractor.org/pages/8581/tu_kay_ver01/sn85033437/1881/07/14/ed-1/seq-1/1","Des Arc, AK","NA, NA","NA, NA","Des Arc","AK",NA,NA,NA,NA,NA,2824,"sn85033437", -91.497665,  34.976985,NA,NA,NA,NA
"235", 8582,"Chicago daily tribune ","Chicago, Illinois", -87.62980, 41.878114,"Chicago","Illinois","6/20/1879",1879, 6,20,"seq-6","https://articleextractor.org/pages/8582/dlc_pulaski_ver01/sn84031492/1879/06/20/ed-1/seq-6/1","Spartanburg, SC","NA, NA","NA, NA","Spartanburg","SC",NA,NA,NA,NA,NA,2825,"sn84031492", -81.932048,  34.949567,NA,NA,NA,NA
"236", 8585,NA,"NA, South Dakota", -99.90181, 43.969515,NA,"South Dakota","4/28/1892",1892, 4,28,"seq-3","https://articleextractor.org/pages/8585/sdhi_dagger_ver01/sn2001063133/1892/04/28/ed-1/seq-3/1","Pointe Coupee Parish, LA","Findlay, OH","Inverness, FL","Pointe Coupee Parish","LA","Findlay","OH","Inverness","FL",NA,2827,"sn2001063133", -91.598396,  30.610217, -83.64993,  41.04422, -82.33140,  28.83545
"237", 8586,"Kansas City daily journal ","Kansas City, Missouri", -94.57857, 39.099727,"Kansas City","Missouri","5/20/1895",1895, 5,20,"seq-1","https://articleextractor.org/pages/8586/mohi_edwards_ver01/sn86063624/1895/05/20/ed-1/seq-1/1","Lafayette County, FL","NA, NA","NA, NA","Lafayette County","FL",NA,NA,NA,NA,NA,2828,"sn86063624", -83.207764,  30.029957,NA,NA,NA,NA
"238", 8587,"The Elbert County tribune ","Elbert, Colorado",-104.53715, 39.219468,"Elbert","Colorado","7/5/1906",1906, 7, 5,"seq-4","https://articleextractor.org/pages/8587/cohi_jasper_ver01/sn90051300/1906/07/05/ed-1/seq-4/1","Bradley, OK","NA, NA","NA, NA","Bradley","OK",NA,NA,NA,NA,NA,2829,"sn90051300", -97.708369,  34.878127,NA,NA,NA,NA
"239", 8590,"The Oakes times ","Oakes, North Dakota", -98.09038, 46.138579,"Oakes","North Dakota","12/27/1906",1906,12,27,"seq-2","https://articleextractor.org/pages/8590/ndhi_carbon_ver01/sn87096017/1906/12/27/ed-1/seq-2/1","Chattanooga, TN","NA, NA","NA, NA","Chattanooga","TN",NA,NA,NA,NA,NA,2830,"sn87096017", -85.309399,  35.045798,NA,NA,NA,NA
"240", 8591,"Democratic messenger ","Snow Hill, Maryland", -75.39270, 38.177063,"Snow Hill","Maryland","8/11/1906",1906, 8,11,"seq-8","https://articleextractor.org/pages/8591/mdu_denton_ver01/sn84026758/1906/08/11/ed-1/seq-8/1","Salisbury, MD","NA, NA","NA, NA","Salisbury","MD",NA,NA,NA,NA,NA,2831,"sn84026758", -75.599369,  38.360674,NA,NA,NA,NA
"241", 8594,NA,"NA, Oregon",-120.55420, 43.804133,NA,"Oregon","10/24/1906",1906,10,24,"seq-8","https://articleextractor.org/pages/8594/oru_framebones_ver01/sn99063957/1906/10/24/ed-1/seq-8/1","Ferry, LA","NA, NA","NA, NA","Ferry","LA",NA,NA,NA,NA,NA,2833,"sn99063957",NA,NA,NA,NA,NA,NA
"242", 8596,NA,"NA, Oklahoma",  99.86272,  8.528547,NA,"Oklahoma","1/12/1906",1906, 1,12,"seq-4","https://articleextractor.org/pages/8596/okhi_greer_ver01/sn96093062/1906/01/12/ed-1/seq-4/1","Moscow, TX","Enid, OK","NA, NA","Moscow","TX","Enid","OK",NA,NA,"second article - a fear of lynching mentioned",2834,"sn96093062", -94.825209,  30.913248, -97.87839,  36.39559,NA,NA
"243", 8597,"The Fargo forum and daily republican ","Fargo, North Dakota", -96.78980, 46.877186,"Fargo","North Dakota","8/17/1906",1906, 8,17,"seq-1","https://articleextractor.org/pages/8597/ndhi_edosian_ver01/sn85042224/1906/08/17/ed-1/seq-1/1","Greenwood, SC","NA, NA","NA, NA","Greenwood","SC",NA,NA,NA,NA,NA,2835,"sn85042224", -82.161788,  34.195400,NA,NA,NA,NA
"244", 8598,"The evening world ","New York, New York", -74.00597, 40.712775,"New York","New York","8/1/1892",1892, 8, 1,"seq-5","https://articleextractor.org/pages/8598/nn_goethe_ver01/sn83030193/1892/08/01/ed-4/seq-5/1","Denver, CO","NA, NA","NA, NA","Denver","CO",NA,NA,NA,NA,"narrowly avoided a lynch mob, it's also in a town outside of Denver that wasn't specified",2836,"sn83030193",-104.990251,  39.739236,NA,NA,NA,NA
"245", 8600,"The morning news ","Savannah, Georgia", -81.09120, 32.080899,"Savannah","Georgia","4/26/1893",1893, 4,26,"seq-4","https://articleextractor.org/pages/8600/gu_drew_ver02/sn86063034/1893/04/26/ed-1/seq-4/1","Denmark, SC","NA, NA","NA, NA","Denmark","SC",NA,NA,NA,NA,NA,2837,"sn86063034", -81.142324,  33.322655,NA,NA,NA,NA
"246", 8602,"Reporter and farmer ","Webster, South Dakota", -97.52009, 45.332180,"Webster","South Dakota","9/27/1894",1894, 9,27,"seq-7","https://articleextractor.org/pages/8602/sdhi_leek_ver02/sn99068116/1894/09/27/ed-1/seq-7/1","McGehee, AK","NA, NA","NA, NA","McGehee","AK",NA,NA,NA,NA,NA,2838,"sn99068116", -91.383286,  33.610759,NA,NA,NA,NA
"247", 8603,NA,"NA, Illinois", -89.39853, 40.633125,NA,"Illinois","6/28/1894",1894, 6,28,"seq-4","https://articleextractor.org/pages/8603/iune_ephemera_ver01/sn92053934/1894/06/28/ed-1/seq-4/1","Decatur, IL","NA, NA","NA, NA","Decatur","IL",NA,NA,NA,NA,"mob wants to lynch someone but hasn't yet",2839,"sn92053934", -88.954800,  39.840315,NA,NA,NA,NA
"248", 8604,"The pioneer express ","Pembina, North Dakota", -97.24368, 48.966377,"Pembina","North Dakota","8/10/1894",1894, 8,10,"seq-1","https://articleextractor.org/pages/8604/ndhi_almont_ver01/sn88076741/1894/08/10/ed-1/seq-1/1","Luraville, FL","NA, NA","NA, NA","Luraville","FL",NA,NA,NA,NA,"unsure if lynching was successful",2840,"sn88076741", -83.169303,  30.122445,NA,NA,NA,NA
"249", 8605,"The true northerner ","Paw Paw, Michigan", -85.89113, 42.217817,"Paw Paw","Michigan","10/26/1900",1900,10,26,"seq-3","https://articleextractor.org/pages/8605/mimtptc_gaylord_ver02/sn85033781/1900/10/26/ed-1/seq-3/1","Vicksburg, MS","NA, NA","NA, NA","Vicksburg","MS",NA,NA,NA,NA,NA,2841,"sn85033781", -90.877882,  32.352646,NA,NA,NA,NA
"250", 8607,"The Wheeling daily intelligencer ","Wheeling, West Virginia", -80.72092, 40.063962,"Wheeling","West Virginia","7/7/1887",1887, 7, 7,"seq-1","https://articleextractor.org/pages/8607/wvu_france_ver01/sn84026844/1887/07/07/ed-1/seq-1/1","Towson, MD","NA, NA","NA, NA","Towson","MD",NA,NA,NA,NA,"attempted lynching but mob was stopped",2842,"sn84026844", -76.601912,  39.401496,NA,NA,NA,NA
"251", 8610,"The Abilene reflector ","Abilene, Kansas", -97.21391, 38.917222,"Abilene","Kansas","5/5/1887",1887, 5, 5,"seq-2","https://articleextractor.org/pages/8610/khi_garwood_ver02/sn84029385/1887/05/05/ed-1/seq-2/1","Louisville, KY","NA, NA","NA, NA","Louisville","KY",NA,NA,NA,NA,"attempted lynching but mob was stopped by military and police",2843,"sn84029385", -85.758456,  38.252665,NA,NA,NA,NA
"252", 8610,"The Abilene reflector ","Abilene, Kansas", -97.21391, 38.917222,"Abilene","Kansas","5/5/1887",1887, 5, 5,"seq-2","https://articleextractor.org/pages/8610/khi_garwood_ver02/sn84029385/1887/05/05/ed-1/seq-2/1","Proctor, WV","NA, NA","NA, NA","Proctor","WV",NA,NA,NA,NA,NA,2843,"sn84029385", -80.823788,  39.710263,NA,NA,NA,NA
"253", 8610,"The Abilene reflector ","Abilene, Kansas", -97.21391, 38.917222,"Abilene","Kansas","5/5/1887",1887, 5, 5,"seq-2","https://articleextractor.org/pages/8610/khi_garwood_ver02/sn84029385/1887/05/05/ed-1/seq-2/1","Louisville, KY","NA, NA","NA, NA","Louisville","KY",NA,NA,NA,NA,"attempted lynching but mob was stopped by military and police",2844,"sn84029385", -85.758456,  38.252665,NA,NA,NA,NA
"254", 8610,"The Abilene reflector ","Abilene, Kansas", -97.21391, 38.917222,"Abilene","Kansas","5/5/1887",1887, 5, 5,"seq-2","https://articleextractor.org/pages/8610/khi_garwood_ver02/sn84029385/1887/05/05/ed-1/seq-2/1","Proctor, WV","NA, NA","NA, NA","Proctor","WV",NA,NA,NA,NA,NA,2844,"sn84029385", -80.823788,  39.710263,NA,NA,NA,NA
"255", 8610,"The Abilene reflector ","Abilene, Kansas", -97.21391, 38.917222,"Abilene","Kansas","5/5/1887",1887, 5, 5,"seq-2","https://articleextractor.org/pages/8610/khi_garwood_ver02/sn84029385/1887/05/05/ed-1/seq-2/1","Louisville, KY","NA, NA","NA, NA","Louisville","KY",NA,NA,NA,NA,"attempted lynching but mob was stopped by military and police",2845,"sn84029385", -85.758456,  38.252665,NA,NA,NA,NA
"256", 8610,"The Abilene reflector ","Abilene, Kansas", -97.21391, 38.917222,"Abilene","Kansas","5/5/1887",1887, 5, 5,"seq-2","https://articleextractor.org/pages/8610/khi_garwood_ver02/sn84029385/1887/05/05/ed-1/seq-2/1","Proctor, WV","NA, NA","NA, NA","Proctor","WV",NA,NA,NA,NA,NA,2845,"sn84029385", -80.823788,  39.710263,NA,NA,NA,NA
"257", 8618,"Kansas City daily journal ","Kansas City, Missouri", -94.57857, 39.099727,"Kansas City","Missouri","1/19/1897",1897, 1,19,"seq-2","https://articleextractor.org/pages/8618/mohi_edwards_ver01/sn86063624/1897/01/19/ed-1/seq-2/1","Sedalia, MO","Columbus, MS","NA, NA","Sedalia","MO","Columbus","MS",NA,NA,"first article - mention of possibly being lynched",2849,"sn86063624", -93.228261,  38.704461, -88.42726,  33.49567,NA,NA
"258", 8619,NA,"NA, Texas", -99.90181, 31.968599,NA,"Texas","7/30/1897",1897, 7,30,"seq-1","https://articleextractor.org/pages/8619/txdn_ferrari_ver02/sn86064199/1897/07/30/ed-1/seq-1/1","San Antonio, TX","NA, NA","NA, NA","San Antonio","TX",NA,NA,NA,NA,"lynching prevented, another attempt might happen story states",2850,"sn86064199", -98.494592,  29.425190,NA,NA,NA,NA
"259", 8621,NA,"NA, Mississippi", -89.39853, 32.354668,NA,"Mississippi","1/14/1898",1898, 1,14,"seq-2","https://articleextractor.org/pages/8621/msar_daisy_ver01/sn87065532/1898/01/14/ed-1/seq-2/1","Bearden, AK","NA, NA","NA, NA","Bearden","AK",NA,NA,NA,NA,NA,2851,"sn87065532", -92.615661,  33.724650,NA,NA,NA,NA
"260", 8622,NA,"NA, South Dakota", -99.90181, 43.969515,NA,"South Dakota","4/25/1895",1895, 4,25,"seq-4","https://articleextractor.org/pages/8622/sdhi_guava_ver02/sn99068086/1895/04/25/ed-1/seq-4/1","Bardstown, KY","NA, NA","NA, NA","Bardstown","KY",NA,NA,NA,NA,"a photographer from that city was taking photos of this lynching",2852,"sn99068086", -85.466902,  37.809228,NA,NA,NA,NA
"261", 8623,"St. Paul daily globe ","Saint Paul, Minnesota", -93.08996, 44.953703,"Saint Paul","Minnesota","4/22/1895",1895, 4,22,"seq-5","https://articleextractor.org/pages/8623/mnhi_onamia_ver01/sn90059522/1895/04/22/ed-1/seq-5/1","Greenville, AL","NA, NA","NA, NA","Greenville","AL",NA,NA,NA,NA,NA,2853,"sn90059522", -86.617752,  31.829597,NA,NA,NA,NA
"262", 8624,"Western Kansas world ","WaKeeney, Kansas", -99.87957, 39.025008,"WaKeeney","Kansas","7/11/1896",1896, 7,11,"seq-2","https://articleextractor.org/pages/8624/khi_kauffman_ver01/sn82015485/1896/07/11/ed-1/seq-2/1","Gaithersburg, MD","Cleveland, OH","NA, NA","Gaithersburg","MD","Cleveland","OH",NA,NA,"second article- attempted lynching related to incident",2854,"sn82015485", -77.201606,  39.143969, -81.69436,  41.49932,NA,NA
"263", 8625,"Abilene weekly reflector ","Abilene, Kansas", -97.21391, 38.917222,"Abilene","Kansas","6/25/1896",1896, 6,25,"seq-12","https://articleextractor.org/pages/8625/khi_lawrence_ver01/sn84029386/1896/06/25/ed-1/seq-12/1","Hartselle, AL","NA, NA","NA, NA","Hartselle","AL",NA,NA,NA,NA,NA,2855,"sn84029386", -86.935284,  34.443428,NA,NA,NA,NA
"264", 8627,"The daily worker ","Chicago, Illinois", -87.62980, 41.878114,"Chicago","Illinois","11/5/1934",1934,11, 5,"seq-5","https://articleextractor.org/pages/8627/iune_garnet_ver01/sn84020097/1934/11/05/ed-1/seq-5/1","Columbia, SC","NA, NA","NA, NA","Columbia","SC",NA,NA,NA,NA,"first article - attempted lynching",2856,"sn84020097", -81.034814,  34.000710,NA,NA,NA,NA
"265", 8627,"The daily worker ","Chicago, Illinois", -87.62980, 41.878114,"Chicago","Illinois","11/5/1934",1934,11, 5,"seq-5","https://articleextractor.org/pages/8627/iune_garnet_ver01/sn84020097/1934/11/05/ed-1/seq-5/1","Columbia, SC","NA, NA","NA, NA","Columbia","SC",NA,NA,NA,NA,"first article - attempted lynching",2857,"sn84020097", -81.034814,  34.000710,NA,NA,NA,NA
"266", 8630,"The Superior times ","Superior, Wisconsin", -92.10408, 46.720774,"Superior","Wisconsin","12/15/1877",1877,12,15,"seq-2","https://articleextractor.org/pages/8630/whi_florence_ver01/sn85040344/1877/12/15/ed-1/seq-2/1","Columbia, TN","NA, NA","NA, NA","Columbia","TN",NA,NA,NA,NA,NA,2858,"sn85040344", -87.035283,  35.615072,NA,NA,NA,NA
"267", 8632,NA,"NA, Tennessee", -86.58045, 35.517491,NA,"Tennessee","9/13/1889",1889, 9,13,"seq-1","https://articleextractor.org/pages/8632/tu_ida_ver01/sn89058007/1889/09/13/ed-1/seq-1/1","Fayetteville, TN","East Point, GA","NA, NA","Fayetteville","TN","East Point","GA",NA,NA,"first article - person in jail to prevent lynching,",2859,"sn89058007", -86.570551,  35.152027, -84.43937,  33.67955,NA,NA
"268", 8632,NA,"NA, Tennessee", -86.58045, 35.517491,NA,"Tennessee","9/13/1889",1889, 9,13,"seq-1","https://articleextractor.org/pages/8632/tu_ida_ver01/sn89058007/1889/09/13/ed-1/seq-1/1","Fayetteville, TN","East Point, GA","NA, NA","Fayetteville","TN","East Point","GA",NA,NA,"first article - person in jail to prevent lynching,",2860,"sn89058007", -86.570551,  35.152027, -84.43937,  33.67955,NA,NA
"269", 8632,NA,"NA, Tennessee", -86.58045, 35.517491,NA,"Tennessee","9/13/1889",1889, 9,13,"seq-1","https://articleextractor.org/pages/8632/tu_ida_ver01/sn89058007/1889/09/13/ed-1/seq-1/1","Fayetteville, TN","East Point, GA","NA, NA","Fayetteville","TN","East Point","GA",NA,NA,"first article - person in jail to prevent lynching,",2861,"sn89058007", -86.570551,  35.152027, -84.43937,  33.67955,NA,NA
"270", 8633,"Helena weekly herald ","Helena, Montana",-112.03911, 46.589145,"Helena","Montana","7/25/1889",1889, 7,25,"seq-3","https://articleextractor.org/pages/8633/mthi_leopardfrog_ver01/sn84036143/1889/07/25/ed-1/seq-3/1","Clinton, IA","Kelly, NM","Sweetwater, WY","Clinton","IA","Kelly","NM","Sweetwater","WY","first article - announcing that lynching will happen that night",2862,"sn84036143", -90.188738,  41.844473,-107.20531,  34.08312,-109.18800,  41.85194
"271", 8633,"Helena weekly herald ","Helena, Montana",-112.03911, 46.589145,"Helena","Montana","7/25/1889",1889, 7,25,"seq-3","https://articleextractor.org/pages/8633/mthi_leopardfrog_ver01/sn84036143/1889/07/25/ed-1/seq-3/1","Clinton, IA","Kelly, NM","Sweetwater, WY","Clinton","IA","Kelly","NM","Sweetwater","WY","first article - announcing that lynching will happen that night",2863,"sn84036143", -90.188738,  41.844473,-107.20531,  34.08312,-109.18800,  41.85194
"272", 8633,"Helena weekly herald ","Helena, Montana",-112.03911, 46.589145,"Helena","Montana","7/25/1889",1889, 7,25,"seq-3","https://articleextractor.org/pages/8633/mthi_leopardfrog_ver01/sn84036143/1889/07/25/ed-1/seq-3/1","Clinton, IA","Kelly, NM","Sweetwater, WY","Clinton","IA","Kelly","NM","Sweetwater","WY","first article - announcing that lynching will happen that night",2864,"sn84036143", -90.188738,  41.844473,-107.20531,  34.08312,-109.18800,  41.85194
"273", 8638,"Daily globe ","St. Paul, Minnesota", -93.08996, 44.953703,"St. Paul","Minnesota","5/2/1882",1882, 5, 2,"seq-2","https://articleextractor.org/pages/8638/mnhi_anoka_ver02/sn83025287/1882/05/02/ed-1/seq-2/1","Minneapolis, MN","NA, NA","NA, NA","Minneapolis","MN",NA,NA,NA,NA,NA,2866,"sn83025287", -93.265011,  44.977753,NA,NA,NA,NA
"274", 8639,"The Dallas daily herald ","Dallas, Texas", -96.79699, 32.776664,"Dallas","Texas","10/28/1886",1886,10,28,"seq-6","https://articleextractor.org/pages/8639/txdn_eagle_ver01/sn83025733/1886/10/28/ed-1/seq-6/1","Brownsville, TN","NA, NA","NA, NA","Brownsville","TN",NA,NA,NA,NA,NA,2867,"sn83025733", -89.262291,  35.593967,NA,NA,NA,NA
"275", 8641,"The Stark County Democrat ","Canton, Ohio", -81.37845, 40.798947,"Canton","Ohio","4/1/1886",1886, 4, 1,"seq-1","https://articleextractor.org/pages/8641/ohi_jaques_ver01/sn84028490/1886/04/01/ed-1/seq-1/1","Ft. Wayne, IN","Alamo, TN","NA, NA","Ft. Wayne","IN","Alamo","TN",NA,NA,"first article - armed posse looking for accused criminal, not stated what they'll do if they find him - MB",2868,"sn84028490", -85.139351,  41.079273, -89.11729,  35.78479,NA,NA
"276", 8641,"The Stark County Democrat ","Canton, Ohio", -81.37845, 40.798947,"Canton","Ohio","4/1/1886",1886, 4, 1,"seq-1","https://articleextractor.org/pages/8641/ohi_jaques_ver01/sn84028490/1886/04/01/ed-1/seq-1/1","Ft. Wayne, IN","Alamo, TN","NA, NA","Ft. Wayne","IN","Alamo","TN",NA,NA,"first article - armed posse looking for accused criminal, not stated what they'll do if they find him - MB",2869,"sn84028490", -85.139351,  41.079273, -89.11729,  35.78479,NA,NA
"277", 8642,"The Cincinnati daily star ",", Ohio", -82.90712, 40.417287,"","Ohio","4/18/1876",1876, 4,18,"seq-3","https://articleextractor.org/pages/8642/ohi_himilco_ver01/sn85025759/1876/04/18/ed-1/seq-3/1","Danville, KY","NA, NA","NA, NA","Danville","KY",NA,NA,NA,NA,NA,2870,"sn85025759", -84.772170,  37.645633,NA,NA,NA,NA
"278", 8643,"The interior journal ","Stanford, Kentucky", -84.66189, 37.531190,"Stanford","Kentucky","7/28/1876",1876, 7,28,"seq-2","https://articleextractor.org/pages/8643/kyu_albatross_ver01/sn84038328/1876/07/28/ed-1/seq-2/1","no city listed, KY","NA, NA","NA, NA","no city listed","KY",NA,NA,NA,NA,"article only says Northern Kentucky",2871,"sn84038328", -84.270018,  37.839333,NA,NA,NA,NA
"279", 8644,"Morning journal and courier ","New Haven , Connecticut", -72.92788, 41.308274,"New Haven ","Connecticut","11/14/1882",1882,11,14,"seq-3","https://articleextractor.org/pages/8644/ct_gum_ver01/sn82015483/1882/11/14/ed-1/seq-3/1","Ashland, KY","NA, NA","NA, NA","Ashland","KY",NA,NA,NA,NA,"attempted lynching",2872,"sn82015483", -82.637939,  38.478414,NA,NA,NA,NA
"280", 8646,"Mower County transcript ","Lansing, Minnesota", -92.97019, 43.745240,"Lansing","Minnesota","1/27/1897",1897, 1,27,"seq-2","https://articleextractor.org/pages/8646/mnhi_rolls_ver01/sn85025431/1897/01/27/ed-1/seq-2/1","no city listed, LA","NA, NA","NA, NA","no city listed","LA",NA,NA,NA,NA,"short one sentence story with only state listed",2873,"sn85025431",-118.242643,  34.054908,NA,NA,NA,NA
"281", 8647,NA,"NA, Idaho",-116.55978, 43.578817,NA,"Idaho","9/18/1894",1894, 9,18,"seq-1","https://articleextractor.org/pages/8647/idhi_james_ver01/sn88056158/1894/09/18/ed-1/seq-1/1","no city listed, KS","no city listed, OH","NA, NA","no city listed","KS","no city listed","OH",NA,NA,"no city listed for either, lynchings mentioned in passing during quote",2874,"sn88056158", -98.484246,  39.011902, -82.90712,  40.41729,NA,NA
"282", 8648,"The Hocking sentinel ","Logan, Ohio", -82.40710, 39.540067,"Logan","Ohio","12/2/1897",1897,12, 2,"seq-2","https://articleextractor.org/pages/8648/ohi_delta_ver01/sn85038119/1897/12/02/ed-1/seq-2/1","Screven, WI","NA, NA","NA, NA","Screven","WI",NA,NA,NA,NA,NA,2875,"sn85038119", -82.017060,  31.486325,NA,NA,NA,NA
"283", 8649,"Waterbury evening Democrat ","Waterbury, Connecticut", -73.05150, 41.558152,"Waterbury","Connecticut","9/6/1894",1894, 9, 6,"seq-1","https://articleextractor.org/pages/8649/ct_gum_ver01/sn94053256/1894/09/06/ed-1/seq-1/1","Millington, TN","NA, NA","NA, NA","Millington","TN",NA,NA,NA,NA,NA,2876,"sn94053256", -89.897308,  35.341474,NA,NA,NA,NA
"284", 8650,"Daily public ledger ","Maysville, Kentucky", -83.74437, 38.641185,"Maysville","Kentucky","6/6/1895",1895, 6, 6,"seq-3","https://articleextractor.org/pages/8650/kyu_gandhi_ver01/sn86069117/1895/06/06/ed-1/seq-3/1","Strasburg, AL","NA, NA","NA, NA","Strasburg","AL",NA,NA,NA,NA,NA,2877,"sn86069117", -86.902298,  32.318231,NA,NA,NA,NA
"285", 8651,"Belmont chronicle ","St. Clairsville, Ohio", -80.90176, 40.080320,"St. Clairsville","Ohio","1/25/1894",1894, 1,25,"seq-1","https://articleextractor.org/pages/8651/ohi_feste_ver01/sn85026241/1894/01/25/ed-1/seq-1/1","Manchester, MO","Kansas City, MO","NA, NA","Manchester","MO","Kansas City","MO",NA,NA,"second article - attempted lynching was stopped",2878,"sn85026241", -90.509288,  38.596998, -94.57857,  39.09973,NA,NA
"286", 8651,"Belmont chronicle ","St. Clairsville, Ohio", -80.90176, 40.080320,"St. Clairsville","Ohio","1/25/1894",1894, 1,25,"seq-1","https://articleextractor.org/pages/8651/ohi_feste_ver01/sn85026241/1894/01/25/ed-1/seq-1/1","Manchester, MO","Kansas City, MO","NA, NA","Manchester","MO","Kansas City","MO",NA,NA,"second article - attempted lynching was stopped",2879,"sn85026241", -90.509288,  38.596998, -94.57857,  39.09973,NA,NA
"287", 8655,NA,"NA, Nebraska", -99.90181, 41.492537,NA,"Nebraska","5/7/1893",1893, 5, 7,"seq-8","https://articleextractor.org/pages/8655/nbu_alliance_ver01/sn99021999/1893/05/07/ed-1/seq-8/1","Willacoochee, GA","NA, NA","NA, NA","Willacoochee","GA",NA,NA,NA,NA,"lynch threat",2881,"sn99021999", -83.045983,  31.340755,NA,NA,NA,NA
"288", 8657,"Washington standard ","Olympia, Washington",-122.90069, 47.037874,"Olympia","Washington","12/14/1906",1906,12,14,"seq-2","https://articleextractor.org/pages/8657/wa_kittitas_ver01/sn84022770/1906/12/14/ed-1/seq-2/1","Herkimer, NY","NA, NA","NA, NA","Herkimer","NY",NA,NA,NA,NA,"lynch threat mentioned - MB",2882,"sn84022770", -74.985989,  43.025626,NA,NA,NA,NA
"289", 8657,"Washington standard ","Olympia, Washington",-122.90069, 47.037874,"Olympia","Washington","12/14/1906",1906,12,14,"seq-2","https://articleextractor.org/pages/8657/wa_kittitas_ver01/sn84022770/1906/12/14/ed-1/seq-2/1","Herkimer, NY","NA, NA","NA, NA","Herkimer","NY",NA,NA,NA,NA,"lynch threat mentioned - MB",2883,"sn84022770", -74.985989,  43.025626,NA,NA,NA,NA
"290", 8663,"The Wheeling daily intelligencer ","Wheeling, West Virginia", -80.72092, 40.063962,"Wheeling","West Virginia","7/29/1893",1893, 7,29,"seq-4","https://articleextractor.org/pages/8663/wvu_france_ver01/sn84026844/1893/07/29/ed-1/seq-4/1","Denver, CO","NA, NA","NA, NA","Denver","CO",NA,NA,NA,NA,"lynching of Italian man - MB",2884,"sn84026844",-104.990251,  39.739236,NA,NA,NA,NA
"291", 8664,"The Seattle star ","Seattle, Washington",-122.33285, 47.606139,"Seattle","Washington","9/24/1906",1906, 9,24,"seq-7","https://articleextractor.org/pages/8664/wa_indianplum_ver02/sn87093407/1906/09/24/ed-1/seq-7/1","East Point, GA","NA, NA","NA, NA","East Point","GA",NA,NA,NA,NA,NA,2885,"sn87093407", -84.439372,  33.679553,NA,NA,NA,NA
"292", 8665,"Evening journal ","Wilmington, Delaware", -75.54839, 39.744655,"Wilmington","Delaware","4/22/1895",1895, 4,22,"seq-2","https://articleextractor.org/pages/8665/deu_arden_ver01/sn85042354/1895/04/22/ed-1/seq-2/1","Greenville, AL","NA, NA","NA, NA","Greenville","AL",NA,NA,NA,NA,NA,2886,"sn85042354", -86.617752,  31.829597,NA,NA,NA,NA
"293", 8668,"Fisherman & farmer ","Edenton, North Carolina", -76.60772, 36.057938,"Edenton","North Carolina","4/3/1891",1891, 4, 3,"seq-6","https://articleextractor.org/pages/8668/ncu_elk_ver01/sn91068084/1891/04/03/ed-1/seq-6/1","New Orleans, LA","NA, NA","NA, NA","New Orleans","LA",NA,NA,NA,NA,"super long article on this incident - MB",2887,"sn91068084", -90.071532,  29.951066,NA,NA,NA,NA
"294", 8669,"The Washington bee ","Washington, District of Columbia", -77.03687, 38.907192,"Washington","District of Columbia","7/9/1892",1892, 7, 9,"seq-2","https://articleextractor.org/pages/8669/dlc_harry_ver01/sn84025891/1892/07/09/ed-1/seq-2/1","Vicksburg, MS","Haynes, AK","Colmes Mill, TX","Vicksburg","MS","Haynes","AK","Colmes Mill","TX","fourth article - no city, MO, fifth article - Port Jervis, NY",2888,"sn84025891", -90.877882,  32.352646,-135.44733,  59.23515, -99.90181,  31.96860
"295", 8669,"The Washington bee ","Washington, District of Columbia", -77.03687, 38.907192,"Washington","District of Columbia","7/9/1892",1892, 7, 9,"seq-2","https://articleextractor.org/pages/8669/dlc_harry_ver01/sn84025891/1892/07/09/ed-1/seq-2/1","Vicksburg, MS","Haynes, AK","Colmes Mill, TX","Vicksburg","MS","Haynes","AK","Colmes Mill","TX","fourth article - no city, MO, fifth article - Port Jervis, NY",2889,"sn84025891", -90.877882,  32.352646,-135.44733,  59.23515, -99.90181,  31.96860
"296", 8669,"The Washington bee ","Washington, District of Columbia", -77.03687, 38.907192,"Washington","District of Columbia","7/9/1892",1892, 7, 9,"seq-2","https://articleextractor.org/pages/8669/dlc_harry_ver01/sn84025891/1892/07/09/ed-1/seq-2/1","Vicksburg, MS","Haynes, AK","Colmes Mill, TX","Vicksburg","MS","Haynes","AK","Colmes Mill","TX","fourth article - no city, MO, fifth article - Port Jervis, NY",2890,"sn84025891", -90.877882,  32.352646,-135.44733,  59.23515, -99.90181,  31.96860
"297", 8669,"The Washington bee ","Washington, District of Columbia", -77.03687, 38.907192,"Washington","District of Columbia","7/9/1892",1892, 7, 9,"seq-2","https://articleextractor.org/pages/8669/dlc_harry_ver01/sn84025891/1892/07/09/ed-1/seq-2/1","Vicksburg, MS","Haynes, AK","Colmes Mill, TX","Vicksburg","MS","Haynes","AK","Colmes Mill","TX","fourth article - no city, MO, fifth article - Port Jervis, NY",2891,"sn84025891", -90.877882,  32.352646,-135.44733,  59.23515, -99.90181,  31.96860
"298", 8669,"The Washington bee ","Washington, District of Columbia", -77.03687, 38.907192,"Washington","District of Columbia","7/9/1892",1892, 7, 9,"seq-2","https://articleextractor.org/pages/8669/dlc_harry_ver01/sn84025891/1892/07/09/ed-1/seq-2/1","Vicksburg, MS","Haynes, AK","Colmes Mill, TX","Vicksburg","MS","Haynes","AK","Colmes Mill","TX","fourth article - no city, MO, fifth article - Port Jervis, NY",2892,"sn84025891", -90.877882,  32.352646,-135.44733,  59.23515, -99.90181,  31.96860
"299", 8669,"The Washington bee ","Washington, District of Columbia", -77.03687, 38.907192,"Washington","District of Columbia","7/9/1892",1892, 7, 9,"seq-2","https://articleextractor.org/pages/8669/dlc_harry_ver01/sn84025891/1892/07/09/ed-1/seq-2/1","Vicksburg, MS","Haynes, AK","Colmes Mill, TX","Vicksburg","MS","Haynes","AK","Colmes Mill","TX","fourth article - no city, MO, fifth article - Port Jervis, NY",2893,"sn84025891", -90.877882,  32.352646,-135.44733,  59.23515, -99.90181,  31.96860
"300", 8670,"The Seattle post-intelligencer ","Seattle, Washington",-122.33285, 47.606139,"Seattle","Washington","10/22/1893",1893,10,22,"seq-4","https://articleextractor.org/pages/8670/wa_forks_ver01/sn83045604/1893/10/22/ed-1/seq-4/1","Roanoke, VA","NA, NA","NA, NA","Roanoke","VA",NA,NA,NA,NA,NA,2894,"sn83045604", -79.941427,  37.270970,NA,NA,NA,NA
"301", 8671,NA,"NA, Michigan", -85.60236, 44.314844,NA,"Michigan","6/9/1891",1891, 6, 9,"seq-1","https://articleextractor.org/pages/8671/mimtptc_adrian_ver01/sn98066392/1891/06/09/ed-1/seq-1/1","Wickliffe, KY","NA, NA","NA, NA","Wickliffe","KY",NA,NA,NA,NA,NA,2895,"sn98066392", -89.089235,  36.964775,NA,NA,NA,NA
"302", 8673,"The morning news ","Savannah, Georgia", -81.09120, 32.080899,"Savannah","Georgia","10/27/1894",1894,10,27,"seq-1","https://articleextractor.org/pages/8673/gu_drew_ver02/sn86063034/1894/10/27/ed-1/seq-1/1","Millington, TN","NA, NA","NA, NA","Millington","TN",NA,NA,NA,NA,NA,2896,"sn86063034", -89.897308,  35.341474,NA,NA,NA,NA
"303", 8673,"The morning news ","Savannah, Georgia", -81.09120, 32.080899,"Savannah","Georgia","10/27/1894",1894,10,27,"seq-1","https://articleextractor.org/pages/8673/gu_drew_ver02/sn86063034/1894/10/27/ed-1/seq-1/1","Millington, TN","NA, NA","NA, NA","Millington","TN",NA,NA,NA,NA,NA,2897,"sn86063034", -89.897308,  35.341474,NA,NA,NA,NA
"304", 8676,"Saint Mary's beacon ","Leonard Town, Maryland", -76.63579, 38.291238,"Leonard Town","Maryland","3/1/1894",1894, 3, 1,"seq-2","https://articleextractor.org/pages/8676/mdu_cain_ver02/sn82006687/1894/03/01/ed-1/seq-2/1","Allegany County, NC","NA, NA","NA, NA","Allegany County","NC",NA,NA,NA,NA,NA,2898,"sn82006687", -81.119608,  36.494084,NA,NA,NA,NA
"305", 8677,NA,"NA, Minnesota", -94.68590, 46.729553,NA,"Minnesota","11/23/1894",1894,11,23,"seq-1","https://articleextractor.org/pages/8677/mnhi_neon_ver01/sn89064526/1894/11/23/ed-1/seq-1/1","Atchison, KS","NA, NA","NA, NA","Atchison","KS",NA,NA,NA,NA,"attempted lynching stopped - MB",2899,"sn89064526", -95.121636,  39.563052,NA,NA,NA,NA
"306", 8683,"Iowa state bystander ","Des Moines, Iowa", -93.62496, 41.586835,"Des Moines","Iowa","10/26/1894",1894,10,26,"seq-1","https://articleextractor.org/pages/8683/iahi_ames_ver01/sn83025186/1894/10/26/ed-1/seq-1/1","no city listed, OH","NA, NA","NA, NA","no city listed","OH",NA,NA,NA,NA,"attempted lynching",2901,"sn83025186", -82.907123,  40.417287,NA,NA,NA,NA
"307", 8683,"Iowa state bystander ","Des Moines, Iowa", -93.62496, 41.586835,"Des Moines","Iowa","10/26/1894",1894,10,26,"seq-1","https://articleextractor.org/pages/8683/iahi_ames_ver01/sn83025186/1894/10/26/ed-1/seq-1/1","no city listed, OH","NA, NA","NA, NA","no city listed","OH",NA,NA,NA,NA,"attempted lynching",2902,"sn83025186", -82.907123,  40.417287,NA,NA,NA,NA
"308", 8683,"Iowa state bystander ","Des Moines, Iowa", -93.62496, 41.586835,"Des Moines","Iowa","10/26/1894",1894,10,26,"seq-1","https://articleextractor.org/pages/8683/iahi_ames_ver01/sn83025186/1894/10/26/ed-1/seq-1/1","no city listed, OH","NA, NA","NA, NA","no city listed","OH",NA,NA,NA,NA,"attempted lynching",2903,"sn83025186", -82.907123,  40.417287,NA,NA,NA,NA
"309", 8685,"The Emporia news ","Emporia, Kansas", -96.18166, 38.403903,"Emporia","Kansas","12/13/1878",1878,12,13,"seq-2","https://articleextractor.org/pages/8685/khi_brown_ver01/sn82016419/1878/12/13/ed-1/seq-2/1","Nebraska City, NE","NA, NA","NA, NA","Nebraska City","NE",NA,NA,NA,NA,NA,2904,"sn82016419", -95.859362,  40.676575,NA,NA,NA,NA
"310", 8688,"Daily public ledger ","Maysville, Kentucky", -83.74437, 38.641185,"Maysville","Kentucky","11/28/1898",1898,11,28,"seq-4","https://articleextractor.org/pages/8688/kyu_gandhi_ver01/sn86069117/1898/11/28/ed-1/seq-4/1","Meridian, MS","NA, NA","NA, NA","Meridian","MS",NA,NA,NA,NA,NA,2905,"sn86069117", -88.703656,  32.364310,NA,NA,NA,NA
"311", 8691,"The Hope pioneer ","Hope, North Dakota", -97.72232, 47.322210,"Hope","North Dakota","3/30/1899",1899, 3,30,"seq-2","https://articleextractor.org/pages/8691/ndhi_argon_ver01/sn87096037/1899/03/30/ed-1/seq-2/1","Texarkana, AK","Little River County, AK","NA, NA","Texarkana","AK","Little River County","AK",NA,NA,NA,2907,"sn87096037", -94.036175,  33.430483, -94.27436,  33.67809,NA,NA
"312", 8697,"The St. Louis Republic ","St. Louis, Missouri", -90.19940, 38.627003,"St. Louis","Missouri","3/27/1900",1900, 3,27,"seq-3","https://articleextractor.org/pages/8697/mohi_kersee_ver01/sn84020274/1900/03/27/ed-1/seq-3/1","Belair, MD","NA, NA","NA, NA","Belair","MD",NA,NA,NA,NA,NA,2908,"sn84020274", -76.348293,  39.535941,NA,NA,NA,NA
"313", 8700,"The St. Louis Republic ","St. Louis, Missouri", -90.19940, 38.627003,"St. Louis","Missouri","1/3/1900",1900, 1, 3,"seq-7","https://articleextractor.org/pages/8700/mohi_gaines_ver01/sn84020274/1900/01/03/ed-1/seq-7/1","Palestine, TX","NA, NA","NA, NA","Palestine","TX",NA,NA,NA,NA,NA,2909,"sn84020274", -95.630789,  31.762115,NA,NA,NA,NA
"314", 8702,"Casper daily tribune ","Casper, Wyoming",-106.29808, 42.848709,"Casper","Wyoming","5/26/1922",1922, 5,26,"seq-12","https://articleextractor.org/pages/8702/wyu_greybull_ver01/sn86072160/1922/05/26/ed-1/seq-12/1","Honey Grove, TX","NA, NA","NA, NA","Honey Grove","TX",NA,NA,NA,NA,"attempted lynching - MB",2910,"sn86072160", -95.909968,  33.583438,NA,NA,NA,NA
"315", 8703,"The progressive farmer ","Winston, North Carolina", -80.25444, 36.103964,"Winston","North Carolina","9/10/1901",1901, 9,10,"seq-3","https://articleextractor.org/pages/8703/ncu_johns_ver01/sn92073049/1901/09/10/ed-1/seq-3/1","Anson, NC","La Grange, NC","Buffalo, NY","Anson","NC","La Grange","NC","Buffalo","NY","second article - person thought to have been lynched but he is alive and was only severely beat, third article - person avoided lynching after police intervened  - MB",2911,"sn92073049", -80.187506,  34.905473, -77.78803,  35.30683, -78.87837,  42.88645
"316", 8704,"The times ","Washington , District of Columbia", -77.03687, 38.907192,"Washington ","District of Columbia","7/28/1899",1899, 7,28,"seq-1","https://articleextractor.org/pages/8704/dlc_franklin_ver01/sn85054468/1899/07/28/ed-1/seq-1/1","Lindsay, LA","NA, NA","NA, NA","Lindsay","LA",NA,NA,NA,NA,NA,2912,"sn85054468",NA,NA,NA,NA,NA,NA
"317", 8707,NA,"NA, Kentucky", 106.15001, 22.726562,NA,"Kentucky","8/22/1901",1901, 8,22,"seq-4","https://articleextractor.org/pages/8707/kyu_charo_ver01/sn86069201/1901/08/22/ed-1/seq-4/1","Flemingsburg, KY","no city listed, AL","NA, NA","Flemingsburg","KY","no city listed","AL",NA,NA,"first and second article - attempted lynching that was prevented",2914,"sn86069201", -83.733808,  38.422300, -86.90230,  32.31823,NA,NA
"318", 8709,"Eureka weekly sentinel ","Eureka, Nevada",-115.96078, 39.512486,"Eureka","Nevada","6/29/1901",1901, 6,29,"seq-1","https://articleextractor.org/pages/8709/nvln_quartz_ver01/sn86076200/1901/06/29/ed-1/seq-1/1","Lookout, CA","NA, NA","NA, NA","Lookout","CA",NA,NA,NA,NA,NA,2915,"sn86076200",-121.149854,  41.208102,NA,NA,NA,NA
"319", 8710,NA,"NA, Mississippi", -89.39853, 32.354668,NA,"Mississippi","2/14/1901",1901, 2,14,"seq-4","https://articleextractor.org/pages/8710/msar_karakul_ver02/sn87065046/1901/02/14/ed-1/seq-4/1","no city listed, KY","NA, NA","NA, NA","no city listed","KY",NA,NA,NA,NA,NA,2916,"sn87065046", -84.270018,  37.839333,NA,NA,NA,NA
"320", 8711,"The San Francisco call ","San Francisco , California",-122.41942, 37.774929,"San Francisco ","California","6/8/1901",1901, 6, 8,"seq-1","https://articleextractor.org/pages/8711/curiv_brea_ver01/sn85066387/1901/06/08/ed-1/seq-1/1","Carrollton, GA","NA, NA","NA, NA","Carrollton","GA",NA,NA,NA,NA,NA,2917,"sn85066387", -85.076611,  33.580110,NA,NA,NA,NA
"321", 8714,"The San Francisco call ","San Francisco , California",-122.41942, 37.774929,"San Francisco ","California","7/11/1897",1897, 7,11,"seq-4","https://articleextractor.org/pages/8714/curiv_fredsplace_ver01/sn85066387/1897/07/11/ed-1/seq-4/2","Union, MO","NA, NA","NA, NA","Union","MO",NA,NA,NA,NA,NA,2918,"sn85066387", -91.008476,  38.450052,NA,NA,NA,NA
"322", 8715,"Daily Yellowstone journal ","Miles City, Montana",-105.84056, 46.408336,"Miles City","Montana","4/7/1887",1887, 4, 7,"seq-1","https://articleextractor.org/pages/8715/mthi_bobcat_ver02/sn86075021/1887/04/07/ed-1/seq-1/1","Powderville, MT","NA, NA","NA, NA","Powderville","MT",NA,NA,NA,NA,"group was contemplating lynching someone - MB",2919,"sn86075021",-105.114934,  45.759901,NA,NA,NA,NA
"323", 8716,"The Indianapolis journal ","Indianapolis , Indiana", -86.15807, 39.768403,"Indianapolis ","Indiana","3/4/1887",1887, 3, 4,"seq-4","https://articleextractor.org/pages/8716/in_indianapolisolympians_ver02/sn82015679/1887/03/04/ed-1/seq-4/1","Dearborn County, IN","NA, NA","NA, NA","Dearborn County","IN",NA,NA,NA,NA,NA,2920,"sn82015679", -84.981754,  39.171307,NA,NA,NA,NA
"324", 8717,"Huntsville gazette ","Huntsville, Alabama", -86.58610, 34.730369,"Huntsville","Alabama","3/12/1887",1887, 3,12,"seq-1","https://articleextractor.org/pages/8717/au_inman_ver01/sn84020151/1887/03/12/ed-1/seq-1/1","Winona, MS","Sidon, MS","NA, NA","Winona","MS","Sidon","MS",NA,NA,NA,2921,"sn84020151", -89.728137,  33.482068, -90.20864,  33.40804,NA,NA
"325", 8717,"Huntsville gazette ","Huntsville, Alabama", -86.58610, 34.730369,"Huntsville","Alabama","3/12/1887",1887, 3,12,"seq-1","https://articleextractor.org/pages/8717/au_inman_ver01/sn84020151/1887/03/12/ed-1/seq-1/1","Winona, MS","Sidon, MS","NA, NA","Winona","MS","Sidon","MS",NA,NA,NA,2922,"sn84020151", -89.728137,  33.482068, -90.20864,  33.40804,NA,NA
"326", 8817,"The record-union ","Sacramento, California",-121.49440, 38.581572,"Sacramento","California","3/25/1891",1891, 3,25,"seq-6","https://articleextractor.org/pages/8817/curiv_oakland_ver01/sn82015104/1891/03/25/ed-1/seq-6/1","New Orleans, LA","NA, NA","NA, NA","New Orleans","LA",NA,NA,NA,NA,NA,3010,"sn82015104", -90.071532,  29.951066,NA,NA,NA,NA
"327", 8818,"The sun ","New York , New York", -74.00597, 40.712775,"New York ","New York","11/9/1896",1896,11, 9,"seq-3","https://articleextractor.org/pages/8818/nn_ovid_ver01/sn83030272/1896/11/09/ed-1/seq-3/1","Lebanon, KY","NA, NONE","NA, NA","Lebanon","KY",NA,"NONE",NA,NA,NA,3011,"sn83030272", -85.252738,  37.569787,NA,NA,NA,NA
"328", 8818,"The sun ","New York , New York", -74.00597, 40.712775,"New York ","New York","11/9/1896",1896,11, 9,"seq-3","https://articleextractor.org/pages/8818/nn_ovid_ver01/sn83030272/1896/11/09/ed-1/seq-3/1","Lebanon, KY","NA, NONE","NA, NA","Lebanon","KY",NA,"NONE",NA,NA,NA,3012,"sn83030272", -85.252738,  37.569787,NA,NA,NA,NA
"329", 8819,"Kansas City journal ","Kansas City, Missouri", -94.57857, 39.099727,"Kansas City","Missouri","9/18/1897",1897, 9,18,"seq-4","https://articleextractor.org/pages/8819/mohi_edwards_ver01/sn86063615/1897/09/18/ed-1/seq-4/1","None, NONE","NA, NA","NA, NA","None","NONE",NA,NA,NA,NA,"There was no lynching on the page.",3013,"sn86063615",NA,NA,NA,NA,NA,NA
"330", 8820,"Staunton spectator and vindicator ","Staunton, Virginia", -79.07170, 38.149576,"Staunton","Virginia","8/25/1898",1898, 8,25,"seq-2","https://articleextractor.org/pages/8820/vi_goforwand_ver02/sn84024720/1898/08/25/ed-1/seq-2/1","Newport News, VA","NA, NA","NA, NA","Newport News","VA",NA,NA,NA,NA,"This is an anticipated lynching.",3014,"sn84024720", -76.473012,  37.087082,NA,NA,NA,NA
"331", 8821,NA,"NA, Kentucky", 106.15001, 22.726562,NA,"Kentucky","2/17/1892",1892, 2,17,"seq-1","https://articleextractor.org/pages/8821/kyu_fargo_ver01/sn86069309/1892/02/17/ed-1/seq-1/1","Pineville, KY","NA, NA","NA, NA","Pineville","KY",NA,NA,NA,NA,"The newspaper name on the Google document says NA, but the article says its name is ""The Breckenridge News"".",3015,"sn86069309", -83.694918,  36.762030,NA,NA,NA,NA
"332", 8822,"Bismarck weekly tribune ","Bismarck, North Dakota",-100.78769, 46.805495,"Bismarck","North Dakota","9/25/1891",1891, 9,25,"seq-1","https://articleextractor.org/pages/8822/ndhi_bisbee_ver01/sn85042588/1891/09/25/ed-1/seq-1/1","Milwaukee, WI","NA, NA","NA, NA","Milwaukee","WI",NA,NA,NA,NA,NA,3016,"sn85042588", -87.906474,  43.038902,NA,NA,NA,NA
"333", 8824,"The Seattle post-intelligencer ","Seattle, Washington",-122.33285, 47.606139,"Seattle","Washington","10/15/1892",1892,10,15,"seq-2","https://articleextractor.org/pages/8824/wa_forks_ver01/sn83045604/1892/10/15/ed-1/seq-2/1","Birmingham, AL","NA, NA","NA, NA","Birmingham","AL",NA,NA,NA,NA,NA,3017,"sn83045604", -86.810357,  33.518589,NA,NA,NA,NA
"334", 8825,"The Jasper weekly courier ","Jasper, Indiana", -86.93111, 38.391442,"Jasper","Indiana","3/18/1892",1892, 3,18,"seq-2","https://articleextractor.org/pages/8825/in_abraham_ver02/sn84023963/1892/03/18/ed-1/seq-2/1","Memphis, TN","Omaha, NE","NA, NA","Memphis","TN","Omaha","NE",NA,NA,NA,3018,"sn84023963", -90.048980,  35.149534, -95.93450,  41.25654,NA,NA
"335", 8825,"The Jasper weekly courier ","Jasper, Indiana", -86.93111, 38.391442,"Jasper","Indiana","3/18/1892",1892, 3,18,"seq-2","https://articleextractor.org/pages/8825/in_abraham_ver02/sn84023963/1892/03/18/ed-1/seq-2/1","Memphis, TN","Omaha, NE","NA, NA","Memphis","TN","Omaha","NE",NA,NA,NA,3019,"sn84023963", -90.048980,  35.149534, -95.93450,  41.25654,NA,NA
"336", 8826,"Fisherman & farmer ","Edenton, North Carolina", -76.60772, 36.057938,"Edenton","North Carolina","8/12/1892",1892, 8,12,"seq-6","https://articleextractor.org/pages/8826/ncu_elk_ver01/sn91068084/1892/08/12/ed-1/seq-6/1","Jacksboro, TN","NA, NA","NA, NA","Jacksboro","TN",NA,NA,NA,NA,NA,3020,"sn91068084", -84.183816,  36.330079,NA,NA,NA,NA
"337", 8827,"The Portland daily press ","Portland, Maine", -70.25682, 43.659099,"Portland","Maine","4/28/1894",1894, 4,28,"seq-1","https://articleextractor.org/pages/8827/me_halfwayrock_ver01/sn83016025/1894/04/28/ed-1/seq-1/1","Hennessey, OK","NA, NA","NA, NA","Hennessey","OK",NA,NA,NA,NA,NA,3021,"sn83016025", -97.898668,  36.109205,NA,NA,NA,NA
"338", 8829,"The Topeka state journal ","Topeka, Kansas", -95.67516, 39.047345,"Topeka","Kansas","10/31/1899",1899,10,31,"seq-4","https://articleextractor.org/pages/8829/khi_jesse_ver01/sn82016014/1899/10/31/ed-1/seq-4/1","Kansas City, KS","NA, NA","NA, NA","Kansas City","KS",NA,NA,NA,NA,NA,3022,"sn82016014", -94.626787,  39.115531,NA,NA,NA,NA
"339", 8830,NA,"NA, Texas", -99.90181, 31.968599,NA,"Texas","5/14/1891",1891, 5,14,"seq-1","https://articleextractor.org/pages/8830/txdn_audi_ver01/sn86088296/1891/05/14/ed-1/seq-1/1","Baltimore, MD","NA, NA","NA, NA","Baltimore","MD",NA,NA,NA,NA,"The newspaper name at the top of the article is the Austin Statesman",3023,"sn86088296", -76.612189,  39.290385,NA,NA,NA,NA
"340", 8831,NA,"NA, North Carolina", -79.01930, 35.759573,NA,"North Carolina","9/26/1891",1891, 9,26,"seq-1","https://articleextractor.org/pages/8831/ncu_fisher_ver01/sn91068305/1891/09/26/ed-1/seq-1/1","Asheville, NC","NA, NA","NA, NA","Asheville","NC",NA,NA,NA,NA,"The name of the paper at the top of the article is The Durham Daily Journal",3024,"sn91068305", -82.551487,  35.595058,NA,NA,NA,NA
"341", 8832,"The western sentinel ","Winston-Salem, North Carolina", -80.24422, 36.099860,"Winston-Salem","North Carolina","4/23/1891",1891, 4,23,"seq-2","https://articleextractor.org/pages/8832/ncu_frankenbatch_ver01/sn92073232/1891/04/23/ed-1/seq-2/1","Charlotte, NC","New Orleans, LA","NA, NA","Charlotte","NC","New Orleans","LA",NA,NA,NA,3025,"sn92073232", -80.843127,  35.227087, -90.07153,  29.95107,NA,NA
"342", 8832,"The western sentinel ","Winston-Salem, North Carolina", -80.24422, 36.099860,"Winston-Salem","North Carolina","4/23/1891",1891, 4,23,"seq-2","https://articleextractor.org/pages/8832/ncu_frankenbatch_ver01/sn92073232/1891/04/23/ed-1/seq-2/1","Charlotte, NC","New Orleans, LA","NA, NA","Charlotte","NC","New Orleans","LA",NA,NA,NA,3026,"sn92073232", -80.843127,  35.227087, -90.07153,  29.95107,NA,NA
"343", 8833,"The morning news ","Savannah, Georgia", -81.09120, 32.080899,"Savannah","Georgia","7/25/1891",1891, 7,25,"seq-1","https://articleextractor.org/pages/8833/gu_columbo_ver02/sn86063034/1891/07/25/ed-1/seq-1/1","Raleigh, NC","Billings, MO","NA, NA","Raleigh","NC","Billings","MO",NA,NA,NA,3027,"sn86063034", -78.638179,  35.779590, -93.55214,  37.06755,NA,NA
"344", 8833,"The morning news ","Savannah, Georgia", -81.09120, 32.080899,"Savannah","Georgia","7/25/1891",1891, 7,25,"seq-1","https://articleextractor.org/pages/8833/gu_columbo_ver02/sn86063034/1891/07/25/ed-1/seq-1/1","Raleigh, NC","Billings, MT","NA, NA","Raleigh","NC","Billings","MT",NA,NA,NA,3027,"sn86063034", -78.638179,  35.779590,-108.50069,  45.78329,NA,NA
"345", 8833,"The morning news ","Savannah, Georgia", -81.09120, 32.080899,"Savannah","Georgia","7/25/1891",1891, 7,25,"seq-1","https://articleextractor.org/pages/8833/gu_columbo_ver02/sn86063034/1891/07/25/ed-1/seq-1/1","Raleigh, NC","Billings, MO","NA, NA","Raleigh","NC","Billings","MO",NA,NA,NA,3028,"sn86063034", -78.638179,  35.779590, -93.55214,  37.06755,NA,NA
"346", 8833,"The morning news ","Savannah, Georgia", -81.09120, 32.080899,"Savannah","Georgia","7/25/1891",1891, 7,25,"seq-1","https://articleextractor.org/pages/8833/gu_columbo_ver02/sn86063034/1891/07/25/ed-1/seq-1/1","Raleigh, NC","Billings, MT","NA, NA","Raleigh","NC","Billings","MT",NA,NA,NA,3028,"sn86063034", -78.638179,  35.779590,-108.50069,  45.78329,NA,NA
"347", 8835,"River Falls journal ","River Falls, Wisconsin", -92.62381, 44.861356,"River Falls","Wisconsin","1/8/1891",1891, 1, 8,"seq-2","https://articleextractor.org/pages/8835/whi_galky_ver01/sn85033255/1891/01/08/ed-1/seq-2/1","Chilton, TX","NA, NA","NA, NA","Chilton","TX",NA,NA,NA,NA,NA,3029,"sn85033255", -97.065006,  31.280390,NA,NA,NA,NA
"348", 8835,"River Falls journal ","River Falls, Wisconsin", -92.62381, 44.861356,"River Falls","Wisconsin","1/8/1891",1891, 1, 8,"seq-2","https://articleextractor.org/pages/8835/whi_galky_ver01/sn85033255/1891/01/08/ed-1/seq-2/1","Chilton, TX","NA, NA","NA, NA","Chilton","TX",NA,NA,NA,NA,NA,3030,"sn85033255", -97.065006,  31.280390,NA,NA,NA,NA
"349", 8837,"Los Angeles herald ","Los Angeles , California",-118.24264, 34.054908,"Los Angeles ","California","10/13/1891",1891,10,13,"seq-2","https://articleextractor.org/pages/8837/curiv_lovelock_ver01/sn84025968/1891/10/13/ed-1/seq-2/1","Woodlawn, WA","NA, NA","NA, NA","Woodlawn","WA",NA,NA,NA,NA,NA,3031,"sn84025968",-122.743991,  45.904559,NA,NA,NA,NA
"350", 8838,"Kansas City journal ","Kansas City, Missouri", -94.57857, 39.099727,"Kansas City","Missouri","2/12/1899",1899, 2,12,"seq-8","https://articleextractor.org/pages/8838/mohi_franklin_ver01/sn86063615/1899/02/12/ed-1/seq-8/1","Leesburg, GA","NA, NA","NA, NA","Leesburg","GA",NA,NA,NA,NA,NA,3032,"sn86063615", -84.170742,  31.732116,NA,NA,NA,NA
"351", 8839,"The Irish standard ","Minneapolis, Minnesota", -93.26501, 44.977753,"Minneapolis","Minnesota","8/5/1893",1893, 8, 5,"seq-2","https://articleextractor.org/pages/8839/mnhi_betelgeuse_ver01/sn90059959/1893/08/05/ed-1/seq-2/1","Galveston, TX","Gaston, SC","NA, NA","Galveston","TX","Gaston","SC",NA,NA,NA,3033,"sn90059959", -94.797696,  29.301348, -81.10093,  33.81710,NA,NA
"352", 8839,"The Irish standard ","Minneapolis, Minnesota", -93.26501, 44.977753,"Minneapolis","Minnesota","8/5/1893",1893, 8, 5,"seq-2","https://articleextractor.org/pages/8839/mnhi_betelgeuse_ver01/sn90059959/1893/08/05/ed-1/seq-2/1","Galveston, TX","Gaston, SC","NA, NA","Galveston","TX","Gaston","SC",NA,NA,NA,3034,"sn90059959", -94.797696,  29.301348, -81.10093,  33.81710,NA,NA
"353", 8840,NA,"NA, Nebraska", -99.90181, 41.492537,NA,"Nebraska","7/21/1893",1893, 7,21,"seq-1","https://articleextractor.org/pages/8840/nbu_alliance_ver01/sn99021999/1893/07/21/ed-1/seq-1/1","NA, NA","NA, NA","NA, NA",NA,NA,NA,NA,NA,NA,"The Newspaper name on the article says it is ""The Omaha Daily Bee"". There is no lynching reported.",3035,"sn99021999",NA,NA,NA,NA,NA,NA
"354", 8841,"The Salt Lake herald ","Salt Lake City , Utah",-111.89105, 40.760779,"Salt Lake City ","Utah","10/23/1898",1898,10,23,"seq-6","https://articleextractor.org/pages/8841/uuml_dantley_ver01/sn85058130/1898/10/23/ed-1/seq-6/1","Louisville, KY","NA, NA","NA, NA","Louisville","KY",NA,NA,NA,NA,NA,3036,"sn85058130", -85.758456,  38.252665,NA,NA,NA,NA
"355", 8842,NA,"NA, Mississippi", -89.39853, 32.354668,NA,"Mississippi","2/9/1893",1893, 2, 9,"seq-2","https://articleextractor.org/pages/8842/msar_flint_ver01/sn87065567/1893/02/09/ed-1/seq-2/1","Richland, VA","Hope, AK","NA, NA","Richland","VA","Hope","AK",NA,NA,NA,3037,"sn87065567", -81.793727,  37.093169,-149.64539,  60.91830,NA,NA
"356", 8842,NA,"NA, Mississippi", -89.39853, 32.354668,NA,"Mississippi","2/9/1893",1893, 2, 9,"seq-2","https://articleextractor.org/pages/8842/msar_flint_ver01/sn87065567/1893/02/09/ed-1/seq-2/1","Richland, VA","Hope, AK","NA, NA","Richland","VA","Hope","AK",NA,NA,"This article is the same as the previous article in the document. Article 531.",3037,"sn87065567", -81.793727,  37.093169,-149.64539,  60.91830,NA,NA
"357", 8842,NA,"NA, Mississippi", -89.39853, 32.354668,NA,"Mississippi","2/9/1893",1893, 2, 9,"seq-2","https://articleextractor.org/pages/8842/msar_flint_ver01/sn87065567/1893/02/09/ed-1/seq-2/1","Richland, VA","Hope, AK","NA, NA","Richland","VA","Hope","AK",NA,NA,NA,3038,"sn87065567", -81.793727,  37.093169,-149.64539,  60.91830,NA,NA
"358", 8842,NA,"NA, Mississippi", -89.39853, 32.354668,NA,"Mississippi","2/9/1893",1893, 2, 9,"seq-2","https://articleextractor.org/pages/8842/msar_flint_ver01/sn87065567/1893/02/09/ed-1/seq-2/1","Richland, VA","Hope, AK","NA, NA","Richland","VA","Hope","AK",NA,NA,"This article is the same as the previous article in the document. Article 531.",3038,"sn87065567", -81.793727,  37.093169,-149.64539,  60.91830,NA,NA
"359", 8844,"Hopkinsville Kentuckian ","Hopkinsville, Kentucky", -87.48862, 36.865601,"Hopkinsville","Kentucky","5/26/1899",1899, 5,26,"seq-1","https://articleextractor.org/pages/8844/kyu_batman_ver01/sn86069395/1899/05/26/ed-1/seq-1/1","Diaz, Option 53","NA, NA","NA, NA","Diaz","Option 53",NA,NA,NA,NA,"The lynching occurred in Diaz, Mexico.",3040,"sn86069395",NA,NA,NA,NA,NA,NA
"360", 8846,"The Coalville times ","Coalville, Utah",-111.39936, 40.917725,"Coalville","Utah","6/16/1899",1899, 6,16,"seq-5","https://articleextractor.org/pages/8846/uuml_james_ver01/sn85058217/1899/06/16/ed-1/seq-5/1","none, NONE","NA, NA","NA, NA","none","NONE",NA,NA,NA,NA,"there was no lynching reported in this article.",3041,"sn85058217",NA,NA,NA,NA,NA,NA
"361", 8847,NA,"NA, Mississippi", -89.39853, 32.354668,NA,"Mississippi","11/17/1892",1892,11,17,"seq-2","https://articleextractor.org/pages/8847/msar_flint_ver01/sn87065567/1892/11/17/ed-1/seq-2/1","none, NONE","NA, NA","NA, NA","none","NONE",NA,NA,NA,NA,"there was no lynching in this article.",3042,"sn87065567",NA,NA,NA,NA,NA,NA
"362", 8849,"The leader ","Brookhaven, Mississippi", -90.44065, 31.579059,"Brookhaven","Mississippi","8/17/1898",1898, 8,17,"seq-1","https://articleextractor.org/pages/8849/msar_agate_ver01/sn86074063/1898/08/17/ed-1/seq-1/1","Corinth, MI","NA, NA","NA, NA","Corinth","MI",NA,NA,NA,NA,NA,3043,"sn86074063", -88.522270,  34.934255,NA,NA,NA,NA
"363", 8849,"The leader ","Brookhaven, Mississippi", -90.44065, 31.579059,"Brookhaven","Mississippi","8/17/1898",1898, 8,17,"seq-1","https://articleextractor.org/pages/8849/msar_agate_ver01/sn86074063/1898/08/17/ed-1/seq-1/1","Corinth, MI","NA, NA","NA, NA","Corinth","MI",NA,NA,NA,NA,"this is the same article as the previous one, 536.",3043,"sn86074063", -88.522270,  34.934255,NA,NA,NA,NA
"364", 8849,"The leader ","Brookhaven, Mississippi", -90.44065, 31.579059,"Brookhaven","Mississippi","8/17/1898",1898, 8,17,"seq-1","https://articleextractor.org/pages/8849/msar_agate_ver01/sn86074063/1898/08/17/ed-1/seq-1/1","Corinth, MI","NA, NA","NA, NA","Corinth","MI",NA,NA,NA,NA,NA,3044,"sn86074063", -88.522270,  34.934255,NA,NA,NA,NA
"365", 8849,"The leader ","Brookhaven, Mississippi", -90.44065, 31.579059,"Brookhaven","Mississippi","8/17/1898",1898, 8,17,"seq-1","https://articleextractor.org/pages/8849/msar_agate_ver01/sn86074063/1898/08/17/ed-1/seq-1/1","Corinth, MI","NA, NA","NA, NA","Corinth","MI",NA,NA,NA,NA,"this is the same article as the previous one, 536.",3044,"sn86074063", -88.522270,  34.934255,NA,NA,NA,NA
"366", 8850,"Los Angeles herald ","Los Angeles , California",-118.24264, 34.054908,"Los Angeles ","California","9/5/1891",1891, 9, 5,"seq-1","https://articleextractor.org/pages/8850/curiv_lovelock_ver01/sn84025968/1891/09/05/ed-1/seq-1/1","Fort Gibson, MI","NA, NA","NA, NA","Fort Gibson","MI",NA,NA,NA,NA,NA,3045,"sn84025968", -85.602364,  44.314844,NA,NA,NA,NA
"367", 8851,NA,"NA, Missouri", 101.75239, 20.924080,NA,"Missouri","9/22/1892",1892, 9,22,"seq-3","https://articleextractor.org/pages/8851/mohi_marmaduke_ver02/sn89066695/1892/09/22/ed-1/seq-3/1","Paris, TX","NA, NA","NA, NA","Paris","TX",NA,NA,NA,NA,NA,3046,"sn89066695", -95.555513,  33.660939,NA,NA,NA,NA
"368", 8852,"Iowa state bystander ","Des Moines, Iowa", -93.62496, 41.586835,"Des Moines","Iowa","11/11/1898",1898,11,11,"seq-4","https://articleextractor.org/pages/8852/iahi_ames_ver01/sn83025186/1898/11/11/ed-1/seq-4/1","NA, IL","NA, NA","NA, NA",NA,"IL",NA,NA,NA,NA,"Peoria",3047,"sn83025186",NA,NA,NA,NA,NA,NA
"369", 8852,"Iowa state bystander ","Des Moines, Iowa", -93.62496, 41.586835,"Des Moines","Iowa","11/11/1898",1898,11,11,"seq-4","https://articleextractor.org/pages/8852/iahi_ames_ver01/sn83025186/1898/11/11/ed-1/seq-4/1","Peoria, IL","NA, NA","NA, NA","Peoria","IL",NA,NA,NA,NA,NA,3047,"sn83025186", -89.588986,  40.693649,NA,NA,NA,NA
"370", 8852,"Iowa state bystander ","Des Moines, Iowa", -93.62496, 41.586835,"Des Moines","Iowa","11/11/1898",1898,11,11,"seq-4","https://articleextractor.org/pages/8852/iahi_ames_ver01/sn83025186/1898/11/11/ed-1/seq-4/1","NA, IL","NA, NA","NA, NA",NA,"IL",NA,NA,NA,NA,"Peoria",3048,"sn83025186",NA,NA,NA,NA,NA,NA
"371", 8852,"Iowa state bystander ","Des Moines, Iowa", -93.62496, 41.586835,"Des Moines","Iowa","11/11/1898",1898,11,11,"seq-4","https://articleextractor.org/pages/8852/iahi_ames_ver01/sn83025186/1898/11/11/ed-1/seq-4/1","Peoria, IL","NA, NA","NA, NA","Peoria","IL",NA,NA,NA,NA,NA,3048,"sn83025186", -89.588986,  40.693649,NA,NA,NA,NA
"372", 8853,NA,"NA, South Dakota", -99.90181, 43.969515,NA,"South Dakota","1/14/1898",1898, 1,14,"seq-4","https://articleextractor.org/pages/8853/sdhi_goshawk_ver03/sn2001063112/1898/01/14/ed-1/seq-4/1","Fort Smith, AR","Bearden, AR","NA, NA","Fort Smith","AR","Bearden","AR",NA,NA,NA,3049,"sn2001063112", -94.420965,  35.384372, -92.61566,  33.72465,NA,NA
"373", 8853,NA,"NA, South Dakota", -99.90181, 43.969515,NA,"South Dakota","1/14/1898",1898, 1,14,"seq-4","https://articleextractor.org/pages/8853/sdhi_goshawk_ver03/sn2001063112/1898/01/14/ed-1/seq-4/1","Fort Smith, AR","Bearden, AR","Pea Ridge, MI","Fort Smith","AR","Bearden","AR","Pea Ridge","MI","This article is the same as articles 542 and 544. I missed the third reported lynching when I submitted the form for 542.",3049,"sn2001063112", -94.420965,  35.384372, -92.61566,  33.72465, -85.60236,  44.31484
"374", 8853,NA,"NA, South Dakota", -99.90181, 43.969515,NA,"South Dakota","1/14/1898",1898, 1,14,"seq-4","https://articleextractor.org/pages/8853/sdhi_goshawk_ver03/sn2001063112/1898/01/14/ed-1/seq-4/1","Fort Smith, AR","Bearden, AR","Pea Ridge, MI","Fort Smith","AR","Bearden","AR","Pea Ridge","MI",NA,3049,"sn2001063112", -94.420965,  35.384372, -92.61566,  33.72465, -85.60236,  44.31484
"375", 8853,NA,"NA, South Dakota", -99.90181, 43.969515,NA,"South Dakota","1/14/1898",1898, 1,14,"seq-4","https://articleextractor.org/pages/8853/sdhi_goshawk_ver03/sn2001063112/1898/01/14/ed-1/seq-4/1","Fort Smith, AR","Bearden, AR","NA, NA","Fort Smith","AR","Bearden","AR",NA,NA,NA,3050,"sn2001063112", -94.420965,  35.384372, -92.61566,  33.72465,NA,NA
"376", 8853,NA,"NA, South Dakota", -99.90181, 43.969515,NA,"South Dakota","1/14/1898",1898, 1,14,"seq-4","https://articleextractor.org/pages/8853/sdhi_goshawk_ver03/sn2001063112/1898/01/14/ed-1/seq-4/1","Fort Smith, AR","Bearden, AR","Pea Ridge, MI","Fort Smith","AR","Bearden","AR","Pea Ridge","MI","This article is the same as articles 542 and 544. I missed the third reported lynching when I submitted the form for 542.",3050,"sn2001063112", -94.420965,  35.384372, -92.61566,  33.72465, -85.60236,  44.31484
"377", 8853,NA,"NA, South Dakota", -99.90181, 43.969515,NA,"South Dakota","1/14/1898",1898, 1,14,"seq-4","https://articleextractor.org/pages/8853/sdhi_goshawk_ver03/sn2001063112/1898/01/14/ed-1/seq-4/1","Fort Smith, AR","Bearden, AR","Pea Ridge, MI","Fort Smith","AR","Bearden","AR","Pea Ridge","MI",NA,3050,"sn2001063112", -94.420965,  35.384372, -92.61566,  33.72465, -85.60236,  44.31484
"378", 8853,NA,"NA, South Dakota", -99.90181, 43.969515,NA,"South Dakota","1/14/1898",1898, 1,14,"seq-4","https://articleextractor.org/pages/8853/sdhi_goshawk_ver03/sn2001063112/1898/01/14/ed-1/seq-4/1","Fort Smith, AR","Bearden, AR","NA, NA","Fort Smith","AR","Bearden","AR",NA,NA,NA,3051,"sn2001063112", -94.420965,  35.384372, -92.61566,  33.72465,NA,NA
"379", 8853,NA,"NA, South Dakota", -99.90181, 43.969515,NA,"South Dakota","1/14/1898",1898, 1,14,"seq-4","https://articleextractor.org/pages/8853/sdhi_goshawk_ver03/sn2001063112/1898/01/14/ed-1/seq-4/1","Fort Smith, AR","Bearden, AR","Pea Ridge, MI","Fort Smith","AR","Bearden","AR","Pea Ridge","MI","This article is the same as articles 542 and 544. I missed the third reported lynching when I submitted the form for 542.",3051,"sn2001063112", -94.420965,  35.384372, -92.61566,  33.72465, -85.60236,  44.31484
"380", 8853,NA,"NA, South Dakota", -99.90181, 43.969515,NA,"South Dakota","1/14/1898",1898, 1,14,"seq-4","https://articleextractor.org/pages/8853/sdhi_goshawk_ver03/sn2001063112/1898/01/14/ed-1/seq-4/1","Fort Smith, AR","Bearden, AR","Pea Ridge, MI","Fort Smith","AR","Bearden","AR","Pea Ridge","MI",NA,3051,"sn2001063112", -94.420965,  35.384372, -92.61566,  33.72465, -85.60236,  44.31484
"381", 8854,NA,"NA, Michigan", -85.60236, 44.314844,NA,"Michigan","6/2/1892",1892, 6, 2,"seq-2","https://articleextractor.org/pages/8854/mimtptc_douglas_ver01/sn96076998/1892/06/02/ed-1/seq-2/1","New Orleans, LA","Memphis, TN","Nashville, TN","New Orleans","LA","Memphis","TN","Nashville","TN","There were mentions of two lynchings but only briefly. One was a Mexican man who was lynched in Texas and a black man lynched in Arkansas. There were no cities listed.",3052,"sn96076998", -90.071532,  29.951066, -90.04898,  35.14953, -86.78160,  36.16266
"382", 8855,NA,"NA, Colorado",-105.78207, 39.550051,NA,"Colorado","4/8/1892",1892, 4, 8,"seq-2","https://articleextractor.org/pages/8855/cohi_leadville_ver01/sn90051167/1892/04/08/ed-1/seq-2/1","Memphis, TN","NA, NA","NA, NA","Memphis","TN",NA,NA,NA,NA,NA,3053,"sn90051167", -90.048980,  35.149534,NA,NA,NA,NA
"383", 8856,"The Coconino weekly sun ","Flagstaff, Arizona",-111.65130, 35.198284,"Flagstaff","Arizona","4/21/1892",1892, 4,21,"seq-1","https://articleextractor.org/pages/8856/az_gilamonster_ver01/sn87062054/1892/04/21/ed-1/seq-1/1","Texarkana, AR","NA, NA","NA, NA","Texarkana","AR",NA,NA,NA,NA,NA,3054,"sn87062054", -94.036175,  33.430483,NA,NA,NA,NA
"384", 8857,"The Wichita daily eagle ","Wichita, Kansas", -97.33005, 37.687176,"Wichita","Kansas","10/15/1892",1892,10,15,"seq-2","https://articleextractor.org/pages/8857/khi_ingalls_ver02/sn82014635/1892/10/15/ed-1/seq-2/1","Birmingham, AL","NA, NA","NA, NA","Birmingham","AL",NA,NA,NA,NA,NA,3055,"sn82014635", -86.810357,  33.518589,NA,NA,NA,NA
"385", 8860,"Montgomery County sentinel ","Rockville, Maryland", -77.15276, 39.083997,"Rockville","Maryland","1/30/1880",1880, 1,30,"seq-3","https://articleextractor.org/pages/8860/mdu_fireweed_ver01/sn83016209/1880/01/30/ed-1/seq-3/1","Montgomery County, MD","Anne Arundel County, MD","Prince George's County, MD","Montgomery County","MD","Anne Arundel County","MD","Prince George's County","MD",NA,3056,"sn83016209", -77.240515,  39.154743, -76.54882,  38.95301, -76.87210,  38.78492
"386", 8863,"The Fulton County news ","McConnellsburg, Pennsylvania", -77.99889, 39.932589,"McConnellsburg","Pennsylvania","8/15/1901",1901, 8,15,"seq-6","https://articleextractor.org/pages/8863/pst_jordan_ver01/sn86081889/1901/08/15/ed-1/seq-6/1","There is no lynching in this article., NONE","NA, NA","NA, NA","There is no lynching in this article.","NONE",NA,NA,NA,NA,NA,3057,"sn86081889",NA,NA,NA,NA,NA,NA
"387", 8868,"The Washburn leader ","Washburn, North Dakota",-101.02903, 47.289160,"Washburn","North Dakota","6/23/1900",1900, 6,23,"seq-2","https://articleextractor.org/pages/8868/ndhi_hydrogen_ver01/sn85000631/1900/06/23/ed-1/seq-2/1","Metcalfe, GA","NA, NA","NA, NA","Metcalfe","GA",NA,NA,NA,NA,NA,3066,"sn85000631", -83.987946,  30.700196,NA,NA,NA,NA
"388", 8869,"Ottumwa semi-weekly courier ","Ottumwa, Iowa", -92.40830, 41.016029,"Ottumwa","Iowa","1/17/1901",1901, 1,17,"seq-2","https://articleextractor.org/pages/8869/iahi_isbell_ver01/sn86061214/1901/01/17/ed-1/seq-2/1","Des Moines, IA","NA, NA","NA, NA","Des Moines","IA",NA,NA,NA,NA,NA,3067,"sn86061214", -93.624959,  41.586835,NA,NA,NA,NA
"389", 8870,"The semi-weekly messenger ","Wilmington, North Carolina", -77.88681, 34.210389,"Wilmington","North Carolina","6/26/1903",1903, 6,26,"seq-5","https://articleextractor.org/pages/8870/ncu_green_ver01/sn91068367/1903/06/26/ed-1/seq-5/1","Wilmington, DE","NA, NA","NA, NA","Wilmington","DE",NA,NA,NA,NA,NA,3068,"sn91068367", -75.548391,  39.744655,NA,NA,NA,NA
"390", 8871,"The St. Louis Republic ","St. Louis, Missouri", -90.19940, 38.627003,"St. Louis","Missouri","6/26/1903",1903, 6,26,"seq-5","https://articleextractor.org/pages/8871/mohi_james_ver01/sn84020274/1903/06/26/ed-1/seq-5/1","Clarendon, AR","NA, NA","NA, NA","Clarendon","AR",NA,NA,NA,NA,NA,3069,"sn84020274", -91.309209,  34.692640,NA,NA,NA,NA
"391", 8872,"Bismarck daily tribune ","Bismarck, North Dakota",-100.78769, 46.805495,"Bismarck","North Dakota","3/26/1902",1902, 3,26,"seq-2","https://articleextractor.org/pages/8872/ndhi_bisbee_ver01/sn85042242/1902/03/26/ed-1/seq-2/1","LaJunta, CO","NA, NA","NA, NA","LaJunta","CO",NA,NA,NA,NA,NA,3070,"sn85042242",-103.543832,  37.985009,NA,NA,NA,NA
"392", 8872,"Bismarck daily tribune ","Bismarck, North Dakota",-100.78769, 46.805495,"Bismarck","North Dakota","3/26/1902",1902, 3,26,"seq-2","https://articleextractor.org/pages/8872/ndhi_bisbee_ver01/sn85042242/1902/03/26/ed-1/seq-2/1","LaJunta, CO","NA, NA","NA, NA","LaJunta","CO",NA,NA,NA,NA,"This is the same article as the previous article in the excel sheet, 555.",3070,"sn85042242",-103.543832,  37.985009,NA,NA,NA,NA
"393", 8872,"Bismarck daily tribune ","Bismarck, North Dakota",-100.78769, 46.805495,"Bismarck","North Dakota","3/26/1902",1902, 3,26,"seq-2","https://articleextractor.org/pages/8872/ndhi_bisbee_ver01/sn85042242/1902/03/26/ed-1/seq-2/1","LaJunta, CO","NA, NA","NA, NA","LaJunta","CO",NA,NA,NA,NA,NA,3071,"sn85042242",-103.543832,  37.985009,NA,NA,NA,NA
"394", 8872,"Bismarck daily tribune ","Bismarck, North Dakota",-100.78769, 46.805495,"Bismarck","North Dakota","3/26/1902",1902, 3,26,"seq-2","https://articleextractor.org/pages/8872/ndhi_bisbee_ver01/sn85042242/1902/03/26/ed-1/seq-2/1","LaJunta, CO","NA, NA","NA, NA","LaJunta","CO",NA,NA,NA,NA,"This is the same article as the previous article in the excel sheet, 555.",3071,"sn85042242",-103.543832,  37.985009,NA,NA,NA,NA
"395", 8874,NA,"NA, Minnesota", -94.68590, 46.729553,NA,"Minnesota","4/18/1902",1902, 4,18,"seq-3","https://articleextractor.org/pages/8874/mnhi_plymouth_ver01/sn90059523/1902/04/18/ed-1/seq-3/1","Leavenworth, KS","NA, NA","NA, NA","Leavenworth","KS",NA,NA,NA,NA,NA,3072,"sn90059523", -94.927937,  39.310352,NA,NA,NA,NA
"396", 8875,"The Gainesville star ","Gainesville, Florida", -82.32500, 29.651956,"Gainesville","Florida","7/24/1903",1903, 7,24,"seq-4","https://articleextractor.org/pages/8875/fu_six_ver01/sn95047242/1903/07/24/ed-1/seq-4/1","Lake Butler, FL","Norway, SC","Maysville, KY","Lake Butler","FL","Norway","SC","Maysville","KY",NA,3073,"sn95047242", -82.339557,  30.022739, -81.12538,  33.45182, -83.74437,  38.64119
"397", 8875,"The Gainesville star ","Gainesville, Florida", -82.32500, 29.651956,"Gainesville","Florida","7/24/1903",1903, 7,24,"seq-4","https://articleextractor.org/pages/8875/fu_six_ver01/sn95047242/1903/07/24/ed-1/seq-4/1","Lake Butler, FL","Norway, SC","Maysville, KY","Lake Butler","FL","Norway","SC","Maysville","KY","This is the same article as the previous article in the sheet, 558. The following articles are all the same and I submitted the locations of the reported lynchings for 558. 558-563 are the same article.",3073,"sn95047242", -82.339557,  30.022739, -81.12538,  33.45182, -83.74437,  38.64119
"398", 8875,"The Gainesville star ","Gainesville, Florida", -82.32500, 29.651956,"Gainesville","Florida","7/24/1903",1903, 7,24,"seq-4","https://articleextractor.org/pages/8875/fu_six_ver01/sn95047242/1903/07/24/ed-1/seq-4/1","Lake Butler, FL","Norway, SC","Maysville, KY","Lake Butler","FL","Norway","SC","Maysville","KY",NA,3074,"sn95047242", -82.339557,  30.022739, -81.12538,  33.45182, -83.74437,  38.64119
"399", 8875,"The Gainesville star ","Gainesville, Florida", -82.32500, 29.651956,"Gainesville","Florida","7/24/1903",1903, 7,24,"seq-4","https://articleextractor.org/pages/8875/fu_six_ver01/sn95047242/1903/07/24/ed-1/seq-4/1","Lake Butler, FL","Norway, SC","Maysville, KY","Lake Butler","FL","Norway","SC","Maysville","KY","This is the same article as the previous article in the sheet, 558. The following articles are all the same and I submitted the locations of the reported lynchings for 558. 558-563 are the same article.",3074,"sn95047242", -82.339557,  30.022739, -81.12538,  33.45182, -83.74437,  38.64119
"400", 8875,"The Gainesville star ","Gainesville, Florida", -82.32500, 29.651956,"Gainesville","Florida","7/24/1903",1903, 7,24,"seq-4","https://articleextractor.org/pages/8875/fu_six_ver01/sn95047242/1903/07/24/ed-1/seq-4/1","Lake Butler, FL","Norway, SC","Maysville, KY","Lake Butler","FL","Norway","SC","Maysville","KY",NA,3075,"sn95047242", -82.339557,  30.022739, -81.12538,  33.45182, -83.74437,  38.64119
"401", 8875,"The Gainesville star ","Gainesville, Florida", -82.32500, 29.651956,"Gainesville","Florida","7/24/1903",1903, 7,24,"seq-4","https://articleextractor.org/pages/8875/fu_six_ver01/sn95047242/1903/07/24/ed-1/seq-4/1","Lake Butler, FL","Norway, SC","Maysville, KY","Lake Butler","FL","Norway","SC","Maysville","KY","This is the same article as the previous article in the sheet, 558. The following articles are all the same and I submitted the locations of the reported lynchings for 558. 558-563 are the same article.",3075,"sn95047242", -82.339557,  30.022739, -81.12538,  33.45182, -83.74437,  38.64119
"402", 8875,"The Gainesville star ","Gainesville, Florida", -82.32500, 29.651956,"Gainesville","Florida","7/24/1903",1903, 7,24,"seq-4","https://articleextractor.org/pages/8875/fu_six_ver01/sn95047242/1903/07/24/ed-1/seq-4/1","Lake Butler, FL","Norway, SC","Maysville, KY","Lake Butler","FL","Norway","SC","Maysville","KY",NA,3076,"sn95047242", -82.339557,  30.022739, -81.12538,  33.45182, -83.74437,  38.64119
"403", 8875,"The Gainesville star ","Gainesville, Florida", -82.32500, 29.651956,"Gainesville","Florida","7/24/1903",1903, 7,24,"seq-4","https://articleextractor.org/pages/8875/fu_six_ver01/sn95047242/1903/07/24/ed-1/seq-4/1","Lake Butler, FL","Norway, SC","Maysville, KY","Lake Butler","FL","Norway","SC","Maysville","KY","This is the same article as the previous article in the sheet, 558. The following articles are all the same and I submitted the locations of the reported lynchings for 558. 558-563 are the same article.",3076,"sn95047242", -82.339557,  30.022739, -81.12538,  33.45182, -83.74437,  38.64119
"404", 8875,"The Gainesville star ","Gainesville, Florida", -82.32500, 29.651956,"Gainesville","Florida","7/24/1903",1903, 7,24,"seq-4","https://articleextractor.org/pages/8875/fu_six_ver01/sn95047242/1903/07/24/ed-1/seq-4/1","Lake Butler, FL","Norway, SC","Maysville, KY","Lake Butler","FL","Norway","SC","Maysville","KY",NA,3077,"sn95047242", -82.339557,  30.022739, -81.12538,  33.45182, -83.74437,  38.64119
"405", 8875,"The Gainesville star ","Gainesville, Florida", -82.32500, 29.651956,"Gainesville","Florida","7/24/1903",1903, 7,24,"seq-4","https://articleextractor.org/pages/8875/fu_six_ver01/sn95047242/1903/07/24/ed-1/seq-4/1","Lake Butler, FL","Norway, SC","Maysville, KY","Lake Butler","FL","Norway","SC","Maysville","KY","This is the same article as the previous article in the sheet, 558. The following articles are all the same and I submitted the locations of the reported lynchings for 558. 558-563 are the same article.",3077,"sn95047242", -82.339557,  30.022739, -81.12538,  33.45182, -83.74437,  38.64119
"406", 8875,"The Gainesville star ","Gainesville, Florida", -82.32500, 29.651956,"Gainesville","Florida","7/24/1903",1903, 7,24,"seq-4","https://articleextractor.org/pages/8875/fu_six_ver01/sn95047242/1903/07/24/ed-1/seq-4/1","Lake Butler, FL","Norway, SC","Maysville, KY","Lake Butler","FL","Norway","SC","Maysville","KY",NA,3078,"sn95047242", -82.339557,  30.022739, -81.12538,  33.45182, -83.74437,  38.64119
"407", 8875,"The Gainesville star ","Gainesville, Florida", -82.32500, 29.651956,"Gainesville","Florida","7/24/1903",1903, 7,24,"seq-4","https://articleextractor.org/pages/8875/fu_six_ver01/sn95047242/1903/07/24/ed-1/seq-4/1","Lake Butler, FL","Norway, SC","Maysville, KY","Lake Butler","FL","Norway","SC","Maysville","KY","This is the same article as the previous article in the sheet, 558. The following articles are all the same and I submitted the locations of the reported lynchings for 558. 558-563 are the same article.",3078,"sn95047242", -82.339557,  30.022739, -81.12538,  33.45182, -83.74437,  38.64119
"408", 8876,NA,"NA, Nebraska", -99.90181, 41.492537,NA,"Nebraska","3/24/1899",1899, 3,24,"seq-1","https://articleextractor.org/pages/8876/nbu_beatrice_ver01/sn99021999/1899/03/24/ed-1/seq-1/1","Texarkana, AR","Jackson, MI","NA, NA","Texarkana","AR","Jackson","MI",NA,NA,"The publication's name is The Omaha Daily Bee.",3079,"sn99021999", -94.036175,  33.430483, -84.40135,  42.24587,NA,NA
"409", 8877,"The San Francisco call ","San Francisco , California",-122.41942, 37.774929,"San Francisco ","California","1/17/1900",1900, 1,17,"seq-6","https://articleextractor.org/pages/8877/curiv_albion_ver01/sn85066387/1900/01/17/ed-1/seq-6/1","none, NONE","NA, NA","NA, NA","none","NONE",NA,NA,NA,NA,"there is no reported lynching, it contains lynching statistics from 1885-1889 in the country.",3080,"sn85066387",NA,NA,NA,NA,NA,NA
"410", 8878,"The Jasper weekly courier ","Jasper, Indiana", -86.93111, 38.391442,"Jasper","Indiana","4/18/1902",1902, 4,18,"seq-2","https://articleextractor.org/pages/8878/in_bird_ver02/sn84023963/1902/04/18/ed-1/seq-2/1","Dukedom, TN","NA, NA","NA, NA","Dukedom","TN",NA,NA,NA,NA,NA,3081,"sn84023963", -88.715054,  36.502282,NA,NA,NA,NA
"411", 8879,"Sistersville daily oil review ","Sistersville, West Virginia", -80.99594, 39.564242,"Sistersville","West Virginia","9/15/1902",1902, 9,15,"seq-1","https://articleextractor.org/pages/8879/wvu_federation_ver01/sn86092356/1902/09/15/ed-1/seq-1/1","Butler, PA","NA, NA","NA, NA","Butler","PA",NA,NA,NA,NA,NA,3082,"sn86092356", -79.895333,  40.861176,NA,NA,NA,NA
"412", 8882,NA,"NA, Georgia", -82.90712, 32.157435,NA,"Georgia","9/4/1901",1901, 9, 4,"seq-1","https://articleextractor.org/pages/8882/gu_gadget_ver01/sn89053684/1901/09/04/ed-1/seq-1/1","Weeping Water, NE","Troy, AL","NA, NA","Weeping Water","NE","Troy","AL",NA,NA,"the paper's name is the Savannah Morning News",3084,"sn89053684", -96.139972,  40.869930, -85.96995,  31.80877,NA,NA
"413", 8882,NA,"NA, Georgia", -82.90712, 32.157435,NA,"Georgia","9/4/1901",1901, 9, 4,"seq-1","https://articleextractor.org/pages/8882/gu_gadget_ver01/sn89053684/1901/09/04/ed-1/seq-1/1","Weeping Water, NE","Troy, AL","NA, NA","Weeping Water","NE","Troy","AL",NA,NA,"the paper's name is the Savannah Morning News",3085,"sn89053684", -96.139972,  40.869930, -85.96995,  31.80877,NA,NA
"414", 8883,NA,"NA, Nebraska", -99.90181, 41.492537,NA,"Nebraska","3/21/1901",1901, 3,21,"seq-1","https://articleextractor.org/pages/8883/nbu_julius_ver01/sn99021999/1901/03/21/ed-1/seq-1/1","New Madrid, MO","NA, NA","NA, NA","New Madrid","MO",NA,NA,NA,NA,"The publication's name is The Omaha Daily Bee.",3086,"sn99021999", -89.527855,  36.586449,NA,NA,NA,NA
"415", 8883,NA,"NA, Nebraska", -99.90181, 41.492537,NA,"Nebraska","3/21/1901",1901, 3,21,"seq-1","https://articleextractor.org/pages/8883/nbu_julius_ver01/sn99021999/1901/03/21/ed-1/seq-1/1","none, NONE","NA, NA","NA, NA","none","NONE",NA,NA,NA,NA,"this is a duplicate of article 571.",3086,"sn99021999",NA,NA,NA,NA,NA,NA
"416", 8883,NA,"NA, Nebraska", -99.90181, 41.492537,NA,"Nebraska","3/21/1901",1901, 3,21,"seq-1","https://articleextractor.org/pages/8883/nbu_julius_ver01/sn99021999/1901/03/21/ed-1/seq-1/1","New Madrid, MO","NA, NA","NA, NA","New Madrid","MO",NA,NA,NA,NA,"The publication's name is The Omaha Daily Bee.",3087,"sn99021999", -89.527855,  36.586449,NA,NA,NA,NA
"417", 8883,NA,"NA, Nebraska", -99.90181, 41.492537,NA,"Nebraska","3/21/1901",1901, 3,21,"seq-1","https://articleextractor.org/pages/8883/nbu_julius_ver01/sn99021999/1901/03/21/ed-1/seq-1/1","none, NONE","NA, NA","NA, NA","none","NONE",NA,NA,NA,NA,"this is a duplicate of article 571.",3087,"sn99021999",NA,NA,NA,NA,NA,NA
"418", 8884,"The gold leaf ","Henderson, North Carolina", -78.40269, 36.327266,"Henderson","North Carolina","10/17/1901",1901,10,17,"seq-4","https://articleextractor.org/pages/8884/ncu_haw_ver01/sn91068402/1901/10/17/ed-1/seq-4/1","none, NONE","NA, NA","NA, NA","none","NONE",NA,NA,NA,NA,"this was a lynch law discussion.",3088,"sn91068402",NA,NA,NA,NA,NA,NA
"419", 8886,"Willmar tribune ","Willmar, Minnesota", -95.04866, 45.122371,"Willmar","Minnesota","6/19/1901",1901, 6,19,"seq-2","https://articleextractor.org/pages/8886/mnhi_edsel_ver01/sn89081022/1901/06/19/ed-1/seq-2/1","Hamburg, AR","NA, NA","NA, NA","Hamburg","AR",NA,NA,NA,NA,NA,3089,"sn89081022", -91.797554,  33.225724,NA,NA,NA,NA
"420", 8890,"The times ","Washington , District of Columbia", -77.03687, 38.907192,"Washington ","District of Columbia","7/17/1897",1897, 7,17,"seq-4","https://articleextractor.org/pages/8890/dlc_dutch_ver02/sn85054468/1897/07/17/ed-1/seq-4/1","Florence, AL","NA, NA","NA, NA","Florence","AL",NA,NA,NA,NA,NA,3090,"sn85054468", -87.677251,  34.799810,NA,NA,NA,NA
"421", 8890,"The times ","Washington , District of Columbia", -77.03687, 38.907192,"Washington ","District of Columbia","7/17/1897",1897, 7,17,"seq-4","https://articleextractor.org/pages/8890/dlc_dutch_ver02/sn85054468/1897/07/17/ed-1/seq-4/1","none, NONE","NA, NA","NA, NA","none","NONE",NA,NA,NA,NA,"this is a duplicate of article 575.",3090,"sn85054468",NA,NA,NA,NA,NA,NA
"422", 8890,"The times ","Washington , District of Columbia", -77.03687, 38.907192,"Washington ","District of Columbia","7/17/1897",1897, 7,17,"seq-4","https://articleextractor.org/pages/8890/dlc_dutch_ver02/sn85054468/1897/07/17/ed-1/seq-4/1","Florence, AL","NA, NA","NA, NA","Florence","AL",NA,NA,NA,NA,NA,3091,"sn85054468", -87.677251,  34.799810,NA,NA,NA,NA
"423", 8890,"The times ","Washington , District of Columbia", -77.03687, 38.907192,"Washington ","District of Columbia","7/17/1897",1897, 7,17,"seq-4","https://articleextractor.org/pages/8890/dlc_dutch_ver02/sn85054468/1897/07/17/ed-1/seq-4/1","none, NONE","NA, NA","NA, NA","none","NONE",NA,NA,NA,NA,"this is a duplicate of article 575.",3091,"sn85054468",NA,NA,NA,NA,NA,NA
"424", 8891,"The daily morning journal and courier ","New Haven, Connecticut", -72.92788, 41.308274,"New Haven","Connecticut","6/1/1903",1903, 6, 1,"seq-1","https://articleextractor.org/pages/8891/ct_cedar_ver01/sn84020358/1903/06/01/ed-1/seq-1/1","Pittsburg, PA","NA, NA","NA, NA","Pittsburg","PA",NA,NA,NA,NA,NA,3092,"sn84020358", -79.995886,  40.440625,NA,NA,NA,NA
"425", 8891,"The daily morning journal and courier ","New Haven, Connecticut", -72.92788, 41.308274,"New Haven","Connecticut","6/1/1903",1903, 6, 1,"seq-1","https://articleextractor.org/pages/8891/ct_cedar_ver01/sn84020358/1903/06/01/ed-1/seq-1/1","Pittsburg, PA","NA, NA","NA, NA","Pittsburg","PA",NA,NA,NA,NA,NA,3092,"sn84020358", -79.995886,  40.440625,NA,NA,NA,NA
"426", 8892,"Iowa County democrat ","Mineral Point, Wisconsin", -90.17985, 42.859997,"Mineral Point","Wisconsin","2/26/1903",1903, 2,26,"seq-7","https://articleextractor.org/pages/8892/whi_lucretia_ver01/sn86086852/1903/02/26/ed-1/seq-7/1","Centerville, IA","NA, NA","NA, NA","Centerville","IA",NA,NA,NA,NA,NA,3093,"sn86086852", -92.873820,  40.729056,NA,NA,NA,NA
"427", 8893,"The Atlanta constitution ","Atlanta, Georgia", -84.38768, 33.748752,"Atlanta","Georgia","6/29/1903",1903, 6,29,"seq-11","https://articleextractor.org/pages/8893/gu_graco_ver01/sn89053706/1903/06/29/ed-1/seq-11/1","Jonesville, LA","NA, NA","NA, NA","Jonesville","LA",NA,NA,NA,NA,NA,3094,"sn89053706", -91.818183,  31.626559,NA,NA,NA,NA
"428", 8894,"The Waterbury Democrat ","Waterbury, Connecticut", -73.05150, 41.558152,"Waterbury","Connecticut","3/27/1940",1940, 3,27,"seq-6","https://articleextractor.org/pages/8894/ct_hepburn_ver01/sn82014085/1940/03/27/ed-1/seq-6/1","Julie County, GA","NA, NA","NA, NA","Julie County","GA",NA,NA,NA,NA,NA,3095,"sn82014085", -82.907123,  32.157435,NA,NA,NA,NA
"429", 8896,NA,"NA, Ohio", -82.90712, 40.417287,NA,"Ohio","10/30/1903",1903,10,30,"seq-2","https://articleextractor.org/pages/8896/ohi_foxtrot_ver01/sn87076843/1903/10/30/ed-1/seq-2/1","Sullivan, IN","NA, NA","NA, NA","Sullivan","IN",NA,NA,NA,NA,NA,3096,"sn87076843", -87.405852,  39.095320,NA,NA,NA,NA
"430", 8897,"The Washburn leader ","Washburn, North Dakota",-101.02903, 47.289160,"Washburn","North Dakota","6/1/1901",1901, 6, 1,"seq-4","https://articleextractor.org/pages/8897/ndhi_hydrogen_ver01/sn85000631/1901/06/01/ed-1/seq-4/1","Wichita, KS","NA, NA","NA, NA","Wichita","KS",NA,NA,NA,NA,NA,3097,"sn85000631", -97.330053,  37.687176,NA,NA,NA,NA
"431", 8906,"The Topeka state journal ","Topeka, Kansas", -95.67516, 39.047345,"Topeka","Kansas","6/14/1913",1913, 6,14,"seq-14","https://articleextractor.org/pages/8906/khi_dalton_ver01/sn82016014/1913/06/14/ed-1/seq-14/1","Anadarko, OK","NA, NA","NA, NA","Anadarko","OK",NA,NA,NA,NA,NA,3098,"sn82016014", -98.243662,  35.072562,NA,NA,NA,NA
"432", 8908,"The news & observer ","Raleigh, North Carolina", -78.63818, 35.779590,"Raleigh","North Carolina","11/5/1903",1903,11, 5,"seq-2","https://articleextractor.org/pages/8908/ncu_hamm_ver01/sn85042104/1903/11/05/ed-1/seq-2/1","Pittsburg, PA","NA, NA","NA, NA","Pittsburg","PA",NA,NA,NA,NA,NA,3099,"sn85042104", -79.995886,  40.440625,NA,NA,NA,NA
"433", 8909,NA,"NA, Mississippi", -89.39853, 32.354668,NA,"Mississippi","1/24/1903",1903, 1,24,"seq-1","https://articleextractor.org/pages/8909/msar_obsidian_ver01/sn87065600/1903/01/24/ed-1/seq-1/1","Attala County, MI","Birmingham, AL","NA, NA","Attala County","MI","Birmingham","AL",NA,NA,"I think I clicked on the wrong google document for this one. The correct locations are below. Not Pittsburg, PA if that is what I submitted.",3100,"sn87065600", -85.602364,  44.314844, -86.81036,  33.51859,NA,NA
"434", 8910,"The Topeka state journal ","Topeka, Kansas", -95.67516, 39.047345,"Topeka","Kansas","4/7/1903",1903, 4, 7,"seq-4","https://articleextractor.org/pages/8910/khi_higuchi_ver01/sn82016014/1903/04/07/ed-1/seq-4/1","Little Rock, AR","NA, NA","NA, NA","Little Rock","AR",NA,NA,NA,NA,NA,3101,"sn82016014", -92.288016,  34.744462,NA,NA,NA,NA
"435", 8912,"Deseret evening news ","Great Salt Lake, Utah",-112.47683, 41.115791,"Great Salt Lake","Utah","7/1/1903",1903, 7, 1,"seq-5","https://articleextractor.org/pages/8912/uuml_twelve_ver01/sn83045555/1903/07/01/ed-1/seq-5/1","Wilmington, DE","NA, NA","NA, NA","Wilmington","DE",NA,NA,NA,NA,NA,3102,"sn83045555", -75.548391,  39.744655,NA,NA,NA,NA
"436", 8912,"Deseret evening news ","Great Salt Lake, Utah",-112.47683, 41.115791,"Great Salt Lake","Utah","7/1/1903",1903, 7, 1,"seq-5","https://articleextractor.org/pages/8912/uuml_twelve_ver01/sn83045555/1903/07/01/ed-1/seq-5/1","Wilmington, DE","NA, NA","NA, NA","Wilmington","DE",NA,NA,NA,NA,NA,3102,"sn83045555", -75.548391,  39.744655,NA,NA,NA,NA
"437", 8914,"Shepherdstown register ","Shepherdstown, West Virginia", -77.80416, 39.430100,"Shepherdstown","West Virginia","10/6/1904",1904,10, 6,"seq-4","https://articleextractor.org/pages/8914/wvu_bones_ver01/sn84026824/1904/10/06/ed-1/seq-4/1","none, NONE","NA, NA","NA, NA","none","NONE",NA,NA,NA,NA,"lynch law.",3103,"sn84026824",NA,NA,NA,NA,NA,NA
"438", 8915,NA,"NA, South Dakota", -99.90181, 43.969515,NA,"South Dakota","8/28/1903",1903, 8,28,"seq-2","https://articleextractor.org/pages/8915/sdhi_dominica_ver01/sn00065154/1903/08/28/ed-1/seq-2/1","Chicago, IL","NA, NA","NA, NA","Chicago","IL",NA,NA,NA,NA,"attempted lynching.",3104,"sn00065154", -87.629798,  41.878114,NA,NA,NA,NA
"439", 8916,"The Hickman courier ","Hickman, Kentucky", -89.18618, 36.571172,"Hickman","Kentucky","1/4/1901",1901, 1, 4,"seq-7","https://articleextractor.org/pages/8916/kyu_kinks_ver01/sn85052141/1901/01/04/ed-1/seq-7/1","Montgomery, AL","NA, NA","NA, NA","Montgomery","AL",NA,NA,NA,NA,NA,3105,"sn85052141", -86.307737,  32.379223,NA,NA,NA,NA
"440", 8918,"The Coalville times ","Coalville, Utah",-111.39936, 40.917725,"Coalville","Utah","5/1/1903",1903, 5, 1,"seq-10","https://articleextractor.org/pages/8918/uuml_kirilenko_ver01/sn85058217/1903/05/01/ed-1/seq-10/1","Carthage, TX","Santa Fe, IL","NA, NA","Carthage","TX","Santa Fe","IL",NA,NA,NA,3106,"sn85058217", -94.337420,  32.157384, -89.42693,  38.53614,NA,NA
"441", 8921,"The Birmingham age-herald ","Birmingham, Alabama", -86.81036, 33.518589,"Birmingham","Alabama","12/28/1903",1903,12,28,"seq-4","https://articleextractor.org/pages/8921/au_capote_ver01/sn85038485/1903/12/28/ed-1/seq-4/1","none, NONE","NA, NA","NA, NA","none","NONE",NA,NA,NA,NA,"lynch law.",3107,"sn85038485",NA,NA,NA,NA,NA,NA
"442", 8923,"The Topeka state journal ","Topeka, Kansas", -95.67516, 39.047345,"Topeka","Kansas","1/15/1904",1904, 1,15,"seq-9","https://articleextractor.org/pages/8923/khi_gygax_ver01/sn82016014/1904/01/15/ed-1/seq-9/1","Gainesville, FL","Petersburg, VA","NA, NA","Gainesville","FL","Petersburg","VA",NA,NA,NA,3108,"sn82016014", -82.324998,  29.651956, -77.40193,  37.22793,NA,NA
"443", 8924,"The Birmingham age-herald ","Birmingham, Alabama", -86.81036, 33.518589,"Birmingham","Alabama","9/28/1904",1904, 9,28,"seq-1","https://articleextractor.org/pages/8924/au_davis_ver01/sn85038485/1904/09/28/ed-1/seq-1/1","none, NONE","NA, NA","NA, NA","none","NONE",NA,NA,NA,NA,NA,3109,"sn85038485",NA,NA,NA,NA,NA,NA
"444", 8929,NA,"NA, Minnesota", -94.68590, 46.729553,NA,"Minnesota","11/23/1905",1905,11,23,"seq-2","https://articleextractor.org/pages/8929/mnhi_disco_ver01/sn90060762/1905/11/23/ed-1/seq-2/1","none, NONE","NA, NA","NA, NA","none","NONE",NA,NA,NA,NA,"it says ""A woman in the south had her husband lynched."" No state, no city.",3110,"sn90060762",NA,NA,NA,NA,NA,NA
"445", 8932,"The Seattle post-intelligencer ","Seattle, Washington",-122.33285, 47.606139,"Seattle","Washington","8/21/1894",1894, 8,21,"seq-4","https://articleextractor.org/pages/8932/wa_forks_ver01/sn83045604/1894/08/21/ed-1/seq-4/1","none, NONE","NA, NA","NA, NA","none","NONE",NA,NA,NA,NA,"lynching discussion.",3111,"sn83045604",NA,NA,NA,NA,NA,NA
"446", 8933,"The Atlanta constitution ","Atlanta, Georgia", -84.38768, 33.748752,"Atlanta","Georgia","2/28/1893",1893, 2,28,"seq-12","https://articleextractor.org/pages/8933/gu_fornax_ver01/sn89053706/1893/02/28/ed-1/seq-12/1","Jellico, TN","NA, NA","NA, NA","Jellico","TN",NA,NA,NA,NA,NA,3112,"sn89053706", -84.126874,  36.587859,NA,NA,NA,NA
"447", 8936,NA,"NA, Arkansas", -91.83183, 35.201050,NA,"Arkansas","7/17/1907",1907, 7,17,"seq-3","https://articleextractor.org/pages/8936/arhi_huskerdu_ver01/sn89051168/1907/07/17/ed-1/seq-3/1","Joplin, MO","NA, NA","NA, NA","Joplin","MO",NA,NA,NA,NA,NA,3114,"sn89051168", -94.513281,  37.084227,NA,NA,NA,NA
"448", 8942,"The Houston daily post ","Houston, Texas", -95.36980, 29.760427,"Houston","Texas","7/13/1901",1901, 7,13,"seq-1","https://articleextractor.org/pages/8942/txdn_delta_ver01/sn86071197/1901/07/13/ed-1/seq-1/1","Kansas City, MO","NA, NA","NA, NA","Kansas City","MO",NA,NA,NA,NA,"they abandoned their lynching plan.",3115,"sn86071197", -94.578567,  39.099727,NA,NA,NA,NA
"449", 8943,"The Superior times ","Superior, Wisconsin", -92.10408, 46.720774,"Superior","Wisconsin","5/13/1893",1893, 5,13,"seq-1","https://articleextractor.org/pages/8943/whi_florence_ver01/sn85040344/1893/05/13/ed-1/seq-1/1","Camden, AR","NA, NA","NA, NA","Camden","AR",NA,NA,NA,NA,NA,3116,"sn85040344", -92.834104,  33.583634,NA,NA,NA,NA
"450", 8944,"The evening times ","Washington, District of Columbia", -77.03687, 38.907192,"Washington","District of Columbia","5/2/1901",1901, 5, 2,"seq-1","https://articleextractor.org/pages/8944/dlc_november_ver01/sn84024441/1901/05/02/ed-1/seq-1/1","Chicago, IL","NA, NA","NA, NA","Chicago","IL",NA,NA,NA,NA,NA,3117,"sn84024441", -87.629798,  41.878114,NA,NA,NA,NA
"451", 8946,"New-York tribune ","New York , New York", -74.00597, 40.712775,"New York ","New York","9/12/1902",1902, 9,12,"seq-9","https://articleextractor.org/pages/8946/dlc_haiti_ver01/sn83030214/1902/09/12/ed-1/seq-9/1","none, NONE","NA, NA","NA, NA","none","NONE",NA,NA,NA,NA,"no lynching reported.",3118,"sn83030214",NA,NA,NA,NA,NA,NA
"452", 8948,"The Washburn leader ","Washburn, North Dakota",-101.02903, 47.289160,"Washburn","North Dakota","3/23/1901",1901, 3,23,"seq-5","https://articleextractor.org/pages/8948/ndhi_hydrogen_ver01/sn85000631/1901/03/23/ed-1/seq-5/1","Nashville, TN","NA, NA","NA, NA","Nashville","TN",NA,NA,NA,NA,NA,3119,"sn85000631", -86.781602,  36.162664,NA,NA,NA,NA
"453", 8949,"Wausau pilot ","Wausau, Wisconsin", -89.63012, 44.959135,"Wausau","Wisconsin","9/13/1904",1904, 9,13,"seq-7","https://articleextractor.org/pages/8949/whi_augurey_ver01/sn85040749/1904/09/13/ed-1/seq-7/1","Picketsville, TN","Brookhaven, MI","NA, NA","Picketsville","TN","Brookhaven","MI",NA,NA,NA,3120,"sn85040749", -86.580447,  35.517491, -90.44065,  31.57906,NA,NA
"454", 8953,"Phoenix tribune ","Phoenix, Arizona",-112.07404, 33.448377,"Phoenix","Arizona","8/17/1918",1918, 8,17,"seq-1","https://articleextractor.org/pages/8953/az_campfiregoneout_ver03/sn96060881/1918/08/17/ed-1/seq-1/1","none, NONE","NA, NA","NA, NA","none","NONE",NA,NA,NA,NA,"no lynching reported.",3121,"sn96060881",NA,NA,NA,NA,NA,NA
"455", 8954,"Albuquerque morning journal ","Albuquerque, New Mexico",-106.65042, 35.084386,"Albuquerque","New Mexico","7/4/1921",1921, 7, 4,"seq-3","https://articleextractor.org/pages/8954/nmu_dumas_ver01/sn84031081/1921/07/04/ed-1/seq-3/1","Des Moines, IA","NA, NA","NA, NA","Des Moines","IA",NA,NA,NA,NA,"attempted lynching.",3122,"sn84031081", -93.624959,  41.586835,NA,NA,NA,NA
"456", 8956,"The Kendrick gazette ","Kendrick, Idaho",-116.64654, 46.614060,"Kendrick","Idaho","12/27/1918",1918,12,27,"seq-6","https://articleextractor.org/pages/8956/idhi_greene_ver01/sn86091096/1918/12/27/ed-1/seq-6/1","none, NONE","NA, NA","NA, NA","none","NONE",NA,NA,NA,NA,"no reported lynching.",3123,"sn86091096",NA,NA,NA,NA,NA,NA
"457", 8957,NA,"NA, Arkansas", -91.83183, 35.201050,NA,"Arkansas","11/21/1902",1902,11,21,"seq-4","https://articleextractor.org/pages/8957/arhi_kangaskhan_ver02/sn89051128/1902/11/21/ed-1/seq-4/1","Lewisburg, TN","NA, NA","NA, NA","Lewisburg","TN",NA,NA,NA,NA,NA,3124,"sn89051128", -86.788889,  35.449240,NA,NA,NA,NA
"458", 8958,"Deseret evening news ","Great Salt Lake, Utah",-112.47683, 41.115791,"Great Salt Lake","Utah","2/6/1902",1902, 2, 6,"seq-2","https://articleextractor.org/pages/8958/uuml_eight_ver01/sn83045555/1902/02/06/ed-1/seq-2/1","Nicholasville, KY","NA, NA","NA, NA","Nicholasville","KY",NA,NA,NA,NA,NA,3125,"sn83045555", -84.572996,  37.880634,NA,NA,NA,NA
"459", 8959,NA,"NA, Tennessee", -86.58045, 35.517491,NA,"Tennessee","5/9/1918",1918, 5, 9,"seq-3","https://articleextractor.org/pages/8959/tu_carla_ver01/sn99065781/1918/05/09/ed-1/seq-3/1","Estill Springs, TN","NA, NA","NA, NA","Estill Springs","TN",NA,NA,NA,NA,NA,3126,"sn99065781", -86.128042,  35.270637,NA,NA,NA,NA
"460", 8960,"Semi-weekly interior journal ","Stanford, Kentucky", -84.66189, 37.531190,"Stanford","Kentucky","3/22/1901",1901, 3,22,"seq-2","https://articleextractor.org/pages/8960/kyu_hendrix_ver01/sn85052020/1901/03/22/ed-1/seq-2/1","Simpson County, KY","NA, NA","NA, NA","Simpson County","KY",NA,NA,NA,NA,NA,3127,"sn85052020", -86.620794,  36.777201,NA,NA,NA,NA
"461", 8961,"The Stark County Democrat ","Canton, Ohio", -81.37845, 40.798947,"Canton","Ohio","3/15/1904",1904, 3,15,"seq-1","https://articleextractor.org/pages/8961/ohi_golf_ver04/sn84028490/1904/03/15/ed-1/seq-1/1","Springfield, OH","NA, NA","NA, NA","Springfield","OH",NA,NA,NA,NA,NA,3128,"sn84028490", -83.808817,  39.924227,NA,NA,NA,NA
"462", 8963,"Richmond dispatch ","Richmond, Virginia", -77.43605, 37.540725,"Richmond","Virginia","9/28/1902",1902, 9,28,"seq-21","https://articleextractor.org/pages/8963/vi_carmel_ver02/sn85038614/1902/09/28/ed-1/seq-21/1","Church Hill, VA","NA, NA","NA, NA","Church Hill","VA",NA,NA,NA,NA,"planned and attempted lynching.",3129,"sn85038614", -77.416252,  37.532840,NA,NA,NA,NA
"463", 8963,"Richmond dispatch ","Richmond, Virginia", -77.43605, 37.540725,"Richmond","Virginia","9/28/1902",1902, 9,28,"seq-21","https://articleextractor.org/pages/8963/vi_carmel_ver02/sn85038614/1902/09/28/ed-1/seq-21/1","Church Hill, VA","NA, NA","NA, NA","Church Hill","VA",NA,NA,NA,NA,"planned and attempted lynching.",3130,"sn85038614", -77.416252,  37.532840,NA,NA,NA,NA
"464", 8963,"Richmond dispatch ","Richmond, Virginia", -77.43605, 37.540725,"Richmond","Virginia","9/28/1902",1902, 9,28,"seq-21","https://articleextractor.org/pages/8963/vi_carmel_ver02/sn85038614/1902/09/28/ed-1/seq-21/1","Church Hill, VA","NA, NA","NA, NA","Church Hill","VA",NA,NA,NA,NA,"planned and attempted lynching.",3131,"sn85038614", -77.416252,  37.532840,NA,NA,NA,NA
"465", 8963,"Richmond dispatch ","Richmond, Virginia", -77.43605, 37.540725,"Richmond","Virginia","9/28/1902",1902, 9,28,"seq-21","https://articleextractor.org/pages/8963/vi_carmel_ver02/sn85038614/1902/09/28/ed-1/seq-21/1","Church Hill, VA","NA, NA","NA, NA","Church Hill","VA",NA,NA,NA,NA,"planned and attempted lynching.",3132,"sn85038614", -77.416252,  37.532840,NA,NA,NA,NA
"466", 8964,NA,"NA, Mississippi", -89.39853, 32.354668,NA,"Mississippi","2/15/1902",1902, 2,15,"seq-1","https://articleextractor.org/pages/8964/msar_obsidian_ver01/sn87065600/1902/02/15/ed-1/seq-1/1","Nicholasville, KY","Lynchburg, TN","NA, NA","Nicholasville","KY","Lynchburg","TN",NA,NA,NA,3133,"sn87065600", -84.572996,  37.880634, -86.37402,  35.28302,NA,NA
"467", 8964,NA,"NA, Mississippi", -89.39853, 32.354668,NA,"Mississippi","2/15/1902",1902, 2,15,"seq-1","https://articleextractor.org/pages/8964/msar_obsidian_ver01/sn87065600/1902/02/15/ed-1/seq-1/1","Nicholasville, KY","Lynchburg, TN","NA, NA","Nicholasville","KY","Lynchburg","TN",NA,NA,NA,3134,"sn87065600", -84.572996,  37.880634, -86.37402,  35.28302,NA,NA
"468", 8965,"The evening world ","New York, New York", -74.00597, 40.712775,"New York","New York","6/4/1904",1904, 6, 4,"seq-12","https://articleextractor.org/pages/8965/nn_plato_ver01/sn83030193/1904/06/04/ed-1/seq-12/1","none, NONE","NA, NA","NA, NA","none","NONE",NA,NA,NA,NA,"no reported lynching.",3135,"sn83030193",NA,NA,NA,NA,NA,NA
"469", 8967,"Little Falls herald ","Little Falls, Minnesota", -94.36944, 45.980556,"Little Falls","Minnesota","9/25/1903",1903, 9,25,"seq-7","https://articleextractor.org/pages/8967/mnhi_opel_ver01/sn89064515/1903/09/25/ed-1/seq-7/1","Luxora, AR","NA, NA","NA, NA","Luxora","AR",NA,NA,NA,NA,NA,3136,"sn89064515", -89.928227,  35.755826,NA,NA,NA,NA
"470", 8968,"The San Francisco call ","San Francisco , California",-122.41942, 37.774929,"San Francisco ","California","1/9/1902",1902, 1, 9,"seq-1","https://articleextractor.org/pages/8968/curiv_carmel_ver01/sn85066387/1902/01/09/ed-1/seq-1/1","Alturas, CA","NA, NA","NA, NA","Alturas","CA",NA,NA,NA,NA,NA,3137,"sn85066387",-120.542456,  41.487115,NA,NA,NA,NA
"471", 8969,NA,"NA, Louisiana", -93.08628, 31.760720,NA,"Louisiana","6/28/1902",1902, 6,28,"seq-1","https://articleextractor.org/pages/8969/lu_eevee_ver01/sn88064328/1902/06/28/ed-1/seq-1/1","none, NONE","NA, NA","NA, NA","none","NONE",NA,NA,NA,NA,"opinion article.",3138,"sn88064328",NA,NA,NA,NA,NA,NA
"472", 8970,"Evening times-Republican ","Marshalltown, Iowa", -92.90804, 42.049467,"Marshalltown","Iowa","11/22/1902",1902,11,22,"seq-5","https://articleextractor.org/pages/8970/iahi_duesenberg_ver01/sn85049554/1902/11/22/ed-1/seq-5/1","none, NONE","NA, NA","NA, NA","none","NONE",NA,NA,NA,NA,"no lynching coverage",3139,"sn85049554",NA,NA,NA,NA,NA,NA
"473", 8971,"Shoshone journal ","Shoshone, Idaho",-114.40587, 42.936017,"Shoshone","Idaho","5/30/1902",1902, 5,30,"seq-2","https://articleextractor.org/pages/8971/idhi_galapagos_ver01/sn86063039/1902/05/30/ed-1/seq-2/1","Paris, MO","NA, NA","NA, NA","Paris","MO",NA,NA,NA,NA,NA,3140,"sn86063039", -92.001281,  39.480872,NA,NA,NA,NA
"474", 8973,"The Topeka state journal ","Topeka, Kansas", -95.67516, 39.047345,"Topeka","Kansas","8/13/1903",1903, 8,13,"seq-10","https://articleextractor.org/pages/8973/khi_gygax_ver01/sn82016014/1903/08/13/ed-1/seq-10/1","Whitesboro, TX","NA, NA","NA, NA","Whitesboro","TX",NA,NA,NA,NA,NA,3141,"sn82016014", -96.906948,  33.656218,NA,NA,NA,NA
"475", 9506,"The Montgomery advertiser ","Montgomery, Alabama", -86.30774, 32.379223,"Montgomery","Alabama","7/3/1901",1901, 7, 3,"seq-4","https://articleextractor.org/pages/9506/au_groom_ver01/sn84020645/1901/07/03/ed-1/seq-4/3","none, NONE","NA, NA","NA, NA","none","NONE",NA,NA,NA,NA,"lynch law",3142,"sn84020645",NA,NA,NA,NA,NA,NA
"476", 9554,NA,"NA, Delaware", -75.52767, 38.910832,NA,"Delaware","3/11/1886",1886, 3,11,"seq-2","https://articleextractor.org/pages/9554/deu_horcrux_ver01/sn88053046/1886/03/11/ed-1/seq-2/2","Eatontown, NJ","NA, NA","NA, NA","Eatontown","NJ",NA,NA,NA,NA,NA,3143,"sn88053046", -74.050973,  40.296222,NA,NA,NA,NA
"477", 9563,NA,"NA, Georgia", -82.90712, 32.157435,NA,"Georgia","3/24/1904",1904, 3,24,"seq-1","https://articleextractor.org/pages/9563/gu_holmes_ver01/sn89053684/1904/03/24/ed-1/seq-1/1","Rome, GA","NA, NA","NA, NA","Rome","GA",NA,NA,NA,NA,NA,3144,"sn89053684", -85.164673,  34.257038,NA,NA,NA,NA
"478", 9564,"The Birmingham age-herald ","Birmingham, Alabama", -86.81036, 33.518589,"Birmingham","Alabama","10/26/1904",1904,10,26,"seq-4","https://articleextractor.org/pages/9564/au_davis_ver01/sn85038485/1904/10/26/ed-1/seq-4/1","Huntsville, NONE","NA, NA","NA, NA","Huntsville","NONE",NA,NA,NA,NA,NA,3145,"sn85038485", -86.586104,  34.730369,NA,NA,NA,NA
"479", 9565,"The Colorado statesman ","Denver, Colorado",-104.99025, 39.739236,"Denver","Colorado","9/25/1909",1909, 9,25,"seq-1","https://articleextractor.org/pages/9565/cohi_hamilton_ver01/sn83025514/1909/09/25/ed-1/seq-1/1","Duncan, MI","NA, NA","NA, NA","Duncan","MI",NA,NA,NA,NA,NA,3146,"sn83025514", -88.844980,  46.471955,NA,NA,NA,NA
"480", 9566,"Owingsville outlook ","Owingsville, Kentucky", -83.76408, 38.144801,"Owingsville","Kentucky","7/2/1903",1903, 7, 2,"seq-3","https://articleextractor.org/pages/9566/kyu_elvis_ver01/sn86069620/1903/07/02/ed-1/seq-3/1","Salt Lake, UT","Wilmington, DE","NA, NA","Salt Lake","UT","Wilmington","DE",NA,NA,NA,3147,"sn86069620",-111.891047,  40.760779, -75.54839,  39.74466,NA,NA
"481", 9566,"Owingsville outlook ","Owingsville, Kentucky", -83.76408, 38.144801,"Owingsville","Kentucky","7/2/1903",1903, 7, 2,"seq-3","https://articleextractor.org/pages/9566/kyu_elvis_ver01/sn86069620/1903/07/02/ed-1/seq-3/1","Salt Lake, UT","Wilmington, DE","NA, NA","Salt Lake","UT","Wilmington","DE",NA,NA,NA,3148,"sn86069620",-111.891047,  40.760779, -75.54839,  39.74466,NA,NA
"482", 9567,"The Maui news ","Wailuku, Hawaii",-156.50483, 20.886943,"Wailuku","Hawaii","3/12/1904",1904, 3,12,"seq-1","https://articleextractor.org/pages/9567/hihouml_flame_ver01/sn82014689/1904/03/12/ed-1/seq-1/1","Springfield, OH","NA, NA","NA, NA","Springfield","OH",NA,NA,NA,NA,NA,3149,"sn82014689", -83.808817,  39.924227,NA,NA,NA,NA
"483", 9567,"The Maui news ","Wailuku, Hawaii",-156.50483, 20.886943,"Wailuku","Hawaii","3/12/1904",1904, 3,12,"seq-1","https://articleextractor.org/pages/9567/hihouml_flame_ver01/sn82014689/1904/03/12/ed-1/seq-1/1","Springfield, OH","NA, NA","NA, NA","Springfield","OH",NA,NA,NA,NA,NA,3150,"sn82014689", -83.808817,  39.924227,NA,NA,NA,NA
"484", 9568,"The citizen ","Berea, Kentucky", -84.29632, 37.568694,"Berea","Kentucky","2/13/1908",1908, 2,13,"seq-7","https://articleextractor.org/pages/9568/kyu_fleetwoodmac_ver01/sn85052076/1908/02/13/ed-1/seq-7/1","Delhi, LA","NA, NA","NA, NA","Delhi","LA",NA,NA,NA,NA,NA,3151,"sn85052076", -91.493174,  32.457642,NA,NA,NA,NA
"485", 9569,NA,"NA, Missouri", 101.75239, 20.924080,NA,"Missouri","7/8/1904",1904, 7, 8,"seq-2","https://articleextractor.org/pages/9569/mohi_eadweard_ver01/sn90061782/1904/07/08/ed-1/seq-2/1","Mojava, CA","Carsville, GA","NA, NA","Mojava","CA","Carsville","GA",NA,NA,NA,3152,"sn90061782",-118.170666,  35.047538, -83.23515,  34.36983,NA,NA
"486", 9569,NA,"NA, Missouri", 101.75239, 20.924080,NA,"Missouri","7/8/1904",1904, 7, 8,"seq-2","https://articleextractor.org/pages/9569/mohi_eadweard_ver01/sn90061782/1904/07/08/ed-1/seq-2/1","NA, NA","NA, NA","NA, NA",NA,NA,NA,NA,NA,NA,"duplicate",3152,"sn90061782",NA,NA,NA,NA,NA,NA
"487", 9569,NA,"NA, Missouri", 101.75239, 20.924080,NA,"Missouri","7/8/1904",1904, 7, 8,"seq-2","https://articleextractor.org/pages/9569/mohi_eadweard_ver01/sn90061782/1904/07/08/ed-1/seq-2/1","Mojava, CA","Carsville, GA","NA, NA","Mojava","CA","Carsville","GA",NA,NA,NA,3153,"sn90061782",-118.170666,  35.047538, -83.23515,  34.36983,NA,NA
"488", 9569,NA,"NA, Missouri", 101.75239, 20.924080,NA,"Missouri","7/8/1904",1904, 7, 8,"seq-2","https://articleextractor.org/pages/9569/mohi_eadweard_ver01/sn90061782/1904/07/08/ed-1/seq-2/1","NA, NA","NA, NA","NA, NA",NA,NA,NA,NA,NA,NA,"duplicate",3153,"sn90061782",NA,NA,NA,NA,NA,NA
"489", 9570,"The Guthrie daily leader ","Guthrie, Oklahoma", -97.42532, 35.878937,"Guthrie","Oklahoma","12/7/1893",1893,12, 7,"seq-2","https://articleextractor.org/pages/9570/okhi_ellis_ver01/sn86063952/1893/12/07/ed-1/seq-2/1","none, NONE","NA, NA","NA, NA","none","NONE",NA,NA,NA,NA,"A lynching happened but there was no city or state. No location.",3154,"sn86063952",NA,NA,NA,NA,NA,NA
"490", 9571,"Richmond dispatch ","Richmond, Virginia", -77.43605, 37.540725,"Richmond","Virginia","9/4/1901",1901, 9, 4,"seq-2","https://articleextractor.org/pages/9571/vi_etna_ver01/sn85038614/1901/09/04/ed-1/seq-2/1","none, NONE","NA, NA","NA, NA","none","NONE",NA,NA,NA,NA,"no lynching",3155,"sn85038614",NA,NA,NA,NA,NA,NA
"491", 9572,"The Muskogee cimeter ","Muskogee, Oklahoma", -95.36969, 35.747877,"Muskogee","Oklahoma","12/13/1907",1907,12,13,"seq-2","https://articleextractor.org/pages/9572/okhi_beaver_ver01/sn83025060/1907/12/13/ed-1/seq-2/1","Osage, NONE","NA, NA","NA, NA","Osage","NONE",NA,NA,NA,NA,NA,3156,"sn83025060",NA,NA,NA,NA,NA,NA
"492", 9573,"The Lamar register ","Lamar, Colorado",-102.62075, 38.087231,"Lamar","Colorado","7/29/1903",1903, 7,29,"seq-4","https://articleextractor.org/pages/9573/cohi_bailey_ver02/sn86063147/1903/07/29/ed-1/seq-4/1","none, MO","NA, NA","NA, NA","none","MO",NA,NA,NA,NA,NA,3157,"sn86063147", -91.831833,  37.964253,NA,NA,NA,NA
"493", 9575,"Evening bulletin ","Honolulu , Hawaii",-157.85814, 21.309884,"Honolulu ","Hawaii","10/9/1905",1905,10, 9,"seq-2","https://articleextractor.org/pages/9575/hihouml_hawk_ver01/sn82016413/1905/10/09/ed-1/seq-2/1","Bainbridge, GA","NA, NA","NA, NA","Bainbridge","GA",NA,NA,NA,NA,NA,3158,"sn82016413", -84.575470,  30.903800,NA,NA,NA,NA
"494", 9576,"Waterbury evening Democrat ","Waterbury , Connecticut", -73.05150, 41.558152,"Waterbury ","Connecticut","2/1/1904",1904, 2, 1,"seq-5","https://articleextractor.org/pages/9576/ct_ironwood_ver01/sn93053726/1904/02/01/ed-1/seq-5/1","Roanoke, VA","NA, NA","NA, NA","Roanoke","VA",NA,NA,NA,NA,NA,3159,"sn93053726", -79.941427,  37.270970,NA,NA,NA,NA
"495", 9577,"The Birmingham age-herald ","Birmingham, Alabama", -86.81036, 33.518589,"Birmingham","Alabama","11/16/1905",1905,11,16,"seq-1","https://articleextractor.org/pages/9577/au_davis_ver01/sn85038485/1905/11/16/ed-1/seq-1/1","Springfield, OH","NA, NA","NA, NA","Springfield","OH",NA,NA,NA,NA,NA,3160,"sn85038485", -83.808817,  39.924227,NA,NA,NA,NA
"496", 9578,"The sun ","New York , New York", -74.00597, 40.712775,"New York ","New York","6/30/1905",1905, 6,30,"seq-3","https://articleextractor.org/pages/9578/nn_feyerabend_ver01/sn83030272/1905/06/30/ed-1/seq-3/1","Watkinsville, GA","NA, NA","NA, NA","Watkinsville","GA",NA,NA,NA,NA,NA,3161,"sn83030272", -83.408771,  33.862896,NA,NA,NA,NA
"497", 9579,"The evening bulletin ","Maysville, Kentucky", -83.74437, 38.641185,"Maysville","Kentucky","9/2/1893",1893, 9, 2,"seq-3","https://articleextractor.org/pages/9579/kyu_ishtar_ver01/sn87060190/1893/09/02/ed-1/seq-3/1","none, NONE","NA, NA","NA, NA","none","NONE",NA,NA,NA,NA,"no lynching coverage",3162,"sn87060190",NA,NA,NA,NA,NA,NA
"498", 9580,"Wheeling register ","Wheeling, West Virginia", -80.72092, 40.063962,"Wheeling","West Virginia","4/20/1893",1893, 4,20,"seq-4","https://articleextractor.org/pages/9580/wvu_holt_ver01/sn86092518/1893/04/20/ed-1/seq-4/1","Morrilltown, AR","NA, NA","NA, NA","Morrilltown","AR",NA,NA,NA,NA,NA,3163,"sn86092518", -92.743784,  35.152616,NA,NA,NA,NA
"499", 9580,"Wheeling register ","Wheeling, West Virginia", -80.72092, 40.063962,"Wheeling","West Virginia","4/20/1893",1893, 4,20,"seq-4","https://articleextractor.org/pages/9580/wvu_holt_ver01/sn86092518/1893/04/20/ed-1/seq-4/1","NA, NA","NA, NA","NA, NA",NA,NA,NA,NA,NA,NA,"duplicate",3163,"sn86092518",NA,NA,NA,NA,NA,NA
"500", 9580,"Wheeling register ","Wheeling, West Virginia", -80.72092, 40.063962,"Wheeling","West Virginia","4/20/1893",1893, 4,20,"seq-4","https://articleextractor.org/pages/9580/wvu_holt_ver01/sn86092518/1893/04/20/ed-1/seq-4/1","Morrilltown, AR","NA, NA","NA, NA","Morrilltown","AR",NA,NA,NA,NA,NA,3164,"sn86092518", -92.743784,  35.152616,NA,NA,NA,NA
"501", 9580,"Wheeling register ","Wheeling, West Virginia", -80.72092, 40.063962,"Wheeling","West Virginia","4/20/1893",1893, 4,20,"seq-4","https://articleextractor.org/pages/9580/wvu_holt_ver01/sn86092518/1893/04/20/ed-1/seq-4/1","NA, NA","NA, NA","NA, NA",NA,NA,NA,NA,NA,NA,"duplicate",3164,"sn86092518",NA,NA,NA,NA,NA,NA
"502", 9581,NA,"NA, South Dakota", -99.90181, 43.969515,NA,"South Dakota","8/10/1905",1905, 8,10,"seq-2","https://articleextractor.org/pages/9581/sdhi_interceptor_ver01/sn98062890/1905/08/10/ed-1/seq-2/1","Hattisburg, MI","NA, NA","NA, NA","Hattisburg","MI",NA,NA,NA,NA,NA,3165,"sn98062890", -89.290339,  31.327119,NA,NA,NA,NA
"503", 9582,"The Stark County Democrat ","Canton, Ohio", -81.37845, 40.798947,"Canton","Ohio","3/30/1893",1893, 3,30,"seq-5","https://articleextractor.org/pages/9582/ohi_golf_ver04/sn84028490/1893/03/30/ed-1/seq-5/1","Jackson, MI","NA, NA","NA, NA","Jackson","MI",NA,NA,NA,NA,NA,3166,"sn84028490", -84.401346,  42.245869,NA,NA,NA,NA
"504", 9585,"The Wichita daily eagle ","Wichita, Kansas", -97.33005, 37.687176,"Wichita","Kansas","3/22/1904",1904, 3,22,"seq-4","https://articleextractor.org/pages/9585/khi_landon_ver01/sn82014635/1904/03/22/ed-1/seq-4/1","none, NONE","NA, NA","NA, NA","none","NONE",NA,NA,NA,NA,"no lynching reported.",3168,"sn82014635",NA,NA,NA,NA,NA,NA
"505", 9586,"The news & observer ","Raleigh, North Carolina", -78.63818, 35.779590,"Raleigh","North Carolina","10/29/1903",1903,10,29,"seq-2","https://articleextractor.org/pages/9586/ncu_hamm_ver01/sn85042104/1903/10/29/ed-1/seq-2/1","none, NONE","NA, NA","NA, NA","none","NONE",NA,NA,NA,NA,"coverage in Mexico",3169,"sn85042104",NA,NA,NA,NA,NA,NA
"506", 9588,"Richmond planet ","Richmond, Virginia", -77.43605, 37.540725,"Richmond","Virginia","1/3/1920",1920, 1, 3,"seq-10","https://articleextractor.org/pages/9588/vi_lauren_ver02/sn84025841/1920/01/03/ed-1/seq-10/1","Louise, MS","NA, NA","NA, NA","Louise","MS",NA,NA,NA,NA,NA,3170,"sn84025841", -90.588705,  32.982351,NA,NA,NA,NA
"507", 9590,"The Durham recorder ","Durham, North Carolina", -78.89862, 35.994033,"Durham","North Carolina","10/16/1908",1908,10,16,"seq-2","https://articleextractor.org/pages/9590/ncu_hawk_ver02/sn84020731/1908/10/16/ed-1/seq-2/1","none, NONE","NA, NA","NA, NA","none","NONE",NA,NA,NA,NA,"no reported lynching.",3171,"sn84020731",NA,NA,NA,NA,NA,NA
"508", 9591,"The Brunswick news ","Brunswick, Georgia", -81.48782, 31.151092,"Brunswick","Georgia","11/25/1920",1920,11,25,"seq-1","https://articleextractor.org/pages/9591/gu_marple_ver01/sn90052143/1920/11/25/ed-1/seq-1/1","DeWitt, GA","NA, NA","NA, NA","DeWitt","GA",NA,NA,NA,NA,NA,3172,"sn90052143", -84.140000,  31.419722,NA,NA,NA,NA
"509", 9593,NA,"NA, Michigan", -85.60236, 44.314844,NA,"Michigan","11/16/1946",1946,11,16,"seq-16","https://articleextractor.org/pages/9593/mimtptc_albion_ver01/sn92063852/1946/11/16/ed-1/seq-16/1","none, NONE","NA, NA","NA, NA","none","NONE",NA,NA,NA,NA,"lynch law",3173,"sn92063852",NA,NA,NA,NA,NA,NA
"510", 9594,"The daily worker ","Chicago, Illinois", -87.62980, 41.878114,"Chicago","Illinois","9/26/1933",1933, 9,26,"seq-6","https://articleextractor.org/pages/9594/iune_fluorite_ver01/sn84020097/1933/09/26/ed-1/seq-6/1","none, NONE","NA, NA","NA, NA","none","NONE",NA,NA,NA,NA,"no lynching reported.",3174,"sn84020097",NA,NA,NA,NA,NA,NA
"511", 9596,NA,"NA, Virginia", -57.59659,-25.309101,NA,"Virginia","5/30/1917",1917, 5,30,"seq-2","https://articleextractor.org/pages/9596/vi_noriker_ver01/sn90052005/1917/05/30/ed-1/seq-2/1","no lynching reported, NA","NA, NA","NA, NA","no lynching reported",NA,NA,NA,NA,NA,NA,3175,"sn90052005",NA,NA,NA,NA,NA,NA
"512", 9597,"The Wheeling intelligencer ","Wheeling, West Virginia", -80.72092, 40.063962,"Wheeling","West Virginia","7/19/1922",1922, 7,19,"seq-1","https://articleextractor.org/pages/9597/wvu_klingon_ver01/sn86092536/1922/07/19/ed-1/seq-1/1","Orlando, FL","NA, NA","NA, NA","Orlando","FL",NA,NA,NA,NA,NA,3176,"sn86092536", -81.378927,  28.538383,NA,NA,NA,NA
"513", 9599,"The Indianapolis journal ","Indianapolis , Indiana", -86.15807, 39.768403,"Indianapolis ","Indiana","1/21/1886",1886, 1,21,"seq-5","https://articleextractor.org/pages/9599/in_asimov_ver02/sn82015679/1886/01/21/ed-1/seq-5/1","Greene County, IL","NA, NA","NA, NA","Greene County","IL",NA,NA,NA,NA,NA,3177,"sn82015679", -90.374835,  39.402986,NA,NA,NA,NA
"514", 9600,"The Bossier banner ","Bellevue, Louisiana", -93.52212, 32.673202,"Bellevue","Louisiana","4/29/1909",1909, 4,29,"seq-2","https://articleextractor.org/pages/9600/lu_ninetails_ver01/sn85034235/1909/04/29/ed-1/seq-2/1","Birmingham, AL","NA, NA","NA, NA","Birmingham","AL",NA,NA,NA,NA,NA,3178,"sn85034235", -86.810357,  33.518589,NA,NA,NA,NA
"515", 9601,NA,"NA, Mississippi", -89.39853, 32.354668,NA,"Mississippi","9/1/1909",1909, 9, 1,"seq-4","https://articleextractor.org/pages/9601/msar_gabardine_ver01/sn87065167/1909/09/01/ed-1/seq-4/1","Monroe, LA","NA, NA","NA, NA","Monroe","LA",NA,NA,NA,NA,NA,3179,"sn87065167", -92.119301,  32.509311,NA,NA,NA,NA
"516", 9602,NA,"NA, Illinois", -89.39853, 40.633125,NA,"Illinois","4/19/1909",1909, 4,19,"seq-1","https://articleextractor.org/pages/9602/iune_heraldry_ver01/sn92053934/1909/04/19/ed-1/seq-1/1","Ada, OK","NA, NA","NA, NA","Ada","OK",NA,NA,NA,NA,NA,3180,"sn92053934", -96.678345,  34.774531,NA,NA,NA,NA
"517", 9604,"The Salt Lake herald-Republican ","Salt Lake City, Utah",-111.89105, 40.760779,"Salt Lake City","Utah","11/26/1909",1909,11,26,"seq-1","https://articleextractor.org/pages/9604/uuml_seven_ver01/sn85058140/1909/11/26/ed-1/seq-1/1","Meridian, MS","NA, NA","NA, NA","Meridian","MS",NA,NA,NA,NA,NA,3181,"sn85058140", -88.703656,  32.364310,NA,NA,NA,NA
"518", 9609,"The Kadoka press ","Kadoka, South Dakota",-101.50987, 43.833882,"Kadoka","South Dakota","6/10/1910",1910, 6,10,"seq-6","https://articleextractor.org/pages/9609/sdhi_honeydew_ver01/sn88063157/1910/06/10/ed-1/seq-6/1","Illinois City, IL","NA, NA","NA, NA","Illinois City","IL",NA,NA,NA,NA,NA,3182,"sn88063157", -90.899691,  41.397323,NA,NA,NA,NA
"519", 9610,"The daily worker ","Chicago, Illinois", -87.62980, 41.878114,"Chicago","Illinois","4/20/1931",1931, 4,20,"seq-2","https://articleextractor.org/pages/9610/iune_fluorite_ver01/sn84020097/1931/04/20/ed-1/seq-2/1","none, AL","NA, NA","NA, NA","none","AL",NA,NA,NA,NA,NA,3183,"sn84020097",NA,NA,NA,NA,NA,NA
"520", 9613,NA,"NA, Maryland", -76.64127, 39.045755,NA,"Maryland","4/14/1910",1910, 4,14,"seq-5","https://articleextractor.org/pages/9613/mdu_jacobsen_ver01/sn88065731/1910/04/14/ed-1/seq-5/1","Meridian, MS","NA, NA","NA, NA","Meridian","MS",NA,NA,NA,NA,NA,3184,"sn88065731", -88.703656,  32.364310,NA,NA,NA,NA
"521", 9615,NA,"NA, Maryland", -76.64127, 39.045755,NA,"Maryland","12/11/1931",1931,12,11,"seq-4","https://articleextractor.org/pages/9615/mdu_cumberland_ver01/sn89060136/1931/12/11/ed-1/seq-4/1","Salisbury, MD","Anne Arundel County, MD","NA, NA","Salisbury","MD","Anne Arundel County","MD",NA,NA,NA,3185,"sn89060136", -75.599369,  38.360674, -76.54882,  38.95301,NA,NA
"522", 9616,"Tonopah daily bonanza ","Tonopah, Nevada",-117.23059, 38.069211,"Tonopah","Nevada","3/22/1910",1910, 3,22,"seq-3","https://articleextractor.org/pages/9616/nvln_aurora_ver02/sn86076142/1910/03/22/ed-1/seq-3/1","Marion, AR","NA, NA","NA, NA","Marion","AR",NA,NA,NA,NA,NA,3186,"sn86076142", -90.197219,  35.214437,NA,NA,NA,NA
"523", 9617,"The Hartford herald ","Hartford, Kentucky", -86.90916, 37.451159,"Hartford","Kentucky","10/8/1913",1913,10, 8,"seq-3","https://articleextractor.org/pages/9617/kyu_fernico_ver01/sn84037890/1913/10/08/ed-1/seq-3/1","none, SC","NA, NA","NA, NA","none","SC",NA,NA,NA,NA,"attempted lynching",3187,"sn84037890", -81.163725,  33.836081,NA,NA,NA,NA
"524", 9618,"Alexandria gazette ","Alexandria, District of Columbia", -77.04692, 38.804836,"Alexandria","District of Columbia","6/20/1913",1913, 6,20,"seq-5","https://articleextractor.org/pages/9618/vi_isogawa_ver01/sn85025007/1913/06/20/ed-1/seq-5/1","Hot Spring, AR","NA, NA","NA, NA","Hot Spring","AR",NA,NA,NA,NA,NA,3188,"sn85025007", -93.054600,  34.507762,NA,NA,NA,NA
"525", 9620,NA,"NA, Mississippi", -89.39853, 32.354668,NA,"Mississippi","5/17/1913",1913, 5,17,"seq-5","https://articleextractor.org/pages/9620/msar_hemp_ver01/sn87065167/1913/05/17/ed-1/seq-5/1","Fort Worth, TX","NA, NA","NA, NA","Fort Worth","TX",NA,NA,NA,NA,NA,3189,"sn87065167", -97.330766,  32.755488,NA,NA,NA,NA
"526", 9622,NA,"NA, South Dakota", -99.90181, 43.969515,NA,"South Dakota","7/21/1910",1910, 7,21,"seq-2","https://articleextractor.org/pages/9622/sdhi_interceptor_ver01/sn98062890/1910/07/21/ed-1/seq-2/1","Newark, OH","NA, NA","NA, NA","Newark","OH",NA,NA,NA,NA,NA,3190,"sn98062890", -82.401264,  40.058121,NA,NA,NA,NA
"527", 9624,NA,"NA, Mississippi", -89.39853, 32.354668,NA,"Mississippi","3/22/1912",1912, 3,22,"seq-1","https://articleextractor.org/pages/9624/msar_hemp_ver01/sn87065167/1912/03/22/ed-1/seq-1/1","Cochran, GA","NA, NA","NA, NA","Cochran","GA",NA,NA,NA,NA,"The Hattiesburg News",3191,"sn87065167", -83.354610,  32.386828,NA,NA,NA,NA
"528", 9625,"Santa Fe new Mexican ","Santa Fe, New Mexico",-105.93780, 35.686975,"Santa Fe","New Mexico","8/1/1912",1912, 8, 1,"seq-6","https://articleextractor.org/pages/9625/nmu_irving_ver01/sn84020630/1912/08/01/ed-1/seq-6/1","Dawson, GA","NA, NA","NA, NA","Dawson","GA",NA,NA,NA,NA,NA,3192,"sn84020630", -84.446583,  31.773500,NA,NA,NA,NA
"529", 9626,"The Birmingham age-herald ","Birmingham, Alabama", -86.81036, 33.518589,"Birmingham","Alabama","9/8/1912",1912, 9, 8,"seq-10","https://articleextractor.org/pages/9626/au_huie_ver01/sn85038485/1912/09/08/ed-1/seq-10/1","Princeton, WV","NA, NA","NA, NA","Princeton","WV",NA,NA,NA,NA,NA,3193,"sn85038485", -81.102592,  37.366229,NA,NA,NA,NA
"530", 9627,"Bismarck daily tribune ","Bismarck, North Dakota",-100.78769, 46.805495,"Bismarck","North Dakota","10/22/1916",1916,10,22,"seq-2","https://articleextractor.org/pages/9627/ndhi_fargo_ver01/sn85042242/1916/10/22/ed-1/seq-2/1","Joplin, MO","NA, NA","NA, NA","Joplin","MO",NA,NA,NA,NA,NA,3194,"sn85042242", -94.513281,  37.084227,NA,NA,NA,NA
"531", 9628,"The Washington times ","Washington , District of Columbia", -77.03687, 38.907192,"Washington ","District of Columbia","8/19/1908",1908, 8,19,"seq-1","https://articleextractor.org/pages/9628/dlc_tango_ver01/sn84026749/1908/08/19/ed-1/seq-1/1","Glendale, WA","NA, NA","NA, NA","Glendale","WA",NA,NA,NA,NA,NA,3195,"sn84026749",-122.358472,  47.939539,NA,NA,NA,NA
"532", 9629,NA,"NA, South Dakota", -99.90181, 43.969515,NA,"South Dakota","8/16/1907",1907, 8,16,"seq-2","https://articleextractor.org/pages/9629/sdhi_kangaroo_ver01/sn99062049/1907/08/16/ed-1/seq-2/1","none, NY","NA, NA","NA, NA","none","NY",NA,NA,NA,NA,"attempted lynching",3196,"sn99062049", -74.005973,  40.712775,NA,NA,NA,NA
"533", 9631,NA,"NA, Nebraska", -99.90181, 41.492537,NA,"Nebraska","1/22/1908",1908, 1,22,"seq-9","https://articleextractor.org/pages/9631/nbu_pound_ver01/sn99021999/1908/01/22/ed-1/seq-9/1","Dothan, AL","NA, NA","NA, NA","Dothan","AL",NA,NA,NA,NA,NA,3197,"sn99021999", -85.390489,  31.223231,NA,NA,NA,NA
"534", 9632,NA,"NA, Nebraska", -99.90181, 41.492537,NA,"Nebraska","4/12/1907",1907, 4,12,"seq-6","https://articleextractor.org/pages/9632/nbu_harrison_ver01/2010270508/1907/04/12/ed-1/seq-6/1","Nehama, NE","NA, NA","NA, NA","Nehama","NE",NA,NA,NA,NA,NA,3198,"2010270508", -99.901813,  41.492537,NA,NA,NA,NA
"535", 9633,"The Montgomery advertiser ","Montgomery, Alabama", -86.30774, 32.379223,"Montgomery","Alabama","6/24/1907",1907, 6,24,"seq-8","https://articleextractor.org/pages/9633/au_ingram_ver01/sn84020645/1907/06/24/ed-1/seq-8/1","none, NONE","NA, NA","NA, NA","none","NONE",NA,NA,NA,NA,"no reported lynching.",3199,"sn84020645",NA,NA,NA,NA,NA,NA
"536", 9634,"The morning news ","Savannah, Georgia", -81.09120, 32.080899,"Savannah","Georgia","11/6/1893",1893,11, 6,"seq-8","https://articleextractor.org/pages/9634/gu_drew_ver02/sn86063034/1893/11/06/ed-1/seq-8/1","none, NONE","NA, NA","NA, NA","none","NONE",NA,NA,NA,NA,"lynching sermon",3200,"sn86063034",NA,NA,NA,NA,NA,NA
"537", 9635,"Americus times-recorder ","Americus, Georgia", -84.23269, 32.072386,"Americus","Georgia","1/22/1907",1907, 1,22,"seq-1","https://articleextractor.org/pages/9635/gu_ara_ver01/sn89053204/1907/01/22/ed-1/seq-1/1","Chattanooga, TN","NA, NA","NA, NA","Chattanooga","TN",NA,NA,NA,NA,NA,3201,"sn89053204", -85.309399,  35.045798,NA,NA,NA,NA
"538", 9638,"The Hope pioneer ","Hope, North Dakota", -97.72232, 47.322210,"Hope","North Dakota","3/12/1908",1908, 3,12,"seq-1","https://articleextractor.org/pages/9638/ndhi_loma_ver01/sn87096037/1908/03/12/ed-1/seq-1/1","Hawkinsville, GA","NA, NA","NA, NA","Hawkinsville","GA",NA,NA,NA,NA,NA,3202,"sn87096037", -83.472118,  32.283773,NA,NA,NA,NA
"539", 9640,"Carson City daily appeal ","Carson City, Nevada",-119.76740, 39.163798,"Carson City","Nevada","7/30/1908",1908, 7,30,"seq-1","https://articleextractor.org/pages/9640/nvln_idlewild_ver01/sn86076241/1908/07/30/ed-1/seq-1/2","Skidoo, NONE","NA, NA","NA, NA","Skidoo","NONE",NA,NA,NA,NA,NA,3203,"sn86076241",NA,NA,NA,NA,NA,NA
"540", 9640,"Carson City daily appeal ","Carson City, Nevada",-119.76740, 39.163798,"Carson City","Nevada","7/30/1908",1908, 7,30,"seq-1","https://articleextractor.org/pages/9640/nvln_idlewild_ver01/sn86076241/1908/07/30/ed-1/seq-1/2","none, NONE","NA, NA","NA, NA","none","NONE",NA,NA,NA,NA,"no lynching reported.",3203,"sn86076241",NA,NA,NA,NA,NA,NA
"541", 9640,"Carson City daily appeal ","Carson City, Nevada",-119.76740, 39.163798,"Carson City","Nevada","7/30/1908",1908, 7,30,"seq-1","https://articleextractor.org/pages/9640/nvln_idlewild_ver01/sn86076241/1908/07/30/ed-1/seq-1/2","Skidoo, NONE","NA, NA","NA, NA","Skidoo","NONE",NA,NA,NA,NA,NA,3204,"sn86076241",NA,NA,NA,NA,NA,NA
"542", 9640,"Carson City daily appeal ","Carson City, Nevada",-119.76740, 39.163798,"Carson City","Nevada","7/30/1908",1908, 7,30,"seq-1","https://articleextractor.org/pages/9640/nvln_idlewild_ver01/sn86076241/1908/07/30/ed-1/seq-1/2","none, NONE","NA, NA","NA, NA","none","NONE",NA,NA,NA,NA,"no lynching reported.",3204,"sn86076241",NA,NA,NA,NA,NA,NA
"543", 9643,"The Utah County Democrat ","Provo City, Utah",-111.65853, 40.233844,"Provo City","Utah","9/10/1908",1908, 9,10,"seq-4","https://articleextractor.org/pages/9643/uuml_dewaele_ver01/sn86091039/1908/09/10/ed-1/seq-4/1","Oxford, MS","Des Moines, IA","NA, NA","Oxford","MS","Des Moines","IA",NA,NA,NA,3205,"sn86091039", -89.518825,  34.365987, -93.62496,  41.58684,NA,NA
"544", 9643,"The Utah County Democrat ","Provo City, Utah",-111.65853, 40.233844,"Provo City","Utah","9/10/1908",1908, 9,10,"seq-4","https://articleextractor.org/pages/9643/uuml_dewaele_ver01/sn86091039/1908/09/10/ed-1/seq-4/1","none, NONE","NA, NA","NA, NA","none","NONE",NA,NA,NA,NA,"duplicate",3205,"sn86091039",NA,NA,NA,NA,NA,NA
"545", 9643,"The Utah County Democrat ","Provo City, Utah",-111.65853, 40.233844,"Provo City","Utah","9/10/1908",1908, 9,10,"seq-4","https://articleextractor.org/pages/9643/uuml_dewaele_ver01/sn86091039/1908/09/10/ed-1/seq-4/1","Oxford, MS","Des Moines, IA","NA, NA","Oxford","MS","Des Moines","IA",NA,NA,NA,3206,"sn86091039", -89.518825,  34.365987, -93.62496,  41.58684,NA,NA
"546", 9643,"The Utah County Democrat ","Provo City, Utah",-111.65853, 40.233844,"Provo City","Utah","9/10/1908",1908, 9,10,"seq-4","https://articleextractor.org/pages/9643/uuml_dewaele_ver01/sn86091039/1908/09/10/ed-1/seq-4/1","none, NONE","NA, NA","NA, NA","none","NONE",NA,NA,NA,NA,"duplicate",3206,"sn86091039",NA,NA,NA,NA,NA,NA
"547", 9644,"The Washington herald ","Washington, District of Columbia", -77.03687, 38.907192,"Washington","District of Columbia","7/21/1908",1908, 7,21,"seq-1","https://articleextractor.org/pages/9644/dlc_india_ver01/sn83045433/1908/07/21/ed-1/seq-1/1","none, LA","Jonesville, Catahoula Parish, LA","NA, NA","none","LA","Jonesville, Catahoula Parish","LA",NA,NA,NA,3207,"sn83045433",NA,NA, -91.81818,  31.62656,NA,NA
"548", 9645,"Deseret evening news ","Great Salt Lake, Utah",-112.47683, 41.115791,"Great Salt Lake","Utah","1/29/1906",1906, 1,29,"seq-1","https://articleextractor.org/pages/9645/uuml_ten_ver01/sn83045555/1906/01/29/ed-1/seq-1/1","Chicago, IL","NA, NA","NA, NA","Chicago","IL",NA,NA,NA,NA,"attempted lynching",3208,"sn83045555", -87.629798,  41.878114,NA,NA,NA,NA
"549", 9647,"New-York tribune ","New York , New York", -74.00597, 40.712775,"New York ","New York","11/11/1908",1908,11,11,"seq-10","https://articleextractor.org/pages/9647/dlc_haiti_ver01/sn83030214/1908/11/11/ed-1/seq-10/1","Biloxi, MS","NA, NA","NA, NA","Biloxi","MS",NA,NA,NA,NA,NA,3209,"sn83030214", -88.885308,  30.396032,NA,NA,NA,NA
"550", 9648,"The Seattle post-intelligencer ","Seattle, Washington",-122.33285, 47.606139,"Seattle","Washington","8/23/1893",1893, 8,23,"seq-2","https://articleextractor.org/pages/9648/wa_forks_ver01/sn83045604/1893/08/23/ed-1/seq-2/1","Greenwood, SC","NA, NA","NA, NA","Greenwood","SC",NA,NA,NA,NA,NA,3210,"sn83045604", -82.161788,  34.195400,NA,NA,NA,NA
"551", 9649,"Idaho County free press ","Grangeville, Idaho",-116.12237, 45.926552,"Grangeville","Idaho","4/14/1893",1893, 4,14,"seq-2","https://articleextractor.org/pages/9649/idhi_cornwell_ver02/sn86091100/1893/04/14/ed-1/seq-2/1","Charlottesville, WV","Gresham, VA","San Bernardino, CA","Charlottesville","WV","Gresham","VA","San Bernardino","CA",NA,3211,"sn86091100", -78.476678,  38.029306, -87.64382,  41.75330,-117.28977,  34.10834
"552", 9649,"Idaho County free press ","Grangeville, Idaho",-116.12237, 45.926552,"Grangeville","Idaho","4/14/1893",1893, 4,14,"seq-2","https://articleextractor.org/pages/9649/idhi_cornwell_ver02/sn86091100/1893/04/14/ed-1/seq-2/1","none, NONE","NA, NA","NA, NA","none","NONE",NA,NA,NA,NA,"duplicate",3211,"sn86091100",NA,NA,NA,NA,NA,NA
"553", 9649,"Idaho County free press ","Grangeville, Idaho",-116.12237, 45.926552,"Grangeville","Idaho","4/14/1893",1893, 4,14,"seq-2","https://articleextractor.org/pages/9649/idhi_cornwell_ver02/sn86091100/1893/04/14/ed-1/seq-2/1","none, NONE","NA, NA","NA, NA","none","NONE",NA,NA,NA,NA,"duplicate",3211,"sn86091100",NA,NA,NA,NA,NA,NA
"554", 9649,"Idaho County free press ","Grangeville, Idaho",-116.12237, 45.926552,"Grangeville","Idaho","4/14/1893",1893, 4,14,"seq-2","https://articleextractor.org/pages/9649/idhi_cornwell_ver02/sn86091100/1893/04/14/ed-1/seq-2/1","NA, NA","none, NONE","duplicate, NA",NA,NA,"none","NONE","duplicate",NA,NA,3211,"sn86091100",NA,NA,NA,NA,NA,NA
"555", 9649,"Idaho County free press ","Grangeville, Idaho",-116.12237, 45.926552,"Grangeville","Idaho","4/14/1893",1893, 4,14,"seq-2","https://articleextractor.org/pages/9649/idhi_cornwell_ver02/sn86091100/1893/04/14/ed-1/seq-2/1","Charlottesville, WV","Gresham, VA","San Bernardino, CA","Charlottesville","WV","Gresham","VA","San Bernardino","CA",NA,3212,"sn86091100", -78.476678,  38.029306, -87.64382,  41.75330,-117.28977,  34.10834
"556", 9649,"Idaho County free press ","Grangeville, Idaho",-116.12237, 45.926552,"Grangeville","Idaho","4/14/1893",1893, 4,14,"seq-2","https://articleextractor.org/pages/9649/idhi_cornwell_ver02/sn86091100/1893/04/14/ed-1/seq-2/1","none, NONE","NA, NA","NA, NA","none","NONE",NA,NA,NA,NA,"duplicate",3212,"sn86091100",NA,NA,NA,NA,NA,NA
"557", 9649,"Idaho County free press ","Grangeville, Idaho",-116.12237, 45.926552,"Grangeville","Idaho","4/14/1893",1893, 4,14,"seq-2","https://articleextractor.org/pages/9649/idhi_cornwell_ver02/sn86091100/1893/04/14/ed-1/seq-2/1","none, NONE","NA, NA","NA, NA","none","NONE",NA,NA,NA,NA,"duplicate",3212,"sn86091100",NA,NA,NA,NA,NA,NA
"558", 9649,"Idaho County free press ","Grangeville, Idaho",-116.12237, 45.926552,"Grangeville","Idaho","4/14/1893",1893, 4,14,"seq-2","https://articleextractor.org/pages/9649/idhi_cornwell_ver02/sn86091100/1893/04/14/ed-1/seq-2/1","NA, NA","none, NONE","duplicate, NA",NA,NA,"none","NONE","duplicate",NA,NA,3212,"sn86091100",NA,NA,NA,NA,NA,NA
"559", 9649,"Idaho County free press ","Grangeville, Idaho",-116.12237, 45.926552,"Grangeville","Idaho","4/14/1893",1893, 4,14,"seq-2","https://articleextractor.org/pages/9649/idhi_cornwell_ver02/sn86091100/1893/04/14/ed-1/seq-2/1","Charlottesville, WV","Gresham, VA","San Bernardino, CA","Charlottesville","WV","Gresham","VA","San Bernardino","CA",NA,3213,"sn86091100", -78.476678,  38.029306, -87.64382,  41.75330,-117.28977,  34.10834
"560", 9649,"Idaho County free press ","Grangeville, Idaho",-116.12237, 45.926552,"Grangeville","Idaho","4/14/1893",1893, 4,14,"seq-2","https://articleextractor.org/pages/9649/idhi_cornwell_ver02/sn86091100/1893/04/14/ed-1/seq-2/1","none, NONE","NA, NA","NA, NA","none","NONE",NA,NA,NA,NA,"duplicate",3213,"sn86091100",NA,NA,NA,NA,NA,NA
"561", 9649,"Idaho County free press ","Grangeville, Idaho",-116.12237, 45.926552,"Grangeville","Idaho","4/14/1893",1893, 4,14,"seq-2","https://articleextractor.org/pages/9649/idhi_cornwell_ver02/sn86091100/1893/04/14/ed-1/seq-2/1","none, NONE","NA, NA","NA, NA","none","NONE",NA,NA,NA,NA,"duplicate",3213,"sn86091100",NA,NA,NA,NA,NA,NA
"562", 9649,"Idaho County free press ","Grangeville, Idaho",-116.12237, 45.926552,"Grangeville","Idaho","4/14/1893",1893, 4,14,"seq-2","https://articleextractor.org/pages/9649/idhi_cornwell_ver02/sn86091100/1893/04/14/ed-1/seq-2/1","NA, NA","none, NONE","duplicate, NA",NA,NA,"none","NONE","duplicate",NA,NA,3213,"sn86091100",NA,NA,NA,NA,NA,NA
"563", 9649,"Idaho County free press ","Grangeville, Idaho",-116.12237, 45.926552,"Grangeville","Idaho","4/14/1893",1893, 4,14,"seq-2","https://articleextractor.org/pages/9649/idhi_cornwell_ver02/sn86091100/1893/04/14/ed-1/seq-2/1","Charlottesville, WV","Gresham, VA","San Bernardino, CA","Charlottesville","WV","Gresham","VA","San Bernardino","CA",NA,3214,"sn86091100", -78.476678,  38.029306, -87.64382,  41.75330,-117.28977,  34.10834
"564", 9649,"Idaho County free press ","Grangeville, Idaho",-116.12237, 45.926552,"Grangeville","Idaho","4/14/1893",1893, 4,14,"seq-2","https://articleextractor.org/pages/9649/idhi_cornwell_ver02/sn86091100/1893/04/14/ed-1/seq-2/1","none, NONE","NA, NA","NA, NA","none","NONE",NA,NA,NA,NA,"duplicate",3214,"sn86091100",NA,NA,NA,NA,NA,NA
"565", 9649,"Idaho County free press ","Grangeville, Idaho",-116.12237, 45.926552,"Grangeville","Idaho","4/14/1893",1893, 4,14,"seq-2","https://articleextractor.org/pages/9649/idhi_cornwell_ver02/sn86091100/1893/04/14/ed-1/seq-2/1","none, NONE","NA, NA","NA, NA","none","NONE",NA,NA,NA,NA,"duplicate",3214,"sn86091100",NA,NA,NA,NA,NA,NA
"566", 9649,"Idaho County free press ","Grangeville, Idaho",-116.12237, 45.926552,"Grangeville","Idaho","4/14/1893",1893, 4,14,"seq-2","https://articleextractor.org/pages/9649/idhi_cornwell_ver02/sn86091100/1893/04/14/ed-1/seq-2/1","NA, NA","none, NONE","duplicate, NA",NA,NA,"none","NONE","duplicate",NA,NA,3214,"sn86091100",NA,NA,NA,NA,NA,NA
"567", 9651,NA,"NA, South Dakota", -99.90181, 43.969515,NA,"South Dakota","1/3/1907",1907, 1, 3,"seq-2","https://articleextractor.org/pages/9651/sdhi_interceptor_ver01/sn98062890/1907/01/03/ed-1/seq-2/1","Las Animas, CO","NA, NA","NA, NA","Las Animas","CO",NA,NA,NA,NA,NA,3215,"sn98062890",-103.222708,  38.066674,NA,NA,NA,NA
"568", 9651,NA,"NA, South Dakota", -99.90181, 43.969515,NA,"South Dakota","1/3/1907",1907, 1, 3,"seq-2","https://articleextractor.org/pages/9651/sdhi_interceptor_ver01/sn98062890/1907/01/03/ed-1/seq-2/1","none, NONE","NA, NA","NA, NA","none","NONE",NA,NA,NA,NA,"no lynching reported.",3215,"sn98062890",NA,NA,NA,NA,NA,NA
"569", 9651,NA,"NA, South Dakota", -99.90181, 43.969515,NA,"South Dakota","1/3/1907",1907, 1, 3,"seq-2","https://articleextractor.org/pages/9651/sdhi_interceptor_ver01/sn98062890/1907/01/03/ed-1/seq-2/1","Las Animas, CO","NA, NA","NA, NA","Las Animas","CO",NA,NA,NA,NA,NA,3216,"sn98062890",-103.222708,  38.066674,NA,NA,NA,NA
"570", 9651,NA,"NA, South Dakota", -99.90181, 43.969515,NA,"South Dakota","1/3/1907",1907, 1, 3,"seq-2","https://articleextractor.org/pages/9651/sdhi_interceptor_ver01/sn98062890/1907/01/03/ed-1/seq-2/1","none, NONE","NA, NA","NA, NA","none","NONE",NA,NA,NA,NA,"no lynching reported.",3216,"sn98062890",NA,NA,NA,NA,NA,NA
"571", 9652,NA,"NA, Missouri", 101.75239, 20.924080,NA,"Missouri","9/11/1908",1908, 9,11,"seq-2","https://articleextractor.org/pages/9652/mohi_flash_ver02/sn89066996/1908/09/11/ed-1/seq-2/1","Albany, GA","NA, NA","NA, NA","Albany","GA",NA,NA,NA,NA,NA,3217,"sn89066996", -84.155741,  31.578507,NA,NA,NA,NA
"572", 9712,"Wheeling register ","Wheeling, West Virginia", -80.72092, 40.063962,"Wheeling","West Virginia","6/22/1895",1895, 6,22,"seq-1","https://articleextractor.org/pages/9712/wvu_isner_ver01/sn86092518/1895/06/22/ed-1/seq-1/2","Jackson, Port Gibson, MS","NA, NA","NA, NA","Jackson, Port Gibson","MS",NA,NA,NA,NA,"The daughter of the lynched victim is being targeted for Lynching as well- police are attempting ""to prevent it""",3273,"sn86092518", -90.983696,  31.957901,NA,NA,NA,NA
"573", 9714,"The Red Cloud chief ","Red Cloud, Nebraska", -98.51959, 40.089005,"Red Cloud","Nebraska","8/16/1901",1901, 8,16,"seq-7","https://articleextractor.org/pages/9714/nbu_dunning_ver01/sn84022835/1901/08/16/ed-1/seq-7/2","Walnut Grove, IN","NA, NA","NA, NA","Walnut Grove","IN",NA,NA,NA,NA,"Walnut grove, upon my research, seems to be an unincorporated community in Indiana",3274,"sn84022835", -95.469658,  44.223069,NA,NA,NA,NA
"574", 9715,"Democratic Northwest and Henry County news ","Napoleon, Ohio", -84.12522, 41.392273,"Napoleon","Ohio","12/13/1894",1894,12,13,"seq-4","https://articleextractor.org/pages/9715/ohi_ingstad_ver01/sn84028297/1894/12/13/ed-1/seq-4/2","no specific town listed, FL","NA, NA","NA, NA","no specific town listed","FL",NA,NA,NA,NA,"no specific town or name of victim listed, just references it in short blurb",3275,"sn84028297", -81.515754,  27.664827,NA,NA,NA,NA
"575", 9717,"The Topeka state journal ","Topeka, Kansas", -95.67516, 39.047345,"Topeka","Kansas","8/2/1899",1899, 8, 2,"seq-3","https://articleextractor.org/pages/9717/khi_jesse_ver01/sn82016014/1899/08/02/ed-1/seq-3/2","Rochester, NY","NA, NA","NA, NA","Rochester","NY",NA,NA,NA,NA,"It was an attempted lynching, the mob was stopped and the man who was almost lynched was instead arrested",3276,"sn82016014", -77.608846,  43.156578,NA,NA,NA,NA
"576", 9718,"Great Falls tribune ","Great Falls, Montana",-111.30077, 47.505285,"Great Falls","Montana","12/13/1922",1922,12,13,"seq-1","https://articleextractor.org/pages/9718/mthi_crane_ver01/sn83045217/1922/12/13/ed-1/seq-1/2","Perry, FL","NA, NA","NA, NA","Perry","FL",NA,NA,NA,NA,"Two men were  lynched ""for the murder of a girl"" however, the article focuses on the lynching of the second man.",3277,"sn83045217", -83.582106,  30.111566,NA,NA,NA,NA
"577", 9719,"The Northwest enterprise ","Seattle, Washington",-122.33285, 47.606139,"Seattle","Washington","2/4/1932",1932, 2, 4,"seq-1","https://articleextractor.org/pages/9719/wa_canvasback_ver02/sn87093377/1932/02/04/ed-1/seq-1/2","n/a, NA","NA, NA","NA, NA","n/a",NA,NA,NA,NA,NA,"This article is discussing 39 being awarded for no lynchings being recorded in 1931, six states appeared on the honor roll for the first time. These six states included Maryland, Louisiana, Missouri, North Dakota, West Virginia and Tennessee. The article mentions that there were 57 attempted lynchings recorded in 1931.",3278,"sn87093377",NA,NA,NA,NA,NA,NA
"578", 9721,"River Falls journal ","River Falls, Wisconsin", -92.62381, 44.861356,"River Falls","Wisconsin","3/28/1912",1912, 3,28,"seq-2","https://articleextractor.org/pages/9721/whi_hegmeister_ver01/sn85033255/1912/03/28/ed-1/seq-2/2","Hawkinsville, GA","NA, NA","NA, NA","Hawkinsville","GA",NA,NA,NA,NA,"Lynched after being taken from police by the mob",3279,"sn85033255", -83.472118,  32.283773,NA,NA,NA,NA
"579", 9723,"Barbour County index ","Medicine Lodge, Kansas", -98.58036, 37.281134,"Medicine Lodge","Kansas","1/13/1909",1909, 1,13,"seq-6","https://articleextractor.org/pages/9723/khi_harvey_ver03/sn82015080/1909/01/13/ed-1/seq-6/2","Sabine county, TN","Russellville, KY","springfield, IL","Sabine county","TN","Russellville","KY","springfield","IL","nine people were shot and lynched in this location",3280,"sn82015080", -86.580447,  35.517491, -86.88722,  36.84532, -89.65015,  39.78172
"580", 9723,"Barbour County index ","Medicine Lodge, Kansas", -98.58036, 37.281134,"Medicine Lodge","Kansas","1/13/1909",1909, 1,13,"seq-6","https://articleextractor.org/pages/9723/khi_harvey_ver03/sn82015080/1909/01/13/ed-1/seq-6/2","Tiptonville, TN","Monticello, KY","NA, NA","Tiptonville","TN","Monticello","KY",NA,NA,"The fourth article for this paper I could not include in the first google form due to space. It has two separate lynching events listed, one in Kentucky and one in Tennessee, I put them in this form as one and two. The event in Tennessee lynched three, in Kentucky lynched one.",3280,"sn82015080", -89.472019,  36.378398, -84.84911,  36.82979,NA,NA
"581", 9723,"Barbour County index ","Medicine Lodge, Kansas", -98.58036, 37.281134,"Medicine Lodge","Kansas","1/13/1909",1909, 1,13,"seq-6","https://articleextractor.org/pages/9723/khi_harvey_ver03/sn82015080/1909/01/13/ed-1/seq-6/2","Sabine county, TN","Russellville, KY","springfield, IL","Sabine county","TN","Russellville","KY","springfield","IL","nine people were shot and lynched in this location",3281,"sn82015080", -86.580447,  35.517491, -86.88722,  36.84532, -89.65015,  39.78172
"582", 9723,"Barbour County index ","Medicine Lodge, Kansas", -98.58036, 37.281134,"Medicine Lodge","Kansas","1/13/1909",1909, 1,13,"seq-6","https://articleextractor.org/pages/9723/khi_harvey_ver03/sn82015080/1909/01/13/ed-1/seq-6/2","Tiptonville, TN","Monticello, KY","NA, NA","Tiptonville","TN","Monticello","KY",NA,NA,"The fourth article for this paper I could not include in the first google form due to space. It has two separate lynching events listed, one in Kentucky and one in Tennessee, I put them in this form as one and two. The event in Tennessee lynched three, in Kentucky lynched one.",3281,"sn82015080", -89.472019,  36.378398, -84.84911,  36.82979,NA,NA
"583", 9723,"Barbour County index ","Medicine Lodge, Kansas", -98.58036, 37.281134,"Medicine Lodge","Kansas","1/13/1909",1909, 1,13,"seq-6","https://articleextractor.org/pages/9723/khi_harvey_ver03/sn82015080/1909/01/13/ed-1/seq-6/2","Sabine county, TN","Russellville, KY","springfield, IL","Sabine county","TN","Russellville","KY","springfield","IL","nine people were shot and lynched in this location",3282,"sn82015080", -86.580447,  35.517491, -86.88722,  36.84532, -89.65015,  39.78172
"584", 9723,"Barbour County index ","Medicine Lodge, Kansas", -98.58036, 37.281134,"Medicine Lodge","Kansas","1/13/1909",1909, 1,13,"seq-6","https://articleextractor.org/pages/9723/khi_harvey_ver03/sn82015080/1909/01/13/ed-1/seq-6/2","Tiptonville, TN","Monticello, KY","NA, NA","Tiptonville","TN","Monticello","KY",NA,NA,"The fourth article for this paper I could not include in the first google form due to space. It has two separate lynching events listed, one in Kentucky and one in Tennessee, I put them in this form as one and two. The event in Tennessee lynched three, in Kentucky lynched one.",3282,"sn82015080", -89.472019,  36.378398, -84.84911,  36.82979,NA,NA
"585", 9723,"Barbour County index ","Medicine Lodge, Kansas", -98.58036, 37.281134,"Medicine Lodge","Kansas","1/13/1909",1909, 1,13,"seq-6","https://articleextractor.org/pages/9723/khi_harvey_ver03/sn82015080/1909/01/13/ed-1/seq-6/2","Sabine county, TN","Russellville, KY","springfield, IL","Sabine county","TN","Russellville","KY","springfield","IL","nine people were shot and lynched in this location",3283,"sn82015080", -86.580447,  35.517491, -86.88722,  36.84532, -89.65015,  39.78172
"586", 9723,"Barbour County index ","Medicine Lodge, Kansas", -98.58036, 37.281134,"Medicine Lodge","Kansas","1/13/1909",1909, 1,13,"seq-6","https://articleextractor.org/pages/9723/khi_harvey_ver03/sn82015080/1909/01/13/ed-1/seq-6/2","Tiptonville, TN","Monticello, KY","NA, NA","Tiptonville","TN","Monticello","KY",NA,NA,"The fourth article for this paper I could not include in the first google form due to space. It has two separate lynching events listed, one in Kentucky and one in Tennessee, I put them in this form as one and two. The event in Tennessee lynched three, in Kentucky lynched one.",3283,"sn82015080", -89.472019,  36.378398, -84.84911,  36.82979,NA,NA
"587", 9724,"The Birmingham age-herald ","Birmingham, Alabama", -86.81036, 33.518589,"Birmingham","Alabama","4/5/1912",1912, 4, 5,"seq-10","https://articleextractor.org/pages/9724/au_huie_ver01/sn85038485/1912/04/05/ed-1/seq-10/2","Elkton, KY","NA, NA","NA, NA","Elkton","KY",NA,NA,NA,NA,"The man did not get lynched but the article states that he ""probably evaded lynching during the night only through the pleading of George Robinson.."". The man was taken to the county jail.",3284,"sn85038485", -87.154167,  36.810043,NA,NA,NA,NA
"588", 9726,"The daily worker ","Chicago, Illinois", -87.62980, 41.878114,"Chicago","Illinois","2/8/1930",1930, 2, 8,"seq-2","https://articleextractor.org/pages/9726/iune_fluorite_ver01/sn84020097/1930/02/08/ed-1/seq-2/3","Winston- Salem, NC","NA, NA","NA, NA","Winston- Salem","NC",NA,NA,NA,NA,"NO LYNCHING occurred, this is an anti-lynch protest",3285,"sn84020097", -80.244216,  36.099860,NA,NA,NA,NA
"589", 9731,"The Daily Missoulian ","Missoula, Montana",-113.99403, 46.872128,"Missoula","Montana","4/23/1918",1918, 4,23,"seq-1","https://articleextractor.org/pages/9731/mthi_indigobunting_ver02/sn83025316/1918/04/23/ed-1/seq-1/2","Lexington, TN","NA, NA","NA, NA","Lexington","TN",NA,NA,NA,NA,"one man was lynched by a mob",3286,"sn83025316", -88.393380,  35.650903,NA,NA,NA,NA
"590", 9733,"Minneapolis spokesman ","Minneapolis, Minnesota", -93.26501, 44.977753,"Minneapolis","Minnesota","5/14/1943",1943, 5,14,"seq-2","https://articleextractor.org/pages/9733/mnhi_croquet_ver01/sn83025247/1943/05/14/ed-1/seq-2/2","NA, MS","NA, NA","NA, NA","NA","MS",NA,NA,NA,NA,"This article discusses the possible conviction of men who lynched a Black man almost a year ago (town not listed)",3287,"sn83025247",NA,NA,NA,NA,NA,NA
"591", 9733,"Minneapolis spokesman ","Minneapolis, Minnesota", -93.26501, 44.977753,"Minneapolis","Minnesota","5/14/1943",1943, 5,14,"seq-2","https://articleextractor.org/pages/9733/mnhi_croquet_ver01/sn83025247/1943/05/14/ed-1/seq-2/2","NA, MS","NA, NA","NA, NA","NA","MS",NA,NA,NA,NA,"This article discusses the possible conviction of men who lynched a Black man almost a year ago (town not listed)",3288,"sn83025247",NA,NA,NA,NA,NA,NA
"592", 9733,"Minneapolis spokesman ","Minneapolis, Minnesota", -93.26501, 44.977753,"Minneapolis","Minnesota","5/14/1943",1943, 5,14,"seq-2","https://articleextractor.org/pages/9733/mnhi_croquet_ver01/sn83025247/1943/05/14/ed-1/seq-2/2","NA, MS","NA, NA","NA, NA","NA","MS",NA,NA,NA,NA,"This article discusses the possible conviction of men who lynched a Black man almost a year ago (town not listed)",3289,"sn83025247",NA,NA,NA,NA,NA,NA
"593", 9734,"The Houston daily post ","Houston, Texas", -95.36980, 29.760427,"Houston","Texas","8/8/1902",1902, 8, 8,"seq-2","https://articleextractor.org/pages/9734/txdn_echo_ver03/sn86071197/1902/08/08/ed-1/seq-2/2","Homer, LA","NA, NA","NA, NA","Homer","LA",NA,NA,NA,NA,"A man was lynched for assault near Homer",3290,"sn86071197", -93.055718,  32.791813,NA,NA,NA,NA
"594", 9735,"The Washington times ","Washington , District of Columbia", -77.03687, 38.907192,"Washington ","District of Columbia","6/9/1903",1903, 6, 9,"seq-5","https://articleextractor.org/pages/9735/dlc_tango_ver01/sn84026749/1903/06/09/ed-1/seq-5/4","Belleville, IL","Fort Valley, near Macon, GA","NA, NA","Belleville","IL","Fort Valley, near Macon","GA",NA,NA,"The article is about the prosecution of the mob, however it references that the ""murderer"" was lynched. I believe in Belleville.",3291,"sn84026749", -89.983993,  38.520050, -83.88741,  32.55376,NA,NA
"595", 9735,"The Washington times ","Washington , District of Columbia", -77.03687, 38.907192,"Washington ","District of Columbia","6/9/1903",1903, 6, 9,"seq-5","https://articleextractor.org/pages/9735/dlc_tango_ver01/sn84026749/1903/06/09/ed-1/seq-5/4","Belleville, IL","Fort Valley, near Macon, GA","NA, NA","Belleville","IL","Fort Valley, near Macon","GA",NA,NA,"The article is about the prosecution of the mob, however it references that the ""murderer"" was lynched. I believe in Belleville.",3292,"sn84026749", -89.983993,  38.520050, -83.88741,  32.55376,NA,NA
"596", 9736,"The Montgomery advertiser ","Montgomery, Alabama", -86.30774, 32.379223,"Montgomery","Alabama","12/27/1902",1902,12,27,"seq-4","https://articleextractor.org/pages/9736/au_groom_ver01/sn84020645/1902/12/27/ed-1/seq-4/2","no lynching occurred, it is discourse about lynching, NA","NA, NA","NA, NA","no lynching occurred, it is discourse about lynching",NA,NA,NA,NA,NA,NA,3293,"sn84020645",NA,NA,NA,NA,NA,NA
"597", 9737,"Wood County reporter ","Grand Rapids , Wisconsin", -89.75677, 44.380134,"Grand Rapids ","Wisconsin","6/16/1903",1903, 6,16,"seq-3","https://articleextractor.org/pages/9737/whi_belle_ver01/sn85033078/1903/06/16/ed-1/seq-3/2","Belleville, IL","NA, NA","NA, NA","Belleville","IL",NA,NA,NA,NA,"This article discusses the lynching of Dave Wyatt, which was discussed in a previous article in this research ( the article in 9735).",3294,"sn85033078", -89.983993,  38.520050,NA,NA,NA,NA
"598", 9739,"The times dispatch ","Richmond, Virginia", -77.43605, 37.540725,"Richmond","Virginia","9/20/1903",1903, 9,20,"seq-20","https://articleextractor.org/pages/9739/vi_gualala_ver01/sn85038615/1903/09/20/ed-1/seq-20/2","Luxora, AR","NA, NA","NA, NA","Luxora","AR",NA,NA,NA,NA,"A black man (Hellem) was lynched by other black men over assault accusations",3295,"sn85038615", -89.928227,  35.755826,NA,NA,NA,NA
"599", 9741,"The Penn's Grove record ","Penn's Grove, New Jersey", -75.46797, 39.729558,"Penn's Grove","New Jersey","3/25/1904",1904, 3,25,"seq-1","https://articleextractor.org/pages/9741/njr_irene_ver02/sn85035524/1904/03/25/ed-1/seq-1/2","Montgomery, TX","NA, NA","NA, NA","Montgomery","TX",NA,NA,NA,NA,"John Maynard was lynched in Montgomery Texas",3296,"sn85035524", -95.696335,  30.388261,NA,NA,NA,NA
"600", 9744,NA,"NA, Colorado",-105.78207, 39.550051,NA,"Colorado","8/8/1903",1903, 8, 8,"seq-4","https://articleextractor.org/pages/9744/uuml_kirilenko_ver01/sn93062856/1903/08/08/ed-1/seq-4/2","N/A (does not say), NA","NA, NA","NA, NA","N/A (does not say)",NA,NA,NA,NA,NA,"Mentions that two or three lynchings occurred that week but does not say where or who. Says that two or three are likely to occur next week.",3297,"sn93062856",NA,NA,NA,NA,NA,NA
"601", 9745,"The Salt Lake herald ","Salt Lake City , Utah",-111.89105, 40.760779,"Salt Lake City ","Utah","12/27/1905",1905,12,27,"seq-5","https://articleextractor.org/pages/9745/uuml_four_ver01/sn85058130/1905/12/27/ed-1/seq-5/2","Butte, MT","NA, NA","NA, NA","Butte","MT",NA,NA,NA,NA,"NO LYNCHING OCCURRED (yet)- discussion of a possible lynching taking place is in the article",3298,"sn85058130",-112.534778,  46.003823,NA,NA,NA,NA
"602", 9746,NA,"NA, Mississippi", -89.39853, 32.354668,NA,"Mississippi","4/26/1894",1894, 4,26,"seq-2","https://articleextractor.org/pages/9746/msar_lapis_ver01/sn87065215/1894/04/26/ed-1/seq-2/2","Tuscumbia, AL","Meridian - NO LYNCHING OCCURED, attempted lynching, MS","NA, NA","Tuscumbia","AL","Meridian - NO LYNCHING OCCURED, attempted lynching","MS",NA,NA,"Three are lynched, Tom Black, John Williams, and Tony Johnston",3299,"sn87065215", -87.702530,  34.731200, -89.39853,  32.35467,NA,NA
"603", 9746,NA,"NA, Mississippi", -89.39853, 32.354668,NA,"Mississippi","4/26/1894",1894, 4,26,"seq-2","https://articleextractor.org/pages/9746/msar_lapis_ver01/sn87065215/1894/04/26/ed-1/seq-2/2","Tuscumbia, AL","Meridian - NO LYNCHING OCCURED, attempted lynching, MS","NA, NA","Tuscumbia","AL","Meridian - NO LYNCHING OCCURED, attempted lynching","MS",NA,NA,"Three are lynched, Tom Black, John Williams, and Tony Johnston",3300,"sn87065215", -87.702530,  34.731200, -89.39853,  32.35467,NA,NA
"604", 9747,NA,"NA, Mississippi", -89.39853, 32.354668,NA,"Mississippi","1/11/1905",1905, 1,11,"seq-10","https://articleextractor.org/pages/9747/msar_karakul_ver02/sn87065046/1905/01/11/ed-1/seq-10/2","Statesboro, GA","Buena Vista, AR","Tallulah Missisippi- Lousiana, LA","Statesboro","GA","Buena Vista","AR","Tallulah Missisippi- Lousiana","LA","For the multiple articles below, there are only two articles on the whole page, however, article 2 lists names and accused crimes of individuals under a section titled ""lynchings"", leaving me to infer that these are the names of several individuals lynched in different states. There is not enough room below, so I will list the rest here 


Sussex County-VA
White Springs Florida- FL
Dorchester County, SC
Doddsville Missisippi- MS
Cleveland, Missisippi-MS (X2)
Montgomery Texas- TX 
St.Charles- Arkansas- AR
Arlington Georgia- GA
Crooks Covial- Idaho 
La Grange Georgia- GA
Europa, Mississippi- MS
Cartersville Georgia- GA
Clayton Lousiana- LA
Cedartown Georgia- GA
Laramie Wyoming- WY
Hickman Kentucky- KY
Crossett Arkansas- AR",3301,"sn87065046", -81.783167,  32.448788, -92.95516,  33.48734, -91.11455,  32.77958
"605", 9749,NA,"NA, Maryland", -76.64127, 39.045755,NA,"Maryland","12/7/1906",1906,12, 7,"seq-2","https://articleextractor.org/pages/9749/mdu_belair_ver01/sn89060136/1906/12/07/ed-1/seq-2/2","- no lynching, just discourse, NA","no lynching- just discourse, NA","NA, NA","- no lynching, just discourse",NA,"no lynching- just discourse",NA,NA,NA,NA,3302,"sn89060136",NA,NA,NA,NA,NA,NA
"606", 9749,NA,"NA, Maryland", -76.64127, 39.045755,NA,"Maryland","12/7/1906",1906,12, 7,"seq-2","https://articleextractor.org/pages/9749/mdu_belair_ver01/sn89060136/1906/12/07/ed-1/seq-2/2","- no lynching, just discourse, NA","no lynching- just discourse, NA","NA, NA","- no lynching, just discourse",NA,"no lynching- just discourse",NA,NA,NA,NA,3303,"sn89060136",NA,NA,NA,NA,NA,NA
"607", 9758,"St. Paul daily globe ","Saint Paul, Minnesota", -93.08996, 44.953703,"Saint Paul","Minnesota","1/18/1889",1889, 1,18,"seq-1","https://articleextractor.org/pages/9758/mnhi_jeffers_ver01/sn90059522/1889/01/18/ed-1/seq-1/5","no lynching, NA","Moorhead  - NOTE: possible planned lynching, MN","NA, NA","no lynching",NA,"Moorhead  - NOTE: possible planned lynching","MN",NA,NA,"no lynching",3304,"sn90059522",NA,NA, -96.76780,  46.87376,NA,NA
"608", 9758,"St. Paul daily globe ","Saint Paul, Minnesota", -93.08996, 44.953703,"Saint Paul","Minnesota","1/18/1889",1889, 1,18,"seq-1","https://articleextractor.org/pages/9758/mnhi_jeffers_ver01/sn90059522/1889/01/18/ed-1/seq-1/5","no lynching, NA","Moorhead  - NOTE: possible planned lynching, MN","NA, NA","no lynching",NA,"Moorhead  - NOTE: possible planned lynching","MN",NA,NA,"no lynching",3305,"sn90059522",NA,NA, -96.76780,  46.87376,NA,NA
"609", 9760,"The evening times ","Washington, District of Columbia", -77.03687, 38.907192,"Washington","District of Columbia","1/25/1901",1901, 1,25,"seq-7","https://articleextractor.org/pages/9760/dlc_november_ver01/sn84024441/1901/01/25/ed-1/seq-7/2","Webster Parish, LA","NA, NA","NA, NA","Webster Parish","LA",NA,NA,NA,NA,"- In Webster Parish LA, does not say which exact city. This area is North Louisiana.",3306,"sn84024441", -93.338892,  32.764136,NA,NA,NA,NA
"610", 9761,"The Cecil Whig ","Elkton, Maryland", -75.83327, 39.606779,"Elkton","Maryland","5/16/1891",1891, 5,16,"seq-3","https://articleextractor.org/pages/9761/mdu_glass_ver02/sn83016348/1891/05/16/ed-1/seq-3/5","Queen Annes County (eastern shore), MD","Queen annes county, MD","NA, NA","Queen Annes County (eastern shore)","MD","Queen annes county","MD",NA,NA,NA,3307,"sn83016348", -76.131995,  39.026357, -76.13200,  39.02636,NA,NA
"611", 9761,"The Cecil Whig ","Elkton, Maryland", -75.83327, 39.606779,"Elkton","Maryland","5/16/1891",1891, 5,16,"seq-3","https://articleextractor.org/pages/9761/mdu_glass_ver02/sn83016348/1891/05/16/ed-1/seq-3/5","Queen annes county, MD","Queen Annes County, Centreville, MD","NA, NA","Queen annes county","MD","Queen Annes County, Centreville","MD",NA,NA,"two people lynched in Queen annes (above). *** The previous google form submitted, under 9761 was done incorrectly. I forgot to include the second article, which is below. These two lynchings above were in one article, the one below is seperate.",3307,"sn83016348", -76.131995,  39.026357, -76.06633,  39.04178,NA,NA
"612", 9761,"The Cecil Whig ","Elkton, Maryland", -75.83327, 39.606779,"Elkton","Maryland","5/16/1891",1891, 5,16,"seq-3","https://articleextractor.org/pages/9761/mdu_glass_ver02/sn83016348/1891/05/16/ed-1/seq-3/5","Queen Annes County (eastern shore), MD","Queen annes county, MD","NA, NA","Queen Annes County (eastern shore)","MD","Queen annes county","MD",NA,NA,NA,3308,"sn83016348", -76.131995,  39.026357, -76.13200,  39.02636,NA,NA
"613", 9761,"The Cecil Whig ","Elkton, Maryland", -75.83327, 39.606779,"Elkton","Maryland","5/16/1891",1891, 5,16,"seq-3","https://articleextractor.org/pages/9761/mdu_glass_ver02/sn83016348/1891/05/16/ed-1/seq-3/5","Queen annes county, MD","Queen Annes County, Centreville, MD","NA, NA","Queen annes county","MD","Queen Annes County, Centreville","MD",NA,NA,"two people lynched in Queen annes (above). *** The previous google form submitted, under 9761 was done incorrectly. I forgot to include the second article, which is below. These two lynchings above were in one article, the one below is seperate.",3308,"sn83016348", -76.131995,  39.026357, -76.06633,  39.04178,NA,NA
"614", 9765,"Iron County register ","Ironton, Missouri", -90.62734, 37.597272,"Ironton","Missouri","1/3/1907",1907, 1, 3,"seq-6","https://articleextractor.org/pages/9765/mohi_igoo_ver01/sn84024283/1907/01/03/ed-1/seq-6/2","Salisbury, NC","Salisbury, NC","NA, NA","Salisbury","NC","Salisbury","NC",NA,NA,"Three Black people lynched after being taken from jail. 

Note for below: 
This article (2) discusses the sentencing of a man involved in the lynching of three Black people in Salisbury NC. This article may be referring to the lynching mentioned in article 1.",3310,"sn84024283", -80.474226,  35.670973, -80.47423,  35.67097,NA,NA
"615", 9766,"St. Paul daily globe ","Saint Paul, Minnesota", -93.08996, 44.953703,"Saint Paul","Minnesota","11/28/1895",1895,11,28,"seq-4","https://articleextractor.org/pages/9766/mnhi_sebeka_ver01/sn90059522/1895/11/28/ed-1/seq-4/4","James County (now Hamilton County)- near White Oak Mountains, TN","NA, NA","NA, NA","James County (now Hamilton County)- near White Oak Mountains","TN",NA,NA,NA,NA,"White man lynched",3311,"sn90059522", -85.147936,  35.161897,NA,NA,NA,NA
"616", 9768,NA,"NA, Mississippi", -89.39853, 32.354668,NA,"Mississippi","8/17/1910",1910, 8,17,"seq-1","https://articleextractor.org/pages/9768/msar_gabardine_ver01/sn87065167/1910/08/17/ed-1/seq-1/2","Princeton (article says Prineton, I believe this is a tyop), WV","NA, NA","NA, NA","Princeton (article says Prineton, I believe this is a tyop)","WV",NA,NA,NA,NA,"Attempted lynching",3312,"sn87065167", -80.454903,  38.597626,NA,NA,NA,NA
"617", 9772,"The citizen ","Berea, Kentucky", -84.29632, 37.568694,"Berea","Kentucky","10/29/1903",1903,10,29,"seq-6","https://articleextractor.org/pages/9772/kyu_fleetwoodmac_ver01/sn85052076/1903/10/29/ed-1/seq-6/3","near Frankton, IN","Guanajato- MEXICO, NA","NA, NA","near Frankton","IN","Guanajato- MEXICO",NA,NA,NA,"NO lynching occurred, mob attempted to capture the man and lynch him but were unsuccessful.",3313,"sn85052076", -85.778867,  40.222817,-101.25736,  21.01901,NA,NA
"618", 9772,"The citizen ","Berea, Kentucky", -84.29632, 37.568694,"Berea","Kentucky","10/29/1903",1903,10,29,"seq-6","https://articleextractor.org/pages/9772/kyu_fleetwoodmac_ver01/sn85052076/1903/10/29/ed-1/seq-6/3","near Frankton, IN","Guanajato- MEXICO, NA","NA, NA","near Frankton","IN","Guanajato- MEXICO",NA,NA,NA,"NO lynching occurred, mob attempted to capture the man and lynch him but were unsuccessful.",3314,"sn85052076", -85.778867,  40.222817,-101.25736,  21.01901,NA,NA
"619", 9773,NA,"NA, New Jersey", -74.40566, 40.058324,NA,"New Jersey","10/22/1908",1908,10,22,"seq-8","https://articleextractor.org/pages/9773/njr_ketchup_ver01/sn87068192/1908/10/22/ed-1/seq-8/2","Walnut Log, Obion County, TN","no lynching occured, NA","NA, NA","Walnut Log, Obion County","TN","no lynching occured",NA,NA,NA,"Possibly two men lynched, only one found (hanging from tree after kidnapped by mob)",3315,"sn87068192", -89.315755,  36.468075,NA,NA,NA,NA
"620", 9773,NA,"NA, New Jersey", -74.40566, 40.058324,NA,"New Jersey","10/22/1908",1908,10,22,"seq-8","https://articleextractor.org/pages/9773/njr_ketchup_ver01/sn87068192/1908/10/22/ed-1/seq-8/2","Walnut Log, Obion County, TN","no lynching occured, NA","NA, NA","Walnut Log, Obion County","TN","no lynching occured",NA,NA,NA,"Possibly two men lynched, only one found (hanging from tree after kidnapped by mob)",3316,"sn87068192", -89.315755,  36.468075,NA,NA,NA,NA
"621", 9777,"The Dolores star ","Dolores, Colorado",-108.50454, 37.473882,"Dolores","Colorado","10/30/1908",1908,10,30,"seq-4","https://articleextractor.org/pages/9777/cohi_alta_ver01/sn86002159/1908/10/30/ed-1/seq-4/2","NA, NA","NA, NA","NA, NA",NA,NA,NA,NA,NA,NA,"NO lynching occurred specifically- discusses lynching as a whole in the US",3317,"sn86002159",NA,NA,NA,NA,NA,NA
"622", 9780,"The leader ","Brookhaven, Mississippi", -90.44065, 31.579059,"Brookhaven","Mississippi","1/19/1898",1898, 1,19,"seq-1","https://articleextractor.org/pages/9780/msar_agate_ver01/sn86074063/1898/01/19/ed-1/seq-1/2","no lynch occurred- discussion of lynchings, NA","NA, NA","NA, NA","no lynch occurred- discussion of lynchings",NA,NA,NA,NA,NA,NA,3318,"sn86074063",NA,NA,NA,NA,NA,NA
"623", 9784,"Norwich bulletin ","Norwich, Connecticut", -72.07591, 41.524265,"Norwich","Connecticut","5/28/1912",1912, 5,28,"seq-1","https://articleextractor.org/pages/9784/ct_danbury_ver01/sn82014086/1912/05/28/ed-1/seq-1/3","Nashville, TN","no lynching, NA","NA, NA","Nashville","TN","no lynching",NA,NA,NA,"Man was shot to death by a mob",3319,"sn82014086", -86.781602,  36.162664,NA,NA,NA,NA
"624", 9784,"Norwich bulletin ","Norwich, Connecticut", -72.07591, 41.524265,"Norwich","Connecticut","5/28/1912",1912, 5,28,"seq-1","https://articleextractor.org/pages/9784/ct_danbury_ver01/sn82014086/1912/05/28/ed-1/seq-1/3","Nashville, TN","no lynching, NA","NA, NA","Nashville","TN","no lynching",NA,NA,NA,"Man was shot to death by a mob",3320,"sn82014086", -86.781602,  36.162664,NA,NA,NA,NA
"625", 9786,"The Union times ","Union, South Carolina", -81.62371, 34.715412,"Union","South Carolina","10/12/1906",1906,10,12,"seq-4","https://articleextractor.org/pages/9786/scu_grandamericancoonhunt_ver01/sn93067853/1906/10/12/ed-1/seq-4/1","no lynching occurred, NA","NA, NA","NA, NA","no lynching occurred",NA,NA,NA,NA,NA,NA,3321,"sn93067853",NA,NA,NA,NA,NA,NA
"626", 9788,"The citizen ","Berea, Kentucky", -84.29632, 37.568694,"Berea","Kentucky","7/30/1908",1908, 7,30,"seq-2","https://articleextractor.org/pages/9788/kyu_fleetwoodmac_ver01/sn85052076/1908/07/30/ed-1/seq-2/1","no lynching, NA","NA, NA","NA, NA","no lynching",NA,NA,NA,NA,NA,NA,3322,"sn85052076",NA,NA,NA,NA,NA,NA
"627", 9789,NA,"NA, New Jersey", -74.40566, 40.058324,NA,"New Jersey","5/25/1907",1907, 5,25,"seq-7","https://articleextractor.org/pages/9789/njr_gandolfini_ver01/sn91064029/1907/05/25/ed-1/seq-7/1","Reidsville, GA","NA, NA","NA, NA","Reidsville","GA",NA,NA,NA,NA,"No exact state or city listed, used byline for state and city. two were lynched",3323,"sn91064029", -82.117898,  32.086861,NA,NA,NA,NA
"628", 9790,"The Jeffersonian ","Atlanta, Georgia", -84.38768, 33.748752,"Atlanta","Georgia","12/7/1916",1916,12, 7,"seq-1","https://articleextractor.org/pages/9790/gu_fornax_ver01/sn82014546/1916/12/07/ed-1/seq-1/1","no lynching occurred, NA","NA, NA","NA, NA","no lynching occurred",NA,NA,NA,NA,NA,"no lynching occurred",3324,"sn82014546",NA,NA,NA,NA,NA,NA
"629", 9791,NA,"NA, Mississippi", -89.39853, 32.354668,NA,"Mississippi","10/3/1916",1916,10, 3,"seq-6","https://articleextractor.org/pages/9791/msar_ikat_ver01/sn87065167/1916/10/03/ed-1/seq-6/1","Canton, MS","NA, NA","NA, NA","Canton","MS",NA,NA,NA,NA,"article states that suspect ""escaped probable lynching"" as a crowd formed to find him(or whoever killed the merchant) but police arrested him first",3325,"sn87065167", -90.036751,  32.612638,NA,NA,NA,NA
"630", 9796,NA,"NA, Nebraska", -99.90181, 41.492537,NA,"Nebraska","10/21/1911",1911,10,21,"seq-15","https://articleextractor.org/pages/9796/nbu_rosewater_ver01/sn99021999/1911/10/21/ed-1/seq-15/1","Manchester, GA","NA, NA","NA, NA","Manchester","GA",NA,NA,NA,NA,"Man lynched- taken by mob of thirty",3326,"sn99021999", -84.619925,  32.859854,NA,NA,NA,NA
"631", 9798,NA,"NA, Maryland", -76.64127, 39.045755,NA,"Maryland","10/11/1916",1916,10,11,"seq-3","https://articleextractor.org/pages/9798/mdu_jacobsen_ver01/sn88065731/1916/10/11/ed-1/seq-3/1","Dewitt, AR","NA, NA","NA, NA","Dewitt","AR",NA,NA,NA,NA,NA,3327,"sn88065731", -91.335128,  34.293215,NA,NA,NA,NA
"632", 9799,"The daily worker ","Chicago, Illinois", -87.62980, 41.878114,"Chicago","Illinois","11/29/1930",1930,11,29,"seq-6","https://articleextractor.org/pages/9799/iune_fluorite_ver01/sn84020097/1930/11/29/ed-1/seq-6/1","NA, NA","NA, NA","NA, NA",NA,NA,NA,NA,NA,NA,"no lynchings occurred in any of these articles",3328,"sn84020097",NA,NA,NA,NA,NA,NA
"633", 9799,"The daily worker ","Chicago, Illinois", -87.62980, 41.878114,"Chicago","Illinois","11/29/1930",1930,11,29,"seq-6","https://articleextractor.org/pages/9799/iune_fluorite_ver01/sn84020097/1930/11/29/ed-1/seq-6/1","NA, NA","NA, NA","NA, NA",NA,NA,NA,NA,NA,NA,"no lynchings occurred in any of these articles",3329,"sn84020097",NA,NA,NA,NA,NA,NA
"634", 9799,"The daily worker ","Chicago, Illinois", -87.62980, 41.878114,"Chicago","Illinois","11/29/1930",1930,11,29,"seq-6","https://articleextractor.org/pages/9799/iune_fluorite_ver01/sn84020097/1930/11/29/ed-1/seq-6/1","NA, NA","NA, NA","NA, NA",NA,NA,NA,NA,NA,NA,"no lynchings occurred in any of these articles",3330,"sn84020097",NA,NA,NA,NA,NA,NA
"635", 9801,NA,"NA, Connecticut", -73.08775, 41.603221,NA,"Connecticut","11/22/1922",1922,11,22,"seq-1","https://articleextractor.org/pages/9801/ct_lebanon_ver03/sn92051227/1922/11/22/ed-1/seq-1/1","Oconee county, GA","NA, NA","NA, NA","Oconee county","GA",NA,NA,NA,NA,"mentions three Black people lynched",3331,"sn92051227", -83.443012,  33.823199,NA,NA,NA,NA
"636", 9802,"Martinsburg W Va evening journal ","Martinsburg, West Virginia", -77.96389, 39.456210,"Martinsburg","West Virginia","12/16/1919",1919,12,16,"seq-6","https://articleextractor.org/pages/9802/wvu_els_ver01/sn85059586/1919/12/16/ed-1/seq-6/1","Chapmanville, WV","NA, NA","NA, NA","Chapmanville","WV",NA,NA,NA,NA,"two Black men lynched",3332,"sn85059586", -82.017350,  37.973711,NA,NA,NA,NA
"637", 9803,"The Seattle star ","Seattle, Washington",-122.33285, 47.606139,"Seattle","Washington","4/5/1918",1918, 4, 5,"seq-16","https://articleextractor.org/pages/9803/wa_muddy_ver02/sn87093407/1918/04/05/ed-1/seq-16/1","Collinsville, IL","NA, NA","NA, NA","Collinsville","IL",NA,NA,NA,NA,NA,3333,"sn87093407", -89.984548,  38.670327,NA,NA,NA,NA
"638", 9804,NA,"NA, South Dakota", -99.90181, 43.969515,NA,"South Dakota","1/7/1915",1915, 1, 7,"seq-2","https://articleextractor.org/pages/9804/sdhi_kangaroo_ver01/sn99062010/1915/01/07/ed-1/seq-2/1","Wetumpka, Elmore County, AL","NA, NA","NA, NA","Wetumpka, Elmore County","AL",NA,NA,NA,NA,"two Black men lynched",3334,"sn99062010", -86.211913,  32.543745,NA,NA,NA,NA
"639", 9805,"The Topeka state journal ","Topeka, Kansas", -95.67516, 39.047345,"Topeka","Kansas","9/21/1900",1900, 9,21,"seq-7","https://articleextractor.org/pages/9805/khi_higuchi_ver01/sn82016014/1900/09/21/ed-1/seq-7/1","Ponchatoula, Tangipahoa Parish county, LA","NA, NA","NA, NA","Ponchatoula, Tangipahoa Parish county","LA",NA,NA,NA,NA,"Four Black people lynched",3335,"sn82016014", -90.441476,  30.438804,NA,NA,NA,NA
"640", 9808,"Alexandria gazette ","Alexandria, District of Columbia", -77.04692, 38.804836,"Alexandria","District of Columbia","3/1/1909",1909, 3, 1,"seq-2","https://articleextractor.org/pages/9808/vi_greenday_ver01/sn85025007/1909/03/01/ed-1/seq-2/1","NA, NA","NA, NA","NA, NA",NA,NA,NA,NA,NA,NA,"no lynching occurred",3336,"sn85025007",NA,NA,NA,NA,NA,NA
"641", 9809,NA,"NA, Nebraska", -99.90181, 41.492537,NA,"Nebraska","4/16/1909",1909, 4,16,"seq-6","https://articleextractor.org/pages/9809/nbu_quarrie_ver01/sn99021999/1909/04/16/ed-1/seq-6/1","NA, FL","NA, NA","NA, NA",NA,"FL",NA,NA,NA,NA,"Town not listed, just the state",3337,"sn99021999", -81.515754,  27.664827,NA,NA,NA,NA
"642", 9810,"Indiana daily times ","Indianapolis , Indiana", -86.15807, 39.768403,"Indianapolis ","Indiana","8/3/1921",1921, 8, 3,"seq-12","https://articleextractor.org/pages/9810/in_collins_ver02/sn85047611/1921/08/03/ed-1/seq-12/1","Mecklenburg County, VA","NA, NA","NA, NA","Mecklenburg County","VA",NA,NA,NA,NA,"One man lynched, the other is being pursued",3338,"sn85047611", -78.384223,  36.642172,NA,NA,NA,NA
"643", 9811,"The Topeka state journal ","Topeka, Kansas", -95.67516, 39.047345,"Topeka","Kansas","1/16/1911",1911, 1,16,"seq-1","https://articleextractor.org/pages/9811/khi_edelbrock_ver01/sn82016014/1911/01/16/ed-1/seq-1/1","Eminence pike, Shelbyville, KY","NA, NA","NA, NA","Eminence pike, Shelbyville","KY",NA,NA,NA,NA,"three lynched",3339,"sn82016014", -85.203371,  38.228106,NA,NA,NA,NA
"644", 9813,NA,"NA, Colorado",-105.78207, 39.550051,NA,"Colorado","1/7/1916",1916, 1, 7,"seq-6","https://articleextractor.org/pages/9813/cohi_leadville_ver01/sn90051167/1916/01/07/ed-1/seq-6/1","NA, GA","NA, NA","NA, NA",NA,"GA",NA,NA,NA,NA,"city not listed, one man lynched",3341,"sn90051167",NA,NA,NA,NA,NA,NA
"645", 9814,"The Hawaiian gazette ","Honolulu , Hawaii",-157.85814, 21.309884,"Honolulu ","Hawaii","2/29/1916",1916, 2,29,"seq-5","https://articleextractor.org/pages/9814/hihouml_lilac_ver02/sn83025121/1916/02/29/ed-1/seq-5/1","Cartersville, GA","NA, NA","NA, NA","Cartersville","GA",NA,NA,NA,NA,"One Black person lynched",3342,"sn83025121", -84.799938,  34.165097,NA,NA,NA,NA
"646", 9815,"The Colorado statesman ","Denver, Colorado",-104.99025, 39.739236,"Denver","Colorado","10/21/1911",1911,10,21,"seq-4","https://articleextractor.org/pages/9815/cohi_hamilton_ver01/sn83025514/1911/10/21/ed-1/seq-4/1","Coatesville, PA","NA, NA","NA, NA","Coatesville","PA",NA,NA,NA,NA,"Article mentions a man lynched here",3343,"sn83025514", -75.823836,  39.983162,NA,NA,NA,NA
"647", 9816,"Alexandria gazette ","Alexandria, District of Columbia", -77.04692, 38.804836,"Alexandria","District of Columbia","5/15/1916",1916, 5,15,"seq-3","https://articleextractor.org/pages/9816/vi_isogawa_ver01/sn85025007/1916/05/15/ed-1/seq-3/1","NA, NA","NA, NA","NA, NA",NA,NA,NA,NA,NA,NA,"no lynching occurred, discusses a past lynching  and does not say where it occurred",3344,"sn85025007",NA,NA,NA,NA,NA,NA
"648", 9817,"The daily worker ","Chicago, Illinois", -87.62980, 41.878114,"Chicago","Illinois","5/15/1930",1930, 5,15,"seq-2","https://articleextractor.org/pages/9817/iune_fluorite_ver01/sn84020097/1930/05/15/ed-1/seq-2/1","Sherman, TX","NA, NA","NA, NA","Sherman","TX",NA,NA,NA,NA,"One Black person lynched, discusses lynchings of others over past few weeks but does not say where they occurred. The second article is discussing the same lynching.",3345,"sn84020097", -96.608880,  33.635662,NA,NA,NA,NA
"649", 9817,"The daily worker ","Chicago, Illinois", -87.62980, 41.878114,"Chicago","Illinois","5/15/1930",1930, 5,15,"seq-2","https://articleextractor.org/pages/9817/iune_fluorite_ver01/sn84020097/1930/05/15/ed-1/seq-2/1","Sherman, TX","NA, NA","NA, NA","Sherman","TX",NA,NA,NA,NA,"One Black person lynched, discusses lynchings of others over past few weeks but does not say where they occurred. The second article is discussing the same lynching.",3346,"sn84020097", -96.608880,  33.635662,NA,NA,NA,NA
"650", 9818,NA,"NA, Nebraska", -99.90181, 41.492537,NA,"Nebraska","12/2/1921",1921,12, 2,"seq-3","https://articleextractor.org/pages/9818/nbu_easternredbud_ver01/sn99021999/1921/12/02/ed-1/seq-3/1","Ballinger, TX","NA, NA","NA, NA","Ballinger","TX",NA,NA,NA,NA,"A 15 year old was the victim",3347,"sn99021999", -99.947308,  31.738206,NA,NA,NA,NA
"651", 9820,"Wauwatosa news ","Wauwatosa, Wisconsin", -88.00759, 43.049457,"Wauwatosa","Wisconsin","10/3/1919",1919,10, 3,"seq-1","https://articleextractor.org/pages/9820/whi_hodag_ver01/sn86086499/1919/10/03/ed-1/seq-1/1","Montgomery, AL","NA, NA","NA, NA","Montgomery","AL",NA,NA,NA,NA,"Two black men lynched",3348,"sn86086499", -86.307737,  32.379223,NA,NA,NA,NA
"652", 9821,NA,"NA, Mississippi", -89.39853, 32.354668,NA,"Mississippi","9/24/1921",1921, 9,24,"seq-1","https://articleextractor.org/pages/9821/msar_beryl_ver01/sn86074065/1921/09/24/ed-1/seq-1/1","McComb, MS","NA, NA","NA, NA","McComb","MS",NA,NA,NA,NA,NA,3349,"sn86074065", -90.453153,  31.243787,NA,NA,NA,NA
"653", 9822,NA,"NA, Connecticut", -73.08775, 41.603221,NA,"Connecticut","2/2/1923",1923, 2, 2,"seq-3","https://articleextractor.org/pages/9822/ct_clash_ver01/sn92051283/1923/02/02/ed-1/seq-3/1","Harrison, AR","NA, NA","NA, NA","Harrison","AR",NA,NA,NA,NA,"One man lynched, another threatened with lynching (both connected)",3350,"sn92051283", -93.107405,  36.229771,NA,NA,NA,NA
"654", 9823,NA,"NA, Arkansas", -91.83183, 35.201050,NA,"Arkansas","11/17/1915",1915,11,17,"seq-4","https://articleextractor.org/pages/9823/arhi_hypno_ver02/sn90050307/1915/11/17/ed-1/seq-4/1","NA, MS","NA, NA","NA, NA","NA","MS",NA,NA,NA,NA,"Mentions a lynching occurred, does not say where in the state",3351,"sn90050307",NA,NA,NA,NA,NA,NA
"655", 9825,"Grant County herald ","Lancaster, Wisconsin", -90.71068, 42.847490,"Lancaster","Wisconsin","9/12/1889",1889, 9,12,"seq-2","https://articleextractor.org/pages/9825/whi_jyme_ver01/sn85033133/1889/09/12/ed-1/seq-2/1","Fayette County, WV","NA, NA","NA, NA","Fayette County","WV",NA,NA,NA,NA,NA,3352,"sn85033133", -81.075466,  38.061591,NA,NA,NA,NA
"656", 9826,"The Seattle star ","Seattle, Washington",-122.33285, 47.606139,"Seattle","Washington","4/2/1915",1915, 4, 2,"seq-11","https://articleextractor.org/pages/9826/wa_juanita_ver01/sn87093407/1915/04/02/ed-1/seq-11/1","NA, NA","NA, NA","NA, NA",NA,NA,NA,NA,NA,NA,"Lynching was not in the US",3353,"sn87093407",NA,NA,NA,NA,NA,NA
"657", 9827,NA,"NA, Illinois", -89.39853, 40.633125,NA,"Illinois","9/19/1919",1919, 9,19,"seq-1","https://articleextractor.org/pages/9827/iune_amethyst_ver01/sn89080007/1919/09/19/ed-1/seq-1/2","Ogelthorpe (inferred from article) Athens, GA","Jacksonville, FL","NA, NA","Ogelthorpe (inferred from article) Athens","GA","Jacksonville","FL",NA,NA,"The second article was coded under the first, but has a different headline and story (below)- two men were lynched",3354,"sn89080007", -83.357567,  33.951935, -81.65565,  30.33218,NA,NA
"658", 9828,NA,"NA, Texas", -99.90181, 31.968599,NA,"Texas","5/23/1918",1918, 5,23,"seq-5","https://articleextractor.org/pages/9828/txdn_greenland_ver01/sn88084272/1918/05/23/ed-1/seq-5/1","Cordele (seven miles from Cordele), GA","NA, NA","NA, NA","Cordele (seven miles from Cordele)","GA",NA,NA,NA,NA,NA,3355,"sn88084272", -83.782394,  31.963507,NA,NA,NA,NA
"659", 9829,"The Ogden standard ","Ogden City, Utah",-111.97383, 41.223000,"Ogden City","Utah","8/18/1915",1915, 8,18,"seq-10","https://articleextractor.org/pages/9829/uuml_indurain_ver01/sn85058396/1915/08/18/ed-1/seq-10/1","Marietta (two miles from here), GA","discussion of first article (no lynch occurred), NA","NA, NA","Marietta (two miles from here)","GA","discussion of first article (no lynch occurred)",NA,NA,NA,"Dead body was almost attacked by Mob after he was lynched",3356,"sn85058396", -84.549933,  33.952602,NA,NA,NA,NA
"660", 9829,"The Ogden standard ","Ogden City, Utah",-111.97383, 41.223000,"Ogden City","Utah","8/18/1915",1915, 8,18,"seq-10","https://articleextractor.org/pages/9829/uuml_indurain_ver01/sn85058396/1915/08/18/ed-1/seq-10/1","Marietta (two miles from here), GA","discussion of first article (no lynch occurred), NA","NA, NA","Marietta (two miles from here)","GA","discussion of first article (no lynch occurred)",NA,NA,NA,"Dead body was almost attacked by Mob after he was lynched",3357,"sn85058396", -84.549933,  33.952602,NA,NA,NA,NA
"661", 9830,NA,"NA, Connecticut", -73.08775, 41.603221,NA,"Connecticut","10/3/1919",1919,10, 3,"seq-1","https://articleextractor.org/pages/9830/ct_kent_ver01/sn92051227/1919/10/03/ed-1/seq-1/1","Omaha, NE","NA, NA","NA, NA","Omaha","NE",NA,NA,NA,NA,NA,3358,"sn92051227", -95.934503,  41.256537,NA,NA,NA,NA
"662", 9831,NA,"NA, Michigan", -85.60236, 44.314844,NA,"Michigan","12/11/1948",1948,12,11,"seq-1","https://articleextractor.org/pages/9831/mimtptc_albion_ver01/sn92063852/1948/12/11/ed-1/seq-1/1","Lyons, GA","NA, NA","NA, NA","Lyons","GA",NA,NA,NA,NA,"Byline is Lyons, specific town not mentioned in the article where it occurred",3359,"sn92063852", -82.321791,  32.204355,NA,NA,NA,NA
"663", 9833,"The broad ax ","Salt Lake City, Illinois", -89.39853, 40.633125,"Salt Lake City","Illinois","5/17/1919",1919, 5,17,"seq-4","https://articleextractor.org/pages/9833/iune_charlie_ver01/sn84024055/1919/05/17/ed-1/seq-4/1","Vicksburg (byline, not specifically mentioned in the article), MS","NA, NA","NA, NA","Vicksburg (byline, not specifically mentioned in the article)","MS",NA,NA,NA,NA,NA,3360,"sn84024055", -90.877882,  32.352646,NA,NA,NA,NA
"664", 9834,"Palestine daily herald ","Palestine, Texas", -95.63079, 31.762115,"Palestine","Texas","7/2/1909",1909, 7, 2,"seq-2","https://articleextractor.org/pages/9834/txdn_bravo_ver01/sn86090383/1909/07/02/ed-1/seq-2/1","Tyler, TX","NA, NA","NA, NA","Tyler","TX",NA,NA,NA,NA,"Occurred in May, May 1 of that year",3361,"sn86090383", -95.301062,  32.351260,NA,NA,NA,NA
"665", 9835,"The Dolores star ","Dolores, Colorado",-108.50454, 37.473882,"Dolores","Colorado","5/11/1917",1917, 5,11,"seq-5","https://articleextractor.org/pages/9835/cohi_alta_ver01/sn86002159/1917/05/11/ed-1/seq-5/1","Phoenix, AZ","NA, NA","NA, NA","Phoenix","AZ",NA,NA,NA,NA,NA,3362,"sn86002159",-112.074037,  33.448377,NA,NA,NA,NA
"666", 9838,NA,"NA, Mississippi", -89.39853, 32.354668,NA,"Mississippi","9/30/1909",1909, 9,30,"seq-2","https://articleextractor.org/pages/9838/msar_hematite_ver01/sn87065216/1909/09/30/ed-1/seq-2/2","Perry, Taylor County, FL","NA, NA","NA, NA","Perry, Taylor County","FL",NA,NA,NA,NA,NA,3363,"sn87065216", -83.582106,  30.111566,NA,NA,NA,NA
"667", 9839,"Evening star ","Washington, District of Columbia", -77.03687, 38.907192,"Washington","District of Columbia","10/9/1911",1911,10, 9,"seq-4","https://articleextractor.org/pages/9839/dlc_neptunian_ver01/sn83045462/1911/10/09/ed-1/seq-4/2","Waynesville, NC","NA, NA","NA, NA","Waynesville","NC",NA,NA,NA,NA,"Attempted and threatened lynching, lynching did not occur",3364,"sn83045462", -82.988748,  35.488715,NA,NA,NA,NA
"668", 9840,NA,"NA, Colorado",-105.78207, 39.550051,NA,"Colorado","7/8/1897",1897, 7, 8,"seq-2","https://articleextractor.org/pages/9840/cohi_alta_ver01/sn90051344/1897/07/08/ed-1/seq-2/2","NA, NA","NA, NA","NA, NA",NA,NA,NA,NA,NA,NA,"No specific lynching- discussing policy surrounding lynchings after an Ohio lynching (where and when not specified)",3365,"sn90051344",NA,NA,NA,NA,NA,NA
"669", 9841,"Mower County transcript ","Lansing, Minnesota", -92.97019, 43.745240,"Lansing","Minnesota","1/11/1888",1888, 1,11,"seq-2","https://articleextractor.org/pages/9841/mnhi_quasar_ver01/sn85025431/1888/01/11/ed-1/seq-2/2","Durango (does not specify state, says ""near Durango A. T), NA","Cherokee, AL","Madisonville, TX","Durango (does not specify state, says ""near Durango A. T)",NA,"Cherokee","AL","Madisonville","TX","Confused on where Durango is located (says Durango A.T)",3366,"sn85025431",-107.880067,  37.275280, -87.97281,  34.75703, -95.91162,  30.94991
"670", 9841,"Mower County transcript ","Lansing, Minnesota", -92.97019, 43.745240,"Lansing","Minnesota","1/11/1888",1888, 1,11,"seq-2","https://articleextractor.org/pages/9841/mnhi_quasar_ver01/sn85025431/1888/01/11/ed-1/seq-2/2","Durango (does not specify state, says ""near Durango A. T), NA","Cherokee, AL","Madisonville, TX","Durango (does not specify state, says ""near Durango A. T)",NA,"Cherokee","AL","Madisonville","TX","Confused on where Durango is located (says Durango A.T)",3367,"sn85025431",-107.880067,  37.275280, -87.97281,  34.75703, -95.91162,  30.94991
"671", 9841,"Mower County transcript ","Lansing, Minnesota", -92.97019, 43.745240,"Lansing","Minnesota","1/11/1888",1888, 1,11,"seq-2","https://articleextractor.org/pages/9841/mnhi_quasar_ver01/sn85025431/1888/01/11/ed-1/seq-2/2","Durango (does not specify state, says ""near Durango A. T), NA","Cherokee, AL","Madisonville, TX","Durango (does not specify state, says ""near Durango A. T)",NA,"Cherokee","AL","Madisonville","TX","Confused on where Durango is located (says Durango A.T)",3368,"sn85025431",-107.880067,  37.275280, -87.97281,  34.75703, -95.91162,  30.94991
"672", 9842,"The Big Sandy news ","Louisa, Kentucky", -82.60321, 38.114254,"Louisa","Kentucky","6/21/1888",1888, 6,21,"seq-2","https://articleextractor.org/pages/9842/kyu_flamingo_ver01/sn83004226/1888/06/21/ed-1/seq-2/2","Union Bridge, Carroll County, MD","NA, NA","NA, NA","Union Bridge, Carroll County","MD",NA,NA,NA,NA,"Attempted lynching, the victim escaped",3369,"sn83004226", -77.176927,  39.568990,NA,NA,NA,NA
"673", 9843,"Macon beacon ","Macon, Mississippi", -88.56088, 33.105404,"Macon","Mississippi","5/17/1890",1890, 5,17,"seq-1","https://articleextractor.org/pages/9843/msar_applejack_ver01/sn83016943/1890/05/17/ed-1/seq-1/2","Santa Maria, CA","NA, NA","NA, NA","Santa Maria","CA",NA,NA,NA,NA,NA,3370,"sn83016943",-120.435719,  34.953034,NA,NA,NA,NA
"674", 9844,"Wood County reporter ","Grand Rapids , Wisconsin", -89.75677, 44.380134,"Grand Rapids ","Wisconsin","10/3/1889",1889,10, 3,"seq-3","https://articleextractor.org/pages/9844/whi_ada_ver01/sn85033078/1889/10/03/ed-1/seq-3/2","Manistique, MI","NA, NA","NA, NA","Manistique","MI",NA,NA,NA,NA,"This is article two on the page (listed under 9844), accidentally submitted other form before I included the second story",3371,"sn85033078", -86.246252,  45.957751,NA,NA,NA,NA
"675", 9844,"Wood County reporter ","Grand Rapids , Wisconsin", -89.75677, 44.380134,"Grand Rapids ","Wisconsin","10/3/1889",1889,10, 3,"seq-3","https://articleextractor.org/pages/9844/whi_ada_ver01/sn85033078/1889/10/03/ed-1/seq-3/2","Manistique, MI","NA, NA","NA, NA","Manistique","MI",NA,NA,NA,NA,"This is article two on the page (listed under 9844), accidentally submitted other form before I included the second story",3372,"sn85033078", -86.246252,  45.957751,NA,NA,NA,NA
"676", 9845,"Daily public ledger ","Maysville, Kentucky", -83.74437, 38.641185,"Maysville","Kentucky","1/16/1895",1895, 1,16,"seq-1","https://articleextractor.org/pages/9845/kyu_gandhi_ver01/sn86069117/1895/01/16/ed-1/seq-1/2","Mt.Sterling, KY","NA, NA","NA, NA","Mt.Sterling","KY",NA,NA,NA,NA,NA,3373,"sn86069117", -83.943256,  38.056468,NA,NA,NA,NA
"677", 9846,"The Wheeling intelligencer ","Wheeling, West Virginia", -80.72092, 40.063962,"Wheeling","West Virginia","4/3/1911",1911, 4, 3,"seq-1","https://articleextractor.org/pages/9846/wvu_boreman_ver01/sn86092536/1911/04/03/ed-1/seq-1/2","Goshen, Pike county, AL","Sussex county (Believed to be Sussex county Deleware), Although the article also mentions virginia, the town mentioned is in Deleware, DE","discussing second article, NA","Goshen, Pike county","AL","Sussex county (Believed to be Sussex county Deleware), Although the article also mentions virginia, the town mentioned is in Deleware","DE","discussing second article",NA,"Article 2- threats of lynching",3374,"sn86092536", -86.118288,  31.722935, -75.43447,  38.65308,NA,NA
"678", 9846,"The Wheeling intelligencer ","Wheeling, West Virginia", -80.72092, 40.063962,"Wheeling","West Virginia","4/3/1911",1911, 4, 3,"seq-1","https://articleextractor.org/pages/9846/wvu_boreman_ver01/sn86092536/1911/04/03/ed-1/seq-1/2","Goshen, Pike county, AL","Sussex county (Believed to be Sussex county Deleware), Although the article also mentions virginia, the town mentioned is in Deleware, DE","discussing second article, NA","Goshen, Pike county","AL","Sussex county (Believed to be Sussex county Deleware), Although the article also mentions virginia, the town mentioned is in Deleware","DE","discussing second article",NA,"Article 2- threats of lynching",3375,"sn86092536", -86.118288,  31.722935, -75.43447,  38.65308,NA,NA
"679", 9846,"The Wheeling intelligencer ","Wheeling, West Virginia", -80.72092, 40.063962,"Wheeling","West Virginia","4/3/1911",1911, 4, 3,"seq-1","https://articleextractor.org/pages/9846/wvu_boreman_ver01/sn86092536/1911/04/03/ed-1/seq-1/2","Goshen, Pike county, AL","Sussex county (Believed to be Sussex county Deleware), Although the article also mentions virginia, the town mentioned is in Deleware, DE","discussing second article, NA","Goshen, Pike county","AL","Sussex county (Believed to be Sussex county Deleware), Although the article also mentions virginia, the town mentioned is in Deleware","DE","discussing second article",NA,"Article 2- threats of lynching",3376,"sn86092536", -86.118288,  31.722935, -75.43447,  38.65308,NA,NA
"680", 9848,"Los Angeles herald ","Los Angeles , California",-118.24264, 34.054908,"Los Angeles ","California","8/6/1908",1908, 8, 6,"seq-10","https://articleextractor.org/pages/9848/curiv_quailvalley_ver01/sn85042462/1908/08/06/ed-1/seq-10/2","Birmingham, AL","NA, NA","NA, NA","Birmingham","AL",NA,NA,NA,NA,NA,3377,"sn85042462", -86.810357,  33.518589,NA,NA,NA,NA
"681", 9849,NA,"NA, Nebraska", -99.90181, 41.492537,NA,"Nebraska","5/2/1888",1888, 5, 2,"seq-1","https://articleextractor.org/pages/9849/nbu_dewitt_ver01/sn99021999/1888/05/02/ed-1/seq-1/2","Sumerville, GA","Vicksburg, MS","NA, NA","Sumerville","GA","Vicksburg","MS",NA,NA,NA,3378,"sn99021999", -85.347734,  34.480642, -90.87788,  32.35265,NA,NA
"682", 9849,NA,"NA, Nebraska", -99.90181, 41.492537,NA,"Nebraska","5/2/1888",1888, 5, 2,"seq-1","https://articleextractor.org/pages/9849/nbu_dewitt_ver01/sn99021999/1888/05/02/ed-1/seq-1/2","Sumerville, GA","Vicksburg, MS","NA, NA","Sumerville","GA","Vicksburg","MS",NA,NA,NA,3379,"sn99021999", -85.347734,  34.480642, -90.87788,  32.35265,NA,NA
"683", 9850,"The daily citizen ","Asheville, North Carolina", -82.55149, 35.595058,"Asheville","North Carolina","11/9/1889",1889,11, 9,"seq-1","https://articleextractor.org/pages/9850/ncu_cane_ver01/sn91068075/1889/11/09/ed-1/seq-1/2","Leesburg, VA","NA, NA","NA, NA","Leesburg","VA",NA,NA,NA,NA,"The eighteen year old was lynched for outraging a white girl",3380,"sn91068075", -77.564532,  39.115452,NA,NA,NA,NA
"684", 9851,"Fair play ","Ste. Genevieve , Missouri", -90.04756, 37.978662,"Ste. Genevieve ","Missouri","4/21/1888",1888, 4,21,"seq-1","https://articleextractor.org/pages/9851/mohi_gordon_ver01/sn87052181/1888/04/21/ed-1/seq-1/2","Memphis, TN","NA, NA","NA, NA","Memphis","TN",NA,NA,NA,NA,NA,3381,"sn87052181", -90.048980,  35.149534,NA,NA,NA,NA
"685", 9852,NA,"NA, Delaware", -75.52767, 38.910832,NA,"Delaware","6/9/1892",1892, 6, 9,"seq-8","https://articleextractor.org/pages/9852/deu_horcrux_ver01/sn88053046/1892/06/09/ed-1/seq-8/2","Port Jervis, NY","Santa Fe, NM","NA, NA","Port Jervis","NY","Santa Fe","NM",NA,NA,"The second article does not have a lynching, it mentions "" discussion of a possible lynching"" against a Man",3382,"sn88053046", -74.692663,  41.375094,-105.93780,  35.68698,NA,NA
"686", 9852,NA,"NA, Delaware", -75.52767, 38.910832,NA,"Delaware","6/9/1892",1892, 6, 9,"seq-8","https://articleextractor.org/pages/9852/deu_horcrux_ver01/sn88053046/1892/06/09/ed-1/seq-8/2","Port Jervis, NY","Santa Fe, NM","NA, NA","Port Jervis","NY","Santa Fe","NM",NA,NA,"The second article does not have a lynching, it mentions "" discussion of a possible lynching"" against a Man",3383,"sn88053046", -74.692663,  41.375094,-105.93780,  35.68698,NA,NA
"687", 9853,"Vilas County news ","Eagle River, Wisconsin", -89.24430, 45.917176,"Eagle River","Wisconsin","12/16/1901",1901,12,16,"seq-1","https://articleextractor.org/pages/9853/whi_clearwater_ver01/sn85040613/1901/12/16/ed-1/seq-1/2","Lake Charles, LA","NA, NA","NA, NA","Lake Charles","LA",NA,NA,NA,NA,NA,3384,"sn85040613", -93.217376,  30.226595,NA,NA,NA,NA
"688", 9854,NA,"NA, Iowa", -93.09770, 41.878003,NA,"Iowa","1/21/1896",1896, 1,21,"seq-6","https://articleextractor.org/pages/9854/iahi_aerodactyl_ver01/sn87058235/1896/01/21/ed-1/seq-6/2","East Peru, IA","NA, NA","NA, NA","East Peru","IA",NA,NA,NA,NA,"Planned/talked about lynching, officers prevented it",3385,"sn87058235", -93.926336,  41.226936,NA,NA,NA,NA
"689",13735,"The mountain sentinel ","Ebensburg, Pennsylvania", -78.72474, 40.485072,"Ebensburg","Pennsylvania","8/1/1850",1850, 8, 1,"seq-3","https://articleextractor.org/pages/13735/pst_kern_ver01/sn86071377/1850/08/01/ed-1/seq-3/1","Culpeper, VA","NA, NA","NA, NA","Culpeper","VA",NA,NA,NA,NA,"Culpepper is spelled differently in the article",   1,"sn86071377", -77.996118,  38.473346,NA,NA,NA,NA
"690",13737,"Chicago daily tribune ","Chicago, Illinois", -87.62980, 41.878114,"Chicago","Illinois","9/28/1874",1874, 9,28,"seq-2","https://articleextractor.org/pages/13737/dlc_fullerton_ver02/sn84031492/1874/09/28/ed-1/seq-2/1","NA, NA","NA, NA","NA, NA",NA,NA,NA,NA,NA,NA,"No lynching, discusses policy",   2,"sn84031492",NA,NA,NA,NA,NA,NA
"691",13740,"Fair play ","Ste. Genevieve , Missouri", -90.04756, 37.978662,"Ste. Genevieve ","Missouri","8/25/1906",1906, 8,25,"seq-1","https://articleextractor.org/pages/13740/mohi_gordon_ver01/sn87052181/1906/08/25/ed-1/seq-1/1","NA, SC","NA, NA","NA, NA",NA,"SC",NA,NA,NA,NA,"Name of the lynched is not listed, nor the town. It does not even say if the person lynched was alleged to have committed a crime, I believe they were lynched just for being Black",   3,"sn87052181", -81.965115,  33.501803,NA,NA,NA,NA
"692",13741,"The Madison daily leader ","Madison, South Dakota", -97.11395, 44.006085,"Madison","South Dakota","10/13/1905",1905,10,13,"seq-1","https://articleextractor.org/pages/13741/sdhi_grenada_ver01/sn99062034/1905/10/13/ed-1/seq-1/1","Elkton, KY","NA, NA","NA, NA","Elkton","KY",NA,NA,NA,NA,NA,   4,"sn99062034", -87.154167,  36.810043,NA,NA,NA,NA
"693",13743,"Gainesville daily sun. ","Gainesville, Florida", -82.32500, 29.651956,"Gainesville","Florida","12/27/1905",1905,12,27,"seq-1","https://articleextractor.org/pages/13743/fu_six_ver01/sn95026977/1905/12/27/ed-1/seq-1/1","San Antonio, TX","NA, NA","NA, NA","San Antonio","TX",NA,NA,NA,NA,"White man lynched",   5,"sn95026977", -98.494592,  29.425190,NA,NA,NA,NA
"694",13744,NA,"NA, Vermont", -72.57784, 44.558803,NA,"Vermont","4/4/1907",1907, 4, 4,"seq-1","https://articleextractor.org/pages/13744/vtu_broccoli_ver01/sn91066782/1907/04/04/ed-1/seq-1/1","NA, NA","NA, NA","NA, NA",NA,NA,NA,NA,NA,NA,"No lynching occurred.",   6,"sn91066782",NA,NA,NA,NA,NA,NA
"695",13745,"The Donaldsonville chief ","Donaldsonville, Louisiana", -90.99288, 30.101032,"Donaldsonville","Louisiana","10/19/1907",1907,10,19,"seq-1","https://articleextractor.org/pages/13745/lu_bolivar_ver01/sn85034248/1907/10/19/ed-1/seq-1/1","Logansport, IN","Memphis, TN","Tunica, MS","Logansport","IN","Memphis","TN","Tunica","MS","Article 1- The man escaped lynching 
Article 2- ""lynching narrowly avoided"" - discussion of lynching 
article 3- three lynched 
article 4- on next form",   7,"sn85034248", -86.356666,  40.754484, -90.04898,  35.14953, -90.38288,  34.68455
"696",13745,"The Donaldsonville chief ","Donaldsonville, Louisiana", -90.99288, 30.101032,"Donaldsonville","Louisiana","10/19/1907",1907,10,19,"seq-1","https://articleextractor.org/pages/13745/lu_bolivar_ver01/sn85034248/1907/10/19/ed-1/seq-1/1","NA, NA","NA, NA","NA, NA",NA,NA,NA,NA,NA,NA,"article 4 of 13745 did not include a lynching",   7,"sn85034248",NA,NA,NA,NA,NA,NA
"697",13745,"The Donaldsonville chief ","Donaldsonville, Louisiana", -90.99288, 30.101032,"Donaldsonville","Louisiana","10/19/1907",1907,10,19,"seq-1","https://articleextractor.org/pages/13745/lu_bolivar_ver01/sn85034248/1907/10/19/ed-1/seq-1/1","Logansport, IN","Memphis, TN","Tunica, MS","Logansport","IN","Memphis","TN","Tunica","MS","Article 1- The man escaped lynching 
Article 2- ""lynching narrowly avoided"" - discussion of lynching 
article 3- three lynched 
article 4- on next form",   8,"sn85034248", -86.356666,  40.754484, -90.04898,  35.14953, -90.38288,  34.68455
"698",13745,"The Donaldsonville chief ","Donaldsonville, Louisiana", -90.99288, 30.101032,"Donaldsonville","Louisiana","10/19/1907",1907,10,19,"seq-1","https://articleextractor.org/pages/13745/lu_bolivar_ver01/sn85034248/1907/10/19/ed-1/seq-1/1","NA, NA","NA, NA","NA, NA",NA,NA,NA,NA,NA,NA,"article 4 of 13745 did not include a lynching",   8,"sn85034248",NA,NA,NA,NA,NA,NA
"699",13745,"The Donaldsonville chief ","Donaldsonville, Louisiana", -90.99288, 30.101032,"Donaldsonville","Louisiana","10/19/1907",1907,10,19,"seq-1","https://articleextractor.org/pages/13745/lu_bolivar_ver01/sn85034248/1907/10/19/ed-1/seq-1/1","Logansport, IN","Memphis, TN","Tunica, MS","Logansport","IN","Memphis","TN","Tunica","MS","Article 1- The man escaped lynching 
Article 2- ""lynching narrowly avoided"" - discussion of lynching 
article 3- three lynched 
article 4- on next form",   9,"sn85034248", -86.356666,  40.754484, -90.04898,  35.14953, -90.38288,  34.68455
"700",13745,"The Donaldsonville chief ","Donaldsonville, Louisiana", -90.99288, 30.101032,"Donaldsonville","Louisiana","10/19/1907",1907,10,19,"seq-1","https://articleextractor.org/pages/13745/lu_bolivar_ver01/sn85034248/1907/10/19/ed-1/seq-1/1","NA, NA","NA, NA","NA, NA",NA,NA,NA,NA,NA,NA,"article 4 of 13745 did not include a lynching",   9,"sn85034248",NA,NA,NA,NA,NA,NA
"701",13745,"The Donaldsonville chief ","Donaldsonville, Louisiana", -90.99288, 30.101032,"Donaldsonville","Louisiana","10/19/1907",1907,10,19,"seq-1","https://articleextractor.org/pages/13745/lu_bolivar_ver01/sn85034248/1907/10/19/ed-1/seq-1/1","Logansport, IN","Memphis, TN","Tunica, MS","Logansport","IN","Memphis","TN","Tunica","MS","Article 1- The man escaped lynching 
Article 2- ""lynching narrowly avoided"" - discussion of lynching 
article 3- three lynched 
article 4- on next form",  10,"sn85034248", -86.356666,  40.754484, -90.04898,  35.14953, -90.38288,  34.68455
"702",13745,"The Donaldsonville chief ","Donaldsonville, Louisiana", -90.99288, 30.101032,"Donaldsonville","Louisiana","10/19/1907",1907,10,19,"seq-1","https://articleextractor.org/pages/13745/lu_bolivar_ver01/sn85034248/1907/10/19/ed-1/seq-1/1","NA, NA","NA, NA","NA, NA",NA,NA,NA,NA,NA,NA,"article 4 of 13745 did not include a lynching",  10,"sn85034248",NA,NA,NA,NA,NA,NA
"703",13747,"Live Oak daily Democrat. ","Live Oak, Florida", -82.98402, 30.294946,"Live Oak","Florida","4/17/1907",1907, 4,17,"seq-1","https://articleextractor.org/pages/13747/fu_seven_ver02/sn95026788/1907/04/17/ed-1/seq-1/1","Cola, LA","NA, NA","NA, NA","Cola","LA",NA,NA,NA,NA,"Strauss escaped first lynching, lynched and died second time",  11,"sn95026788",NA,NA,NA,NA,NA,NA
"704",13749,"Brownsville herald ","Brownsville, Texas", -97.49748, 25.901747,"Brownsville","Texas","10/2/1921",1921,10, 2,"seq-2","https://articleextractor.org/pages/13749/txdn_burnett_ver01/sn86063730/1921/10/02/ed-1/seq-2/1","Pintta, FL","NA, NA","NA, NA","Pintta","FL",NA,NA,NA,NA,"Shot to death ""for insulting a white girl""",  13,"sn86063730", -83.352371,  30.594096,NA,NA,NA,NA
"705",13751,"The Washington times ","Washington , District of Columbia", -77.03687, 38.907192,"Washington ","District of Columbia","8/1/1921",1921, 8, 1,"seq-6","https://articleextractor.org/pages/13751/dlc_yorkie_ver01/sn84026749/1921/08/01/ed-1/seq-6/1","Chicago, IL","NA, NA","NA, NA","Chicago","IL",NA,NA,NA,NA,"Mob threatens to lynch the man, police prevent it",  14,"sn84026749", -87.629798,  41.878114,NA,NA,NA,NA
"706",13752,"The New York herald ","New York , New York", -74.00597, 40.712775,"New York ","New York","5/14/1843",1843, 5,14,"seq-2","https://articleextractor.org/pages/13752/dlc_kudzu_ver01/sn83030313/1843/05/14/ed-1/seq-2/1","Covington, LA","NA, NA","NA, NA","Covington","LA",NA,NA,NA,NA,"Shot to death by a mob- stated that the men killed were of covington- did not specify if thats where it occured- Jenny G",  15,"sn83030313", -90.100911,  30.475470,NA,NA,NA,NA
"707",13753,"The New York herald ","New York , New York", -74.00597, 40.712775,"New York ","New York","7/9/1848",1848, 7, 9,"seq-2","https://articleextractor.org/pages/13753/dlc_marcus_ver01/sn83030313/1848/07/09/ed-1/seq-2/1","NA, NA","NA, NA","NA, NA",NA,NA,NA,NA,NA,NA,"not a lynching",  16,"sn83030313",NA,NA,NA,NA,NA,NA
"708",13754,"The Hillsdale standard ","Hillsdale, Michigan", -84.63051, 41.920047,"Hillsdale","Michigan","3/28/1854",1854, 3,28,"seq-2","https://articleextractor.org/pages/13754/mimtptc_beulah_ver01/sn85033637/1854/03/28/ed-1/seq-2/1","NA, NA","NA, NA","NA, NA",NA,NA,NA,NA,NA,NA,"Very difficult to read, I believe three were lynched, but can not determine where or when - Jenny G",  17,"sn85033637",NA,NA,NA,NA,NA,NA
"709",13755,"The Hillsdale standard ","Hillsdale, Michigan", -84.63051, 41.920047,"Hillsdale","Michigan","8/14/1855",1855, 8,14,"seq-2","https://articleextractor.org/pages/13755/mimtptc_beulah_ver01/sn85033637/1855/08/14/ed-1/seq-2/1","Washington county, Milwaukee, WI","NA, NA","NA, NA","Washington county, Milwaukee","WI",NA,NA,NA,NA,NA,  18,"sn85033637", -87.906474,  43.038902,NA,NA,NA,NA
"710",13756,"New Orleans daily crescent ",", Louisiana", -91.52086, 30.519078,"","Louisiana","1/11/1856",1856, 1,11,"seq-1","https://articleextractor.org/pages/13756/lu_pearse_ver01/sn82015753/1856/01/11/ed-1/seq-1/1","Toloume county, Monterey, CA","NA, NA","NA, NA","Toloume county, Monterey","CA",NA,NA,NA,NA,"The article mentions the lynching, but states it was a year ago, and the men charged were being indicted in Toloume, making me believe it occurred there. Can be double checked- Jenny g",  19,"sn82015753",-119.974053,  38.029655,NA,NA,NA,NA
"711",13757,"American Lancaster gazette ","Lancaster, Ohio", -82.59933, 39.713675,"Lancaster","Ohio","2/28/1856",1856, 2,28,"seq-1","https://articleextractor.org/pages/13757/ohi_drake_ver01/sn85026105/1856/02/28/ed-1/seq-1/1","Charleston, Coles county, IL","NA, NA","NA, NA","Charleston, Coles county","IL",NA,NA,NA,NA,NA,  20,"sn85026105", -88.176152,  39.496146,NA,NA,NA,NA
"712",13758,"Vermont watchman and State journal ","Montpelier, Vermont", -72.57539, 44.260059,"Montpelier","Vermont","6/26/1857",1857, 6,26,"seq-2","https://articleextractor.org/pages/13758/vtu_graniteville_ver01/sn84023200/1857/06/26/ed-1/seq-2/1","Lousville, KY","NA, NA","NA, NA","Lousville","KY",NA,NA,NA,NA,"Four Black people lynched, Louisville grand jury indicted murderers",  21,"sn84023200", -85.758456,  38.252665,NA,NA,NA,NA
"713",13759,"Anti-slavery bugle ","New-Lisbon, Ohio", -80.76813, 40.772004,"New-Lisbon","Ohio","7/17/1858",1858, 7,17,"seq-1","https://articleextractor.org/pages/13759/ohi_ariel_ver02/sn83035487/1858/07/17/ed-1/seq-1/1","NA, NA","NA, NA","NA, NA",NA,NA,NA,NA,NA,NA,"no lynch, just mob intimidation",  22,"sn83035487",NA,NA,NA,NA,NA,NA
"714",13763,"The Perrysburg journal ","Perrysburg, Ohio", -83.62716, 41.556996,"Perrysburg","Ohio","7/28/1859",1859, 7,28,"seq-3","https://articleextractor.org/pages/13763/ohi_cobweb_ver04/sn85026192/1859/07/28/ed-1/seq-3/1","Marshall, MO","NA, NA","NA, NA","Marshall","MO",NA,NA,NA,NA,"three lynched",  24,"sn85026192", -93.196870,  39.123078,NA,NA,NA,NA
"715",13764,"Cleveland morning leader ","Cleveland , Ohio", -81.69436, 41.499320,"Cleveland ","Ohio","1/8/1859",1859, 1, 8,"seq-2","https://articleextractor.org/pages/13764/ohi_desdemona_ver01/sn83035143/1859/01/08/ed-1/seq-2/1","City/town not listed, MO","NA, NA","NA, NA","City/town not listed","MO",NA,NA,NA,NA,NA,  25,"sn83035143", -91.831833,  37.964253,NA,NA,NA,NA
"716",13765,"Chicago daily tribune ","Chicago, Illinois", -87.62980, 41.878114,"Chicago","Illinois","1/8/1864",1864, 1, 8,"seq-3","https://articleextractor.org/pages/13765/dlc_edgewater_ver02/sn84031490/1864/01/08/ed-1/seq-3/1","Los Angelos, CA","NA, NA","NA, NA","Los Angelos","CA",NA,NA,NA,NA,"five men lynched",  26,"sn84031490",-118.242643,  34.054908,NA,NA,NA,NA
"717",13766,"Cincinnati daily press ","Cincinnati , Ohio", -84.51202, 39.103118,"Cincinnati ","Ohio","10/6/1860",1860,10, 6,"seq-1","https://articleextractor.org/pages/13766/ohi_guildenstern_ver01/sn84028745/1860/10/06/ed-1/seq-1/1","Fort Smith, AR","NA, NA","NA, NA","Fort Smith","AR",NA,NA,NA,NA,"two men lynched",  27,"sn84028745", -94.420965,  35.384372,NA,NA,NA,NA
"718",13768,"Red Wing sentinel ","Red Wing, Minnesota", -92.53696, 44.566069,"Red Wing","Minnesota","1/2/1861",1861, 1, 2,"seq-2","https://articleextractor.org/pages/13768/mnhi_datsun_ver01/sn85025569/1861/01/02/ed-1/seq-2/1","NA, NA","NA, NA","NA, NA",NA,NA,NA,NA,NA,NA,"no lynching",  28,"sn85025569",NA,NA,NA,NA,NA,NA
"719",13769,"Sunday dispatch ","New York , New York", -74.00597, 40.712775,"New York ","New York","6/28/1863",1863, 6,28,"seq-6","https://articleextractor.org/pages/13769/dlc_dunbar_ver01/sn85026213/1863/06/28/ed-1/seq-6/1","Newburg, NA","NA, NA","NA, NA","Newburg",NA,NA,NA,NA,NA,"State not listed*****, just says ""Newburg""- Jenny G",  29,"sn85026213",NA,NA,NA,NA,NA,NA
"720",13774,"New York dispatch ","New York , New York", -74.00597, 40.712775,"New York ","New York","7/16/1865",1865, 7,16,"seq-6","https://articleextractor.org/pages/13774/dlc_dunbar_ver01/sn85026214/1865/07/16/ed-1/seq-6/1","Albany, NY","NA, NA","NA, NA","Albany","NY",NA,NA,NA,NA,"attempted/discussion of lynchings",  31,"sn85026214", -73.756232,  42.652579,NA,NA,NA,NA
"721",13776,"The Kenosha telegraph ","Kenosha, Wisconsin", -87.82118, 42.584742,"Kenosha","Wisconsin","9/23/1869",1869, 9,23,"seq-1","https://articleextractor.org/pages/13776/whi_dynamite_ver01/sn85033123/1869/09/23/ed-1/seq-1/1","Portage, WI","NA, NA","NA, NA","Portage","WI",NA,NA,NA,NA,NA,  34,"sn85033123", -89.462620,  43.539149,NA,NA,NA,NA
"722",13778,"The Cheyenne daily leader ","Cheyenne, Wyoming",-104.82025, 41.139981,"Cheyenne","Wyoming","2/6/1879",1879, 2, 6,"seq-1","https://articleextractor.org/pages/13778/wyu_baggs_ver01/sn84022149/1879/02/06/ed-1/seq-1/1","Wrightsville, IL","NA, NA","NA, NA","Wrightsville","IL",NA,NA,NA,NA,NA,  35,"sn84022149", -89.398528,  40.633125,NA,NA,NA,NA
"723",13781,"Perrysburg journal. ","Perrysburg, Ohio", -83.62716, 41.556996,"Perrysburg","Ohio","4/18/1873",1873, 4,18,"seq-1","https://articleextractor.org/pages/13781/ohi_cobweb_ver04/sn87076843/1873/04/18/ed-1/seq-1/1","Monterey County, CA","NA, NA","NA, NA","Monterey County","CA",NA,NA,NA,NA,NA,  36,"sn87076843",-121.894749,  36.600224,NA,NA,NA,NA
"724",13782,"The Somerset herald ","Somerset, Pennsylvania", -79.07808, 40.008411,"Somerset","Pennsylvania","8/19/1874",1874, 8,19,"seq-2","https://articleextractor.org/pages/13782/pst_grange_ver01/sn84026409/1874/08/19/ed-1/seq-2/1","Martinsburg, WV","NA, NA","NA, NA","Martinsburg","WV",NA,NA,NA,NA,NA,  37,"sn84026409", -77.963887,  39.456210,NA,NA,NA,NA
"725",13784,"Daily Kennebec journal ","Augusta, Maine", -69.77949, 44.310624,"Augusta","Maine","12/9/1875",1875,12, 9,"seq-3","https://articleextractor.org/pages/13784/me_dyerbrook_ver01/sn82014248/1875/12/09/ed-1/seq-3/1","San diego, CA","no lynching, NA","NA, NA","San diego","CA","no lynching",NA,NA,NA,"Two Mexicans were lynched by citizens",  38,"sn82014248",-117.161084,  32.715738,NA,NA,NA,NA
"726",13784,"Daily Kennebec journal ","Augusta, Maine", -69.77949, 44.310624,"Augusta","Maine","12/9/1875",1875,12, 9,"seq-3","https://articleextractor.org/pages/13784/me_dyerbrook_ver01/sn82014248/1875/12/09/ed-1/seq-3/1","San diego, CA","no lynching, NA","NA, NA","San diego","CA","no lynching",NA,NA,NA,"Two Mexicans were lynched by citizens",  39,"sn82014248",-117.161084,  32.715738,NA,NA,NA,NA
"727",13789,"The Kenosha telegraph ","Kenosha, Wisconsin", -87.82118, 42.584742,"Kenosha","Wisconsin","12/17/1880",1880,12,17,"seq-1","https://articleextractor.org/pages/13789/whi_engledinger_ver02/sn85033123/1880/12/17/ed-1/seq-1/1","Brazil, IN","Clarenden County, SC","NA, NA","Brazil","IN","Clarenden County","SC",NA,NA,NA,  41,"sn85033123", -87.125015,  39.523652, -80.18751,  33.67342,NA,NA
"728",13789,"The Kenosha telegraph ","Kenosha, Wisconsin", -87.82118, 42.584742,"Kenosha","Wisconsin","12/17/1880",1880,12,17,"seq-1","https://articleextractor.org/pages/13789/whi_engledinger_ver02/sn85033123/1880/12/17/ed-1/seq-1/1","Brazil, IN","Clarenden County, SC","NA, NA","Brazil","IN","Clarenden County","SC",NA,NA,NA,  42,"sn85033123", -87.125015,  39.523652, -80.18751,  33.67342,NA,NA
"729",13792,"Huntsville gazette ","Huntsville, Alabama", -86.58610, 34.730369,"Huntsville","Alabama","4/8/1882",1882, 4, 8,"seq-1","https://articleextractor.org/pages/13792/au_inman_ver01/sn84020151/1882/04/08/ed-1/seq-1/1","Chatham, VA","Selma, AL","South pueblo, CO","Chatham","VA","Selma","AL","South pueblo","CO","Three different locations noted for the five lynchings. I listed them in the different articles, despite them being in one article. five lynched",  50,"sn84020151", -79.398081,  36.825694, -87.02110,  32.40736,-104.64007,  38.31305
"730",13793,"The Iola register ","Iola, Kansas", -95.39998, 37.924480,"Iola","Kansas","10/20/1882",1882,10,20,"seq-2","https://articleextractor.org/pages/13793/khi_dole_ver01/sn83040340/1882/10/20/ed-1/seq-2/1","Posey county, Evansville, IN","Fort Fetterman, WY","discusses same lynching as article 1, NA","Posey county, Evansville","IN","Fort Fetterman","WY","discusses same lynching as article 1",NA,NA,  51,"sn83040340", -87.894245,  38.002036,-105.48604,  42.84306,NA,NA
"731",13793,"The Iola register ","Iola, Kansas", -95.39998, 37.924480,"Iola","Kansas","10/20/1882",1882,10,20,"seq-2","https://articleextractor.org/pages/13793/khi_dole_ver01/sn83040340/1882/10/20/ed-1/seq-2/1","Posey county, Evansville, IN","Fort Fetterman, WY","discusses same lynching as article 1, NA","Posey county, Evansville","IN","Fort Fetterman","WY","discusses same lynching as article 1",NA,NA,  52,"sn83040340", -87.894245,  38.002036,-105.48604,  42.84306,NA,NA
"732",13793,"The Iola register ","Iola, Kansas", -95.39998, 37.924480,"Iola","Kansas","10/20/1882",1882,10,20,"seq-2","https://articleextractor.org/pages/13793/khi_dole_ver01/sn83040340/1882/10/20/ed-1/seq-2/1","Posey county, Evansville, IN","Fort Fetterman, WY","discusses same lynching as article 1, NA","Posey county, Evansville","IN","Fort Fetterman","WY","discusses same lynching as article 1",NA,NA,  53,"sn83040340", -87.894245,  38.002036,-105.48604,  42.84306,NA,NA
"733",13795,"Evening bulletin ","Maysville , Kentucky", -83.74437, 38.641185,"Maysville ","Kentucky","10/27/1882",1882,10,27,"seq-2","https://articleextractor.org/pages/13795/kyu_ishtar_ver01/sn86069125/1882/10/27/ed-1/seq-2/1","Eastern Kentucky (no specific city), KY","NA, NA","NA, NA","Eastern Kentucky (no specific city)","KY",NA,NA,NA,NA,"no specific city or town mentioned, threats of a lynching in eastern KY, no lynching occurred.",  55,"sn86069125", -82.806713,  37.516476,NA,NA,NA,NA
"734",13798,"The Portland daily press ","Portland, Maine", -70.25682, 43.659099,"Portland","Maine","6/16/1883",1883, 6,16,"seq-1","https://articleextractor.org/pages/13798/me_edgecomb_ver02/sn83016025/1883/06/16/ed-1/seq-1/1","Cheboygan, MI","conway, SC","Rockford, AL","Cheboygan","MI","conway","SC","Rockford","AL","note article 2- two lynched",  56,"sn83016025", -84.474480,  45.646956, -79.04781,  33.83600, -86.21969,  32.88957
"735",13798,"The Portland daily press ","Portland, Maine", -70.25682, 43.659099,"Portland","Maine","6/16/1883",1883, 6,16,"seq-1","https://articleextractor.org/pages/13798/me_edgecomb_ver02/sn83016025/1883/06/16/ed-1/seq-1/1","Cheboygan, MI","conway, SC","Rockford, AL","Cheboygan","MI","conway","SC","Rockford","AL","note article 2- two lynched",  57,"sn83016025", -84.474480,  45.646956, -79.04781,  33.83600, -86.21969,  32.88957
"736",13798,"The Portland daily press ","Portland, Maine", -70.25682, 43.659099,"Portland","Maine","6/16/1883",1883, 6,16,"seq-1","https://articleextractor.org/pages/13798/me_edgecomb_ver02/sn83016025/1883/06/16/ed-1/seq-1/1","Cheboygan, MI","conway, SC","Rockford, AL","Cheboygan","MI","conway","SC","Rockford","AL","note article 2- two lynched",  58,"sn83016025", -84.474480,  45.646956, -79.04781,  33.83600, -86.21969,  32.88957
"737",13799,"The Portland daily press ","Portland, Maine", -70.25682, 43.659099,"Portland","Maine","4/5/1883",1883, 4, 5,"seq-1","https://articleextractor.org/pages/13799/me_edgecomb_ver02/sn83016025/1883/04/05/ed-1/seq-1/1","little rock, AR","NA, NE","NA, NA","little rock","AR",NA,"NE",NA,NA,"referred to as a ""boy""- child lynched? for article 1 
article 2- city not mentioned, just Nebraska, two lynched 
article 3- no lynching occurred",  59,"sn83016025", -92.288016,  34.744462,NA,NA,NA,NA
"738",13799,"The Portland daily press ","Portland, Maine", -70.25682, 43.659099,"Portland","Maine","4/5/1883",1883, 4, 5,"seq-1","https://articleextractor.org/pages/13799/me_edgecomb_ver02/sn83016025/1883/04/05/ed-1/seq-1/1","little rock, AR","NA, NE","NA, NA","little rock","AR",NA,"NE",NA,NA,"referred to as a ""boy""- child lynched? for article 1 
article 2- city not mentioned, just Nebraska, two lynched 
article 3- no lynching occurred",  60,"sn83016025", -92.288016,  34.744462,NA,NA,NA,NA
"739",13799,"The Portland daily press ","Portland, Maine", -70.25682, 43.659099,"Portland","Maine","4/5/1883",1883, 4, 5,"seq-1","https://articleextractor.org/pages/13799/me_edgecomb_ver02/sn83016025/1883/04/05/ed-1/seq-1/1","little rock, AR","NA, NE","NA, NA","little rock","AR",NA,"NE",NA,NA,"referred to as a ""boy""- child lynched? for article 1 
article 2- city not mentioned, just Nebraska, two lynched 
article 3- no lynching occurred",  61,"sn83016025", -92.288016,  34.744462,NA,NA,NA,NA
"740",13800,"The Stark County Democrat ","Canton, Ohio", -81.37845, 40.798947,"Canton","Ohio","2/14/1883",1883, 2,14,"seq-1","https://articleextractor.org/pages/13800/ohi_jaques_ver01/sn84028490/1883/02/14/ed-1/seq-1/1","Paola, KS","NA, NA","NA, NA","Paola","KS",NA,NA,NA,NA,"failed attempt to at a lynching- mob retreated",  62,"sn84028490", -94.879129,  38.572235,NA,NA,NA,NA
"741",13801,"The farmer and mechanic ","Raleigh, North Carolina", -78.63818, 35.779590,"Raleigh","North Carolina","8/22/1883",1883, 8,22,"seq-3","https://articleextractor.org/pages/13801/ncu_grandfather_ver01/sn85042098/1883/08/22/ed-1/seq-3/2","millen County, GA","no lynching, NA","Carson city, CO","millen County","GA","no lynching",NA,"Carson city","CO","article 1 has two separate events in it, I included one of the events under article 3****",  63,"sn85042098", -81.949281,  32.804051,NA,NA,-119.76740,  39.16380
"742",13801,"The farmer and mechanic ","Raleigh, North Carolina", -78.63818, 35.779590,"Raleigh","North Carolina","8/22/1883",1883, 8,22,"seq-3","https://articleextractor.org/pages/13801/ncu_grandfather_ver01/sn85042098/1883/08/22/ed-1/seq-3/2","millen County, GA","no lynching, NA","Carson city, CO","millen County","GA","no lynching",NA,"Carson city","CO","article 1 has two separate events in it, I included one of the events under article 3****",  64,"sn85042098", -81.949281,  32.804051,NA,NA,-119.76740,  39.16380
"743",13805,"The news boy. ","Benton, Missouri", -89.56258, 37.097828,"Benton","Missouri","8/18/1894",1894, 8,18,"seq-4","https://articleextractor.org/pages/13805/mohi_gordon_ver01/sn89066235/1894/08/18/ed-1/seq-4/1","NA, NA","NA, NA","NA, NA",NA,NA,NA,NA,NA,NA,"no lynching occurred",  70,"sn89066235",NA,NA,NA,NA,NA,NA
"744",13806,"The Atlanta constitution ","Atlanta, Georgia", -84.38768, 33.748752,"Atlanta","Georgia","4/10/1894",1894, 4,10,"seq-9","https://articleextractor.org/pages/13806/gu_fornax_ver01/sn89053706/1894/04/10/ed-1/seq-9/1","no lynch occurred, NA","Palmers island, NA","Wilkesbarre, PA","no lynch occurred",NA,"Palmers island",NA,"Wilkesbarre","PA","second article- state not listed where lynching occurred, says the victim was taken to palmers island.I googled this, and it says it is in Massachusetts. Unsure of this - Jenny G",  71,"sn89053706",NA,NA, -70.90908,  41.62693, -75.88131,  41.24591
"745",13806,"The Atlanta constitution ","Atlanta, Georgia", -84.38768, 33.748752,"Atlanta","Georgia","4/10/1894",1894, 4,10,"seq-9","https://articleextractor.org/pages/13806/gu_fornax_ver01/sn89053706/1894/04/10/ed-1/seq-9/1","no lynch occurred, NA","Palmers island, NA","Wilkesbarre, PA","no lynch occurred",NA,"Palmers island",NA,"Wilkesbarre","PA","second article- state not listed where lynching occurred, says the victim was taken to palmers island.I googled this, and it says it is in Massachusetts. Unsure of this - Jenny G",  72,"sn89053706",NA,NA, -70.90908,  41.62693, -75.88131,  41.24591
"746",13806,"The Atlanta constitution ","Atlanta, Georgia", -84.38768, 33.748752,"Atlanta","Georgia","4/10/1894",1894, 4,10,"seq-9","https://articleextractor.org/pages/13806/gu_fornax_ver01/sn89053706/1894/04/10/ed-1/seq-9/1","no lynch occurred, NA","Palmers island, NA","Wilkesbarre, PA","no lynch occurred",NA,"Palmers island",NA,"Wilkesbarre","PA","second article- state not listed where lynching occurred, says the victim was taken to palmers island.I googled this, and it says it is in Massachusetts. Unsure of this - Jenny G",  73,"sn89053706",NA,NA, -70.90908,  41.62693, -75.88131,  41.24591
"747",13807,"The farmers' union. ","Memphis, Missouri", -92.17129, 40.457812,"Memphis","Missouri","1/4/1894",1894, 1, 4,"seq-6","https://articleextractor.org/pages/13807/mohi_flash_ver02/sn89067453/1894/01/04/ed-1/seq-6/1","Bedford, IN","Brownstown, IN","Corunna, MI","Bedford","IN","Brownstown","IN","Corunna","MI","two more articles (4 and 5) on this page, not enough room below, will fill out another google form",  74,"sn89067453", -86.487215,  38.861162, -86.04192,  38.87894, -84.11774,  42.98197
"748",13807,"The farmers' union. ","Memphis, Missouri", -92.17129, 40.457812,"Memphis","Missouri","1/4/1894",1894, 1, 4,"seq-6","https://articleextractor.org/pages/13807/mohi_flash_ver02/sn89067453/1894/01/04/ed-1/seq-6/1","Decatur, IL","Paris, TX","NA, MN","Decatur","IL","Paris","TX",NA,"MN","I just noticed upon scrolling that there are seven articles on this page, not just five. Will continue below ( from article 4 and up).",  74,"sn89067453", -88.954800,  39.840315, -95.55551,  33.66094, -93.26501,  44.97775
"749",13807,"The farmers' union. ","Memphis, Missouri", -92.17129, 40.457812,"Memphis","Missouri","1/4/1894",1894, 1, 4,"seq-6","https://articleextractor.org/pages/13807/mohi_flash_ver02/sn89067453/1894/01/04/ed-1/seq-6/1","knoxville, TN","Bakersville, NC","Memphis, TN","knoxville","TN","Bakersville","NC","Memphis","TN","continuation of 13807",  74,"sn89067453", -83.920739,  35.960638, -82.15874,  36.01567, -90.04898,  35.14953
"750",13807,"The farmers' union. ","Memphis, Missouri", -92.17129, 40.457812,"Memphis","Missouri","1/4/1894",1894, 1, 4,"seq-6","https://articleextractor.org/pages/13807/mohi_flash_ver02/sn89067453/1894/01/04/ed-1/seq-6/1","Roanoke, VA","Bardwell, KY","NA, NA","Roanoke","VA","Bardwell","KY",NA,NA,"continuation of 13807",  74,"sn89067453", -79.941427,  37.270970, -89.00979,  36.87061,NA,NA
"751",13807,"The farmers' union. ","Memphis, Missouri", -92.17129, 40.457812,"Memphis","Missouri","1/4/1894",1894, 1, 4,"seq-6","https://articleextractor.org/pages/13807/mohi_flash_ver02/sn89067453/1894/01/04/ed-1/seq-6/1","Bedford, IN","Brownstown, IN","Corunna, MI","Bedford","IN","Brownstown","IN","Corunna","MI","two more articles (4 and 5) on this page, not enough room below, will fill out another google form",  75,"sn89067453", -86.487215,  38.861162, -86.04192,  38.87894, -84.11774,  42.98197
"752",13807,"The farmers' union. ","Memphis, Missouri", -92.17129, 40.457812,"Memphis","Missouri","1/4/1894",1894, 1, 4,"seq-6","https://articleextractor.org/pages/13807/mohi_flash_ver02/sn89067453/1894/01/04/ed-1/seq-6/1","Decatur, IL","Paris, TX","NA, MN","Decatur","IL","Paris","TX",NA,"MN","I just noticed upon scrolling that there are seven articles on this page, not just five. Will continue below ( from article 4 and up).",  75,"sn89067453", -88.954800,  39.840315, -95.55551,  33.66094, -93.26501,  44.97775
"753",13807,"The farmers' union. ","Memphis, Missouri", -92.17129, 40.457812,"Memphis","Missouri","1/4/1894",1894, 1, 4,"seq-6","https://articleextractor.org/pages/13807/mohi_flash_ver02/sn89067453/1894/01/04/ed-1/seq-6/1","knoxville, TN","Bakersville, NC","Memphis, TN","knoxville","TN","Bakersville","NC","Memphis","TN","continuation of 13807",  75,"sn89067453", -83.920739,  35.960638, -82.15874,  36.01567, -90.04898,  35.14953
"754",13807,"The farmers' union. ","Memphis, Missouri", -92.17129, 40.457812,"Memphis","Missouri","1/4/1894",1894, 1, 4,"seq-6","https://articleextractor.org/pages/13807/mohi_flash_ver02/sn89067453/1894/01/04/ed-1/seq-6/1","Roanoke, VA","Bardwell, KY","NA, NA","Roanoke","VA","Bardwell","KY",NA,NA,"continuation of 13807",  75,"sn89067453", -79.941427,  37.270970, -89.00979,  36.87061,NA,NA
"755",13807,"The farmers' union. ","Memphis, Missouri", -92.17129, 40.457812,"Memphis","Missouri","1/4/1894",1894, 1, 4,"seq-6","https://articleextractor.org/pages/13807/mohi_flash_ver02/sn89067453/1894/01/04/ed-1/seq-6/1","Bedford, IN","Brownstown, IN","Corunna, MI","Bedford","IN","Brownstown","IN","Corunna","MI","two more articles (4 and 5) on this page, not enough room below, will fill out another google form",  76,"sn89067453", -86.487215,  38.861162, -86.04192,  38.87894, -84.11774,  42.98197
"756",13807,"The farmers' union. ","Memphis, Missouri", -92.17129, 40.457812,"Memphis","Missouri","1/4/1894",1894, 1, 4,"seq-6","https://articleextractor.org/pages/13807/mohi_flash_ver02/sn89067453/1894/01/04/ed-1/seq-6/1","Decatur, IL","Paris, TX","NA, MN","Decatur","IL","Paris","TX",NA,"MN","I just noticed upon scrolling that there are seven articles on this page, not just five. Will continue below ( from article 4 and up).",  76,"sn89067453", -88.954800,  39.840315, -95.55551,  33.66094, -93.26501,  44.97775
"757",13807,"The farmers' union. ","Memphis, Missouri", -92.17129, 40.457812,"Memphis","Missouri","1/4/1894",1894, 1, 4,"seq-6","https://articleextractor.org/pages/13807/mohi_flash_ver02/sn89067453/1894/01/04/ed-1/seq-6/1","knoxville, TN","Bakersville, NC","Memphis, TN","knoxville","TN","Bakersville","NC","Memphis","TN","continuation of 13807",  76,"sn89067453", -83.920739,  35.960638, -82.15874,  36.01567, -90.04898,  35.14953
"758",13807,"The farmers' union. ","Memphis, Missouri", -92.17129, 40.457812,"Memphis","Missouri","1/4/1894",1894, 1, 4,"seq-6","https://articleextractor.org/pages/13807/mohi_flash_ver02/sn89067453/1894/01/04/ed-1/seq-6/1","Roanoke, VA","Bardwell, KY","NA, NA","Roanoke","VA","Bardwell","KY",NA,NA,"continuation of 13807",  76,"sn89067453", -79.941427,  37.270970, -89.00979,  36.87061,NA,NA
"759",13807,"The farmers' union. ","Memphis, Missouri", -92.17129, 40.457812,"Memphis","Missouri","1/4/1894",1894, 1, 4,"seq-6","https://articleextractor.org/pages/13807/mohi_flash_ver02/sn89067453/1894/01/04/ed-1/seq-6/1","Bedford, IN","Brownstown, IN","Corunna, MI","Bedford","IN","Brownstown","IN","Corunna","MI","two more articles (4 and 5) on this page, not enough room below, will fill out another google form",  77,"sn89067453", -86.487215,  38.861162, -86.04192,  38.87894, -84.11774,  42.98197
"760",13807,"The farmers' union. ","Memphis, Missouri", -92.17129, 40.457812,"Memphis","Missouri","1/4/1894",1894, 1, 4,"seq-6","https://articleextractor.org/pages/13807/mohi_flash_ver02/sn89067453/1894/01/04/ed-1/seq-6/1","Decatur, IL","Paris, TX","NA, MN","Decatur","IL","Paris","TX",NA,"MN","I just noticed upon scrolling that there are seven articles on this page, not just five. Will continue below ( from article 4 and up).",  77,"sn89067453", -88.954800,  39.840315, -95.55551,  33.66094, -93.26501,  44.97775
"761",13807,"The farmers' union. ","Memphis, Missouri", -92.17129, 40.457812,"Memphis","Missouri","1/4/1894",1894, 1, 4,"seq-6","https://articleextractor.org/pages/13807/mohi_flash_ver02/sn89067453/1894/01/04/ed-1/seq-6/1","knoxville, TN","Bakersville, NC","Memphis, TN","knoxville","TN","Bakersville","NC","Memphis","TN","continuation of 13807",  77,"sn89067453", -83.920739,  35.960638, -82.15874,  36.01567, -90.04898,  35.14953
"762",13807,"The farmers' union. ","Memphis, Missouri", -92.17129, 40.457812,"Memphis","Missouri","1/4/1894",1894, 1, 4,"seq-6","https://articleextractor.org/pages/13807/mohi_flash_ver02/sn89067453/1894/01/04/ed-1/seq-6/1","Roanoke, VA","Bardwell, KY","NA, NA","Roanoke","VA","Bardwell","KY",NA,NA,"continuation of 13807",  77,"sn89067453", -79.941427,  37.270970, -89.00979,  36.87061,NA,NA
"763",13807,"The farmers' union. ","Memphis, Missouri", -92.17129, 40.457812,"Memphis","Missouri","1/4/1894",1894, 1, 4,"seq-6","https://articleextractor.org/pages/13807/mohi_flash_ver02/sn89067453/1894/01/04/ed-1/seq-6/1","Bedford, IN","Brownstown, IN","Corunna, MI","Bedford","IN","Brownstown","IN","Corunna","MI","two more articles (4 and 5) on this page, not enough room below, will fill out another google form",  78,"sn89067453", -86.487215,  38.861162, -86.04192,  38.87894, -84.11774,  42.98197
"764",13807,"The farmers' union. ","Memphis, Missouri", -92.17129, 40.457812,"Memphis","Missouri","1/4/1894",1894, 1, 4,"seq-6","https://articleextractor.org/pages/13807/mohi_flash_ver02/sn89067453/1894/01/04/ed-1/seq-6/1","Decatur, IL","Paris, TX","NA, MN","Decatur","IL","Paris","TX",NA,"MN","I just noticed upon scrolling that there are seven articles on this page, not just five. Will continue below ( from article 4 and up).",  78,"sn89067453", -88.954800,  39.840315, -95.55551,  33.66094, -93.26501,  44.97775
"765",13807,"The farmers' union. ","Memphis, Missouri", -92.17129, 40.457812,"Memphis","Missouri","1/4/1894",1894, 1, 4,"seq-6","https://articleextractor.org/pages/13807/mohi_flash_ver02/sn89067453/1894/01/04/ed-1/seq-6/1","knoxville, TN","Bakersville, NC","Memphis, TN","knoxville","TN","Bakersville","NC","Memphis","TN","continuation of 13807",  78,"sn89067453", -83.920739,  35.960638, -82.15874,  36.01567, -90.04898,  35.14953
"766",13807,"The farmers' union. ","Memphis, Missouri", -92.17129, 40.457812,"Memphis","Missouri","1/4/1894",1894, 1, 4,"seq-6","https://articleextractor.org/pages/13807/mohi_flash_ver02/sn89067453/1894/01/04/ed-1/seq-6/1","Roanoke, VA","Bardwell, KY","NA, NA","Roanoke","VA","Bardwell","KY",NA,NA,"continuation of 13807",  78,"sn89067453", -79.941427,  37.270970, -89.00979,  36.87061,NA,NA
"767",13807,"The farmers' union. ","Memphis, Missouri", -92.17129, 40.457812,"Memphis","Missouri","1/4/1894",1894, 1, 4,"seq-6","https://articleextractor.org/pages/13807/mohi_flash_ver02/sn89067453/1894/01/04/ed-1/seq-6/1","Bedford, IN","Brownstown, IN","Corunna, MI","Bedford","IN","Brownstown","IN","Corunna","MI","two more articles (4 and 5) on this page, not enough room below, will fill out another google form",  79,"sn89067453", -86.487215,  38.861162, -86.04192,  38.87894, -84.11774,  42.98197
"768",13807,"The farmers' union. ","Memphis, Missouri", -92.17129, 40.457812,"Memphis","Missouri","1/4/1894",1894, 1, 4,"seq-6","https://articleextractor.org/pages/13807/mohi_flash_ver02/sn89067453/1894/01/04/ed-1/seq-6/1","Decatur, IL","Paris, TX","NA, MN","Decatur","IL","Paris","TX",NA,"MN","I just noticed upon scrolling that there are seven articles on this page, not just five. Will continue below ( from article 4 and up).",  79,"sn89067453", -88.954800,  39.840315, -95.55551,  33.66094, -93.26501,  44.97775
"769",13807,"The farmers' union. ","Memphis, Missouri", -92.17129, 40.457812,"Memphis","Missouri","1/4/1894",1894, 1, 4,"seq-6","https://articleextractor.org/pages/13807/mohi_flash_ver02/sn89067453/1894/01/04/ed-1/seq-6/1","knoxville, TN","Bakersville, NC","Memphis, TN","knoxville","TN","Bakersville","NC","Memphis","TN","continuation of 13807",  79,"sn89067453", -83.920739,  35.960638, -82.15874,  36.01567, -90.04898,  35.14953
"770",13807,"The farmers' union. ","Memphis, Missouri", -92.17129, 40.457812,"Memphis","Missouri","1/4/1894",1894, 1, 4,"seq-6","https://articleextractor.org/pages/13807/mohi_flash_ver02/sn89067453/1894/01/04/ed-1/seq-6/1","Roanoke, VA","Bardwell, KY","NA, NA","Roanoke","VA","Bardwell","KY",NA,NA,"continuation of 13807",  79,"sn89067453", -79.941427,  37.270970, -89.00979,  36.87061,NA,NA
"771",13807,"The farmers' union. ","Memphis, Missouri", -92.17129, 40.457812,"Memphis","Missouri","1/4/1894",1894, 1, 4,"seq-6","https://articleextractor.org/pages/13807/mohi_flash_ver02/sn89067453/1894/01/04/ed-1/seq-6/1","Bedford, IN","Brownstown, IN","Corunna, MI","Bedford","IN","Brownstown","IN","Corunna","MI","two more articles (4 and 5) on this page, not enough room below, will fill out another google form",  80,"sn89067453", -86.487215,  38.861162, -86.04192,  38.87894, -84.11774,  42.98197
"772",13807,"The farmers' union. ","Memphis, Missouri", -92.17129, 40.457812,"Memphis","Missouri","1/4/1894",1894, 1, 4,"seq-6","https://articleextractor.org/pages/13807/mohi_flash_ver02/sn89067453/1894/01/04/ed-1/seq-6/1","Decatur, IL","Paris, TX","NA, MN","Decatur","IL","Paris","TX",NA,"MN","I just noticed upon scrolling that there are seven articles on this page, not just five. Will continue below ( from article 4 and up).",  80,"sn89067453", -88.954800,  39.840315, -95.55551,  33.66094, -93.26501,  44.97775
"773",13807,"The farmers' union. ","Memphis, Missouri", -92.17129, 40.457812,"Memphis","Missouri","1/4/1894",1894, 1, 4,"seq-6","https://articleextractor.org/pages/13807/mohi_flash_ver02/sn89067453/1894/01/04/ed-1/seq-6/1","knoxville, TN","Bakersville, NC","Memphis, TN","knoxville","TN","Bakersville","NC","Memphis","TN","continuation of 13807",  80,"sn89067453", -83.920739,  35.960638, -82.15874,  36.01567, -90.04898,  35.14953
"774",13807,"The farmers' union. ","Memphis, Missouri", -92.17129, 40.457812,"Memphis","Missouri","1/4/1894",1894, 1, 4,"seq-6","https://articleextractor.org/pages/13807/mohi_flash_ver02/sn89067453/1894/01/04/ed-1/seq-6/1","Roanoke, VA","Bardwell, KY","NA, NA","Roanoke","VA","Bardwell","KY",NA,NA,"continuation of 13807",  80,"sn89067453", -79.941427,  37.270970, -89.00979,  36.87061,NA,NA
"775",13807,"The farmers' union. ","Memphis, Missouri", -92.17129, 40.457812,"Memphis","Missouri","1/4/1894",1894, 1, 4,"seq-6","https://articleextractor.org/pages/13807/mohi_flash_ver02/sn89067453/1894/01/04/ed-1/seq-6/1","Bedford, IN","Brownstown, IN","Corunna, MI","Bedford","IN","Brownstown","IN","Corunna","MI","two more articles (4 and 5) on this page, not enough room below, will fill out another google form",  81,"sn89067453", -86.487215,  38.861162, -86.04192,  38.87894, -84.11774,  42.98197
"776",13807,"The farmers' union. ","Memphis, Missouri", -92.17129, 40.457812,"Memphis","Missouri","1/4/1894",1894, 1, 4,"seq-6","https://articleextractor.org/pages/13807/mohi_flash_ver02/sn89067453/1894/01/04/ed-1/seq-6/1","Decatur, IL","Paris, TX","NA, MN","Decatur","IL","Paris","TX",NA,"MN","I just noticed upon scrolling that there are seven articles on this page, not just five. Will continue below ( from article 4 and up).",  81,"sn89067453", -88.954800,  39.840315, -95.55551,  33.66094, -93.26501,  44.97775
"777",13807,"The farmers' union. ","Memphis, Missouri", -92.17129, 40.457812,"Memphis","Missouri","1/4/1894",1894, 1, 4,"seq-6","https://articleextractor.org/pages/13807/mohi_flash_ver02/sn89067453/1894/01/04/ed-1/seq-6/1","knoxville, TN","Bakersville, NC","Memphis, TN","knoxville","TN","Bakersville","NC","Memphis","TN","continuation of 13807",  81,"sn89067453", -83.920739,  35.960638, -82.15874,  36.01567, -90.04898,  35.14953
"778",13807,"The farmers' union. ","Memphis, Missouri", -92.17129, 40.457812,"Memphis","Missouri","1/4/1894",1894, 1, 4,"seq-6","https://articleextractor.org/pages/13807/mohi_flash_ver02/sn89067453/1894/01/04/ed-1/seq-6/1","Roanoke, VA","Bardwell, KY","NA, NA","Roanoke","VA","Bardwell","KY",NA,NA,"continuation of 13807",  81,"sn89067453", -79.941427,  37.270970, -89.00979,  36.87061,NA,NA
"779",13807,"The farmers' union. ","Memphis, Missouri", -92.17129, 40.457812,"Memphis","Missouri","1/4/1894",1894, 1, 4,"seq-6","https://articleextractor.org/pages/13807/mohi_flash_ver02/sn89067453/1894/01/04/ed-1/seq-6/1","Bedford, IN","Brownstown, IN","Corunna, MI","Bedford","IN","Brownstown","IN","Corunna","MI","two more articles (4 and 5) on this page, not enough room below, will fill out another google form",  82,"sn89067453", -86.487215,  38.861162, -86.04192,  38.87894, -84.11774,  42.98197
"780",13807,"The farmers' union. ","Memphis, Missouri", -92.17129, 40.457812,"Memphis","Missouri","1/4/1894",1894, 1, 4,"seq-6","https://articleextractor.org/pages/13807/mohi_flash_ver02/sn89067453/1894/01/04/ed-1/seq-6/1","Decatur, IL","Paris, TX","NA, MN","Decatur","IL","Paris","TX",NA,"MN","I just noticed upon scrolling that there are seven articles on this page, not just five. Will continue below ( from article 4 and up).",  82,"sn89067453", -88.954800,  39.840315, -95.55551,  33.66094, -93.26501,  44.97775
"781",13807,"The farmers' union. ","Memphis, Missouri", -92.17129, 40.457812,"Memphis","Missouri","1/4/1894",1894, 1, 4,"seq-6","https://articleextractor.org/pages/13807/mohi_flash_ver02/sn89067453/1894/01/04/ed-1/seq-6/1","knoxville, TN","Bakersville, NC","Memphis, TN","knoxville","TN","Bakersville","NC","Memphis","TN","continuation of 13807",  82,"sn89067453", -83.920739,  35.960638, -82.15874,  36.01567, -90.04898,  35.14953
"782",13807,"The farmers' union. ","Memphis, Missouri", -92.17129, 40.457812,"Memphis","Missouri","1/4/1894",1894, 1, 4,"seq-6","https://articleextractor.org/pages/13807/mohi_flash_ver02/sn89067453/1894/01/04/ed-1/seq-6/1","Roanoke, VA","Bardwell, KY","NA, NA","Roanoke","VA","Bardwell","KY",NA,NA,"continuation of 13807",  82,"sn89067453", -79.941427,  37.270970, -89.00979,  36.87061,NA,NA
"783",13807,"The farmers' union. ","Memphis, Missouri", -92.17129, 40.457812,"Memphis","Missouri","1/4/1894",1894, 1, 4,"seq-6","https://articleextractor.org/pages/13807/mohi_flash_ver02/sn89067453/1894/01/04/ed-1/seq-6/1","Bedford, IN","Brownstown, IN","Corunna, MI","Bedford","IN","Brownstown","IN","Corunna","MI","two more articles (4 and 5) on this page, not enough room below, will fill out another google form",  83,"sn89067453", -86.487215,  38.861162, -86.04192,  38.87894, -84.11774,  42.98197
"784",13807,"The farmers' union. ","Memphis, Missouri", -92.17129, 40.457812,"Memphis","Missouri","1/4/1894",1894, 1, 4,"seq-6","https://articleextractor.org/pages/13807/mohi_flash_ver02/sn89067453/1894/01/04/ed-1/seq-6/1","Decatur, IL","Paris, TX","NA, MN","Decatur","IL","Paris","TX",NA,"MN","I just noticed upon scrolling that there are seven articles on this page, not just five. Will continue below ( from article 4 and up).",  83,"sn89067453", -88.954800,  39.840315, -95.55551,  33.66094, -93.26501,  44.97775
"785",13807,"The farmers' union. ","Memphis, Missouri", -92.17129, 40.457812,"Memphis","Missouri","1/4/1894",1894, 1, 4,"seq-6","https://articleextractor.org/pages/13807/mohi_flash_ver02/sn89067453/1894/01/04/ed-1/seq-6/1","knoxville, TN","Bakersville, NC","Memphis, TN","knoxville","TN","Bakersville","NC","Memphis","TN","continuation of 13807",  83,"sn89067453", -83.920739,  35.960638, -82.15874,  36.01567, -90.04898,  35.14953
"786",13807,"The farmers' union. ","Memphis, Missouri", -92.17129, 40.457812,"Memphis","Missouri","1/4/1894",1894, 1, 4,"seq-6","https://articleextractor.org/pages/13807/mohi_flash_ver02/sn89067453/1894/01/04/ed-1/seq-6/1","Roanoke, VA","Bardwell, KY","NA, NA","Roanoke","VA","Bardwell","KY",NA,NA,"continuation of 13807",  83,"sn89067453", -79.941427,  37.270970, -89.00979,  36.87061,NA,NA
"787",13808,"Birmingham age-herald ","Birmingham, Alabama", -86.81036, 33.518589,"Birmingham","Alabama","9/4/1894",1894, 9, 4,"seq-4","https://articleextractor.org/pages/13808/au_abernethy_ver01/sn84020639/1894/09/04/ed-1/seq-4/1","NA, NA","NA, NA","NA, NA",NA,NA,NA,NA,NA,NA,"no lynching",  84,"sn84020639",NA,NA,NA,NA,NA,NA
"788",13810,"Phillipsburg herald ","Phillipsburg, Kansas", -99.32398, 39.756121,"Phillipsburg","Kansas","5/17/1894",1894, 5,17,"seq-1","https://articleextractor.org/pages/13810/khi_curry_ver01/sn85029677/1894/05/17/ed-1/seq-1/1","Sharon Springs, KS","NA, NA","NA, NA","Sharon Springs","KS",NA,NA,NA,NA,"two lynched",  85,"sn85029677",-101.752116,  38.897787,NA,NA,NA,NA
"789",13811,"Potosi journal. ","Potosi, Missouri", -90.78791, 37.936438,"Potosi","Missouri","6/1/1898",1898, 6, 1,"seq-2","https://articleextractor.org/pages/13811/mohi_marmaduke_ver02/sn90061371/1898/06/01/ed-1/seq-2/1","NA, NA","NA, NA","NA, NA",NA,NA,NA,NA,NA,NA,"One lynched, does not say what state or city",  86,"sn90061371",NA,NA,NA,NA,NA,NA
"790",13812,"The Washington weekly post. ","Washington, District of Columbia", -77.03687, 38.907192,"Washington","District of Columbia","5/2/1899",1899, 5, 2,"seq-1","https://articleextractor.org/pages/13812/dlc_echo_ver01/sn87062234/1899/05/02/ed-1/seq-1/1","Memphis, TN","NA, NA","NA, NA","Memphis","TN",NA,NA,NA,NA,"second article on page has no lynchings",  87,"sn87062234", -90.048980,  35.149534,NA,NA,NA,NA
"791",13812,"The Washington weekly post. ","Washington, District of Columbia", -77.03687, 38.907192,"Washington","District of Columbia","5/2/1899",1899, 5, 2,"seq-1","https://articleextractor.org/pages/13812/dlc_echo_ver01/sn87062234/1899/05/02/ed-1/seq-1/1","Memphis, TN","NA, NA","NA, NA","Memphis","TN",NA,NA,NA,NA,"second article on page has no lynchings",  88,"sn87062234", -90.048980,  35.149534,NA,NA,NA,NA
"792",13813,"The Topeka state journal ","Topeka, Kansas", -95.67516, 39.047345,"Topeka","Kansas","7/22/1899",1899, 7,22,"seq-1","https://articleextractor.org/pages/13813/khi_jesse_ver01/sn82016014/1899/07/22/ed-1/seq-1/1","mexico, MO","Alma, KS","NA, NA","mexico","MO","Alma","KS",NA,NA,"second article- planned/suspected lynching, did not occur",  89,"sn82016014", -91.887271,  39.173065, -96.28916,  39.01667,NA,NA
"793",13813,"The Topeka state journal ","Topeka, Kansas", -95.67516, 39.047345,"Topeka","Kansas","7/22/1899",1899, 7,22,"seq-1","https://articleextractor.org/pages/13813/khi_jesse_ver01/sn82016014/1899/07/22/ed-1/seq-1/1","mexico, MO","Alma, KS","NA, NA","mexico","MO","Alma","KS",NA,NA,"second article- planned/suspected lynching, did not occur",  90,"sn82016014", -91.887271,  39.173065, -96.28916,  39.01667,NA,NA
"794",13814,"Ottumwa semi-weekly courier ","Ottumwa, Iowa", -92.40830, 41.016029,"Ottumwa","Iowa","11/18/1902",1902,11,18,"seq-1","https://articleextractor.org/pages/13814/iahi_isbell_ver01/sn86061214/1902/11/18/ed-1/seq-1/1","Elizabethtown, KY","NA, NA","NA, NA","Elizabethtown","KY",NA,NA,NA,NA,NA,  91,"sn86061214", -85.864941,  37.703065,NA,NA,NA,NA
"795",13815,"The Ogden standard ","Ogden City, Utah",-111.97383, 41.223000,"Ogden City","Utah","11/24/1909",1909,11,24,"seq-6","https://articleextractor.org/pages/13815/uuml_fourteen_ver01/sn85058398/1909/11/24/ed-1/seq-6/1","Anniston, AL","NA, NA","NA, NA","Anniston","AL",NA,NA,NA,NA,NA,  92,"sn85058398", -85.831632,  33.659826,NA,NA,NA,NA
"796",13818,"The Topeka state journal ","Topeka, Kansas", -95.67516, 39.047345,"Topeka","Kansas","6/11/1902",1902, 6,11,"seq-8","https://articleextractor.org/pages/13818/khi_higuchi_ver01/sn82016014/1902/06/11/ed-1/seq-8/1","Charlotte, NC","NA, NA","NA, NA","Charlotte","NC",NA,NA,NA,NA,"two lynched",  93,"sn82016014", -80.843127,  35.227087,NA,NA,NA,NA
"797",13819,"Deseret evening news ","Great Salt Lake, Utah",-112.47683, 41.115791,"Great Salt Lake","Utah","7/31/1902",1902, 7,31,"seq-1","https://articleextractor.org/pages/13819/uuml_nine_ver01/sn83045555/1902/07/31/ed-1/seq-1/1","cornie bottoms, 25 miles from Magnolia, AR","Leesburg, VA","NA, NA","cornie bottoms, 25 miles from Magnolia","AR","Leesburg","VA",NA,NA,NA,  94,"sn83045555", -93.177966,  33.128518, -77.56453,  39.11545,NA,NA
"798",13819,"Deseret evening news ","Great Salt Lake, Utah",-112.47683, 41.115791,"Great Salt Lake","Utah","7/31/1902",1902, 7,31,"seq-1","https://articleextractor.org/pages/13819/uuml_nine_ver01/sn83045555/1902/07/31/ed-1/seq-1/1","cornie bottoms, 25 miles from Magnolia, AR","Leesburg, VA","NA, NA","cornie bottoms, 25 miles from Magnolia","AR","Leesburg","VA",NA,NA,NA,  95,"sn83045555", -93.177966,  33.128518, -77.56453,  39.11545,NA,NA
"799",13820,"Rock Island Argus. ","Rock Island, Illinois", -90.57875, 41.509477,"Rock Island","Illinois","8/1/1902",1902, 8, 1,"seq-1","https://articleextractor.org/pages/13820/iune_folio_ver01/sn92053934/1902/08/01/ed-1/seq-1/1","a few miles from Leesburg, VA","NA, NA","NA, NA","a few miles from Leesburg","VA",NA,NA,NA,NA,NA,  96,"sn92053934", -77.564532,  39.115452,NA,NA,NA,NA
"800",13823,"Ceredo advance ","Ceredo, West Virginia", -82.55877, 38.396471,"Ceredo","West Virginia","10/7/1903",1903,10, 7,"seq-2","https://articleextractor.org/pages/13823/wvu_moore_ver01/sn86092392/1903/10/07/ed-1/seq-2/1","Oxford, OH","NA, NA","NA, NA","Oxford","OH",NA,NA,NA,NA,"Officials prevented a lynching here at the time this article was written. However, two separate lynchings occurred at this location 11 years prior and 25 years prior",  98,"sn86092392", -84.745231,  39.506997,NA,NA,NA,NA
"801",13824,"Northern Wisconsin advertiser ","Wabeno, Wisconsin", -88.66025, 45.438842,"Wabeno","Wisconsin","8/20/1903",1903, 8,20,"seq-2","https://articleextractor.org/pages/13824/whi_jarvey_ver01/sn85040705/1903/08/20/ed-1/seq-2/1","whitesboro, TX","NA, NA","NA, NA","whitesboro","TX",NA,NA,NA,NA,NA,  99,"sn85040705", -96.906948,  33.656218,NA,NA,NA,NA
"802",13826,"New-York tribune ","New York , New York", -74.00597, 40.712775,"New York ","New York","9/2/1903",1903, 9, 2,"seq-4","https://articleextractor.org/pages/13826/dlc_mexico_ver01/sn83030214/1903/09/02/ed-1/seq-4/1","Shawneetown, IL","NA, NA","NA, NA","Shawneetown","IL",NA,NA,NA,NA,"Attempted lynching", 100,"sn83030214", -88.186703,  37.713102,NA,NA,NA,NA
"803",13827,"The Waxahachie daily light ","Waxahachie, Texas", -96.84833, 32.386531,"Waxahachie","Texas","9/16/1903",1903, 9,16,"seq-2","https://articleextractor.org/pages/13827/txdn_dewitt_ver01/sn86090369/1903/09/16/ed-1/seq-2/1","Centerville, MS","NA, NA","NA, NA","Centerville","MS",NA,NA,NA,NA,NA, 101,"sn86090369", -91.068438,  31.089620,NA,NA,NA,NA
"804",13828,"The Savannah morning news. ","Savannah, Georgia", -81.09120, 32.080899,"Savannah","Georgia","3/11/1904",1904, 3,11,"seq-4","https://articleextractor.org/pages/13828/gu_holmes_ver01/sn89053684/1904/03/11/ed-1/seq-4/1","Murphysboro, IL","NA, NA","NA, NA","Murphysboro","IL",NA,NA,NA,NA,"attempted lynching", 102,"sn89053684", -89.335089,  37.764495,NA,NA,NA,NA
"805",13829,"Vernon County censor ","Viroqua, Wisconsin", -90.88874, 43.556917,"Viroqua","Wisconsin","9/7/1904",1904, 9, 7,"seq-10","https://articleextractor.org/pages/13829/whi_clabbert_ver01/sn85040451/1904/09/07/ed-1/seq-10/1","NA, NA","NA, NA","NA, NA",NA,NA,NA,NA,NA,NA,"no lynching occurred", 103,"sn85040451",NA,NA,NA,NA,NA,NA
"806",13830,"Perth Amboy evening news ","Perth Amboy, New Jersey", -74.26542, 40.506772,"Perth Amboy","New Jersey","8/6/1904",1904, 8, 6,"seq-6","https://articleextractor.org/pages/13830/njr_allspice_ver02/sn85035720/1904/08/06/ed-2/seq-6/1","Hartford, CT","NA, NA","NA, NA","Hartford","CT",NA,NA,NA,NA,"Attempted lynching by mob- tried to force way through to get the prisoner, yelled ""lynch him""", 104,"sn85035720", -72.673372,  41.765804,NA,NA,NA,NA
"807",13831,"The Savannah morning news. ","Savannah, Georgia", -81.09120, 32.080899,"Savannah","Georgia","8/22/1904",1904, 8,22,"seq-8","https://articleextractor.org/pages/13831/gu_inspector_ver01/sn89053684/1904/08/22/ed-1/seq-8/1","NA, NA","NA, NA","NA, NA",NA,NA,NA,NA,NA,NA,"no lynching occurred", 105,"sn89053684",NA,NA,NA,NA,NA,NA
"808",13831,"The Savannah morning news. ","Savannah, Georgia", -81.09120, 32.080899,"Savannah","Georgia","8/22/1904",1904, 8,22,"seq-8","https://articleextractor.org/pages/13831/gu_inspector_ver01/sn89053684/1904/08/22/ed-1/seq-8/1","NA, NA","NA, NA","NA, NA",NA,NA,NA,NA,NA,NA,"no lynching occurred", 106,"sn89053684",NA,NA,NA,NA,NA,NA
"809",13832,"The Jackson herald. ","Jackson, Missouri", -89.66621, 37.382273,"Jackson","Missouri","1/7/1904",1904, 1, 7,"seq-3","https://articleextractor.org/pages/13832/mohi_felice_ver01/sn89066620/1904/01/07/ed-1/seq-3/1","Thebes, IL","NA, NA","NA, NA","Thebes","IL",NA,NA,NA,NA,"occurred ""last spring""", 107,"sn89066620", -89.460921,  37.220884,NA,NA,NA,NA
"810",13834,"The Leavenworth echo ","Leavenworth, Washington",-120.66148, 47.596233,"Leavenworth","Washington","3/18/1904",1904, 3,18,"seq-4","https://articleextractor.org/pages/13834/wa_cedar_ver01/sn87093039/1904/03/18/ed-1/seq-4/1","NA, OH","NA, NA","NA, NA",NA,"OH",NA,NA,NA,NA,"I can infer this occurred in Ohio by context, but it does not say for sure, or what town- Jenny G", 108,"sn87093039",NA,NA,NA,NA,NA,NA
"811",13835,"The Salt Lake herald ","Salt Lake City , Utah",-111.89105, 40.760779,"Salt Lake City ","Utah","6/21/1905",1905, 6,21,"seq-2","https://articleextractor.org/pages/13835/uuml_four_ver01/sn85058130/1905/06/21/ed-1/seq-2/1","Hohenwald, TN","NA, NA","NA, NA","Hohenwald","TN",NA,NA,NA,NA,"shot to death", 109,"sn85058130", -87.551963,  35.547851,NA,NA,NA,NA
"812",13836,"The interior journal ","Stanford, Kentucky", -84.66189, 37.531190,"Stanford","Kentucky","1/14/1910",1910, 1,14,"seq-4","https://articleextractor.org/pages/13836/kyu_fernico_ver01/sn85052021/1910/01/14/ed-1/seq-4/1","Vienna, IL","NA, NA","NA, NA","Vienna","IL",NA,NA,NA,NA,"Planned lynching- guards worked to preventing it", 110,"sn85052021", -88.897843,  37.415329,NA,NA,NA,NA
"813",13837,"Owingsville outlook ","Owingsville, Kentucky", -83.76408, 38.144801,"Owingsville","Kentucky","8/10/1905",1905, 8,10,"seq-3","https://articleextractor.org/pages/13837/kyu_elvis_ver01/sn86069620/1905/08/10/ed-1/seq-3/1","Hattiesburg, MS","NA, NA","NA, NA","Hattiesburg","MS",NA,NA,NA,NA,"Three Black people lynched here, according to ""advices""", 111,"sn86069620", -89.290339,  31.327119,NA,NA,NA,NA
"814",13839,"Perrysburg journal. ","Perrysburg, Ohio", -83.62716, 41.556996,"Perrysburg","Ohio","11/3/1905",1905,11, 3,"seq-2","https://articleextractor.org/pages/13839/ohi_foxtrot_ver01/sn87076843/1905/11/03/ed-1/seq-2/1","Bainbridge, LA","NA, NA","NA, NA","Bainbridge","LA",NA,NA,NA,NA,NA, 112,"sn87076843",-118.435697,  34.079253,NA,NA,NA,NA
"815",13840,"The mirror. ","Stillwater, Minnesota", -92.80884, 45.056004,"Stillwater","Minnesota","8/24/1905",1905, 8,24,"seq-2","https://articleextractor.org/pages/13840/mnhi_disco_ver01/sn90060762/1905/08/24/ed-1/seq-2/1","NA, NA","NA, NA","NA, NA",NA,NA,NA,NA,NA,NA,"lynchings occurred ""in the south"" but nothing else was specified", 113,"sn90060762",NA,NA,NA,NA,NA,NA
"816",13843,"Evening capital. ","Annapolis, Maryland", -76.49218, 38.978445,"Annapolis","Maryland","10/11/1905",1905,10,11,"seq-2","https://articleextractor.org/pages/13843/mdu_kensington_ver02/sn88065721/1905/10/11/ed-1/seq-2/2","Bainbridge, GA","NA, NA","NA, NA","Bainbridge","GA",NA,NA,NA,NA,NA, 115,"sn88065721", -84.575470,  30.903800,NA,NA,NA,NA
"817",13844,"The semi-weekly messenger ","Wilmington, North Carolina", -77.88681, 34.210389,"Wilmington","North Carolina","12/29/1905",1905,12,29,"seq-5","https://articleextractor.org/pages/13844/ncu_green_ver01/sn91068367/1905/12/29/ed-1/seq-5/1","barnwell, SC","no lynching, NA","no lynching, NA","barnwell","SC","no lynching",NA,"no lynching",NA,"Article 1- double lynching", 116,"sn91068367", -81.358718,  33.244873,NA,NA,NA,NA
"818",13844,"The semi-weekly messenger ","Wilmington, North Carolina", -77.88681, 34.210389,"Wilmington","North Carolina","12/29/1905",1905,12,29,"seq-5","https://articleextractor.org/pages/13844/ncu_green_ver01/sn91068367/1905/12/29/ed-1/seq-5/1","barnwell, SC","no lynching, NA","no lynching, NA","barnwell","SC","no lynching",NA,"no lynching",NA,"Article 1- double lynching", 117,"sn91068367", -81.358718,  33.244873,NA,NA,NA,NA
"819",13844,"The semi-weekly messenger ","Wilmington, North Carolina", -77.88681, 34.210389,"Wilmington","North Carolina","12/29/1905",1905,12,29,"seq-5","https://articleextractor.org/pages/13844/ncu_green_ver01/sn91068367/1905/12/29/ed-1/seq-5/1","barnwell, SC","no lynching, NA","no lynching, NA","barnwell","SC","no lynching",NA,"no lynching",NA,"Article 1- double lynching", 118,"sn91068367", -81.358718,  33.244873,NA,NA,NA,NA
"820",13846,"The Salt Lake tribune ","Salt Lake City, Utah",-111.89105, 40.760779,"Salt Lake City","Utah","6/5/1905",1905, 6, 5,"seq-1","https://articleextractor.org/pages/13846/uuml_merckx_ver01/sn83045396/1905/06/05/ed-1/seq-1/1","Lousville, MS","NA, NA","NA, NA","Lousville","MS",NA,NA,NA,NA,NA, 119,"sn83045396", -89.055062,  33.123738,NA,NA,NA,NA
"821",13847,"The Guthrie daily leader ","Guthrie, Oklahoma", -97.42532, 35.878937,"Guthrie","Oklahoma","6/29/1905",1905, 6,29,"seq-1","https://articleextractor.org/pages/13847/okhi_delaware_ver01/sn86063952/1905/06/29/ed-1/seq-1/1","Watkinsville, GA","NA, NA","NA, NA","Watkinsville","GA",NA,NA,NA,NA,"Seven Black men and one White man were lynched", 120,"sn86063952", -83.408771,  33.862896,NA,NA,NA,NA
"822",13848,"The commonwealth. ","Greenwood, Mississippi", -90.17953, 33.516232,"Greenwood","Mississippi","3/18/1905",1905, 3,18,"seq-5","https://articleextractor.org/pages/13848/msar_cotton_ver01/sn89065008/1905/03/18/ed-1/seq-5/1","NA, NA","NA, NA","NA, NA",NA,NA,NA,NA,NA,NA,"State or city is not listed, says man was lynched on his way to jail in Washington County- Jenny G", 121,"sn89065008",NA,NA,NA,NA,NA,NA
"823",13849,"The frontier. ","O'Neill City, Nebraska", -98.64789, 42.457672,"O'Neill City","Nebraska","9/7/1905",1905, 9, 7,"seq-6","https://articleextractor.org/pages/13849/nbu_keithsbear_ver02/2010270509/1905/09/07/ed-1/seq-6/1","lincoln, NE","no lynching, NA","no lynching, NA","lincoln","NE","no lynching",NA,"no lynching",NA,"Attempted lynching", 122,"2010270509", -96.702596,  40.813616,NA,NA,NA,NA
"824",13849,"The frontier. ","O'Neill City, Nebraska", -98.64789, 42.457672,"O'Neill City","Nebraska","9/7/1905",1905, 9, 7,"seq-6","https://articleextractor.org/pages/13849/nbu_keithsbear_ver02/2010270509/1905/09/07/ed-1/seq-6/1","lincoln, NE","no lynching, NA","no lynching, NA","lincoln","NE","no lynching",NA,"no lynching",NA,"Attempted lynching", 123,"2010270509", -96.702596,  40.813616,NA,NA,NA,NA
"825",13849,"The frontier. ","O'Neill City, Nebraska", -98.64789, 42.457672,"O'Neill City","Nebraska","9/7/1905",1905, 9, 7,"seq-6","https://articleextractor.org/pages/13849/nbu_keithsbear_ver02/2010270509/1905/09/07/ed-1/seq-6/1","lincoln, NE","no lynching, NA","no lynching, NA","lincoln","NE","no lynching",NA,"no lynching",NA,"Attempted lynching", 124,"2010270509", -96.702596,  40.813616,NA,NA,NA,NA
"826",13850,"The Salt Lake herald ","Salt Lake City , Utah",-111.89105, 40.760779,"Salt Lake City ","Utah","7/7/1905",1905, 7, 7,"seq-3","https://articleextractor.org/pages/13850/uuml_four_ver01/sn85058130/1905/07/07/ed-1/seq-3/1","Dumas, AR","NA, NA","NA, NA","Dumas","AR",NA,NA,NA,NA,"Black man lynched for marrying a white girl", 125,"sn85058130", -91.483520,  33.883416,NA,NA,NA,NA
"827",13851,"The Salt Lake herald ","Salt Lake City , Utah",-111.89105, 40.760779,"Salt Lake City ","Utah","8/27/1905",1905, 8,27,"seq-2","https://articleextractor.org/pages/13851/uuml_four_ver01/sn85058130/1905/08/27/ed-1/seq-2/1","Dallas, TX","NA, NA","NA, NA","Dallas","TX",NA,NA,NA,NA,NA, 126,"sn85058130", -96.796988,  32.776664,NA,NA,NA,NA
"828",13852,"Daily Kennebec journal ","Augusta, Maine", -69.77949, 44.310624,"Augusta","Maine","4/23/1907",1907, 4,23,"seq-2","https://articleextractor.org/pages/13852/me_burdin_ver03/sn82014248/1907/04/23/ed-1/seq-2/1","NA, NA","NA, NA","NA, NA",NA,NA,NA,NA,NA,NA,"no lynching", 127,"sn82014248",NA,NA,NA,NA,NA,NA
"829",13853,"The sun ","New York , New York", -74.00597, 40.712775,"New York ","New York","3/16/1907",1907, 3,16,"seq-5","https://articleextractor.org/pages/13853/nn_iqbal_ver01/sn83030272/1907/03/16/ed-1/seq-5/1","monroe, LA","NA, NA","NA, NA","monroe","LA",NA,NA,NA,NA,"Two Black men lynched", 128,"sn83030272", -92.119301,  32.509311,NA,NA,NA,NA
"830",13855,"The Barre daily times. ","Barre, Vermont", -72.50205, 44.197006,"Barre","Vermont","7/22/1907",1907, 7,22,"seq-1","https://articleextractor.org/pages/13855/vtu_broccoli_ver01/sn91066782/1907/07/22/ed-1/seq-1/1","Olive branch, MS","NA, NA","NA, NA","Olive branch","MS",NA,NA,NA,NA,NA, 129,"sn91066782", -89.829532,  34.961760,NA,NA,NA,NA
"831",13856,"The Marion daily mirror. ","Marion, Ohio", -83.12852, 40.588670,"Marion","Ohio","7/16/1907",1907, 7,16,"seq-4","https://articleextractor.org/pages/13856/ohi_juliet_ver01/sn88077573/1907/07/16/ed-1/seq-4/1","NA, TX","NA, NA","NA, NA",NA,"TX",NA,NA,NA,NA,"States the Black man, but does not say exactly where in Texas", 130,"sn88077573", -99.901813,  31.968599,NA,NA,NA,NA
"832",13857,"Pine Bluff daily graphic. ","Pine Bluff, Arkansas", -92.00340, 34.224908,"Pine Bluff","Arkansas","5/7/1907",1907, 5, 7,"seq-8","https://articleextractor.org/pages/13857/arhi_huskerdu_ver01/sn89051168/1907/05/07/ed-1/seq-8/1","Mcgehee, AR","NA, NA","NA, NA","Mcgehee","AR",NA,NA,NA,NA,NA, 131,"sn89051168", -91.383286,  33.610759,NA,NA,NA,NA
"833",13858,"The Wahpeton times ","Wahpeton, North Dakota", -96.60591, 46.265237,"Wahpeton","North Dakota","1/31/1907",1907, 1,31,"seq-2","https://articleextractor.org/pages/13858/ndhi_colfax_ver01/sn84024779/1907/01/31/ed-1/seq-2/1","Greenwood, MS","NA, NA","NA, NA","Greenwood","MS",NA,NA,NA,NA,NA, 132,"sn84024779", -90.179528,  33.516232,NA,NA,NA,NA
"834",13860,"The Salt Lake herald ","Salt Lake City , Utah",-111.89105, 40.760779,"Salt Lake City ","Utah","8/15/1907",1907, 8,15,"seq-1","https://articleextractor.org/pages/13860/uuml_five_ver01/sn85058130/1907/08/15/ed-1/seq-1/1","Boulder, CO","NA, NA","NA, NA","Boulder","CO",NA,NA,NA,NA,"Planned/attempted lynching", 133,"sn85058130",-105.270546,  40.014986,NA,NA,NA,NA
"835",13861,"Omaha daily bee. ","Omaha , Nebraska", -95.93450, 41.256537,"Omaha ","Nebraska","12/27/1907",1907,12,27,"seq-2","https://articleextractor.org/pages/13861/nbu_pound_ver01/sn99021999/1907/12/27/ed-1/seq-2/1","Henrietta (now spelled henryetta), OK","NA, NA","NA, NA","Henrietta (now spelled henryetta)","OK",NA,NA,NA,NA,"One lynching occurred here and one attempted lynching", 134,"sn99021999", -95.981943,  35.439826,NA,NA,NA,NA
"836",13862,"Evening times-Republican ","Marshalltown, Iowa", -92.90804, 42.049467,"Marshalltown","Iowa","3/25/1907",1907, 3,25,"seq-1","https://articleextractor.org/pages/13862/iahi_estes_ver01/sn85049554/1907/03/25/ed-1/seq-1/1","Florence, AL","NA, NA","NA, NA","Florence","AL",NA,NA,NA,NA,NA, 135,"sn85049554", -87.677251,  34.799810,NA,NA,NA,NA
"837",13865,"Evening star ","Washington, District of Columbia", -77.03687, 38.907192,"Washington","District of Columbia","2/27/1907",1907, 2,27,"seq-2","https://articleextractor.org/pages/13865/dlc_vizsla_ver02/sn83045462/1907/02/27/ed-1/seq-2/1","NA, NA","NA, NA","NA, NA",NA,NA,NA,NA,NA,NA,"article 1 and 2- no specific lynching mentioned, although a prevention of a lynching is referred to", 136,"sn83045462",NA,NA,NA,NA,NA,NA
"838",13865,"Evening star ","Washington, District of Columbia", -77.03687, 38.907192,"Washington","District of Columbia","2/27/1907",1907, 2,27,"seq-2","https://articleextractor.org/pages/13865/dlc_vizsla_ver02/sn83045462/1907/02/27/ed-1/seq-2/1","NA, NA","NA, NA","NA, NA",NA,NA,NA,NA,NA,NA,"article 1 and 2- no specific lynching mentioned, although a prevention of a lynching is referred to", 137,"sn83045462",NA,NA,NA,NA,NA,NA
"839",13866,"Watson's weekly Jeffersonian ","Atlanta, Georgia", -84.38768, 33.748752,"Atlanta","Georgia","8/8/1907",1907, 8, 8,"seq-5","https://articleextractor.org/pages/13866/gu_fornax_ver01/sn90052331/1907/08/08/ed-1/seq-5/1","Crisfield, MD","NA, NA","NA, NA","Crisfield","MD",NA,NA,NA,NA,NA, 138,"sn90052331", -75.853821,  37.983458,NA,NA,NA,NA
"840",13867,"Iowa state bystander ","Des Moines, Iowa", -93.62496, 41.586835,"Des Moines","Iowa","12/17/1909",1909,12,17,"seq-2","https://articleextractor.org/pages/13867/iahi_ames_ver01/sn83025186/1909/12/17/ed-1/seq-2/1","NA, NA","NA, NA","NA, NA",NA,NA,NA,NA,NA,NA,"anticipated possibility of a lynching, but no lynching occurred", 139,"sn83025186",NA,NA,NA,NA,NA,NA
"841",13868,"Rock Island Argus. ","Rock Island, Illinois", -90.57875, 41.509477,"Rock Island","Illinois","7/31/1909",1909, 7,31,"seq-9","https://articleextractor.org/pages/13868/iune_heraldry_ver01/sn92053934/1909/07/31/ed-1/seq-9/1","Opelousas, LA","NA, NA","NA, NA","Opelousas","LA",NA,NA,NA,NA,"Two lynched", 140,"sn92053934", -92.081509,  30.533530,NA,NA,NA,NA
"842",13870,"The Mena weekly star. ","Mena, Arkansas", -94.23637, 34.584224,"Mena","Arkansas","5/27/1909",1909, 5,27,"seq-1","https://articleextractor.org/pages/13870/arhi_electabuzz_ver01/sn89051213/1909/05/27/ed-1/seq-1/1","Chattanooga, TN","NA, NA","NA, NA","Chattanooga","TN",NA,NA,NA,NA,"The officials allowed the mob to take and lynch this Black victim", 141,"sn89051213", -85.309399,  35.045798,NA,NA,NA,NA
"843",13871,"The Wenatchee daily world ","Wenatchee, Washington",-120.31035, 47.423460,"Wenatchee","Washington","11/13/1909",1909,11,13,"seq-1","https://articleextractor.org/pages/13871/wa_american_ver02/sn86072041/1909/11/13/ed-1/seq-1/1","Chattanooga, TN","NA, NA","NA, NA","Chattanooga","TN",NA,NA,NA,NA,"same lynching as noted in 13870", 142,"sn86072041", -85.309399,  35.045798,NA,NA,NA,NA
"844",13873,"The Tacoma times ","Tacoma, Washington",-122.44429, 47.252877,"Tacoma","Washington","8/10/1910",1910, 8,10,"seq-1","https://articleextractor.org/pages/13873/wa_elm_ver01/sn88085187/1910/08/10/ed-1/seq-1/1","Newark, OH","NA, NA","NA, NA","Newark","OH",NA,NA,NA,NA,"Mentions a lynching occurred, the byline says Newark Ohio, it is assumed this is where it happened.", 143,"sn88085187", -82.401264,  40.058121,NA,NA,NA,NA
"845",13874,"The Big Sandy news ","Louisa, Kentucky", -82.60321, 38.114254,"Louisa","Kentucky","2/4/1910",1910, 2, 4,"seq-2","https://articleextractor.org/pages/13874/kyu_flamingo_ver01/sn83004226/1910/02/04/ed-1/seq-2/1","Chattanooga, TN","NA, NA","NA, NA","Chattanooga","TN",NA,NA,NA,NA,"Same lynching as noted in 13870", 144,"sn83004226", -85.309399,  35.045798,NA,NA,NA,NA
"846",13875,"The Parma herald. ","Parma, Idaho",-116.94321, 43.785162,"Parma","Idaho","8/11/1910",1910, 8,11,"seq-3","https://articleextractor.org/pages/13875/idhi_damascus_ver01/sn89055001/1910/08/11/ed-1/seq-3/1","Paris, NA","NA, NA","NA, NA","Paris",NA,NA,NA,NA,NA,"OUTSIDE OF US", 145,"sn89055001",   2.352222,  48.856614,NA,NA,NA,NA
"847",13877,"The Ekalaka eagle ","Ekalaka, Montana",-104.55273, 45.888887,"Ekalaka","Montana","1/21/1910",1910, 1,21,"seq-6","https://articleextractor.org/pages/13877/mthi_dollyvarden_ver01/sn85053090/1910/01/21/ed-1/seq-6/1","Vienna, IL","NA, NA","NA, NA","Vienna","IL",NA,NA,NA,NA,"Attempted/planned lynching", 146,"sn85053090", -88.897843,  37.415329,NA,NA,NA,NA
"848",13879,"Arizona republican ","Phoenix, Arizona",-112.07404, 33.448377,"Phoenix","Arizona","5/13/1911",1911, 5,13,"seq-9","https://articleextractor.org/pages/13879/az_chuckwalla_ver01/sn84020558/1911/05/13/ed-1/seq-9/1","Livermoore, KY","NA, NA","NA, NA","Livermoore","KY",NA,NA,NA,NA,NA, 147,"sn84020558", -87.131941,  37.493103,NA,NA,NA,NA
"849",13880,"Americus times-recorder ","Americus, Georgia", -84.23269, 32.072386,"Americus","Georgia","2/17/1911",1911, 2,17,"seq-1","https://articleextractor.org/pages/13880/gu_bootes_ver01/sn89053204/1911/02/17/ed-1/seq-1/1","Stanford, KY","NA, NA","NA, NA","Stanford","KY",NA,NA,NA,NA,"Attempted lynching", 148,"sn89053204", -84.661888,  37.531190,NA,NA,NA,NA
"850",13881,"Los Angeles herald ","Los Angeles , California",-118.24264, 34.054908,"Los Angeles ","California","6/27/1909",1909, 6,27,"seq-1","https://articleextractor.org/pages/13881/curiv_quailvalley_ver01/sn85042462/1909/06/27/ed-1/seq-1/2","NA, OK","NA, NA","NA, NA",NA,"OK",NA,NA,NA,NA,"Does not state where in Oklahoma", 149,"sn85042462",NA,NA,NA,NA,NA,NA
"851",13882,"Los Angeles herald ","Los Angeles , California",-118.24264, 34.054908,"Los Angeles ","California","7/4/1910",1910, 7, 4,"seq-2","https://articleextractor.org/pages/13882/curiv_rubidoux_ver01/sn85042462/1910/07/04/ed-1/seq-2/2","Charleston, MO","NA, NA","NA, NA","Charleston","MO",NA,NA,NA,NA,"both confess before they are killed", 150,"sn85042462", -89.350631,  36.920885,NA,NA,NA,NA
"852",13884,"Fulton County tribune. ","Wauseon, Ohio", -84.14162, 41.549218,"Wauseon","Ohio","9/11/1914",1914, 9,11,"seq-3","https://articleextractor.org/pages/13884/ohi_magellan_ver01/sn87076552/1914/09/11/ed-1/seq-3/1","Paris, KY","NA, NA","NA, NA","Paris","KY",NA,NA,NA,NA,"Attempted lynching", 152,"sn87076552", -84.252987,  38.209799,NA,NA,NA,NA
"853",13885,"The daily Gate City ","Keokuk, Iowa", -91.39640, 40.404473,"Keokuk","Iowa","8/7/1914",1914, 8, 7,"seq-3","https://articleextractor.org/pages/13885/iahi_decorah_ver01/sn83025182/1914/08/07/ed-1/seq-3/1","New orleans, LA","NA, NA","NA, NA","New orleans","LA",NA,NA,NA,NA,"Three lynched overall", 153,"sn83025182", -90.071532,  29.951066,NA,NA,NA,NA
"854",13886,"Oxford eagle. ","Oxford, Mississippi", -89.51883, 34.365987,"Oxford","Mississippi","3/19/1914",1914, 3,19,"seq-1","https://articleextractor.org/pages/13886/msar_diamond_ver01/sn87065469/1914/03/19/ed-1/seq-1/1","Hearne, TX","NA, NA","NA, NA","Hearne","TX",NA,NA,NA,NA,NA, 154,"sn87065469", -96.593026,  30.878524,NA,NA,NA,NA
"855",13887,"The Monroe journal ","Monroe, North Carolina", -80.54951, 34.985428,"Monroe","North Carolina","3/2/1915",1915, 3, 2,"seq-8","https://articleextractor.org/pages/13887/ncu_kings_ver01/sn91068476/1915/03/02/ed-1/seq-8/1","NA, NA","NA, NA","NA, NA",NA,NA,NA,NA,NA,NA,"Does not specify state or city lynching occurred in", 155,"sn91068476",NA,NA,NA,NA,NA,NA
"856",13891,"Evening capital and Maryland gazette. ","Annapolis, Maryland", -76.49218, 38.978445,"Annapolis","Maryland","7/6/1915",1915, 7, 6,"seq-2","https://articleextractor.org/pages/13891/mdu_kensington_ver02/sn88065726/1915/07/06/ed-1/seq-2/1","NA, NA","NA, NA","NA, NA",NA,NA,NA,NA,NA,NA,"states; "" a mob threatens to lynch the prisoner"" but does not say where (city or state) - Attempted lynching? - jenny G", 157,"sn88065726",NA,NA,NA,NA,NA,NA
"857",13892,"The Port Gibson reveille ","Port Gibson, Mississippi", -90.98173, 31.960773,"Port Gibson","Mississippi","8/26/1915",1915, 8,26,"seq-2","https://articleextractor.org/pages/13892/msar_jacard_ver01/sn86090233/1915/08/26/ed-1/seq-2/1","NA, NA","NA, NA","NA, NA",NA,NA,NA,NA,NA,NA,"condemnation of prior lynching- does not say where it occurred", 158,"sn86090233",NA,NA,NA,NA,NA,NA
"858",13893,"The Dolores star ","Dolores, Colorado",-108.50454, 37.473882,"Dolores","Colorado","8/27/1915",1915, 8,27,"seq-4","https://articleextractor.org/pages/13893/cohi_alta_ver01/sn86002159/1915/08/27/ed-1/seq-4/1","NA, NA","NA, NA","NA, NA",NA,NA,NA,NA,NA,NA,"city or state not mentioned- I dont believe a lynching occurred, but I am confused by this article,- Jenny G", 159,"sn86002159",NA,NA,NA,NA,NA,NA
"859",13894,"The review ","High Point, North Carolina", -80.00532, 35.955692,"High Point","North Carolina","10/14/1915",1915,10,14,"seq-3","https://articleextractor.org/pages/13894/ncu_elk_ver01/sn91068415/1915/10/14/ed-1/seq-3/1","NA, NA","NA, NA","NA, NA",NA,NA,NA,NA,NA,NA,"no lynching occurred", 160,"sn91068415",NA,NA,NA,NA,NA,NA
"860",13895,"The Hawaiian gazette ","Honolulu , Hawaii",-157.85814, 21.309884,"Honolulu ","Hawaii","8/17/1915",1915, 8,17,"seq-1","https://articleextractor.org/pages/13895/hihouml_lilac_ver02/sn83025121/1915/08/17/ed-1/seq-1/1","Milledgeville, GA","NA, NA","NA, NA","Milledgeville","GA",NA,NA,NA,NA,NA, 161,"sn83025121", -83.232099,  33.080143,NA,NA,NA,NA
"861",13896,"Manchester Democrat ","Manchester, Iowa", -91.45797, 42.485785,"Manchester","Iowa","7/7/1915",1915, 7, 7,"seq-7","https://articleextractor.org/pages/13896/iahi_bettendorf_ver01/sn84038306/1915/07/07/ed-1/seq-7/1","Cedar Bluff, MS","NA, NA","NA, NA","Cedar Bluff","MS",NA,NA,NA,NA,NA, 162,"sn84038306", -88.832276,  33.586787,NA,NA,NA,NA
"862",13897,"Newark evening star and Newark advertiser ","Newark, New Jersey", -74.17237, 40.735657,"Newark","New Jersey","12/21/1915",1915,12,21,"seq-2","https://articleextractor.org/pages/13897/njr_elliot_ver01/sn91064011/1915/12/21/ed-1/seq-2/1","Eastman, GA","NA, NA","NA, NA","Eastman","GA",NA,NA,NA,NA,NA, 163,"sn91064011", -83.177651,  32.197673,NA,NA,NA,NA
"863",13898,"Wauwatosa news ","Wauwatosa, Wisconsin", -88.00759, 43.049457,"Wauwatosa","Wisconsin","8/13/1915",1915, 8,13,"seq-5","https://articleextractor.org/pages/13898/whi_hodag_ver01/sn86086499/1915/08/13/ed-1/seq-5/1","n/a, NA","Mobile, AL","NA, NA","n/a",NA,"Mobile","AL",NA,NA,"The first article was a roundup of nine ""legal hangings"" as well as lynchings from across the country, so not really possible to geocode.", 164,"sn86086499",NA,NA, -88.03989,  30.69537,NA,NA
"864",13898,"Wauwatosa news ","Wauwatosa, Wisconsin", -88.00759, 43.049457,"Wauwatosa","Wisconsin","8/13/1915",1915, 8,13,"seq-5","https://articleextractor.org/pages/13898/whi_hodag_ver01/sn86086499/1915/08/13/ed-1/seq-5/1","n/a, NA","Mobile, AL","NA, NA","n/a",NA,"Mobile","AL",NA,NA,"The first article was a roundup of nine ""legal hangings"" as well as lynchings from across the country, so not really possible to geocode.", 165,"sn86086499",NA,NA, -88.03989,  30.69537,NA,NA
"865",13900,"Five Mile Beach weekly journal. ","Wildwood, New Jersey", -74.81489, 38.991780,"Wildwood","New Jersey","1/7/1916",1916, 1, 7,"seq-4","https://articleextractor.org/pages/13900/njr_harris_ver01/sn90063041/1916/01/07/ed-1/seq-4/1","NA, NA","NA, NA","NA, NA",NA,NA,NA,NA,NA,NA,"No location provided", 166,"sn90063041",NA,NA,NA,NA,NA,NA
"866",13902,"The Loup City northwestern ","Loup City, Nebraska", -98.96675, 41.275565,"Loup City","Nebraska","8/31/1916",1916, 8,31,"seq-2","https://articleextractor.org/pages/13902/nbu_ancientbison_ver01/2018270203/1916/08/31/ed-1/seq-2/1","Newberry, FL","NA, NA","NA, NA","Newberry","FL",NA,NA,NA,NA,"Five people were hanged, three men and two women.", 167,"2018270203", -82.606502,  29.646354,NA,NA,NA,NA
"867",13903,"The Cook County news-herald ","Grand Marais, Minnesota", -90.33427, 47.750447,"Grand Marais","Minnesota","1/13/1916",1916, 1,13,"seq-2","https://articleextractor.org/pages/13903/mnhi_kia_ver02/sn83016544/1916/01/13/ed-1/seq-2/1","n/a, NA","NA, NA","NA, NA","n/a",NA,NA,NA,NA,NA,"No location provided", 168,"sn83016544",NA,NA,NA,NA,NA,NA
"868",13904,"The frontier. ","O'Neill City, Nebraska", -98.64789, 42.457672,"O'Neill City","Nebraska","8/31/1916",1916, 8,31,"seq-3","https://articleextractor.org/pages/13904/nbu_keithsbear_ver02/2010270509/1916/08/31/ed-1/seq-3/1","Vivian, LA","NA, NA","NA, NA","Vivian","LA",NA,NA,NA,NA,NA, 169,"2010270509", -93.987403,  32.871528,NA,NA,NA,NA
"869",13905,"The Hartford herald ","Hartford, Kentucky", -86.90916, 37.451159,"Hartford","Kentucky","2/2/1916",1916, 2, 2,"seq-4","https://articleextractor.org/pages/13905/kyu_fernico_ver01/sn84037890/1916/02/02/ed-1/seq-4/1","Albany, GA","NA, NA","NA, NA","Albany","GA",NA,NA,NA,NA,"Five people lynched.", 170,"sn84037890", -84.155741,  31.578507,NA,NA,NA,NA
"870",13906,"The sun ","New York , New York", -74.00597, 40.712775,"New York ","New York","10/1/1919",1919,10, 1,"seq-8","https://articleextractor.org/pages/13906/nn_pielou_ver01/sn83030431/1919/10/01/ed-1/seq-8/1","Montgomery, AL","Pueblo, CO","NA, NA","Montgomery","AL","Pueblo","CO",NA,NA,"Two lynched, police shot another person.", 171,"sn83030431", -86.307737,  32.379223,-104.60914,  38.25445,NA,NA
"871",13906,"The sun ","New York , New York", -74.00597, 40.712775,"New York ","New York","10/1/1919",1919,10, 1,"seq-8","https://articleextractor.org/pages/13906/nn_pielou_ver01/sn83030431/1919/10/01/ed-1/seq-8/1","Montgomery, AL","Pueblo, CO","NA, NA","Montgomery","AL","Pueblo","CO",NA,NA,"Two lynched, police shot another person.", 172,"sn83030431", -86.307737,  32.379223,-104.60914,  38.25445,NA,NA
"872",13907,"Weekly journal-miner ","Prescott, Arizona",-112.46850, 34.540024,"Prescott","Arizona","10/18/1916",1916,10,18,"seq-1","https://articleextractor.org/pages/13907/az_bobcat_ver01/sn85032923/1916/10/18/ed-1/seq-1/1","Paducah, KY","NA, NA","NA, NA","Paducah","KY",NA,NA,NA,NA,NA, 173,"sn85032923", -88.600048,  37.083389,NA,NA,NA,NA
"873",13910,"The sun ","New York , New York", -74.00597, 40.712775,"New York ","New York","12/29/1891",1891,12,29,"seq-5","https://articleextractor.org/pages/13910/nn_milosz_ver01/sn83030272/1891/12/29/ed-1/seq-5/1","Mobile, AL","Leesburg, FL","NA, NA","Mobile","AL","Leesburg","FL",NA,NA,NA, 174,"sn83030272", -88.039891,  30.695366, -81.87786,  28.81082,NA,NA
"874",13910,"The sun ","New York , New York", -74.00597, 40.712775,"New York ","New York","12/29/1891",1891,12,29,"seq-5","https://articleextractor.org/pages/13910/nn_milosz_ver01/sn83030272/1891/12/29/ed-1/seq-5/1","Mobile, AL","Leesburg, FL","NA, NA","Mobile","AL","Leesburg","FL",NA,NA,NA, 175,"sn83030272", -88.039891,  30.695366, -81.87786,  28.81082,NA,NA
"875",13912,"The West Virginian ","Fairmont, West Virginia", -80.14258, 39.485085,"Fairmont","West Virginia","9/21/1917",1917, 9,21,"seq-4","https://articleextractor.org/pages/13912/wvu_pepper_ver01/sn86072054/1917/09/21/ed-1/seq-4/1","NA, NA","NA, NA","NA, NA",NA,NA,NA,NA,NA,NA,"Lynching didn't end up happening, also there was no city listed", 176,"sn86072054",NA,NA,NA,NA,NA,NA
"876",13915,"Richmond planet ","Richmond, Virginia", -77.43605, 37.540725,"Richmond","Virginia","4/13/1918",1918, 4,13,"seq-1","https://articleextractor.org/pages/13915/vi_lauren_ver02/sn84025841/1918/04/13/ed-1/seq-1/1","Monroe, LA","NA, NA","NA, NA","Monroe","LA",NA,NA,NA,NA,NA, 177,"sn84025841", -92.119301,  32.509311,NA,NA,NA,NA
"877",13918,"Cayton's weekly ","Seattle, Washington",-122.33285, 47.606139,"Seattle","Washington","9/21/1918",1918, 9,21,"seq-4","https://articleextractor.org/pages/13918/wa_elm_ver01/sn87093353/1918/09/21/ed-1/seq-4/1","NA, NA","NA, NA","NA, NA",NA,NA,NA,NA,NA,NA,"No lynching coverage. Offers a reward to anyone who is responsible for arresting a person involved in organizing/participating in a lynching in an effort to punish lynching. -Apurva", 178,"sn87093353",NA,NA,NA,NA,NA,NA
"878",13918,"Cayton's weekly ","Seattle, Washington",-122.33285, 47.606139,"Seattle","Washington","9/21/1918",1918, 9,21,"seq-4","https://articleextractor.org/pages/13918/wa_elm_ver01/sn87093353/1918/09/21/ed-1/seq-4/1","NA, NA","NA, NA","NA, NA",NA,NA,NA,NA,NA,NA,"No lynching coverage. Offers a reward to anyone who is responsible for arresting a person involved in organizing/participating in a lynching in an effort to punish lynching. -Apurva", 179,"sn87093353",NA,NA,NA,NA,NA,NA
"879",13919,"Americus times-recorder ","Americus, Georgia", -84.23269, 32.072386,"Americus","Georgia","5/23/1918",1918, 5,23,"seq-8","https://articleextractor.org/pages/13919/gu_corvus_ver01/sn89053204/1918/05/23/ed-1/seq-8/1","Cordele, GA","NA, NA","NA, NA","Cordele","GA",NA,NA,NA,NA,NA, 180,"sn89053204", -83.782394,  31.963507,NA,NA,NA,NA
"880",13920,"Hopkinsville Kentuckian ","Hopkinsville, Kentucky", -87.48862, 36.865601,"Hopkinsville","Kentucky","3/5/1918",1918, 3, 5,"seq-1","https://articleextractor.org/pages/13920/kyu_albatross_ver01/sn86069395/1918/03/05/ed-1/seq-1/1","Delhi, LA","NA, NA","NA, NA","Delhi","LA",NA,NA,NA,NA,NA, 181,"sn86069395", -91.493174,  32.457642,NA,NA,NA,NA
"881",13924,"The daily Alaska citizen. ","Fairbanks, Alaska",-147.71998, 64.840051,"Fairbanks","Alaska","11/21/1919",1919,11,21,"seq-3","https://articleextractor.org/pages/13924/ak_gyrfalcon_ver01/sn96060003/1919/11/21/ed-1/seq-3/1","Omaha, NE","NA, NA","NA, NA","Omaha","NE",NA,NA,NA,NA,NA, 182,"sn96060003", -95.934503,  41.256537,NA,NA,NA,NA
"882",13925,"The Birmingham age-herald ","Birmingham, Alabama", -86.81036, 33.518589,"Birmingham","Alabama","11/29/1919",1919,11,29,"seq-1","https://articleextractor.org/pages/13925/au_carver_ver01/sn85038485/1919/11/29/ed-1/seq-1/1","Fox Worth, MS","NA, NA","NA, NA","Fox Worth","MS",NA,NA,NA,NA,"The main article highlighted on the article extractor did not have a city, but there was another article on the page that detailed a lynching in Fox Worth, Mississippi. -Apurva", 183,"sn85038485", -89.867638,  31.233884,NA,NA,NA,NA
"883",13928,"Omaha daily bee. ","Omaha , Nebraska", -95.93450, 41.256537,"Omaha ","Nebraska","7/28/1919",1919, 7,28,"seq-1","https://articleextractor.org/pages/13928/nbu_coreopsis_ver01/sn99021999/1919/07/28/ed-1/seq-1/1","Milan, GA","NA, NA","NA, NA","Milan","GA",NA,NA,NA,NA,NA, 184,"sn99021999", -83.062649,  32.017400,NA,NA,NA,NA
"884",13928,"Omaha daily bee. ","Omaha , Nebraska", -95.93450, 41.256537,"Omaha ","Nebraska","7/28/1919",1919, 7,28,"seq-1","https://articleextractor.org/pages/13928/nbu_coreopsis_ver01/sn99021999/1919/07/28/ed-1/seq-1/1","Milan, GA","NA, NA","NA, NA","Milan","GA",NA,NA,NA,NA,NA, 185,"sn99021999", -83.062649,  32.017400,NA,NA,NA,NA
"885",13929,"The Wisconsin weekly blade ","Madison, Wisconsin", -89.40075, 43.072166,"Madison","Wisconsin","2/6/1919",1919, 2, 6,"seq-2","https://articleextractor.org/pages/13929/whi_imp_ver01/sn84025842/1919/02/06/ed-1/seq-2/1","NA, NA","NA, NA","NA, NA",NA,NA,NA,NA,NA,NA,"No actual lynchings reported, both articles on the page are commentary on the Tuskegee Institute's record of lynchings. -Apurva", 186,"sn84025842",NA,NA,NA,NA,NA,NA
"886",13929,"The Wisconsin weekly blade ","Madison, Wisconsin", -89.40075, 43.072166,"Madison","Wisconsin","2/6/1919",1919, 2, 6,"seq-2","https://articleextractor.org/pages/13929/whi_imp_ver01/sn84025842/1919/02/06/ed-1/seq-2/1","NA, NA","NA, NA","NA, NA",NA,NA,NA,NA,NA,NA,"No actual lynchings reported, both articles on the page are commentary on the Tuskegee Institute's record of lynchings. -Apurva", 187,"sn84025842",NA,NA,NA,NA,NA,NA
"887",13930,"The broad ax ","Salt Lake City, Illinois", -89.39853, 40.633125,"Salt Lake City","Illinois","8/30/1919",1919, 8,30,"seq-3","https://articleextractor.org/pages/13930/iune_charlie_ver01/sn84024055/1919/08/30/ed-1/seq-3/1","Eastman, GA","NA, NA","NA, NA","Eastman","GA",NA,NA,NA,NA,NA, 188,"sn84024055", -83.177651,  32.197673,NA,NA,NA,NA
"888",13932,"The Chattanooga news ","Chattanooga, Tennessee", -85.30940, 35.045798,"Chattanooga","Tennessee","9/30/1919",1919, 9,30,"seq-9","https://articleextractor.org/pages/13932/tu_anita_ver01/sn85038531/1919/09/30/ed-1/seq-9/1","Omaha, NE","NA, NA","NA, NA","Omaha","NE",NA,NA,NA,NA,"Attempted to lynch major, lynched one Black person. -Apurva", 190,"sn85038531", -95.934503,  41.256537,NA,NA,NA,NA
"889",13934,"The Washington times ","Washington , District of Columbia", -77.03687, 38.907192,"Washington ","District of Columbia","4/8/1919",1919, 4, 8,"seq-7","https://articleextractor.org/pages/13934/dlc_jetblue_ver01/sn84026749/1919/04/08/ed-1/seq-7/1","NA, NA","NA, NA","NA, NA",NA,NA,NA,NA,NA,NA,"No actual lynching, a person was arrested and there are threats/worries of a lynching but no lynching reported -Apurva", 191,"sn84026749",NA,NA,NA,NA,NA,NA
"890",13937,"Norwich bulletin ","Norwich, Connecticut", -72.07591, 41.524265,"Norwich","Connecticut","10/1/1919",1919,10, 1,"seq-1","https://articleextractor.org/pages/13937/ct_berlin_ver01/sn82014086/1919/10/01/ed-1/seq-1/1","Omaha, NE","NA, NA","NA, NA","Omaha","NE",NA,NA,NA,NA,"Although there are two articles, the first article was not a lynching as the mob put the man in jail but didn't kill him. The second article mentioned someone who was lynched during an attack on the county building. -Apurva", 192,"sn82014086", -95.934503,  41.256537,NA,NA,NA,NA
"891",13937,"Norwich bulletin ","Norwich, Connecticut", -72.07591, 41.524265,"Norwich","Connecticut","10/1/1919",1919,10, 1,"seq-1","https://articleextractor.org/pages/13937/ct_berlin_ver01/sn82014086/1919/10/01/ed-1/seq-1/1","Omaha, NE","NA, NA","NA, NA","Omaha","NE",NA,NA,NA,NA,"Although there are two articles, the first article was not a lynching as the mob put the man in jail but didn't kill him. The second article mentioned someone who was lynched during an attack on the county building. -Apurva", 193,"sn82014086", -95.934503,  41.256537,NA,NA,NA,NA
"892",13940,"Omaha daily bee. ","Omaha , Nebraska", -95.93450, 41.256537,"Omaha ","Nebraska","4/27/1919",1919, 4,27,"seq-2","https://articleextractor.org/pages/13940/nbu_coreopsis_ver01/sn99021999/1919/04/27/ed-1/seq-2/1","NA, NA","NA, NA","NA, NA",NA,NA,NA,NA,NA,NA,"This was an attempted lynching in Berlin. Though there's only a city, the other cities mentioned like Bamberg and Munich imply this incident was not in the U.S., so it doesn't count anyways. -Apurva", 194,"sn99021999",NA,NA,NA,NA,NA,NA
"893",13941,"The Colorado statesman ","Denver, Colorado",-104.99025, 39.739236,"Denver","Colorado","11/8/1919",1919,11, 8,"seq-1","https://articleextractor.org/pages/13941/cohi_hamilton_ver01/sn83025514/1919/11/08/ed-1/seq-1/1","NA, NA","NA, NA","NA, NA",NA,NA,NA,NA,NA,NA,"Four articles on page. Article 1 is a letter against lynching. Article 2 is about the reaction to a senator's defense of lynching. Article 3 talks about lynchings as a whole but doesn't report on individual lynchings. Article 4 is about workers who refuse to work segregated. No actual coverage of lynching incidents on the page. -Apurva", 195,"sn83025514",NA,NA,NA,NA,NA,NA
"894",13941,"The Colorado statesman ","Denver, Colorado",-104.99025, 39.739236,"Denver","Colorado","11/8/1919",1919,11, 8,"seq-1","https://articleextractor.org/pages/13941/cohi_hamilton_ver01/sn83025514/1919/11/08/ed-1/seq-1/1","NA, NA","NA, NA","NA, NA",NA,NA,NA,NA,NA,NA,"Four articles on page. Article 1 is a letter against lynching. Article 2 is about the reaction to a senator's defense of lynching. Article 3 talks about lynchings as a whole but doesn't report on individual lynchings. Article 4 is about workers who refuse to work segregated. No actual coverage of lynching incidents on the page. -Apurva", 196,"sn83025514",NA,NA,NA,NA,NA,NA
"895",13941,"The Colorado statesman ","Denver, Colorado",-104.99025, 39.739236,"Denver","Colorado","11/8/1919",1919,11, 8,"seq-1","https://articleextractor.org/pages/13941/cohi_hamilton_ver01/sn83025514/1919/11/08/ed-1/seq-1/1","NA, NA","NA, NA","NA, NA",NA,NA,NA,NA,NA,NA,"Four articles on page. Article 1 is a letter against lynching. Article 2 is about the reaction to a senator's defense of lynching. Article 3 talks about lynchings as a whole but doesn't report on individual lynchings. Article 4 is about workers who refuse to work segregated. No actual coverage of lynching incidents on the page. -Apurva", 197,"sn83025514",NA,NA,NA,NA,NA,NA
"896",13941,"The Colorado statesman ","Denver, Colorado",-104.99025, 39.739236,"Denver","Colorado","11/8/1919",1919,11, 8,"seq-1","https://articleextractor.org/pages/13941/cohi_hamilton_ver01/sn83025514/1919/11/08/ed-1/seq-1/1","NA, NA","NA, NA","NA, NA",NA,NA,NA,NA,NA,NA,"Four articles on page. Article 1 is a letter against lynching. Article 2 is about the reaction to a senator's defense of lynching. Article 3 talks about lynchings as a whole but doesn't report on individual lynchings. Article 4 is about workers who refuse to work segregated. No actual coverage of lynching incidents on the page. -Apurva", 198,"sn83025514",NA,NA,NA,NA,NA,NA
"897",13942,"Phoenix tribune ","Phoenix, Arizona",-112.07404, 33.448377,"Phoenix","Arizona","1/11/1919",1919, 1,11,"seq-3","https://articleextractor.org/pages/13942/az_campfiregoneout_ver03/sn96060881/1919/01/11/ed-1/seq-3/1","NA, NA","NA, NA","NA, NA",NA,NA,NA,NA,NA,NA,"Gives county of one lynching but not city, and in second lynching, provides the city of the newspaper but not of the lynching. Wasn't sure if either of those count so I'm making a note here. -Apurva", 199,"sn96060881",NA,NA,NA,NA,NA,NA
"898",13943,"The Cordova daily times ","Cordova, Alaska",-145.75254, 60.542409,"Cordova","Alaska","9/30/1919",1919, 9,30,"seq-1","https://articleextractor.org/pages/13943/ak_finwhale_ver01/sn86072239/1919/09/30/ed-1/seq-1/1","Montgomery, AL","NA, NA","NA, NA","Montgomery","AL",NA,NA,NA,NA,"Two men lynched by mob of 25. Story from Associated Press. -Apurva", 200,"sn86072239", -86.307737,  32.379223,NA,NA,NA,NA
"899",13946,"El Paso herald. ","El Paso, Texas",-106.48502, 31.761878,"El Paso","Texas","9/30/1919",1919, 9,30,"seq-1","https://articleextractor.org/pages/13946/txdn_hungary_ver01/sn88084272/1919/09/30/ed-1/seq-1/3","Omaha, NE","NA, NA","NA, NA","Omaha","NE",NA,NA,NA,NA,"First article is about ongoing search for a person by a mob who wants to lynch him. Second article is about attempted lynching on Omaha mayor, which doesn't count, but the reason for this attempt is because he tried to stop rioters from lynching someone. The person the mayor tried to prevent the lynching of ended up being lynched, which I counted. -Apurva", 201,"sn88084272", -95.934503,  41.256537,NA,NA,NA,NA
"900",13946,"El Paso herald. ","El Paso, Texas",-106.48502, 31.761878,"El Paso","Texas","9/30/1919",1919, 9,30,"seq-1","https://articleextractor.org/pages/13946/txdn_hungary_ver01/sn88084272/1919/09/30/ed-1/seq-1/3","Omaha, NE","NA, NA","NA, NA","Omaha","NE",NA,NA,NA,NA,"First article is about ongoing search for a person by a mob who wants to lynch him. Second article is about attempted lynching on Omaha mayor, which doesn't count, but the reason for this attempt is because he tried to stop rioters from lynching someone. The person the mayor tried to prevent the lynching of ended up being lynched, which I counted. -Apurva", 202,"sn88084272", -95.934503,  41.256537,NA,NA,NA,NA
"901",13947,"Hickory daily record ","Hickory, North Carolina", -81.34446, 35.734454,"Hickory","North Carolina","7/7/1920",1920, 7, 7,"seq-1","https://articleextractor.org/pages/13947/ncu_deer_ver01/sn91068423/1920/07/07/ed-1/seq-1/1","Roxboro, NC","NA, NA","NA, NA","Roxboro","NC",NA,NA,NA,NA,"By Associated Press. -Apurva", 203,"sn91068423", -78.982788,  36.393752,NA,NA,NA,NA
"902",13949,"Evening capital and Maryland gazette. ","Annapolis, Maryland", -76.49218, 38.978445,"Annapolis","Maryland","7/8/1920",1920, 7, 8,"seq-1","https://articleextractor.org/pages/13949/mdu_jessup_ver01/sn88065726/1920/07/08/ed-1/seq-1/1","NA, NA","NA, NA","NA, NA",NA,NA,NA,NA,NA,NA,"No actual lynching. Black Republican committeeman is saying Black people get lynched for voting, but no confirmed lynching in the article. -Apurva", 204,"sn88065726",NA,NA,NA,NA,NA,NA
"903",13950,"The Colorado statesman ","Denver, Colorado",-104.99025, 39.739236,"Denver","Colorado","2/21/1920",1920, 2,21,"seq-1","https://articleextractor.org/pages/13950/cohi_hamilton_ver01/sn83025514/1920/02/21/ed-1/seq-1/1","NA, NA","NA, NA","NA, NA",NA,NA,NA,NA,NA,NA,"No actual lynching coverage, just talks about lynching as a topic broadly. -Apurva", 205,"sn83025514",NA,NA,NA,NA,NA,NA
"904",13951,"Omaha daily bee. ","Omaha , Nebraska", -95.93450, 41.256537,"Omaha ","Nebraska","1/18/1920",1920, 1,18,"seq-2","https://articleextractor.org/pages/13951/nbu_coreopsis_ver01/sn99021999/1920/01/18/ed-1/seq-2/1","NA, NA","NA, NA","NA, NA",NA,NA,NA,NA,NA,NA,"There is a lynching mentioned but no specific location is provided for it. -Apurva", 206,"sn99021999",NA,NA,NA,NA,NA,NA
"905",13954,"The Alaska daily empire ","Juneau, Alaska",-134.42013, 58.300493,"Juneau","Alaska","12/23/1920",1920,12,23,"seq-1","https://articleextractor.org/pages/13954/ak_jellymoss_ver01/sn84020657/1920/12/23/ed-1/seq-1/1","Fort Worth, TX","NA, NA","NA, NA","Fort Worth","TX",NA,NA,NA,NA,NA, 207,"sn84020657", -97.330766,  32.755488,NA,NA,NA,NA
"906",13955,"The Pensacola journal. ","Pensacola, Florida", -87.21692, 30.421309,"Pensacola","Florida","11/4/1920",1920,11, 4,"seq-1","https://articleextractor.org/pages/13955/fu_cedarkey_ver01/sn87062268/1920/11/04/ed-1/seq-1/1","Ocoee, FL","NA, NA","NA, NA","Ocoee","FL",NA,NA,NA,NA,NA, 208,"sn87062268", -81.543962,  28.569168,NA,NA,NA,NA
"907",13957,"The Ogden standard-examiner ","Ogden, Utah",-111.97383, 41.223000,"Ogden","Utah","12/24/1920",1920,12,24,"seq-1","https://articleextractor.org/pages/13957/uuml_kloeden_ver01/sn85058393/1920/12/24/ed-1/seq-1/1","Purvis, MS","NA, NA","NA, NA","Purvis","MS",NA,NA,NA,NA,"Article said sheriff ""believed"" that black people lynched the victim. -Apurva", 209,"sn85058393", -89.409787,  31.143235,NA,NA,NA,NA
"908",13960,"The Seattle star ","Seattle, Washington",-122.33285, 47.606139,"Seattle","Washington","8/20/1921",1921, 8,20,"seq-14","https://articleextractor.org/pages/13960/wa_bainbridge_ver01/sn87093407/1921/08/20/ed-1/seq-14/1","NA, NA","NA, NA","NA, NA",NA,NA,NA,NA,NA,NA,"Article 1- unconfirmed lynching? said ""would-be lynchers"" and ""attempted"" but unclear whether it happened or not. Article 2- threat to lynch, no confirmed incident. -Apurva", 211,"sn87093407",NA,NA,NA,NA,NA,NA
"909",13960,"The Seattle star ","Seattle, Washington",-122.33285, 47.606139,"Seattle","Washington","8/20/1921",1921, 8,20,"seq-14","https://articleextractor.org/pages/13960/wa_bainbridge_ver01/sn87093407/1921/08/20/ed-1/seq-14/1","NA, NA","NA, NA","NA, NA",NA,NA,NA,NA,NA,NA,"Article 1- unconfirmed lynching? said ""would-be lynchers"" and ""attempted"" but unclear whether it happened or not. Article 2- threat to lynch, no confirmed incident. -Apurva", 212,"sn87093407",NA,NA,NA,NA,NA,NA
"910",13961,"The monitor. ","Omaha, Nebraska", -95.93450, 41.256537,"Omaha","Nebraska","7/7/1921",1921, 7, 7,"seq-2","https://articleextractor.org/pages/13961/nbu_indescribablebeast_ver01/00225879/1921/07/07/ed-1/seq-2/1","NA, NA","NA, NA","NA, NA",NA,NA,NA,NA,NA,NA,"No lynching. Talks about how people of all races are starting to fight against lynching. -Apurva", 213,"00225879",NA,NA,NA,NA,NA,NA
"911",13963,"The public ledger ","Maysville, Kentucky", -83.74437, 38.641185,"Maysville","Kentucky","8/20/1921",1921, 8,20,"seq-4","https://articleextractor.org/pages/13963/kyu_dove_ver02/sn85038022/1921/08/20/ed-1/seq-4/1","NA, NA","NA, NA","NA, NA",NA,NA,NA,NA,NA,NA,"Planned/intended lynchings, no actual lynching as far as the article says. -Apurva", 214,"sn85038022",NA,NA,NA,NA,NA,NA
"912",13964,"The Washington times ","Washington , District of Columbia", -77.03687, 38.907192,"Washington ","District of Columbia","7/24/1921",1921, 7,24,"seq-3","https://articleextractor.org/pages/13964/dlc_yorkie_ver01/sn84026749/1921/07/24/ed-1/seq-3/1","Hattiesburg, MS","NA, NA","NA, NA","Hattiesburg","MS",NA,NA,NA,NA,NA, 215,"sn84026749", -89.290339,  31.327119,NA,NA,NA,NA
"913",13967,"The Pensacola journal. ","Pensacola, Florida", -87.21692, 30.421309,"Pensacola","Florida","9/3/1922",1922, 9, 3,"seq-1","https://articleextractor.org/pages/13967/fu_cedarkey_ver01/sn87062268/1922/09/03/ed-1/seq-1/1","Athens, GA","NA, NA","NA, NA","Athens","GA",NA,NA,NA,NA,NA, 216,"sn87062268", -83.357567,  33.951935,NA,NA,NA,NA
"914",13967,"The Pensacola journal. ","Pensacola, Florida", -87.21692, 30.421309,"Pensacola","Florida","9/3/1922",1922, 9, 3,"seq-1","https://articleextractor.org/pages/13967/fu_cedarkey_ver01/sn87062268/1922/09/03/ed-1/seq-1/1","Winder, GA","NA, NA","NA, NA","Winder","GA",NA,NA,NA,NA,"My apologies, I caught my mistake after submitting the form for this article, please disregard the form submission that says Athens, GA. That was the dateline, not the location of the lynching. So sorry! -Apurva", 216,"sn87062268", -83.720171,  33.992610,NA,NA,NA,NA
"915",13968,"Brownsville herald ","Brownsville, Texas", -97.49748, 25.901747,"Brownsville","Texas","5/21/1922",1922, 5,21,"seq-1","https://articleextractor.org/pages/13968/txdn_burnett_ver01/sn86063730/1922/05/21/ed-1/seq-1/1","Conroe, TX","Columbus, TX","NA, NA","Conroe","TX","Columbus","TX",NA,NA,"It says one article on the page, but there are two separate lynchings. I've added the second below. -Apurva", 217,"sn86063730", -95.456051,  30.311877, -96.53969,  29.70662,NA,NA
"916",13969,"Great Falls tribune ","Great Falls, Montana",-111.30077, 47.505285,"Great Falls","Montana","7/2/1922",1922, 7, 2,"seq-2","https://articleextractor.org/pages/13969/mthi_crane_ver01/sn83045217/1922/07/02/ed-1/seq-2/1","Lonesbridge, GA","NA, NA","NA, NA","Lonesbridge","GA",NA,NA,NA,NA,NA, 218,"sn83045217", -82.907123,  32.157435,NA,NA,NA,NA
"917",13972,"Evening star ","Washington, District of Columbia", -77.03687, 38.907192,"Washington","District of Columbia","8/17/1923",1923, 8,17,"seq-1","https://articleextractor.org/pages/13972/dlc_armstrong_ver02/sn83045462/1923/08/17/ed-1/seq-1/1","Wellston, GA","NA, NA","NA, NA","Wellston","GA",NA,NA,NA,NA,"Two articles, second is about the same lynching as the first. Counted as one. -Apurva", 220,"sn83045462", -82.907123,  32.157435,NA,NA,NA,NA
"918",13972,"Evening star ","Washington, District of Columbia", -77.03687, 38.907192,"Washington","District of Columbia","8/17/1923",1923, 8,17,"seq-1","https://articleextractor.org/pages/13972/dlc_armstrong_ver02/sn83045462/1923/08/17/ed-1/seq-1/1","Wellston, GA","NA, NA","NA, NA","Wellston","GA",NA,NA,NA,NA,"Two articles, second is about the same lynching as the first. Counted as one. -Apurva", 221,"sn83045462", -82.907123,  32.157435,NA,NA,NA,NA
"919",13974,"The Colorado statesman ","Denver, Colorado",-104.99025, 39.739236,"Denver","Colorado","6/30/1923",1923, 6,30,"seq-4","https://articleextractor.org/pages/13974/cohi_hamilton_ver01/sn83025514/1923/06/30/ed-1/seq-4/1","NA, NA","NA, NA","NA, NA",NA,NA,NA,NA,NA,NA,"Lynching was prevented. -Apurva", 222,"sn83025514",NA,NA,NA,NA,NA,NA
"920",13975,"Southwest Washington labor press ","Hoquiam, Washington",-123.88390, 46.977043,"Hoquiam","Washington","10/3/1924",1924,10, 3,"seq-4","https://articleextractor.org/pages/13975/wa_canvasback_ver02/sn88087163/1924/10/03/ed-1/seq-4/1","NA, NA","NA, NA","NA, NA",NA,NA,NA,NA,NA,NA,"No actual lynching. Talks about how Black people get lynched for the crimes of white people. -Apurva", 223,"sn88087163",NA,NA,NA,NA,NA,NA
"921",13976,"The daily worker ","Chicago, Illinois", -87.62980, 41.878114,"Chicago","Illinois","1/5/1925",1925, 1, 5,"seq-6","https://articleextractor.org/pages/13976/iune_emerald_ver03/sn84020097/1925/01/05/ed-1/seq-6/1","NA, NA","NA, NA","NA, NA",NA,NA,NA,NA,NA,NA,"No specific lynching instance. -Apurva", 224,"sn84020097",NA,NA,NA,NA,NA,NA
"922",13977,"Evening star ","Washington, District of Columbia", -77.03687, 38.907192,"Washington","District of Columbia","11/10/1927",1927,11,10,"seq-45","https://articleextractor.org/pages/13977/dlc_irving_ver01/sn83045462/1927/11/10/ed-1/seq-45/1","Carthage, IL","NA, NA","NA, NA","Carthage","IL",NA,NA,NA,NA,"Talks about the killing of Joseph Smith, founder of Mormon church. Unsure if it counts? Its not really ""news"" or reported, this came out in 1927, decades after the incident. -Apurva", 225,"sn83045462", -91.136254,  40.416433,NA,NA,NA,NA
"923",13978,"The daily worker ","Chicago, Illinois", -87.62980, 41.878114,"Chicago","Illinois","7/20/1928",1928, 7,20,"seq-1","https://articleextractor.org/pages/13978/iune_fluorite_ver01/sn84020097/1928/07/20/ed-1/seq-1/1","Brookhaven, MS","Houston, TX","NA, NA","Brookhaven","MS","Houston","TX",NA,NA,"One article, about communist party denouncing lynchings. However, mentions multiple recent lynchings with location. -Apurva", 226,"sn84020097", -90.440651,  31.579059, -95.36980,  29.76043,NA,NA
"924",13979,"New Britain herald ","New Britain, Connecticut", -72.77954, 41.661210,"New Britain","Connecticut","8/13/1930",1930, 8,13,"seq-14","https://articleextractor.org/pages/13979/ct_inxs_ver01/sn82014519/1930/08/13/ed-1/seq-14/1","Marion, IN","NA, NA","NA, NA","Marion","IN",NA,NA,NA,NA,"Guards posted following lynching of two people. -Apurva", 227,"sn82014519", -85.659144,  40.558374,NA,NA,NA,NA
"925",13980,"The Indianapolis times ","Indianapolis , Indiana", -86.15807, 39.768403,"Indianapolis ","Indiana","10/2/1930",1930,10, 2,"seq-1","https://articleextractor.org/pages/13980/in_goldman_ver01/sn82015313/1930/10/02/ed-1/seq-1/1","Marion, IN","NA, NA","NA, NA","Marion","IN",NA,NA,NA,NA,"Two people lynched. -Apurva", 228,"sn82015313", -85.659144,  40.558374,NA,NA,NA,NA
"926",13981,"The Indianapolis times ","Indianapolis , Indiana", -86.15807, 39.768403,"Indianapolis ","Indiana","8/14/1930",1930, 8,14,"seq-3","https://articleextractor.org/pages/13981/in_goldman_ver01/sn82015313/1930/08/14/ed-1/seq-3/1","Marion, IN","NA, NA","NA, NA","Marion","IN",NA,NA,NA,NA,"Two people lynched. -Apurva", 229,"sn82015313", -85.659144,  40.558374,NA,NA,NA,NA
"927",13983,"The Bismarck tribune ","Bismarck, North Dakota",-100.78769, 46.805495,"Bismarck","North Dakota","3/7/1931",1931, 3, 7,"seq-1","https://articleextractor.org/pages/13983/ndhi_ferengi_ver01/sn85042243/1931/03/07/ed-1/seq-1/1","NA, NA","NA, NA","NA, NA",NA,NA,NA,NA,NA,NA,"Report of a mob gathering to lynch the prisoner, but no confirmed lynching. -Apurva", 230,"sn85042243",NA,NA,NA,NA,NA,NA
"928",13984,"The Detroit tribune. ","Detroit, Michigan", -83.04575, 42.331427,"Detroit","Michigan","11/6/1937",1937,11, 6,"seq-1","https://articleextractor.org/pages/13984/mimtptc_albion_ver01/sn92063852/1937/11/06/ed-1/seq-1/1","NA, NA","NA, NA","NA, NA",NA,NA,NA,NA,NA,NA,"Article 1- Lynching attempt thwarted. Article 2- talks about attempt. No confirmed lynching-Apurva", 231,"sn92063852",NA,NA,NA,NA,NA,NA
"929",13984,"The Detroit tribune. ","Detroit, Michigan", -83.04575, 42.331427,"Detroit","Michigan","11/6/1937",1937,11, 6,"seq-1","https://articleextractor.org/pages/13984/mimtptc_albion_ver01/sn92063852/1937/11/06/ed-1/seq-1/1","NA, NA","NA, NA","NA, NA",NA,NA,NA,NA,NA,NA,"Article 1- Lynching attempt thwarted. Article 2- talks about attempt. No confirmed lynching-Apurva", 232,"sn92063852",NA,NA,NA,NA,NA,NA
"930",13986,"The Michigan chronicle ","Detroit, Michigan", -83.04575, 42.331427,"Detroit","Michigan","7/29/1939",1939, 7,29,"seq-2","https://articleextractor.org/pages/13986/mimtptc_clare_ver03/sn83045324/1939/07/29/ed-1/seq-2/1","Canton, MS","NA, NA","NA, NA","Canton","MS",NA,NA,NA,NA,"Lynching happened a month prior to the publication date of the article -Apurva", 234,"sn83045324", -90.036751,  32.612638,NA,NA,NA,NA
"931",13988,"The Michigan chronicle ","Detroit, Michigan", -83.04575, 42.331427,"Detroit","Michigan","12/15/1945",1945,12,15,"seq-6","https://articleextractor.org/pages/13988/mimtptc_clare_ver03/sn83045324/1945/12/15/ed-1/seq-6/1","NA, NA","NA, NA","NA, NA",NA,NA,NA,NA,NA,NA,"Public figure is anti-lynching. No lynching occurrence. -Apurva", 235,"sn83045324",NA,NA,NA,NA,NA,NA
"932",13994,"Minneapolis spokesman ","Minneapolis, Minnesota", -93.26501, 44.977753,"Minneapolis","Minnesota","1/22/1960",1960, 1,22,"seq-8","https://articleextractor.org/pages/13994/mnhi_dodgeball_ver01/sn83025247/1960/01/22/ed-1/seq-8/1","Monroe, GA","NA, NA","NA, NA","Monroe","GA",NA,NA,NA,NA,"Mentions the first lynching of 1947, said it occurred in South Carolina but no city. Further down in the article there is mention of lynchers going free in Monroe, Georgia. -Apurva", 238,"sn83025247", -83.713229,  33.794836,NA,NA,NA,NA
"933",13994,"Minneapolis spokesman ","Minneapolis, Minnesota", -93.26501, 44.977753,"Minneapolis","Minnesota","1/22/1960",1960, 1,22,"seq-8","https://articleextractor.org/pages/13994/mnhi_dodgeball_ver01/sn83025247/1960/01/22/ed-1/seq-8/1","Biloxi, MS","NA, NA","NA, NA","Biloxi","MS",NA,NA,NA,NA,"Lynchers get out of trial. -Apurva", 238,"sn83025247", -88.885308,  30.396032,NA,NA,NA,NA
"934",13995,"The Grenada sentinel ","Grenada, Mississippi", -89.80842, 33.769005,"Grenada","Mississippi","12/29/1906",1906,12,29,"seq-3","https://articleextractor.org/pages/13995/msar_flax_ver01/sn85034375/1906/12/29/ed-1/seq-3/1","Scooba, MS","NA, NA","NA, NA","Scooba","MS",NA,NA,NA,NA,"Five Black people were shot in a race riot by white people. -Apurva", 239,"sn85034375", -88.476427,  32.828187,NA,NA,NA,NA
"935",13996,"The Spanish Fork press ","Spanish Fork, Utah",-111.65492, 40.114955,"Spanish Fork","Utah","12/27/1906",1906,12,27,"seq-2","https://articleextractor.org/pages/13996/uuml_layden_ver01/sn85058245/1906/12/27/ed-1/seq-2/1","Annapolis, MD","NA, NA","NA, NA","Annapolis","MD",NA,NA,NA,NA,NA, 240,"sn85058245", -76.492183,  38.978445,NA,NA,NA,NA
"936",13997,"The Idaho Republican ","Blackfoot, Idaho",-112.34498, 43.190471,"Blackfoot","Idaho","12/28/1906",1906,12,28,"seq-2","https://articleextractor.org/pages/13997/idhi_fraser_ver01/sn86091197/1906/12/28/ed-1/seq-2/1","NA, NA","NA, NA","NA, NA",NA,NA,NA,NA,NA,NA,"Word-for-word same article as The Spanish Fork press 12/27/1906. Same lynching, wasn't sure if I should double count. -Apurva", 241,"sn86091197",NA,NA,NA,NA,NA,NA
"937",13999,"The Mankato free press ","Mankato, Minnesota", -93.99940, 44.163578,"Mankato","Minnesota","12/28/1906",1906,12,28,"seq-3","https://articleextractor.org/pages/13999/mnhi_goalball_ver01/sn83016589/1906/12/28/ed-1/seq-3/2","Scooba, MS","Wahalak, MS","NA, NA","Scooba","MS","Wahalak","MS",NA,NA,"Article 1- Race riot. Does this count? Article 2- lynchings + killings in Wahalak, stated below. -Apurva", 242,"sn83016589", -88.476427,  32.828187, -88.52976,  32.90569,NA,NA
"938",13999,"The Mankato free press ","Mankato, Minnesota", -93.99940, 44.163578,"Mankato","Minnesota","12/28/1906",1906,12,28,"seq-3","https://articleextractor.org/pages/13999/mnhi_goalball_ver01/sn83016589/1906/12/28/ed-1/seq-3/2","Scooba, MS","Wahalak, MS","NA, NA","Scooba","MS","Wahalak","MS",NA,NA,"Article 1- Race riot. Does this count? Article 2- lynchings + killings in Wahalak, stated below. -Apurva", 243,"sn83016589", -88.476427,  32.828187, -88.52976,  32.90569,NA,NA
"939",13999,"The Mankato free press ","Mankato, Minnesota", -93.99940, 44.163578,"Mankato","Minnesota","12/28/1906",1906,12,28,"seq-3","https://articleextractor.org/pages/13999/mnhi_goalball_ver01/sn83016589/1906/12/28/ed-1/seq-3/2","Scooba, MS","Wahalak, MS","NA, NA","Scooba","MS","Wahalak","MS",NA,NA,"Article 1- Race riot. Does this count? Article 2- lynchings + killings in Wahalak, stated below. -Apurva", 244,"sn83016589", -88.476427,  32.828187, -88.52976,  32.90569,NA,NA
"940",14000,"The Kendrick gazette ","Kendrick, Idaho",-116.64654, 46.614060,"Kendrick","Idaho","12/28/1906",1906,12,28,"seq-2","https://articleextractor.org/pages/14000/idhi_greene_ver01/sn86091096/1906/12/28/ed-1/seq-2/1","Annapolis, MD","NA, NA","NA, NA","Annapolis","MD",NA,NA,NA,NA,NA, 245,"sn86091096", -76.492183,  38.978445,NA,NA,NA,NA
"941",14002,"Omaha daily bee. ","Omaha , Nebraska", -95.93450, 41.256537,"Omaha ","Nebraska","3/17/1906",1906, 3,17,"seq-10","https://articleextractor.org/pages/14002/nbu_offutt_ver01/sn99021999/1906/03/17/ed-1/seq-10/2","NA, NA","NA, NA","NA, NA",NA,NA,NA,NA,NA,NA,"Not a specific lynching instance. -Apurva", 246,"sn99021999",NA,NA,NA,NA,NA,NA
"942",14003,"The Washington herald ","Washington, District of Columbia", -77.03687, 38.907192,"Washington","District of Columbia","12/22/1906",1906,12,22,"seq-4","https://articleextractor.org/pages/14003/dlc_hotel_ver01/sn83045433/1906/12/22/ed-1/seq-4/1","Annapolis, MD","NA, NA","NA, NA","Annapolis","MD",NA,NA,NA,NA,"Extensive + long coverage of this lynching. The mob wore blackface. -Apurva", 247,"sn83045433", -76.492183,  38.978445,NA,NA,NA,NA
"943",14004,"Iron County register ","Ironton, Missouri", -90.62734, 37.597272,"Ironton","Missouri","10/11/1906",1906,10,11,"seq-2","https://articleextractor.org/pages/14004/mohi_igoo_ver01/sn84024283/1906/10/11/ed-1/seq-2/1","Argenta, AR","NA, NA","NA, NA","Argenta","AR",NA,NA,NA,NA,"Lynching was in Argenta, which is now called North Little Rock. -Apurva", 248,"sn84024283", -92.267750,  34.756104,NA,NA,NA,NA
"944",14005,"Palestine daily herald ","Palestine, Texas", -95.63079, 31.762115,"Palestine","Texas","1/30/1906",1906, 1,30,"seq-2","https://articleextractor.org/pages/14005/txdn_bravo_ver01/sn86090383/1906/01/30/ed-1/seq-2/1","Washington, GA","NA, NA","NA, NA","Washington","GA",NA,NA,NA,NA,"Mob captured a Black person who was accused of a crime on a white girl, but the white girl's parents begged the mob to not lynch the Black man, so no confirmed lynching happened. -Apurva", 249,"sn86090383", -82.739309,  33.736795,NA,NA,NA,NA
"945",14006,"The Madison daily leader ","Madison, South Dakota", -97.11395, 44.006085,"Madison","South Dakota","10/30/1906",1906,10,30,"seq-2","https://articleextractor.org/pages/14006/sdhi_grenada_ver01/sn99062034/1906/10/30/ed-1/seq-2/1","NA, NA","NA, NA","NA, NA",NA,NA,NA,NA,NA,NA,"no lynching -Apurva", 250,"sn99062034",NA,NA,NA,NA,NA,NA
"946",14007,"The La Jara chronicle. ","La Jara, Colorado",-105.96030, 37.275008,"La Jara","Colorado","8/31/1906",1906, 8,31,"seq-6","https://articleextractor.org/pages/14007/cohi_finntown_ver01/sn90051015/1906/08/31/ed-1/seq-6/1","Springfield, MO","NA, NA","NA, NA","Springfield","MO",NA,NA,NA,NA,"Trial regarding the lynching. Jury failed to agree on verdict.- Apurva", 251,"sn90051015", -93.292299,  37.208957,NA,NA,NA,NA
"947",14010,"Mower County transcript ","Lansing, Minnesota", -92.97019, 43.745240,"Lansing","Minnesota","11/14/1906",1906,11,14,"seq-6","https://articleextractor.org/pages/14010/mnhi_saturn_ver01/sn85025431/1906/11/14/ed-1/seq-6/1","Sale City, GA","NA, NA","NA, NA","Sale City","GA",NA,NA,NA,NA,NA, 252,"sn85025431", -84.021290,  31.264349,NA,NA,NA,NA
"948",14011,"The Havre herald ","Havre, Montana",-109.68409, 48.549999,"Havre","Montana","10/5/1906",1906,10, 5,"seq-8","https://articleextractor.org/pages/14011/mthi_nuthatch_ver01/sn84036162/1906/10/05/ed-1/seq-8/1","Mobile, AL","NA, NA","NA, NA","Mobile","AL",NA,NA,NA,NA,"Mob showed up to county jail with the intent to lynch someone. Ongoing story as far as the article says, but a potential lynching. -Apurva", 253,"sn84036162", -88.039891,  30.695366,NA,NA,NA,NA
"949",14013,"The Daily Ardmoreite ","Ardmore, Oklahoma", -97.14363, 34.174261,"Ardmore","Oklahoma","5/24/1906",1906, 5,24,"seq-4","https://articleextractor.org/pages/14013/okhi_kiowa_ver01/sn85042303/1906/05/24/ed-1/seq-4/1","Springfield, MO","Rosedale, KS","NA, NA","Springfield","MO","Rosedale","KS",NA,NA,NA, 254,"sn85042303", -93.292299,  37.208957, -94.61921,  39.05793,NA,NA
"950",14013,"The Daily Ardmoreite ","Ardmore, Oklahoma", -97.14363, 34.174261,"Ardmore","Oklahoma","5/24/1906",1906, 5,24,"seq-4","https://articleextractor.org/pages/14013/okhi_kiowa_ver01/sn85042303/1906/05/24/ed-1/seq-4/1","Springfield, MO","Rosedale, KS","NA, NA","Springfield","MO","Rosedale","KS",NA,NA,NA, 255,"sn85042303", -93.292299,  37.208957, -94.61921,  39.05793,NA,NA
"951",14014,"The frontier. ","O'Neill City, Nebraska", -98.64789, 42.457672,"O'Neill City","Nebraska","3/22/1906",1906, 3,22,"seq-7","https://articleextractor.org/pages/14014/nbu_keithsbear_ver02/2010270509/1906/03/22/ed-1/seq-7/1","Chattanooga, TN","NA, NA","NA, NA","Chattanooga","TN",NA,NA,NA,NA,NA, 256,"2010270509", -85.309399,  35.045798,NA,NA,NA,NA
"952",14015,"Hopkinsville Kentuckian ","Hopkinsville, Kentucky", -87.48862, 36.865601,"Hopkinsville","Kentucky","6/16/1903",1903, 6,16,"seq-4","https://articleextractor.org/pages/14015/kyu_inxs_ver01/sn86069395/1903/06/16/ed-1/seq-4/1","NA, NA","NA, NA","NA, NA",NA,NA,NA,NA,NA,NA,"Provides a city called Maysville but there are like three Maysvilles in the south so unclear without the state. Also not a confirmed lynching but a potential one/mob wants to lynch someone but hasn't. -Apurva", 257,"sn86069395",NA,NA,NA,NA,NA,NA
"953",14016,"The Madison daily leader ","Madison, South Dakota", -97.11395, 44.006085,"Madison","South Dakota","6/5/1903",1903, 6, 5,"seq-1","https://articleextractor.org/pages/14016/sdhi_faroe_ver01/sn99062034/1903/06/05/ed-1/seq-1/1","Joplin, MO","NA, NA","NA, NA","Joplin","MO",NA,NA,NA,NA,NA, 258,"sn99062034", -94.513281,  37.084227,NA,NA,NA,NA
"954",14017,"The Billings gazette ","Billings, Montana",-108.50069, 45.783286,"Billings","Montana","5/29/1903",1903, 5,29,"seq-4","https://articleextractor.org/pages/14017/mthi_kelseya_ver02/sn84036008/1903/05/29/ed-1/seq-4/1","Newcastle, WY","NA, NA","NA, NA","Newcastle","WY",NA,NA,NA,NA,NA, 259,"sn84036008",-104.204941,  43.854700,NA,NA,NA,NA
"955",14018,"The Atlanta constitution ","Atlanta, Georgia", -84.38768, 33.748752,"Atlanta","Georgia","6/15/1903",1903, 6,15,"seq-11","https://articleextractor.org/pages/14018/gu_graco_ver01/sn89053706/1903/06/15/ed-1/seq-11/1","Johnson City, TN","Forest Hill, LA","NA, NA","Johnson City","TN","Forest Hill","LA",NA,NA,"Article 1- someone was literally strung up from a tree by a mob before the lynching was stopped. -Apurva", 260,"sn89053706", -82.353473,  36.313440, -92.53125,  31.04186,NA,NA
"956",14018,"The Atlanta constitution ","Atlanta, Georgia", -84.38768, 33.748752,"Atlanta","Georgia","6/15/1903",1903, 6,15,"seq-11","https://articleextractor.org/pages/14018/gu_graco_ver01/sn89053706/1903/06/15/ed-1/seq-11/1","Johnson City, TN","NA, NA","NA, NA","Johnson City","TN",NA,NA,NA,NA,"Same exact article as number 14018, in The Atlanta Constitution. newswire -Apurva", 260,"sn89053706", -82.353473,  36.313440,NA,NA,NA,NA
"957",14018,"The Atlanta constitution ","Atlanta, Georgia", -84.38768, 33.748752,"Atlanta","Georgia","6/15/1903",1903, 6,15,"seq-11","https://articleextractor.org/pages/14018/gu_graco_ver01/sn89053706/1903/06/15/ed-1/seq-11/1","Johnson City, TN","Forest Hill, LA","NA, NA","Johnson City","TN","Forest Hill","LA",NA,NA,"Article 1- someone was literally strung up from a tree by a mob before the lynching was stopped. -Apurva", 261,"sn89053706", -82.353473,  36.313440, -92.53125,  31.04186,NA,NA
"958",14018,"The Atlanta constitution ","Atlanta, Georgia", -84.38768, 33.748752,"Atlanta","Georgia","6/15/1903",1903, 6,15,"seq-11","https://articleextractor.org/pages/14018/gu_graco_ver01/sn89053706/1903/06/15/ed-1/seq-11/1","Johnson City, TN","NA, NA","NA, NA","Johnson City","TN",NA,NA,NA,NA,"Same exact article as number 14018, in The Atlanta Constitution. newswire -Apurva", 261,"sn89053706", -82.353473,  36.313440,NA,NA,NA,NA
"959",14021,"The semi-weekly messenger ","Wilmington, North Carolina", -77.88681, 34.210389,"Wilmington","North Carolina","7/21/1903",1903, 7,21,"seq-1","https://articleextractor.org/pages/14021/ncu_green_ver01/sn91068367/1903/07/21/ed-1/seq-1/1","Lake Butler, FL","NA, NA","NA, NA","Lake Butler","FL",NA,NA,NA,NA,"Lynching carried out by all Black people, the person lynched assaulted a Black woman. -Apurva", 263,"sn91068367", -82.339557,  30.022739,NA,NA,NA,NA
"960",14022,"Tarboro' press ","Tarborough, North Carolina", -77.53580, 35.896824,"Tarborough","North Carolina","9/6/1851",1851, 9, 6,"seq-1","https://articleextractor.org/pages/14022/ncu_dan_ver01/sn85042204/1851/09/06/ed-1/seq-1/1","Columbus, GA","Toomsboro, GA","NA, NA","Columbus","GA","Toomsboro","GA",NA,NA,NA, 264,"sn85042204", -84.987709,  32.460976, -83.07932,  32.82682,NA,NA
"961",14022,"Tarboro' press ","Tarborough, North Carolina", -77.53580, 35.896824,"Tarborough","North Carolina","9/6/1851",1851, 9, 6,"seq-1","https://articleextractor.org/pages/14022/ncu_dan_ver01/sn85042204/1851/09/06/ed-1/seq-1/1","Columbus, GA","Toomsboro, GA","NA, NA","Columbus","GA","Toomsboro","GA",NA,NA,NA, 265,"sn85042204", -84.987709,  32.460976, -83.07932,  32.82682,NA,NA
"962",14022,"Tarboro' press ","Tarborough, North Carolina", -77.53580, 35.896824,"Tarborough","North Carolina","9/6/1851",1851, 9, 6,"seq-1","https://articleextractor.org/pages/14022/ncu_dan_ver01/sn85042204/1851/09/06/ed-1/seq-1/1","Columbus, GA","Toomsboro, GA","NA, NA","Columbus","GA","Toomsboro","GA",NA,NA,NA, 266,"sn85042204", -84.987709,  32.460976, -83.07932,  32.82682,NA,NA
"963",14024,"Rock Island Argus. ","Rock Island, Illinois", -90.57875, 41.509477,"Rock Island","Illinois","10/25/1904",1904,10,25,"seq-1","https://articleextractor.org/pages/14024/iune_guttenberg_ver01/sn92053934/1904/10/25/ed-1/seq-1/1","Berkley, VA","NA, NA","NA, NA","Berkley","VA",NA,NA,NA,NA,NA, 267,"sn92053934", -76.283829,  36.831815,NA,NA,NA,NA
"964",14025,"Reporter and farmer ","Webster, South Dakota", -97.52009, 45.332180,"Webster","South Dakota","8/25/1904",1904, 8,25,"seq-7","https://articleextractor.org/pages/14025/sdhi_leek_ver02/sn99068116/1904/08/25/ed-1/seq-7/1","Cedartown, GA","NA, NA","NA, NA","Cedartown","GA",NA,NA,NA,NA,NA, 268,"sn99068116", -85.256582,  34.011271,NA,NA,NA,NA
"965",14026,"Rock Island Argus. ","Rock Island, Illinois", -90.57875, 41.509477,"Rock Island","Illinois","7/25/1894",1894, 7,25,"seq-2","https://articleextractor.org/pages/14026/iune_ephemera_ver01/sn92053934/1894/07/25/ed-1/seq-2/1","Lake Cormorant, MS","NA, NA","NA, NA","Lake Cormorant","MS",NA,NA,NA,NA,NA, 269,"sn92053934", -90.214540,  34.904263,NA,NA,NA,NA
"966",14028,"Daily Kennebec journal ","Augusta, Maine", -69.77949, 44.310624,"Augusta","Maine","1/2/1894",1894, 1, 2,"seq-7","https://articleextractor.org/pages/14028/me_freeport_ver01/sn82014248/1894/01/02/ed-1/seq-7/1","New Orleans, LA","Roanoke, VA","NA, NA","New Orleans","LA","Roanoke","VA",NA,NA,"This article is a list of miscellaneous affairs. Attempted lynching in Roanoke, VA. -Apurva", 270,"sn82014248", -90.071532,  29.951066, -79.94143,  37.27097,NA,NA
"967",14028,"Daily Kennebec journal ","Augusta, Maine", -69.77949, 44.310624,"Augusta","Maine","1/2/1894",1894, 1, 2,"seq-7","https://articleextractor.org/pages/14028/me_freeport_ver01/sn82014248/1894/01/02/ed-1/seq-7/1","New Orleans, LA","Roanoke, VA","NA, NA","New Orleans","LA","Roanoke","VA",NA,NA,"This article is a list of miscellaneous affairs. Attempted lynching in Roanoke, VA. -Apurva", 271,"sn82014248", -90.071532,  29.951066, -79.94143,  37.27097,NA,NA
"968",14028,"Daily Kennebec journal ","Augusta, Maine", -69.77949, 44.310624,"Augusta","Maine","1/2/1894",1894, 1, 2,"seq-7","https://articleextractor.org/pages/14028/me_freeport_ver01/sn82014248/1894/01/02/ed-1/seq-7/1","New Orleans, LA","Roanoke, VA","NA, NA","New Orleans","LA","Roanoke","VA",NA,NA,"This article is a list of miscellaneous affairs. Attempted lynching in Roanoke, VA. -Apurva", 272,"sn82014248", -90.071532,  29.951066, -79.94143,  37.27097,NA,NA
"969",14029,"Daily Kennebec journal ","Augusta, Maine", -69.77949, 44.310624,"Augusta","Maine","4/4/1881",1881, 4, 4,"seq-3","https://articleextractor.org/pages/14029/me_eddington_ver01/sn82014248/1881/04/04/ed-1/seq-3/1","Sidney, NE","NA, NA","NA, NA","Sidney","NE",NA,NA,NA,NA,NA, 273,"sn82014248",-102.977450,  41.144822,NA,NA,NA,NA
"970",14030,"St. Landry democrat. ","Opelousas, Louisiana", -92.08151, 30.533530,"Opelousas","Louisiana","8/27/1881",1881, 8,27,"seq-2","https://articleextractor.org/pages/14030/lu_blastoise_ver01/sn88064537/1881/08/27/ed-1/seq-2/1","St. Louis, MO","NA, NA","NA, NA","St. Louis","MO",NA,NA,NA,NA,NA, 274,"sn88064537", -90.199404,  38.627003,NA,NA,NA,NA
"971",14031,"Savannah morning news ","Savannah), Georgia", -81.09120, 32.080899,"Savannah)","Georgia","6/17/1881",1881, 6,17,"seq-1","https://articleextractor.org/pages/14031/gu_ace_ver02/sn82015137/1881/06/17/ed-1/seq-1/1","Rogerville, TN","Cincinnati, OH","NA, NA","Rogerville","TN","Cincinnati","OH",NA,NA,"The Rogerville article said there was fear that a lynching would happen, not confirmed but I still recorded. -Apurva", 275,"sn82015137", -83.005442,  36.407317, -84.51202,  39.10312,NA,NA
"972",14031,"Savannah morning news ","Savannah), Georgia", -81.09120, 32.080899,"Savannah)","Georgia","6/17/1881",1881, 6,17,"seq-1","https://articleextractor.org/pages/14031/gu_ace_ver02/sn82015137/1881/06/17/ed-1/seq-1/1","Rogerville, TN","Cincinnati, OH","NA, NA","Rogerville","TN","Cincinnati","OH",NA,NA,"The Rogerville article said there was fear that a lynching would happen, not confirmed but I still recorded. -Apurva", 276,"sn82015137", -83.005442,  36.407317, -84.51202,  39.10312,NA,NA
"973",14033,"Richmond daily Whig ","Richmond, Virginia", -77.43605, 37.540725,"Richmond","Virginia","5/21/1846",1846, 5,21,"seq-2","https://articleextractor.org/pages/14033/vi_appaloosa_ver01/sn84024656/1846/05/21/ed-1/seq-2/1","Jefferson County, FL","NA, NA","NA, NA","Jefferson County","FL",NA,NA,NA,NA,NA, 278,"sn84024656", -83.889706,  30.431198,NA,NA,NA,NA
"974",14036,"The daily dispatch ","Richmond , Virginia", -77.43605, 37.540725,"Richmond ","Virginia","11/30/1859",1859,11,30,"seq-2","https://articleextractor.org/pages/14036/vi_manowar_ver01/sn84024738/1859/11/30/ed-1/seq-2/1","Conecuh County, AL","NA, NA","NA, NA","Conecuh County","AL",NA,NA,NA,NA,"No city, just county. -Apurva", 280,"sn84024738", -86.982429,  31.501571,NA,NA,NA,NA
"975",14037,"The press and tribune ","Chicago, Illinois", -87.62980, 41.878114,"Chicago","Illinois","4/11/1859",1859, 4,11,"seq-2","https://articleextractor.org/pages/14037/dlc_belmont_ver02/sn82014511/1859/04/11/ed-1/seq-2/1","Holly Springs, MS","NA, NA","NA, NA","Holly Springs","MS",NA,NA,NA,NA,"Man was threatened with lynch law but not confirmed lynching -Apurva", 281,"sn82014511", -89.448689,  34.767597,NA,NA,NA,NA
"976",14038,"Port Tobacco times, and Charles County advertiser. ","Port Tobacco, Maryland", -77.01883, 38.511384,"Port Tobacco","Maryland","8/23/1860",1860, 8,23,"seq-2","https://articleextractor.org/pages/14038/mdu_elsberg_ver02/sn89060060/1860/08/23/ed-1/seq-2/1","Milford, DE","NA, NA","NA, NA","Milford","DE",NA,NA,NA,NA,"Attempted lynching but was prevented. -Apurva", 282,"sn89060060", -75.427975,  38.912613,NA,NA,NA,NA
"977",14040,"The Portland daily press ","Portland, Maine", -70.25682, 43.659099,"Portland","Maine","8/5/1867",1867, 8, 5,"seq-2","https://articleextractor.org/pages/14040/me_edgecomb_ver02/sn83016025/1867/08/05/ed-1/seq-2/1","Morris, IL","NA, NA","NA, NA","Morris","IL",NA,NA,NA,NA,NA, 283,"sn83016025", -88.421178,  41.357254,NA,NA,NA,NA
"978",14041,"Memphis daily appeal ","Memphis, Alabama", -88.29753, 33.136514,"Memphis","Alabama","6/13/1867",1867, 6,13,"seq-2","https://articleextractor.org/pages/14041/tu_bonnielou_ver01/sn83045160/1867/06/13/ed-1/seq-2/1","Border of Boyle and Mercer counties, KY","NA, NA","NA, NA","Border of Boyle and Mercer counties","KY",NA,NA,NA,NA,NA, 284,"sn83045160", -84.270018,  37.839333,NA,NA,NA,NA
"979",14046,"The daily gazette ","Wilmington, Delaware", -75.54839, 39.744655,"Wilmington","Delaware","7/19/1879",1879, 7,19,"seq-2","https://articleextractor.org/pages/14046/deu_accio_ver01/sn82014805/1879/07/19/ed-1/seq-2/1","Richmond, TN","NA, NA","NA, NA","Richmond","TN",NA,NA,NA,NA,NA, 289,"sn82014805", -86.591940,  35.385631,NA,NA,NA,NA
"980",14047,"Wessington Springs herald. ","Wessington Spri, South Dakota", -98.56954, 44.079157,"Wessington Spri","South Dakota","8/7/1885",1885, 8, 7,"seq-2","https://articleextractor.org/pages/14047/sdhi_mustang_ver01/sn99067997/1885/08/07/ed-1/seq-2/1","Manley, NC","Douglasville, GA","Minden, LA","Manley","NC","Douglasville","GA","Minden","LA","Lynching threatened at Manley, NC. Confirmed lynching Douglasville, GA and Minden, LA. Not enough room in the google form but there was also an article about a mob of Black people lynching a Black person in Redfield, AR. -Apurva", 290,"sn99067997", -79.371697,  35.185714, -84.74771,  33.75150, -93.28684,  32.61543
"981",14047,"Wessington Springs herald. ","Wessington Spri, South Dakota", -98.56954, 44.079157,"Wessington Spri","South Dakota","8/7/1885",1885, 8, 7,"seq-2","https://articleextractor.org/pages/14047/sdhi_mustang_ver01/sn99067997/1885/08/07/ed-1/seq-2/1","Manley, NC","Douglasville, GA","Minden, LA","Manley","NC","Douglasville","GA","Minden","LA","Lynching threatened at Manley, NC. Confirmed lynching Douglasville, GA and Minden, LA. Not enough room in the google form but there was also an article about a mob of Black people lynching a Black person in Redfield, AR. -Apurva", 291,"sn99067997", -79.371697,  35.185714, -84.74771,  33.75150, -93.28684,  32.61543
"982",14047,"Wessington Springs herald. ","Wessington Spri, South Dakota", -98.56954, 44.079157,"Wessington Spri","South Dakota","8/7/1885",1885, 8, 7,"seq-2","https://articleextractor.org/pages/14047/sdhi_mustang_ver01/sn99067997/1885/08/07/ed-1/seq-2/1","Manley, NC","Douglasville, GA","Minden, LA","Manley","NC","Douglasville","GA","Minden","LA","Lynching threatened at Manley, NC. Confirmed lynching Douglasville, GA and Minden, LA. Not enough room in the google form but there was also an article about a mob of Black people lynching a Black person in Redfield, AR. -Apurva", 292,"sn99067997", -79.371697,  35.185714, -84.74771,  33.75150, -93.28684,  32.61543
"983",14047,"Wessington Springs herald. ","Wessington Spri, South Dakota", -98.56954, 44.079157,"Wessington Spri","South Dakota","8/7/1885",1885, 8, 7,"seq-2","https://articleextractor.org/pages/14047/sdhi_mustang_ver01/sn99067997/1885/08/07/ed-1/seq-2/1","Manley, NC","Douglasville, GA","Minden, LA","Manley","NC","Douglasville","GA","Minden","LA","Lynching threatened at Manley, NC. Confirmed lynching Douglasville, GA and Minden, LA. Not enough room in the google form but there was also an article about a mob of Black people lynching a Black person in Redfield, AR. -Apurva", 293,"sn99067997", -79.371697,  35.185714, -84.74771,  33.75150, -93.28684,  32.61543
"984",14050,"The Topeka state journal ","Topeka, Kansas", -95.67516, 39.047345,"Topeka","Kansas","3/27/1902",1902, 3,27,"seq-8","https://articleextractor.org/pages/14050/khi_higuchi_ver01/sn82016014/1902/03/27/ed-1/seq-8/1","La Junta, CO","NA, NA","NA, NA","La Junta","CO",NA,NA,NA,NA,NA, 295,"sn82016014",-103.543832,  37.985009,NA,NA,NA,NA
"985",14051,"Martinsburg journal ","Martinsburg, West Virginia", -77.96389, 39.456210,"Martinsburg","West Virginia","9/29/1922",1922, 9,29,"seq-2","https://articleextractor.org/pages/14051/wvu_els_ver01/sn85059587/1922/09/29/ed-1/seq-2/1","Sandersville, GA","NA, NA","NA, NA","Sandersville","GA",NA,NA,NA,NA,NA, 296,"sn85059587", -82.810138,  32.981543,NA,NA,NA,NA
"986",14052,"Worcester Democrat and the ledger-enterprise. ","Pocomoke City, Maryland", -75.56798, 38.075677,"Pocomoke City","Maryland","2/13/1926",1926, 2,13,"seq-4","https://articleextractor.org/pages/14052/mdu_frederick_ver03/sn89060127/1926/02/13/ed-1/seq-4/1","Georgetown, DE","NA, NA","NA, NA","Georgetown","DE",NA,NA,NA,NA,NA, 297,"sn89060127", -75.385473,  38.690113,NA,NA,NA,NA
"987",14054,"The Detroit tribune. ","Detroit, Michigan", -83.04575, 42.331427,"Detroit","Michigan","12/28/1946",1946,12,28,"seq-4","https://articleextractor.org/pages/14054/mimtptc_albion_ver01/sn92063852/1946/12/28/ed-1/seq-4/1","Monroe, GA","NA, NA","NA, NA","Monroe","GA",NA,NA,NA,NA,NA, 302,"sn92063852", -83.713229,  33.794836,NA,NA,NA,NA
"988",14056,"Evening star ","Washington, District of Columbia", -77.03687, 38.907192,"Washington","District of Columbia","5/20/1949",1949, 5,20,"seq-3","https://articleextractor.org/pages/14056/dlc_2hayden_ver02/sn83045462/1949/05/20/ed-1/seq-3/1","Clarkesville, VA","NA, NA","NA, NA","Clarkesville","VA",NA,NA,NA,NA,"Victim was severely beaten, not killed.", 303,"sn83045462", -78.556945,  36.624030,NA,NA,NA,NA
"989",14213,"Constantine republican ","Constantine, Michigan", -85.66860, 41.841160,"Constantine","Michigan","11/9/1836",1836,11, 9,"seq-1","https://articleextractor.org/pages/14213/mimtptc_alpena_ver01/sn83016620/1836/11/09/ed-1/seq-1/1","Chillicothe, OH","NA, NA","NA, NA","Chillicothe","OH",NA,NA,NA,NA,NA, 304,"sn83016620", -82.982402,  39.333120,NA,NA,NA,NA
"990",14214,"Litchfield enquirer ","Litchfield, Connecticut", -73.18872, 41.747264,"Litchfield","Connecticut","12/21/1837",1837,12,21,"seq-2","https://articleextractor.org/pages/14214/ct_barnum_ver01/sn84020071/1837/12/21/ed-1/seq-2/1","Warren, KY","NA, NA","NA, NA","Warren","KY",NA,NA,NA,NA,NA, 305,"sn84020071", -86.499655,  36.988604,NA,NA,NA,NA
"991",14216,"Eastern times ","Bath, Maine", -69.82060, 43.910635,"Bath","Maine","8/1/1850",1850, 8, 1,"seq-3","https://articleextractor.org/pages/14216/me_calais_ver02/sn82014356/1850/08/01/ed-1/seq-3/1","Culpepper, VA","NA, NA","NA, NA","Culpepper","VA",NA,NA,NA,NA,NA, 307,"sn82014356", -77.996118,  38.473346,NA,NA,NA,NA
"992",14217,"The Portsmouth inquirer ","Portsmouth, Ohio", -82.99767, 38.731743,"Portsmouth","Ohio","11/11/1850",1850,11,11,"seq-3","https://articleextractor.org/pages/14217/ohi_drake_ver01/sn85026203/1850/11/11/ed-1/seq-3/1","Clinton, IA","NA, NA","NA, NA","Clinton","IA",NA,NA,NA,NA,NA, 308,"sn85026203", -90.188738,  41.844473,NA,NA,NA,NA
"993",14218,"Democratic banner. ","Bowling Green, Missouri", -91.19514, 39.341989,"Bowling Green","Missouri","1/14/1850",1850, 1,14,"seq-2","https://articleextractor.org/pages/14218/mohi_jerome_ver01/sn89066057/1850/01/14/ed-1/seq-2/1","Phillips County, AR","NA, NA","NA, NA","Phillips County","AR",NA,NA,NA,NA,NA, 309,"sn89066057", -90.867513,  34.461121,NA,NA,NA,NA
"994",14220,"Lewisburg chronicle ","Lewisburg, Pennsylvania", -76.88441, 40.964529,"Lewisburg","Pennsylvania","6/25/1851",1851, 6,25,"seq-4","https://articleextractor.org/pages/14220/pst_fenske_ver02/sn85055197/1851/06/25/ed-1/seq-4/1","Milton, FL","NA, NA","NA, NA","Milton","FL",NA,NA,NA,NA,NA, 311,"sn85055197", -87.039688,  30.632415,NA,NA,NA,NA
"995",14222,"The republic ","Washington , District of Columbia", -77.03687, 38.907192,"Washington ","District of Columbia","9/24/1851",1851, 9,24,"seq-3","https://articleextractor.org/pages/14222/dlc_dragon_ver01/sn82014434/1851/09/24/ed-1/seq-3/1","Greenwood Valley, NONE","NA, NA","NA, NA","Greenwood Valley","NONE",NA,NA,NA,NA,NA, 312,"sn82014434",NA,NA,NA,NA,NA,NA
"996",14223,"The daily dispatch ","Richmond , Virginia", -77.43605, 37.540725,"Richmond ","Virginia","11/13/1856",1856,11,13,"seq-2","https://articleextractor.org/pages/14223/vi_manowar_ver01/sn84024738/1856/11/13/ed-1/seq-2/1","Marion, AR","NA, NA","NA, NA","Marion","AR",NA,NA,NA,NA,NA, 313,"sn84024738", -90.197219,  35.214437,NA,NA,NA,NA
"997",14224,"Holmes County Republican ","Millersburg, Ohio", -81.91792, 40.554507,"Millersburg","Ohio","7/16/1857",1857, 7,16,"seq-2","https://articleextractor.org/pages/14224/ohi_edgar_ver01/sn84028820/1857/07/16/ed-1/seq-2/1","Cedar, IA","NA, NA","NA, NA","Cedar","IA",NA,NA,NA,NA,NA, 314,"sn84028820", -92.525745,  41.212233,NA,NA,NA,NA
"998",14225,"Weekly North Carolina standard ","Raleigh, North Carolina", -78.63818, 35.779590,"Raleigh","North Carolina","6/17/1857",1857, 6,17,"seq-4","https://articleextractor.org/pages/14225/ncu_alligator_ver01/sn84045030/1857/06/17/ed-1/seq-4/1","Rockingham County, VA","NA, NA","NA, NA","Rockingham County","VA",NA,NA,NA,NA,"Only county, no city.", 315,"sn84045030", -78.883555,  38.582592,NA,NA,NA,NA
"999",14226,"Evening star ","Washington, District of Columbia", -77.03687, 38.907192,"Washington","District of Columbia","1/17/1861",1861, 1,17,"seq-2","https://articleextractor.org/pages/14226/dlc_leonberger_ver03/sn83045462/1861/01/17/ed-1/seq-2/1","Roane County, TN","NA, NA","NA, NA","Roane County","TN",NA,NA,NA,NA,"Says Union men hung a man with a grapevine and made him take an oath. -Apurva", 316,"sn83045462", -84.564147,  35.836117,NA,NA,NA,NA
"1000",14228,"Evening star ","Washington, District of Columbia", -77.03687, 38.907192,"Washington","District of Columbia","10/8/1861",1861,10, 8,"seq-2","https://articleextractor.org/pages/14228/dlc_leonberger_ver03/sn83045462/1861/10/08/ed-1/seq-2/1","Grimes County, TX","NA, NA","NA, NA","Grimes County","TX",NA,NA,NA,NA,NA, 317,"sn83045462", -95.983258,  30.482985,NA,NA,NA,NA
"1001",14230,"The Manitowoc pilot ","Manitowoc, Wisconsin", -87.65758, 44.088606,"Manitowoc","Wisconsin","11/21/1862",1862,11,21,"seq-3","https://articleextractor.org/pages/14230/whi_grace_ver01/sn85033139/1862/11/21/ed-1/seq-3/1","Dalton, VA","NA, NA","NA, NA","Dalton","VA",NA,NA,NA,NA,NA, 319,"sn85033139", -78.656894,  37.431573,NA,NA,NA,NA
"1002",14231,"Chicago daily tribune ","Chicago, Illinois", -87.62980, 41.878114,"Chicago","Illinois","10/14/1878",1878,10,14,"seq-4","https://articleextractor.org/pages/14231/dlc_michigan_ver01/sn84031492/1878/10/14/ed-1/seq-4/1","Ansonia, CT","NA, NA","NA, NA","Ansonia","CT",NA,NA,NA,NA,NA, 320,"sn84031492", -73.078997,  41.346208,NA,NA,NA,NA
"1003",14232,"The Detroit tribune. ","Detroit, Michigan", -83.04575, 42.331427,"Detroit","Michigan","7/18/1942",1942, 7,18,"seq-1","https://articleextractor.org/pages/14232/mimtptc_albion_ver01/sn92063852/1942/07/18/ed-1/seq-1/1","Texarkana, TX","NA, NA","NA, NA","Texarkana","TX",NA,NA,NA,NA,NA, 321,"sn92063852", -94.047688,  33.425125,NA,NA,NA,NA
"1004",14234,"The Cordova daily times ","Cordova, Alaska",-145.75254, 60.542409,"Cordova","Alaska","8/3/1921",1921, 8, 3,"seq-1","https://articleextractor.org/pages/14234/ak_gyrfalcon_ver01/sn86072239/1921/08/03/ed-1/seq-1/1","Lawrenceville, VA","NA, NA","NA, NA","Lawrenceville","VA",NA,NA,NA,NA,NA, 322,"sn86072239", -77.846937,  36.757647,NA,NA,NA,NA
"1005",14237,"The Alaska daily empire ","Juneau, Alaska",-134.42013, 58.300493,"Juneau","Alaska","2/5/1923",1923, 2, 5,"seq-1","https://articleextractor.org/pages/14237/ak_flatheadsole_ver01/sn84020657/1923/02/05/ed-1/seq-1/1","Willedgeville, GA","NA, NA","NA, NA","Willedgeville","GA",NA,NA,NA,NA,NA, 323,"sn84020657", -83.232099,  33.080143,NA,NA,NA,NA
"1006",14238,"The Alaska daily empire ","Juneau, Alaska",-134.42013, 58.300493,"Juneau","Alaska","7/22/1924",1924, 7,22,"seq-1","https://articleextractor.org/pages/14238/ak_goshawk_ver01/sn84020657/1924/07/22/ed-1/seq-1/1","Mound City, IL","NA, NA","NA, NA","Mound City","IL",NA,NA,NA,NA,"Says a posse formed with the intent to kill but it didn't happen. -Apurva", 324,"sn84020657", -89.162573,  37.085329,NA,NA,NA,NA
"1007",14239,"The Nome daily nugget. ","Nome, Alaska",-165.40864, 64.500591,"Nome","Alaska","4/7/1914",1914, 4, 7,"seq-1","https://articleextractor.org/pages/14239/ak_kingcrab_ver03/sn87062011/1914/04/07/ed-1/seq-1/1","Noble, OK","Wendell, NC","NA, NA","Noble","OK","Wendell","NC",NA,NA,"Two lynchings in the article", 325,"sn87062011", -97.394753,  35.139236, -78.36972,  35.78099,NA,NA
"1008",14241,"Seward weekly gateway. ","Seward, Alaska",-149.44210, 60.104774,"Seward","Alaska","8/3/1907",1907, 8, 3,"seq-4","https://articleextractor.org/pages/14241/ak_harborseal_ver04/sn98059811/1907/08/03/ed-1/seq-4/1","Crisfield, MD","NA, NA","NA, NA","Crisfield","MD",NA,NA,NA,NA,NA, 326,"sn98059811", -75.853821,  37.983458,NA,NA,NA,NA
"1009",14242,"The Nome nugget. ","Nome, Alaska",-165.40864, 64.500591,"Nome","Alaska","2/28/1925",1925, 2,28,"seq-5","https://articleextractor.org/pages/14242/ak_halibut_ver01/sn87062013/1925/02/28/ed-1/seq-5/1","Shreveport, LA","NA, NA","NA, NA","Shreveport","LA",NA,NA,NA,NA,NA, 327,"sn87062013", -93.750179,  32.525152,NA,NA,NA,NA
"1010",14243,"The daily Alaska citizen. ","Fairbanks, Alaska",-147.71998, 64.840051,"Fairbanks","Alaska","11/12/1919",1919,11,12,"seq-1","https://articleextractor.org/pages/14243/ak_gyrfalcon_ver01/sn96060003/1919/11/12/ed-1/seq-1/1","Centralia, WA","NA, NA","NA, NA","Centralia","WA",NA,NA,NA,NA,NA, 328,"sn96060003",-122.954297,  46.716214,NA,NA,NA,NA
"1011",14244,"The daily Alaska citizen. ","Fairbanks, Alaska",-147.71998, 64.840051,"Fairbanks","Alaska","9/30/1919",1919, 9,30,"seq-1","https://articleextractor.org/pages/14244/ak_gyrfalcon_ver01/sn96060003/1919/09/30/ed-1/seq-1/1","Omaha, NE","NA, NA","NA, NA","Omaha","NE",NA,NA,NA,NA,NA, 329,"sn96060003", -95.934503,  41.256537,NA,NA,NA,NA
"1012",14245,"Seward daily gateway ","Seward, Alaska",-149.44210, 60.104774,"Seward","Alaska","4/18/1932",1932, 4,18,"seq-1","https://articleextractor.org/pages/14245/ak_icelandgull_ver01/sn87062169/1932/04/18/ed-1/seq-1/1","St. Francis, KS","NA, NA","NA, NA","St. Francis","KS",NA,NA,NA,NA,NA, 330,"sn87062169",-101.800943,  39.774186,NA,NA,NA,NA
"1013",14246,"The Alaska daily empire ","Juneau, Alaska",-134.42013, 58.300493,"Juneau","Alaska","6/14/1917",1917, 6,14,"seq-8","https://articleextractor.org/pages/14246/ak_jellymoss_ver01/sn84020657/1917/06/14/ed-1/seq-8/1","Columbia, MS","NA, NA","NA, NA","Columbia","MS",NA,NA,NA,NA,NA, 331,"sn84020657", -89.835428,  31.252457,NA,NA,NA,NA
"1014",14248,"The log cabin Democrat ","Conway, Arkansas", -92.43665, 35.091751,"Conway","Arkansas","7/19/1906",1906, 7,19,"seq-3","https://articleextractor.org/pages/14248/arhi_charmander_ver01/sn86090230/1906/07/19/ed-1/seq-3/1","Tillar, AR","NA, NA","NA, NA","Tillar","AR",NA,NA,NA,NA,NA, 332,"sn86090230", -91.452121,  33.710304,NA,NA,NA,NA
"1015",14249,"The Conway log cabin. ","Conway, Arkansas", -92.43665, 35.091751,"Conway","Arkansas","7/23/1901",1901, 7,23,"seq-2","https://articleextractor.org/pages/14249/arhi_charmander_ver01/sn89051194/1901/07/23/ed-1/seq-2/1","Girard, LA","NA, NA","NA, NA","Girard","LA",NA,NA,NA,NA,NA, 333,"sn89051194", -91.806515,  32.481809,NA,NA,NA,NA
"1016",14250,"The Mena weekly star ","Mena, Arkansas", -94.23637, 34.584224,"Mena","Arkansas","10/27/1897",1897,10,27,"seq-4","https://articleextractor.org/pages/14250/arhi_electabuzz_ver01/sn85032996/1897/10/27/ed-1/seq-4/1","Leonardville, KS","NA, NA","NA, NA","Leonardville","KS",NA,NA,NA,NA,"Mob started to lynch but then stopped. -Apurva", 334,"sn85032996", -96.858901,  39.364442,NA,NA,NA,NA
"1017",14251,"The Mena weekly star. ","Mena, Arkansas", -94.23637, 34.584224,"Mena","Arkansas","6/10/1909",1909, 6,10,"seq-6","https://articleextractor.org/pages/14251/arhi_electabuzz_ver01/sn89051213/1909/06/10/ed-1/seq-6/2","Frankfort, KY","NA, NA","NA, NA","Frankfort","KY",NA,NA,NA,NA,NA, 335,"sn89051213", -84.873284,  38.200905,NA,NA,NA,NA
"1018",14253,"The Russellville Democrat ","Russellville, Arkansas", -93.13370, 35.278116,"Russellville","Arkansas","7/25/1889",1889, 7,25,"seq-1","https://articleextractor.org/pages/14253/arhi_igglybuff_ver01/sn84023017/1889/07/25/ed-1/seq-1/1","Iuka, MS","NA, NA","NA, NA","Iuka","MS",NA,NA,NA,NA,NA, 336,"sn84023017", -88.190041,  34.811757,NA,NA,NA,NA
"1019",14254,"The Sentinel=record. ","Hot Springs, Arkansas", -93.05460, 34.507762,"Hot Springs","Arkansas","12/21/1918",1918,12,21,"seq-3","https://articleextractor.org/pages/14254/arhi_gyarados_ver01/sn89051285/1918/12/21/ed-1/seq-3/1","Shubuta, MS","NA, NA","NA, NA","Shubuta","MS",NA,NA,NA,NA,NA, 337,"sn89051285", -88.699485,  31.860155,NA,NA,NA,NA
"1020",14255,"The Sentinel=record. ","Hot Springs, Arkansas", -93.05460, 34.507762,"Hot Springs","Arkansas","5/22/1918",1918, 5,22,"seq-1","https://articleextractor.org/pages/14255/arhi_gyarados_ver01/sn89051285/1918/05/22/ed-1/seq-1/1","Andalusa, AL","NA, NA","NA, NA","Andalusa","AL",NA,NA,NA,NA,NA, 338,"sn89051285", -86.483291,  31.308504,NA,NA,NA,NA
"1021",14256,"Pine Bluff daily graphic. ","Pine Bluff, Arkansas", -92.00340, 34.224908,"Pine Bluff","Arkansas","6/6/1898",1898, 6, 6,"seq-5","https://articleextractor.org/pages/14256/arhi_fugazi_ver01/sn89051168/1898/06/06/ed-1/seq-5/1","Clarksville, MO","NA, NA","NA, NA","Clarksville","MO",NA,NA,NA,NA,NA, 339,"sn89051168", -90.905131,  39.370603,NA,NA,NA,NA
"1022",14257,"Pine Bluff daily graphic. ","Pine Bluff, Arkansas", -92.00340, 34.224908,"Pine Bluff","Arkansas","9/11/1894",1894, 9,11,"seq-2","https://articleextractor.org/pages/14257/arhi_elvis_ver01/sn89051168/1894/09/11/ed-1/seq-2/1","Millington, TN","NA, NA","NA, NA","Millington","TN",NA,NA,NA,NA,NA, 340,"sn89051168", -89.897308,  35.341474,NA,NA,NA,NA
"1023",14257,"Pine Bluff daily graphic. ","Pine Bluff, Arkansas", -92.00340, 34.224908,"Pine Bluff","Arkansas","9/11/1894",1894, 9,11,"seq-2","https://articleextractor.org/pages/14257/arhi_elvis_ver01/sn89051168/1894/09/11/ed-1/seq-2/1","Millington, TN","NA, NA","NA, NA","Millington","TN",NA,NA,NA,NA,NA, 341,"sn89051168", -89.897308,  35.341474,NA,NA,NA,NA
"1024",14258,"The Monticellonian ","Monticello, Arkansas", -91.80219, 33.629670,"Monticello","Arkansas","7/5/1901",1901, 7, 5,"seq-1","https://articleextractor.org/pages/14258/arhi_elvis_ver01/sn84022980/1901/07/05/ed-1/seq-1/1","Jager, WV","NA, NA","NA, NA","Jager","WV",NA,NA,NA,NA,"Attempted lynching.", 342,"sn84022980", -81.813726,  37.464556,NA,NA,NA,NA
"1025",14259,"The Prescott daily news. ","Prescott, Arkansas", -93.38098, 33.802490,"Prescott","Arkansas","5/11/1908",1908, 5,11,"seq-3","https://articleextractor.org/pages/14259/arhi_gyarados_ver01/sn90050307/1908/05/11/ed-1/seq-3/1","Pulaski, TN","NA, NA","NA, NA","Pulaski","TN",NA,NA,NA,NA,NA, 343,"sn90050307", -87.030841,  35.199802,NA,NA,NA,NA
"1026",14260,"The Prescott daily news. ","Prescott, Arkansas", -93.38098, 33.802490,"Prescott","Arkansas","7/18/1908",1908, 7,18,"seq-4","https://articleextractor.org/pages/14260/arhi_gyarados_ver01/sn90050307/1908/07/18/ed-1/seq-4/1","Bremond, TX","NA, NA","NA, NA","Bremond","TX",NA,NA,NA,NA,NA, 344,"sn90050307", -96.676922,  31.165182,NA,NA,NA,NA
"1027",14261,"The Prescott daily news. ","Prescott, Arkansas", -93.38098, 33.802490,"Prescott","Arkansas","8/6/1908",1908, 8, 6,"seq-1","https://articleextractor.org/pages/14261/arhi_gyarados_ver01/sn90050307/1908/08/06/ed-1/seq-1/1","Brighton, AL","NA, NA","NA, NA","Brighton","AL",NA,NA,NA,NA,NA, 345,"sn90050307", -86.947215,  33.434275,NA,NA,NA,NA
"1028",14262,"The Birmingham age-herald ","Birmingham, Alabama", -86.81036, 33.518589,"Birmingham","Alabama","11/1/1915",1915,11, 1,"seq-1","https://articleextractor.org/pages/14262/au_ayler_ver01/sn85038485/1915/11/01/ed-1/seq-1/1","Columbia, MS","NA, NA","NA, NA","Columbia","MS",NA,NA,NA,NA,NA, 346,"sn85038485", -89.835428,  31.252457,NA,NA,NA,NA
"1029",14264,"The age-herald ","Birmingham, Alabama", -86.81036, 33.518589,"Birmingham","Alabama","9/28/1899",1899, 9,28,"seq-4","https://articleextractor.org/pages/14264/au_brown_ver01/sn86072192/1899/09/28/ed-1/seq-4/1","NA, NA","NA, NA","NA, NA",NA,NA,NA,NA,NA,NA,"This is a lynching record for over four months. They detail the individual cases but there are far too many to list in the form. -Apurva", 347,"sn86072192",NA,NA,NA,NA,NA,NA
"1030",14265,"The Birmingham age-herald ","Birmingham, Alabama", -86.81036, 33.518589,"Birmingham","Alabama","9/23/1919",1919, 9,23,"seq-2","https://articleextractor.org/pages/14265/au_carver_ver01/sn85038485/1919/09/23/ed-1/seq-2/1","Athens, GA","NA, NA","NA, NA","Athens","GA",NA,NA,NA,NA,NA, 348,"sn85038485", -83.357567,  33.951935,NA,NA,NA,NA
"1031",14265,"The Birmingham age-herald ","Birmingham, Alabama", -86.81036, 33.518589,"Birmingham","Alabama","9/23/1919",1919, 9,23,"seq-2","https://articleextractor.org/pages/14265/au_carver_ver01/sn85038485/1919/09/23/ed-1/seq-2/1","Athens, GA","NA, NA","NA, NA","Athens","GA",NA,NA,NA,NA,NA, 348,"sn85038485", -83.357567,  33.951935,NA,NA,NA,NA
"1032",14266,"The Birmingham age-herald ","Birmingham, Alabama", -86.81036, 33.518589,"Birmingham","Alabama","7/5/1905",1905, 7, 5,"seq-1","https://articleextractor.org/pages/14266/au_davis_ver01/sn85038485/1905/07/05/ed-1/seq-1/1","Russellville, KY","NA, NA","NA, NA","Russellville","KY",NA,NA,NA,NA,NA, 349,"sn85038485", -86.887219,  36.845320,NA,NA,NA,NA
"1033",14267,"The Birmingham age-herald ","Birmingham, Alabama", -86.81036, 33.518589,"Birmingham","Alabama","3/12/1904",1904, 3,12,"seq-1","https://articleextractor.org/pages/14267/au_davis_ver01/sn85038485/1904/03/12/ed-1/seq-1/1","Springfield, OH","NA, NA","NA, NA","Springfield","OH",NA,NA,NA,NA,"There is another article on this page that talks about children putting a rope around a Black child and dragging him. As it was not a mob I am unsure if that counts as a lynching, but I thought it was notable.", 350,"sn85038485", -83.808817,  39.924227,NA,NA,NA,NA
"1034",14269,"The Birmingham age-herald ","Birmingham, Alabama", -86.81036, 33.518589,"Birmingham","Alabama","7/17/1907",1907, 7,17,"seq-1","https://articleextractor.org/pages/14269/au_evans_ver01/sn85038485/1907/07/17/ed-1/seq-1/1","Wadesboro, NC","NA, NA","NA, NA","Wadesboro","NC",NA,NA,NA,NA,NA, 353,"sn85038485", -80.076727,  34.968210,NA,NA,NA,NA
"1035",14271,"The Birmingham age-herald ","Birmingham, Alabama", -86.81036, 33.518589,"Birmingham","Alabama","9/9/1908",1908, 9, 9,"seq-1","https://articleextractor.org/pages/14271/au_flagg_ver01/sn85038485/1908/09/09/ed-1/seq-1/1","Oxford, MS","NA, NA","NA, NA","Oxford","MS",NA,NA,NA,NA,NA, 354,"sn85038485", -89.518825,  34.365987,NA,NA,NA,NA
"1036",14272,"The Birmingham age-herald ","Birmingham, Alabama", -86.81036, 33.518589,"Birmingham","Alabama","2/10/1909",1909, 2,10,"seq-1","https://articleextractor.org/pages/14272/au_flagg_ver01/sn85038485/1909/02/10/ed-1/seq-1/1","Houston, MS","NA, NA","NA, NA","Houston","MS",NA,NA,NA,NA,NA, 355,"sn85038485", -88.999227,  33.898446,NA,NA,NA,NA
"1037",14273,"The Birmingham age-herald ","Birmingham, Alabama", -86.81036, 33.518589,"Birmingham","Alabama","2/12/1909",1909, 2,12,"seq-1","https://articleextractor.org/pages/14273/au_flagg_ver01/sn85038485/1909/02/12/ed-1/seq-1/1","Lakeland, FL","NA, NA","NA, NA","Lakeland","FL",NA,NA,NA,NA,"A person will be lynched ""tonight,"" according to the article. -Apurva", 356,"sn85038485", -81.949804,  28.039465,NA,NA,NA,NA
"1038",14274,"The Birmingham age-herald ","Birmingham, Alabama", -86.81036, 33.518589,"Birmingham","Alabama","1/2/1912",1912, 1, 2,"seq-6","https://articleextractor.org/pages/14274/au_huie_ver01/sn85038485/1912/01/02/ed-1/seq-6/1","Muldrow, OK","NA, NA","NA, NA","Muldrow","OK",NA,NA,NA,NA,NA, 357,"sn85038485", -94.598831,  35.406203,NA,NA,NA,NA
"1039",14274,"The Birmingham age-herald ","Birmingham, Alabama", -86.81036, 33.518589,"Birmingham","Alabama","1/2/1912",1912, 1, 2,"seq-6","https://articleextractor.org/pages/14274/au_huie_ver01/sn85038485/1912/01/02/ed-1/seq-6/1","Muldrow, OK","NA, NA","NA, NA","Muldrow","OK",NA,NA,NA,NA,NA, 358,"sn85038485", -94.598831,  35.406203,NA,NA,NA,NA
"1040",14276,"Arizona weekly journal-miner ","Prescott, Arizona",-112.46850, 34.540024,"Prescott","Arizona","3/2/1892",1892, 3, 2,"seq-1","https://articleextractor.org/pages/14276/az_apachetrout_ver01/sn85032938/1892/03/02/ed-1/seq-1/1","Warner, AK","NA, NA","NA, NA","Warner","AK",NA,NA,NA,NA,NA, 360,"sn85032938",NA,NA,NA,NA,NA,NA
"1041",14277,"Arizona weekly journal-miner ","Prescott, Arizona",-112.46850, 34.540024,"Prescott","Arizona","5/2/1894",1894, 5, 2,"seq-1","https://articleextractor.org/pages/14277/az_apachetrout_ver01/sn85032938/1894/05/02/ed-1/seq-1/1","Madison Parish, LA","NA, NA","NA, NA","Madison Parish","LA",NA,NA,NA,NA,"Predicts that many more will be lynched within the day. -Apurva", 361,"sn85032938", -91.289104,  32.440158,NA,NA,NA,NA
"1042",14278,"Arizona weekly journal-miner ","Prescott, Arizona",-112.46850, 34.540024,"Prescott","Arizona","2/19/1896",1896, 2,19,"seq-1","https://articleextractor.org/pages/14278/az_apachetrout_ver01/sn85032938/1896/02/19/ed-1/seq-1/1","Sullivan, IL","NA, NA","NA, NA","Sullivan","IL",NA,NA,NA,NA,NA, 362,"sn85032938", -88.607839,  39.599479,NA,NA,NA,NA
"1043",14279,"Arizona weekly journal-miner ","Prescott, Arizona",-112.46850, 34.540024,"Prescott","Arizona","2/26/1896",1896, 2,26,"seq-1","https://articleextractor.org/pages/14279/az_apachetrout_ver01/sn85032938/1896/02/26/ed-1/seq-1/1","Cincinnati, OH","NA, NA","NA, NA","Cincinnati","OH",NA,NA,NA,NA,"Mob gathered to lynch people but it didn't end up happening.", 363,"sn85032938", -84.512020,  39.103118,NA,NA,NA,NA
"1044",14285,"Arizona republican ","Phoenix, Arizona",-112.07404, 33.448377,"Phoenix","Arizona","9/28/1897",1897, 9,28,"seq-1","https://articleextractor.org/pages/14285/az_elk_ver01/sn84020558/1897/09/28/ed-1/seq-1/1","Tecumseh, OK","NA, NA","NA, NA","Tecumseh","OK",NA,NA,NA,NA,"Lynching mob planned to go to Tecumseh but prisoner was moved to Oklahoma city to prevent the lynching. -Apurva", 364,"sn84020558", -96.936689,  35.257850,NA,NA,NA,NA
"1045",14286,"Arizona republican ","Phoenix, Arizona",-112.07404, 33.448377,"Phoenix","Arizona","1/5/1898",1898, 1, 5,"seq-1","https://articleextractor.org/pages/14286/az_elk_ver01/sn84020558/1898/01/05/ed-1/seq-1/1","Between Johnsville and Kingtree, SC","NA, NA","NA, NA","Between Johnsville and Kingtree","SC",NA,NA,NA,NA,"Occurred on the way to Kingtree from Johnsonville so exact location unclear-Apurva", 365,"sn84020558", -79.830626,  33.667664,NA,NA,NA,NA
"1046",14287,"Arizona republican ","Phoenix, Arizona",-112.07404, 33.448377,"Phoenix","Arizona","8/19/1899",1899, 8,19,"seq-1","https://articleextractor.org/pages/14287/az_elk_ver01/sn84020558/1899/08/19/ed-1/seq-1/1","Port Gibson, MS","Clem, GA","Atlanta, GA","Port Gibson","MS","Clem","GA","Atlanta","GA","Four lynchings in the article. I'll put the fourth location here: Bell Buckle, TN", 366,"sn84020558", -90.981732,  31.960773, -85.01328,  33.52817, -84.38768,  33.74875
"1047",14290,"Bisbee daily review ","Bisbee, Arizona",-109.92841, 31.448155,"Bisbee","Arizona","5/8/1907",1907, 5, 8,"seq-6","https://articleextractor.org/pages/14290/az_hummingbird_ver02/sn84024827/1907/05/08/ed-1/seq-6/1","Sterrett, OK","NA, NA","NA, NA","Sterrett","OK",NA,NA,NA,NA,NA, 367,"sn84024827", -86.479982,  33.448718,NA,NA,NA,NA
"1048",14291,"Bisbee daily review ","Bisbee, Arizona",-109.92841, 31.448155,"Bisbee","Arizona","7/31/1917",1917, 7,31,"seq-2","https://articleextractor.org/pages/14291/az_incadove_ver01/sn84024827/1917/07/31/ed-1/seq-2/1","Garland City, AR","NA, NA","NA, NA","Garland City","AR",NA,NA,NA,NA,NA, 368,"sn84024827", -93.710899,  33.357965,NA,NA,NA,NA
"1049",14292,"Arizona daily citizen. ","Tucson, Arizona",-110.97418, 32.253979,"Tucson","Arizona","8/20/1901",1901, 8,20,"seq-1","https://articleextractor.org/pages/14292/az_jeddito_ver01/sn87062098/1901/08/20/ed-1/seq-1/1","Pierce City, MO","NA, NA","NA, NA","Pierce City","MO",NA,NA,NA,NA,NA, 369,"sn87062098", -94.000210,  36.945895,NA,NA,NA,NA
"1050",14293,"Arizona republican ","Phoenix, Arizona",-112.07404, 33.448377,"Phoenix","Arizona","1/14/1893",1893, 1,14,"seq-1","https://articleextractor.org/pages/14293/az_kangaroorat_ver01/sn84020558/1893/01/14/ed-1/seq-1/1","Brinkley, AR","NA, NA","NA, NA","Brinkley","AR",NA,NA,NA,NA,NA, 370,"sn84020558", -91.194581,  34.887197,NA,NA,NA,NA
"1051",14294,"The Dolores star ","Dolores, Colorado",-108.50454, 37.473882,"Dolores","Colorado","5/24/1907",1907, 5,24,"seq-5","https://articleextractor.org/pages/14294/cohi_alta_ver01/sn86002159/1907/05/24/ed-1/seq-5/1","Sterrett, OK","NA, NA","NA, NA","Sterrett","OK",NA,NA,NA,NA,NA, 371,"sn86002159", -86.479982,  33.448718,NA,NA,NA,NA
"1052",14295,"Arizona republican ","Phoenix, Arizona",-112.07404, 33.448377,"Phoenix","Arizona","7/8/1920",1920, 7, 8,"seq-1","https://articleextractor.org/pages/14295/az_locoweed_ver01/sn84020558/1920/07/08/ed-1/seq-1/1","Paris, TX","Roxboro, NC","NA, NA","Paris","TX","Roxboro","NC",NA,NA,NA, 372,"sn84020558", -95.555513,  33.660939, -78.98279,  36.39375,NA,NA
"1053",14295,"Arizona republican ","Phoenix, Arizona",-112.07404, 33.448377,"Phoenix","Arizona","7/8/1920",1920, 7, 8,"seq-1","https://articleextractor.org/pages/14295/az_locoweed_ver01/sn84020558/1920/07/08/ed-1/seq-1/1","Paris, TX","Roxboro, NC","NA, NA","Paris","TX","Roxboro","NC",NA,NA,NA, 373,"sn84020558", -95.555513,  33.660939, -78.98279,  36.39375,NA,NA
"1054",14296,"Franklin's paper the statesman. ","Denver, Colorado",-104.99025, 39.739236,"Denver","Colorado","8/6/1910",1910, 8, 6,"seq-3","https://articleextractor.org/pages/14296/cohi_abbeyville_ver01/sn91052311/1910/08/06/ed-1/seq-3/1","Urbana, OH","NA, NA","NA, NA","Urbana","OH",NA,NA,NA,NA,NA, 374,"sn91052311", -83.752430,  40.108391,NA,NA,NA,NA
"1055",14297,"Arizona republican ","Phoenix, Arizona",-112.07404, 33.448377,"Phoenix","Arizona","7/27/1903",1903, 7,27,"seq-1","https://articleextractor.org/pages/14297/az_leopardfrog_ver01/sn84020558/1903/07/27/ed-1/seq-1/1","Danville, IL","NA, NA","NA, NA","Danville","IL",NA,NA,NA,NA,"Race riots", 375,"sn84020558", -87.630021,  40.124481,NA,NA,NA,NA
"1056",14299,"The Colorado statesman ","Denver, Colorado",-104.99025, 39.739236,"Denver","Colorado","6/13/1908",1908, 6,13,"seq-1","https://articleextractor.org/pages/14299/cohi_hamilton_ver01/sn83025514/1908/06/13/ed-1/seq-1/1","Providence, KY","NA, NA","NA, NA","Providence","KY",NA,NA,NA,NA,"Mob killed a person who saved a Black person from being lynched. -Apurva", 376,"sn83025514", -87.762790,  37.397545,NA,NA,NA,NA
"1057",14300,"The Colorado statesman ","Denver, Colorado",-104.99025, 39.739236,"Denver","Colorado","1/23/1915",1915, 1,23,"seq-1","https://articleextractor.org/pages/14300/cohi_hamilton_ver01/sn83025514/1915/01/23/ed-1/seq-1/1","Elmore County, AL","NA, NA","NA, NA","Elmore County","AL",NA,NA,NA,NA,NA, 377,"sn83025514", -86.012157,  32.564708,NA,NA,NA,NA
"1058",14302,"The Elbert County tribune ","Elbert, Colorado",-104.53715, 39.219468,"Elbert","Colorado","8/20/1915",1915, 8,20,"seq-4","https://articleextractor.org/pages/14302/cohi_jasper_ver01/sn90051300/1915/08/20/ed-1/seq-4/1","Marietta, GA","NA, NA","NA, NA","Marietta","GA",NA,NA,NA,NA,NA, 380,"sn90051300", -84.549933,  33.952602,NA,NA,NA,NA
"1059",14302,"The Elbert County tribune ","Elbert, Colorado",-104.53715, 39.219468,"Elbert","Colorado","8/20/1915",1915, 8,20,"seq-4","https://articleextractor.org/pages/14302/cohi_jasper_ver01/sn90051300/1915/08/20/ed-1/seq-4/1","NA, NA","Bainbridge, GA","NA, NA",NA,NA,"Bainbridge","GA",NA,NA,NA, 380,"sn90051300",NA,NA, -84.57547,  30.90380,NA,NA
"1060",14302,"The Elbert County tribune ","Elbert, Colorado",-104.53715, 39.219468,"Elbert","Colorado","8/20/1915",1915, 8,20,"seq-4","https://articleextractor.org/pages/14302/cohi_jasper_ver01/sn90051300/1915/08/20/ed-1/seq-4/1","Marietta, GA","NA, NA","NA, NA","Marietta","GA",NA,NA,NA,NA,NA, 381,"sn90051300", -84.549933,  33.952602,NA,NA,NA,NA
"1061",14302,"The Elbert County tribune ","Elbert, Colorado",-104.53715, 39.219468,"Elbert","Colorado","8/20/1915",1915, 8,20,"seq-4","https://articleextractor.org/pages/14302/cohi_jasper_ver01/sn90051300/1915/08/20/ed-1/seq-4/1","NA, NA","Bainbridge, GA","NA, NA",NA,NA,"Bainbridge","GA",NA,NA,NA, 381,"sn90051300",NA,NA, -84.57547,  30.90380,NA,NA
"1062",14304,"The state herald. ","Holyoke, Colorado",-102.30241, 40.584437,"Holyoke","Colorado","5/8/1891",1891, 5, 8,"seq-2","https://articleextractor.org/pages/14304/cohi_leadville_ver01/sn90051167/1891/05/08/ed-1/seq-2/1","Columbus, MS","NA, NA","NA, NA","Columbus","MS",NA,NA,NA,NA,NA, 382,"sn90051167", -88.427263,  33.495674,NA,NA,NA,NA
"1063",14306,"The state herald. ","Holyoke, Colorado",-102.30241, 40.584437,"Holyoke","Colorado","1/20/1893",1893, 1,20,"seq-2","https://articleextractor.org/pages/14306/cohi_leadville_ver01/sn90051167/1893/01/20/ed-1/seq-2/1","Gaston, KY","NA, NA","NA, NA","Gaston","KY",NA,NA,NA,NA,NA, 383,"sn90051167", -86.221916,  37.892844,NA,NA,NA,NA
"1064",14307,"The state herald. ","Holyoke, Colorado",-102.30241, 40.584437,"Holyoke","Colorado","9/2/1904",1904, 9, 2,"seq-2","https://articleextractor.org/pages/14307/cohi_leadville_ver01/sn90051167/1904/09/02/ed-1/seq-2/1","Laramie, WY","NA, NA","NA, NA","Laramie","WY",NA,NA,NA,NA,NA, 384,"sn90051167",-105.591101,  41.311367,NA,NA,NA,NA
"1065",14308,"Norwich bulletin ","Norwich, Connecticut", -72.07591, 41.524265,"Norwich","Connecticut","1/29/1916",1916, 1,29,"seq-8","https://articleextractor.org/pages/14308/ct_andover_ver01/sn82014086/1916/01/29/ed-1/seq-8/1","Ocala, FL","NA, NA","NA, NA","Ocala","FL",NA,NA,NA,NA,NA, 385,"sn82014086", -82.140092,  29.187199,NA,NA,NA,NA
"1066",14310,"Norwich bulletin ","Norwich, Connecticut", -72.07591, 41.524265,"Norwich","Connecticut","10/6/1920",1920,10, 6,"seq-1","https://articleextractor.org/pages/14310/ct_canaan_ver01/sn82014086/1920/10/06/ed-1/seq-1/1","McClenny, FL","NA, NA","NA, NA","McClenny","FL",NA,NA,NA,NA,"Spelled as both McClenny and Macclenny when I googled the name of the city and I believe McClenny is the older name. -Apurva", 386,"sn82014086", -82.122057,  30.282181,NA,NA,NA,NA
"1067",14311,"The daily morning journal and courier ","New Haven, Connecticut", -72.92788, 41.308274,"New Haven","Connecticut","12/17/1900",1900,12,17,"seq-1","https://articleextractor.org/pages/14311/ct_butternut_ver01/sn84020358/1900/12/17/ed-1/seq-1/1","Rockport, IN","NA, NA","NA, NA","Rockport","IN",NA,NA,NA,NA,NA, 387,"sn84020358", -87.049441,  37.883105,NA,NA,NA,NA
"1068",14312,"The daily morning journal and courier ","New Haven, Connecticut", -72.92788, 41.308274,"New Haven","Connecticut","5/25/1899",1899, 5,25,"seq-4","https://articleextractor.org/pages/14312/ct_butternut_ver01/sn84020358/1899/05/25/ed-1/seq-4/1","NA, IN","NA, NA","NA, NA",NA,"IN",NA,NA,NA,NA,"No city.", 388,"sn84020358",  53.094372,  32.863451,NA,NA,NA,NA
"1069",14317,"Morning journal and courier ","New Haven , Connecticut", -72.92788, 41.308274,"New Haven ","Connecticut","7/10/1891",1891, 7,10,"seq-3","https://articleextractor.org/pages/14317/ct_forest_ver01/sn82015483/1891/07/10/ed-1/seq-3/1","Little Rock, AR","NA, NA","NA, NA","Little Rock","AR",NA,NA,NA,NA,NA, 391,"sn82015483", -92.288016,  34.744462,NA,NA,NA,NA
"1070",14318,"Morning journal and courier ","New Haven , Connecticut", -72.92788, 41.308274,"New Haven ","Connecticut","9/13/1884",1884, 9,13,"seq-3","https://articleextractor.org/pages/14318/ct_elm_ver01/sn82015483/1884/09/13/ed-1/seq-3/1","Oxford, FL","NA, NA","NA, NA","Oxford","FL",NA,NA,NA,NA,NA, 392,"sn82015483", -82.037304,  28.927483,NA,NA,NA,NA
"1071",14320,"Morning journal and courier ","New Haven , Connecticut", -72.92788, 41.308274,"New Haven ","Connecticut","4/29/1892",1892, 4,29,"seq-3","https://articleextractor.org/pages/14320/ct_forest_ver01/sn82015483/1892/04/29/ed-1/seq-3/1","Goodletsville, TN","NA, NA","NA, NA","Goodletsville","TN",NA,NA,NA,NA,"The town is spelled as Goodlettsville in the present day. -Apurva", 394,"sn82015483", -86.713289,  36.322276,NA,NA,NA,NA
"1072",14356,"Los Angeles herald ","Los Angeles , California",-118.24264, 34.054908,"Los Angeles ","California","11/4/1907",1907,11, 4,"seq-8","https://articleextractor.org/pages/14356/curiv_pomo_ver01/sn85042462/1907/11/04/ed-1/seq-8/1","Van Vlett, MS","NA, NA","NA, NA","Van Vlett","MS",NA,NA,NA,NA,"Victim was being moved from Okoluna to county jail in Houston when a mob took him from an officer near Van Vlett", 425,"sn85042462", -88.900334,  33.987055,NA,NA,NA,NA
"1073",14357,"Los Angeles herald ","Los Angeles , California",-118.24264, 34.054908,"Los Angeles ","California","5/10/1909",1909, 5,10,"seq-1","https://articleextractor.org/pages/14357/curiv_quailvalley_ver01/sn85042462/1909/05/10/ed-1/seq-1/1","Jacksonville, FL","NA, NA","NA, NA","Jacksonville","FL",NA,NA,NA,NA,"The dateline for this is Jacksonville and the article says the events took place ""at Camden,"" but I was not able to find any sign of Camden, FL being an actual city or town.", 426,"sn85042462", -81.655651,  30.332184,NA,NA,NA,NA
"1074",14358,"Los Angeles herald ","Los Angeles , California",-118.24264, 34.054908,"Los Angeles ","California","8/22/1909",1909, 8,22,"seq-1","https://articleextractor.org/pages/14358/curiv_quailvalley_ver01/sn85042462/1909/08/22/ed-1/seq-1/1","Rock, WV","NA, NA","NA, NA","Rock","WV",NA,NA,NA,NA,NA, 427,"sn85042462", -81.222042,  37.367895,NA,NA,NA,NA
"1075",14361,"Smyrna times ","Smyrna, Delaware", -75.60465, 39.299834,"Smyrna","Delaware","2/15/1911",1911, 2,15,"seq-3","https://articleextractor.org/pages/14361/deu_batman_ver01/sn84020422/1911/02/15/ed-1/seq-3/1","Newark, OH","NA, NA","NA, NA","Newark","OH",NA,NA,NA,NA,"This article is not about the lynching itself but about a man being sentenced for complicity in a lynching.", 429,"sn84020422", -82.401264,  40.058121,NA,NA,NA,NA
"1076",14362,"The daily gazette ","Wilmington, Delaware", -75.54839, 39.744655,"Wilmington","Delaware","5/5/1881",1881, 5, 5,"seq-4","https://articleextractor.org/pages/14362/deu_bombarda_ver01/sn82014805/1881/05/05/ed-1/seq-4/1","NA, NA","NA, NA","NA, NA",NA,NA,NA,NA,NA,NA,"It does not sound like a lynching actually occurred here; people yelled ""lynch him"" at a man as he was taken to jail, but they did not actually do anything.", 430,"sn82014805",NA,NA,NA,NA,NA,NA
"1077",14363,"Evening journal ","Wilmington, Delaware", -75.54839, 39.744655,"Wilmington","Delaware","7/2/1901",1901, 7, 2,"seq-5","https://articleextractor.org/pages/14363/deu_bear_ver01/sn85042354/1901/07/02/ed-1/seq-5/1","Lawrenceville, VA","NA, NA","NA, NA","Lawrenceville","VA",NA,NA,NA,NA,NA, 431,"sn85042354", -77.846937,  36.757647,NA,NA,NA,NA
"1078",14364,"Milford chronicle ","Milford, Delaware", -75.42798, 38.912613,"Milford","Delaware","12/15/1911",1911,12,15,"seq-5","https://articleextractor.org/pages/14364/deu_catwoman_ver01/sn87062224/1911/12/15/ed-1/seq-5/1","Valliant, OK","NA, NA","NA, NA","Valliant","OK",NA,NA,NA,NA,NA, 432,"sn87062224", -95.093839,  34.002329,NA,NA,NA,NA
"1079",14365,"Middletown transcript ","Middletown, Delaware", -75.71632, 39.449556,"Middletown","Delaware","1/3/1914",1914, 1, 3,"seq-1","https://articleextractor.org/pages/14365/deu_crucio_ver01/sn84026820/1914/01/03/ed-1/seq-1/1","Chestertown, MD","NA, NA","NA, NA","Chestertown","MD",NA,NA,NA,NA,"There were threats of a lynching but it had not happened yet", 433,"sn84026820", -76.069004,  39.218866,NA,NA,NA,NA
"1080",14366,"The Wilmington daily Republican. ","Wilmington, Delaware", -75.54839, 39.744655,"Wilmington","Delaware","8/24/1891",1891, 8,24,"seq-1","https://articleextractor.org/pages/14366/deu_episky_ver01/sn88053055/1891/08/24/ed-1/seq-1/1","Shelbyville, IN","NA, NA","NA, NA","Shelbyville","IN",NA,NA,NA,NA,NA, 434,"sn88053055", -85.776924,  39.521437,NA,NA,NA,NA
"1081",14366,"The Wilmington daily Republican. ","Wilmington, Delaware", -75.54839, 39.744655,"Wilmington","Delaware","8/24/1891",1891, 8,24,"seq-1","https://articleextractor.org/pages/14366/deu_episky_ver01/sn88053055/1891/08/24/ed-1/seq-1/1","Shelbyville, IN","NA, NA","NA, NA","Shelbyville","IN",NA,NA,NA,NA,NA, 435,"sn88053055", -85.776924,  39.521437,NA,NA,NA,NA
"1082",14367,"Daily Republican ",", Delaware", -75.52767, 38.910832,"","Delaware","5/22/1890",1890, 5,22,"seq-1","https://articleextractor.org/pages/14367/deu_episky_ver01/sn84038114/1890/05/22/ed-1/seq-1/1","Columbus, MS","NA, NA","NA, NA","Columbus","MS",NA,NA,NA,NA,NA, 436,"sn84038114", -88.427263,  33.495674,NA,NA,NA,NA
"1083",14368,"The Wilmington daily Republican. ","Wilmington, Delaware", -75.54839, 39.744655,"Wilmington","Delaware","10/15/1894",1894,10,15,"seq-2","https://articleextractor.org/pages/14368/deu_episky_ver01/sn88053055/1894/10/15/ed-1/seq-2/1","Lexington, KY","NA, NA","NA, NA","Lexington","KY",NA,NA,NA,NA,NA, 437,"sn88053055", -84.503716,  38.040584,NA,NA,NA,NA
"1084",14369,"The Wilmington daily Republican. ","Wilmington, Delaware", -75.54839, 39.744655,"Wilmington","Delaware","7/17/1894",1894, 7,17,"seq-1","https://articleextractor.org/pages/14369/deu_episky_ver01/sn88053055/1894/07/17/ed-1/seq-1/1","Scottsville, KY","Adairville, KY","NA, NA","Scottsville","KY","Adairville","KY",NA,NA,NA, 438,"sn88053055", -86.190542,  36.753378, -86.85194,  36.66754,NA,NA
"1085",14370,"The Wilmington daily Republican. ","Wilmington, Delaware", -75.54839, 39.744655,"Wilmington","Delaware","4/30/1892",1892, 4,30,"seq-4","https://articleextractor.org/pages/14370/deu_episky_ver01/sn88053055/1892/04/30/ed-1/seq-4/1","Clayton, DE","NA, NA","NA, NA","Clayton","DE",NA,NA,NA,NA,NA, 439,"sn88053055", -75.634373,  39.290667,NA,NA,NA,NA
"1086",14371,"The Wilmington daily Republican. ","Wilmington, Delaware", -75.54839, 39.744655,"Wilmington","Delaware","9/18/1896",1896, 9,18,"seq-3","https://articleextractor.org/pages/14371/deu_fidelius_ver01/sn88053055/1896/09/18/ed-1/seq-3/1","Union City, TN","NA, NA","NA, NA","Union City","TN",NA,NA,NA,NA,NA, 440,"sn88053055", -89.057010,  36.424230,NA,NA,NA,NA
"1087",14372,"The Wilmington daily Republican. ","Wilmington, Delaware", -75.54839, 39.744655,"Wilmington","Delaware","6/10/1897",1897, 6,10,"seq-3","https://articleextractor.org/pages/14372/deu_fidelius_ver01/sn88053055/1897/06/10/ed-1/seq-3/1","Princess Anne, MD","NA, NA","NA, NA","Princess Anne","MD",NA,NA,NA,NA,NA, 441,"sn88053055", -75.692427,  38.202899,NA,NA,NA,NA
"1088",14374,"The Cordova daily times ","Cordova, Alaska",-145.75254, 60.542409,"Cordova","Alaska","12/30/1920",1920,12,30,"seq-1","https://articleextractor.org/pages/14374/ak_gyrfalcon_ver01/sn86072239/1920/12/30/ed-1/seq-1/1","Council Bluffs, IA","NA, NA","NA, NA","Council Bluffs","IA",NA,NA,NA,NA,"Mob almost lynched a man", 442,"sn86072239", -95.860833,  41.261944,NA,NA,NA,NA
"1089",14375,"The Cordova daily times ","Cordova, Alaska",-145.75254, 60.542409,"Cordova","Alaska","2/10/1923",1923, 2,10,"seq-1","https://articleextractor.org/pages/14375/ak_gyrfalcon_ver01/sn86072239/1923/02/10/ed-1/seq-1/1","Waco, TX","NA, NA","NA, NA","Waco","TX",NA,NA,NA,NA,"Mob threatened to lynch a man in jail", 443,"sn86072239", -97.146670,  31.549333,NA,NA,NA,NA
"1090",14376,"The Alaska citizen. ","Fairbanks, Alaska",-147.71998, 64.840051,"Fairbanks","Alaska","9/6/1915",1915, 9, 6,"seq-1","https://articleextractor.org/pages/14376/ak_gyrfalcon_ver01/sn96060002/1915/09/06/ed-1/seq-1/1","Nashville, TN","NA, NA","NA, NA","Nashville","TN",NA,NA,NA,NA,NA, 444,"sn96060002", -86.781602,  36.162664,NA,NA,NA,NA
"1091",14377,"Semi=weekly graphic. ","Pine Bluff, Arkansas", -92.00340, 34.224908,"Pine Bluff","Arkansas","10/24/1896",1896,10,24,"seq-3","https://articleextractor.org/pages/14377/arhi_aerosmith_ver01/sn89051163/1896/10/24/ed-1/seq-3/1","Greenwood, MS","NA, NA","NA, NA","Greenwood","MS",NA,NA,NA,NA,NA, 445,"sn89051163", -90.179528,  33.516232,NA,NA,NA,NA
"1092",14378,"The Forrest City times ","Forrest City, Arkansas", -90.78523, 35.009258,"Forrest City","Arkansas","1/1/1904",1904, 1, 1,"seq-1","https://articleextractor.org/pages/14378/arhi_alakazam_ver01/sn84022960/1904/01/01/ed-1/seq-1/1","Council Bluffs, IA","NA, NA","NA, NA","Council Bluffs","IA",NA,NA,NA,NA,"Threats of a lynching led to the two men being moved to the state penitentiary at Fort Madison", 446,"sn84022960", -95.860833,  41.261944,NA,NA,NA,NA
"1093",14379,"The log cabin Democrat ","Conway, Arkansas", -92.43665, 35.091751,"Conway","Arkansas","6/16/1920",1920, 6,16,"seq-1","https://articleextractor.org/pages/14379/arhi_bulbasaur_ver01/sn85033000/1920/06/16/ed-1/seq-1/1","Duluth, MN","NA, NA","NA, NA","Duluth","MN",NA,NA,NA,NA,NA, 447,"sn85033000", -92.100485,  46.786672,NA,NA,NA,NA
"1094",14380,"The log cabin Democrat ","Conway, Arkansas", -92.43665, 35.091751,"Conway","Arkansas","8/16/1921",1921, 8,16,"seq-1","https://articleextractor.org/pages/14380/arhi_bulbasaur_ver01/sn85033000/1921/08/16/ed-1/seq-1/1","Datura, TX","NA, NA","NA, NA","Datura","TX",NA,NA,NA,NA,NA, 448,"sn85033000", -96.613041,  31.724332,NA,NA,NA,NA
"1095",14381,"The Sentinel=record. ","Hot Springs, Arkansas", -93.05460, 34.507762,"Hot Springs","Arkansas","2/19/1910",1910, 2,19,"seq-1","https://articleextractor.org/pages/14381/arhi_electabuzz_ver01/sn89051285/1910/02/19/ed-1/seq-1/1","Cairo, IL","Cherry, IL","NA, NA","Cairo","IL","Cherry","IL",NA,NA,"Mob threatened to lynch a man in jail", 449,"sn89051285", -89.176461,  37.005329, -89.21342,  41.42698,NA,NA
"1096",14383,"Newport weekly independent. ","Newport, Arkansas", -91.26413, 35.606063,"Newport","Arkansas","7/24/1903",1903, 7,24,"seq-2","https://articleextractor.org/pages/14383/arhi_kangaskhan_ver02/sn89051128/1903/07/24/ed-1/seq-2/1","New York City, NY","Brooklyn, IL","Basin, WY","New York City","NY","Brooklyn","IL","Basin","WY","Mob threatened to lynch a man", 452,"sn89051128", -74.005973,  40.712775, -90.16594,  38.65866,-108.03899,  44.37996
"1097",14384,"The Dermott news. ","Dermott, Arkansas", -91.43609, 33.524958,"Dermott","Arkansas","8/26/1915",1915, 8,26,"seq-6","https://articleextractor.org/pages/14384/arhi_kangaskhan_ver02/sn90050260/1915/08/26/ed-1/seq-6/1","Atlanta, GA","NA, NA","NA, NA","Atlanta","GA",NA,NA,NA,NA,NA, 453,"sn90050260", -84.387684,  33.748752,NA,NA,NA,NA
"1098",14385,"Pine Bluff daily graphic. ","Pine Bluff, Arkansas", -92.00340, 34.224908,"Pine Bluff","Arkansas","6/18/1916",1916, 6,18,"seq-13","https://articleextractor.org/pages/14385/arhi_kraftwerk_ver01/sn89051168/1916/06/18/ed-1/seq-13/1","Muskogee, OK","NA, NA","NA, NA","Muskogee","OK",NA,NA,NA,NA,"Mob threatened to lynch a man after he was found not guilty of murder", 454,"sn89051168", -95.369691,  35.747877,NA,NA,NA,NA
"1099",14386,"The age-herald ","Birmingham, Alabama", -86.81036, 33.518589,"Birmingham","Alabama","3/25/1900",1900, 3,25,"seq-1","https://articleextractor.org/pages/14386/au_brown_ver01/sn86072192/1900/03/25/ed-1/seq-1/1","Emporia, VA","NA, NA","NA, NA","Emporia","VA",NA,NA,NA,NA,NA, 455,"sn86072192", -77.542481,  36.685983,NA,NA,NA,NA
"1100",14387,"The Birmingham age-herald ","Birmingham, Alabama", -86.81036, 33.518589,"Birmingham","Alabama","11/9/1902",1902,11, 9,"seq-3","https://articleextractor.org/pages/14387/au_capote_ver01/sn85038485/1902/11/09/ed-1/seq-3/1","Anniston, AL","NA, NA","NA, NA","Anniston","AL",NA,NA,NA,NA,"Threats of a lynching", 456,"sn85038485", -85.831632,  33.659826,NA,NA,NA,NA
"1101",14389,"The Birmingham age-herald ","Birmingham, Alabama", -86.81036, 33.518589,"Birmingham","Alabama","6/26/1903",1903, 6,26,"seq-4","https://articleextractor.org/pages/14389/au_capote_ver01/sn85038485/1903/06/26/ed-1/seq-4/1","Belleville, IL","Wilmington, DE","NA, NA","Belleville","IL","Wilmington","DE",NA,NA,NA, 457,"sn85038485", -89.983993,  38.520050, -75.54839,  39.74466,NA,NA
"1102",14389,"The Birmingham age-herald ","Birmingham, Alabama", -86.81036, 33.518589,"Birmingham","Alabama","6/26/1903",1903, 6,26,"seq-4","https://articleextractor.org/pages/14389/au_capote_ver01/sn85038485/1903/06/26/ed-1/seq-4/1","Belleville, IL","Wilmington, DE","NA, NA","Belleville","IL","Wilmington","DE",NA,NA,NA, 458,"sn85038485", -89.983993,  38.520050, -75.54839,  39.74466,NA,NA
"1103",14390,"The Birmingham age-herald ","Birmingham, Alabama", -86.81036, 33.518589,"Birmingham","Alabama","8/6/1903",1903, 8, 6,"seq-1","https://articleextractor.org/pages/14390/au_capote_ver01/sn85038485/1903/08/06/ed-1/seq-1/1","Asotin, WA","NA, NA","NA, NA","Asotin","WA",NA,NA,NA,NA,NA, 459,"sn85038485",-117.048212,  46.339326,NA,NA,NA,NA
"1104",14391,"The Birmingham age-herald ","Birmingham, Alabama", -86.81036, 33.518589,"Birmingham","Alabama","11/3/1903",1903,11, 3,"seq-1","https://articleextractor.org/pages/14391/au_capote_ver01/sn85038485/1903/11/03/ed-1/seq-1/1","Taylortown, LA","NA, NA","NA, NA","Taylortown","LA",NA,NA,NA,NA,NA, 460,"sn85038485", -93.596009,  32.386544,NA,NA,NA,NA
"1105",14392,"The age-herald ","Birmingham, Alabama", -86.81036, 33.518589,"Birmingham","Alabama","11/16/1900",1900,11,16,"seq-2","https://articleextractor.org/pages/14392/au_capote_ver01/sn86072192/1900/11/16/ed-1/seq-2/1","Jefferson, TX","NA, NA","NA, NA","Jefferson","TX",NA,NA,NA,NA,NA, 461,"sn86072192", -94.345193,  32.757363,NA,NA,NA,NA
"1106",14393,"The age-herald ","Birmingham, Alabama", -86.81036, 33.518589,"Birmingham","Alabama","2/7/1902",1902, 2, 7,"seq-10","https://articleextractor.org/pages/14393/au_capote_ver01/sn86072192/1902/02/07/ed-1/seq-10/1","Lynchburg, TN","NA, NA","NA, NA","Lynchburg","TN",NA,NA,NA,NA,NA, 462,"sn86072192", -86.374021,  35.283024,NA,NA,NA,NA
"1107",14394,"The age-herald ","Birmingham, Alabama", -86.81036, 33.518589,"Birmingham","Alabama","3/26/1902",1902, 3,26,"seq-3","https://articleextractor.org/pages/14394/au_capote_ver01/sn86072192/1902/03/26/ed-1/seq-3/1","Washington, NC","NA, NA","NA, NA","Washington","NC",NA,NA,NA,NA,NA, 463,"sn86072192", -77.052174,  35.546552,NA,NA,NA,NA
"1108",14396,"The Birmingham age-herald ","Birmingham, Alabama", -86.81036, 33.518589,"Birmingham","Alabama","11/26/1906",1906,11,26,"seq-1","https://articleextractor.org/pages/14396/au_evans_ver01/sn85038485/1906/11/26/ed-1/seq-1/1","Springfield, MO","Lafayette, LA","NA, NA","Springfield","MO","Lafayette","LA",NA,NA,NA, 465,"sn85038485", -93.292299,  37.208957, -92.01984,  30.22409,NA,NA
"1109",14397,"The Birmingham age-herald ","Birmingham, Alabama", -86.81036, 33.518589,"Birmingham","Alabama","5/25/1909",1909, 5,25,"seq-6","https://articleextractor.org/pages/14397/au_flagg_ver01/sn85038485/1909/05/25/ed-1/seq-6/1","Chattanooga, TN","NA, NA","NA, NA","Chattanooga","TN",NA,NA,NA,NA,NA, 466,"sn85038485", -85.309399,  35.045798,NA,NA,NA,NA
"1110",14397,"The Birmingham age-herald ","Birmingham, Alabama", -86.81036, 33.518589,"Birmingham","Alabama","5/25/1909",1909, 5,25,"seq-6","https://articleextractor.org/pages/14397/au_flagg_ver01/sn85038485/1909/05/25/ed-1/seq-6/1","Chattanooga, TN","NA, NA","NA, NA","Chattanooga","TN",NA,NA,NA,NA,NA, 467,"sn85038485", -85.309399,  35.045798,NA,NA,NA,NA
"1111",14399,"The Birmingham age-herald ","Birmingham, Alabama", -86.81036, 33.518589,"Birmingham","Alabama","7/23/1910",1910, 7,23,"seq-1","https://articleextractor.org/pages/14399/au_gaston_ver01/sn85038485/1910/07/23/ed-1/seq-1/1","Newark, OH","NA, NA","NA, NA","Newark","OH",NA,NA,NA,NA,NA, 468,"sn85038485", -82.401264,  40.058121,NA,NA,NA,NA
"1112",14400,"The Birmingham age-herald ","Birmingham, Alabama", -86.81036, 33.518589,"Birmingham","Alabama","11/8/1910",1910,11, 8,"seq-1","https://articleextractor.org/pages/14400/au_gaston_ver01/sn85038485/1910/11/08/ed-1/seq-1/1","Macon, GA","NA, NA","NA, NA","Macon","GA",NA,NA,NA,NA,NA, 469,"sn85038485", -83.632402,  32.840695,NA,NA,NA,NA
"1113",14401,"The Birmingham age-herald ","Birmingham, Alabama", -86.81036, 33.518589,"Birmingham","Alabama","9/18/1911",1911, 9,18,"seq-7","https://articleextractor.org/pages/14401/au_huie_ver01/sn85038485/1911/09/18/ed-1/seq-7/1","Warrenton, NC","NA, NA","NA, NA","Warrenton","NC",NA,NA,NA,NA,NA, 470,"sn85038485", -78.155271,  36.398480,NA,NA,NA,NA
"1114",14402,"The Birmingham age-herald ","Birmingham, Alabama", -86.81036, 33.518589,"Birmingham","Alabama","10/6/1911",1911,10, 6,"seq-11","https://articleextractor.org/pages/14402/au_huie_ver01/sn85038485/1911/10/06/ed-1/seq-11/1","Eastman, GA","NA, NA","NA, NA","Eastman","GA",NA,NA,NA,NA,NA, 471,"sn85038485", -83.177651,  32.197673,NA,NA,NA,NA
"1115",14403,"The Birmingham age-herald ","Birmingham, Alabama", -86.81036, 33.518589,"Birmingham","Alabama","1/23/1912",1912, 1,23,"seq-8","https://articleextractor.org/pages/14403/au_huie_ver01/sn85038485/1912/01/23/ed-1/seq-8/1","Hamilton, GA","NA, NA","NA, NA","Hamilton","GA",NA,NA,NA,NA,NA, 472,"sn85038485", -84.874931,  32.757911,NA,NA,NA,NA
"1116",14406,"Phoenix tribune ","Phoenix, Arizona",-112.07404, 33.448377,"Phoenix","Arizona","7/22/1922",1922, 7,22,"seq-1","https://articleextractor.org/pages/14406/az_campfiregoneout_ver03/sn96060881/1922/07/22/ed-1/seq-1/1","Benton, LA","NA, NA","NA, NA","Benton","LA",NA,NA,NA,NA,NA, 474,"sn96060881", -93.741845,  32.694868,NA,NA,NA,NA
"1117",14406,"Phoenix tribune ","Phoenix, Arizona",-112.07404, 33.448377,"Phoenix","Arizona","7/22/1922",1922, 7,22,"seq-1","https://articleextractor.org/pages/14406/az_campfiregoneout_ver03/sn96060881/1922/07/22/ed-1/seq-1/1","Benton, LA","NA, NA","NA, NA","Benton","LA",NA,NA,NA,NA,NA, 475,"sn96060881", -93.741845,  32.694868,NA,NA,NA,NA
"1118",14408,"Nogales international ","Nogales, Arizona",-110.93425, 31.340377,"Nogales","Arizona","1/6/1934",1934, 1, 6,"seq-6","https://articleextractor.org/pages/14408/az_groomcreek_ver04/sn96060774/1934/01/06/ed-1/seq-6/1","San Jose, CA","NA, NA","NA, NA","San Jose","CA",NA,NA,NA,NA,NA, 476,"sn96060774",-121.885253,  37.338740,NA,NA,NA,NA
"1119",14411,"Arizona republican ","Phoenix, Arizona",-112.07404, 33.448377,"Phoenix","Arizona","8/9/1901",1901, 8, 9,"seq-1","https://articleextractor.org/pages/14411/az_kangaroorat_ver01/sn84020558/1901/08/09/ed-1/seq-1/1","Carrolton, MS","NA, NA","NA, NA","Carrolton","MS",NA,NA,NA,NA,NA, 477,"sn84020558", -89.920361,  33.508177,NA,NA,NA,NA
"1120",14411,"Arizona republican ","Phoenix, Arizona",-112.07404, 33.448377,"Phoenix","Arizona","8/9/1901",1901, 8, 9,"seq-1","https://articleextractor.org/pages/14411/az_kangaroorat_ver01/sn84020558/1901/08/09/ed-1/seq-1/1","Carrolton, MS","Smithville, TN","NA, NA","Carrolton","MS","Smithville","TN",NA,NA,NA, 477,"sn84020558", -89.920361,  33.508177, -85.81415,  35.96062,NA,NA
"1121",14411,"Arizona republican ","Phoenix, Arizona",-112.07404, 33.448377,"Phoenix","Arizona","8/9/1901",1901, 8, 9,"seq-1","https://articleextractor.org/pages/14411/az_kangaroorat_ver01/sn84020558/1901/08/09/ed-1/seq-1/1","Carrolton, MS","NA, NA","NA, NA","Carrolton","MS",NA,NA,NA,NA,NA, 478,"sn84020558", -89.920361,  33.508177,NA,NA,NA,NA
"1122",14411,"Arizona republican ","Phoenix, Arizona",-112.07404, 33.448377,"Phoenix","Arizona","8/9/1901",1901, 8, 9,"seq-1","https://articleextractor.org/pages/14411/az_kangaroorat_ver01/sn84020558/1901/08/09/ed-1/seq-1/1","Carrolton, MS","Smithville, TN","NA, NA","Carrolton","MS","Smithville","TN",NA,NA,NA, 478,"sn84020558", -89.920361,  33.508177, -85.81415,  35.96062,NA,NA
"1123",14412,"Bisbee daily review ","Bisbee, Arizona",-109.92841, 31.448155,"Bisbee","Arizona","7/27/1919",1919, 7,27,"seq-1","https://articleextractor.org/pages/14412/az_kitfox_ver01/sn84024827/1919/07/27/ed-1/seq-1/1","Milan, GA","NA, NA","NA, NA","Milan","GA",NA,NA,NA,NA,NA, 479,"sn84024827", -83.062649,  32.017400,NA,NA,NA,NA
"1124",14413,"Bisbee daily review ","Bisbee, Arizona",-109.92841, 31.448155,"Bisbee","Arizona","12/28/1919",1919,12,28,"seq-1","https://articleextractor.org/pages/14413/az_kitfox_ver01/sn84024827/1919/12/28/ed-1/seq-1/1","Franklinton, NC","NA, NA","NA, NA","Franklinton","NC",NA,NA,NA,NA,NA, 480,"sn84024827", -78.458054,  36.101816,NA,NA,NA,NA
"1125",14414,"Arizona republican ","Phoenix, Arizona",-112.07404, 33.448377,"Phoenix","Arizona","8/24/1906",1906, 8,24,"seq-1","https://articleextractor.org/pages/14414/az_leopardfrog_ver01/sn84020558/1906/08/24/ed-1/seq-1/1","St. George, SC","NA, NA","NA, NA","St. George","SC",NA,NA,NA,NA,NA, 481,"sn84020558", -80.575653,  33.185996,NA,NA,NA,NA
"1126",14415,"The Raymer enterprise. ","New Raymer, Colorado",-103.84388, 40.608037,"New Raymer","Colorado","9/25/1919",1919, 9,25,"seq-6","https://articleextractor.org/pages/14415/cohi_aberdeen_ver01/sn89052040/1919/09/25/ed-1/seq-6/1","Pueblo, CO","NA, NA","NA, NA","Pueblo","CO",NA,NA,NA,NA,NA, 482,"sn89052040",-104.609141,  38.254447,NA,NA,NA,NA
"1127",14416,"The Raymer enterprise. ","New Raymer, Colorado",-103.84388, 40.608037,"New Raymer","Colorado","10/9/1919",1919,10, 9,"seq-2","https://articleextractor.org/pages/14416/cohi_aberdeen_ver01/sn89052040/1919/10/09/ed-1/seq-2/1","Omaha, NE","NA, NA","NA, NA","Omaha","NE",NA,NA,NA,NA,NA, 483,"sn89052040", -95.934503,  41.256537,NA,NA,NA,NA
"1128",14417,"The Raymer enterprise. ","New Raymer, Colorado",-103.84388, 40.608037,"New Raymer","Colorado","10/27/1921",1921,10,27,"seq-7","https://articleextractor.org/pages/14417/cohi_aberdeen_ver01/sn89052040/1921/10/27/ed-1/seq-7/1","Appleton, SC","NA, NA","NA, NA","Appleton","SC",NA,NA,NA,NA,NA, 484,"sn89052040", -81.362885,  33.043489,NA,NA,NA,NA
"1129",14418,"The Raymer enterprise. ","New Raymer, Colorado",-103.84388, 40.608037,"New Raymer","Colorado","8/2/1923",1923, 8, 2,"seq-6","https://articleextractor.org/pages/14418/cohi_aberdeen_ver01/sn89052040/1923/08/02/ed-1/seq-6/1","Bingham, UT","NA, NA","NA, NA","Bingham","UT",NA,NA,NA,NA,"Mob gathered outside jail but was held back", 485,"sn89052040",-112.131572,  40.558671,NA,NA,NA,NA
"1130",14419,"Rocky Ford enterprise. ","Rocky Ford, Colorado",-103.72023, 38.052508,"Rocky Ford","Colorado","1/22/1915",1915, 1,22,"seq-2","https://articleextractor.org/pages/14419/cohi_carr_ver02/sn90051265/1915/01/22/ed-1/seq-2/1","Monticello, GA","NA, NA","NA, NA","Monticello","GA",NA,NA,NA,NA,NA, 486,"sn90051265", -83.683229,  33.304848,NA,NA,NA,NA
"1131",14420,"The Ordway new era. ","Ordway, Colorado",-103.75606, 38.218061,"Ordway","Colorado","7/18/1913",1913, 7,18,"seq-2","https://articleextractor.org/pages/14420/cohi_fairplay_ver01/sn90051033/1913/07/18/ed-1/seq-2/1","Blountstown, FL","NA, NA","NA, NA","Blountstown","FL",NA,NA,NA,NA,NA, 487,"sn90051033", -85.045195,  30.443529,NA,NA,NA,NA
"1132",14424,"The Colorado statesman ","Denver, Colorado",-104.99025, 39.739236,"Denver","Colorado","5/3/1924",1924, 5, 3,"seq-1","https://articleextractor.org/pages/14424/cohi_hamilton_ver01/sn83025514/1924/05/03/ed-1/seq-1/1","Woodbury, GA","NA, NA","NA, NA","Woodbury","GA",NA,NA,NA,NA,NA, 489,"sn83025514", -84.582703,  32.983739,NA,NA,NA,NA
"1133",14425,"The Keota news. ","Keota, Colorado",-104.07523, 40.702764,"Keota","Colorado","5/11/1917",1917, 5,11,"seq-4","https://articleextractor.org/pages/14425/cohi_jamestown_ver01/sn89052038/1917/05/11/ed-1/seq-4/2","Phoenix, AZ","NA, NA","NA, NA","Phoenix","AZ",NA,NA,NA,NA,NA, 490,"sn89052038",-112.074037,  33.448377,NA,NA,NA,NA
"1134",14426,"The Elbert County tribune ","Elbert, Colorado",-104.53715, 39.219468,"Elbert","Colorado","10/17/1907",1907,10,17,"seq-4","https://articleextractor.org/pages/14426/cohi_jasper_ver01/sn90051300/1907/10/17/ed-1/seq-4/1","Tunica, MS","NA, NA","NA, NA","Tunica","MS",NA,NA,NA,NA,NA, 491,"sn90051300", -90.382877,  34.684545,NA,NA,NA,NA
"1135",14427,"Pueblo chieftain. ","Pueblo, Colorado",-104.60914, 38.254447,"Pueblo","Colorado","4/27/1921",1921, 4,27,"seq-5","https://articleextractor.org/pages/14427/cohi_kebler_ver01/sn90051672/1921/04/27/ed-1/seq-5/1","Picayune, MS","NA, NA","NA, NA","Picayune","MS",NA,NA,NA,NA,NA, 492,"sn90051672", -89.679508,  30.525469,NA,NA,NA,NA
"1136",14429,"The daily morning journal and courier ","New Haven, Connecticut", -72.92788, 41.308274,"New Haven","Connecticut","7/15/1898",1898, 7,15,"seq-1","https://articleextractor.org/pages/14429/ct_ash_ver01/sn84020358/1898/07/15/ed-1/seq-1/1","Monticello, AR","NA, NA","NA, NA","Monticello","AR",NA,NA,NA,NA,NA, 493,"sn84020358", -91.802186,  33.629670,NA,NA,NA,NA
"1137",14430,"The daily morning journal and courier ","New Haven, Connecticut", -72.92788, 41.308274,"New Haven","Connecticut","3/11/1904",1904, 3,11,"seq-1","https://articleextractor.org/pages/14430/ct_cedar_ver01/sn84020358/1904/03/11/ed-1/seq-1/1","Springfield, OH","NA, NA","NA, NA","Springfield","OH",NA,NA,NA,NA,NA, 494,"sn84020358", -83.808817,  39.924227,NA,NA,NA,NA
"1138",14431,"Norwich bulletin ","Norwich, Connecticut", -72.07591, 41.524265,"Norwich","Connecticut","5/24/1911",1911, 5,24,"seq-1","https://articleextractor.org/pages/14431/ct_danbury_ver01/sn82014086/1911/05/24/ed-1/seq-1/1","Gallatin, TN","NA, NA","NA, NA","Gallatin","TN",NA,NA,NA,NA,NA, 495,"sn82014086", -86.448511,  36.387768,NA,NA,NA,NA
"1139",14435,"Waterbury evening Democrat ","Waterbury, Connecticut", -73.05150, 41.558152,"Waterbury","Connecticut","12/30/1889",1889,12,30,"seq-1","https://articleextractor.org/pages/14435/ct_forest_ver01/sn94053256/1889/12/30/ed-1/seq-1/1","Barnwell, SC","NA, NA","NA, NA","Barnwell","SC",NA,NA,NA,NA,NA, 497,"sn94053256", -81.358718,  33.244873,NA,NA,NA,NA
"1140",14435,"Waterbury evening Democrat ","Waterbury, Connecticut", -73.05150, 41.558152,"Waterbury","Connecticut","12/30/1889",1889,12,30,"seq-1","https://articleextractor.org/pages/14435/ct_forest_ver01/sn94053256/1889/12/30/ed-1/seq-1/1","Barnwell, SC","NA, NA","NA, NA","Barnwell","SC",NA,NA,NA,NA,NA, 498,"sn94053256", -81.358718,  33.244873,NA,NA,NA,NA
"1141",14436,"Waterbury evening Democrat ","Waterbury, Connecticut", -73.05150, 41.558152,"Waterbury","Connecticut","1/2/1893",1893, 1, 2,"seq-3","https://articleextractor.org/pages/14436/ct_gum_ver01/sn94053256/1893/01/02/ed-1/seq-3/1","Wamack Hill, AL","Monroeville, AL","NA, NA","Wamack Hill","AL","Monroeville","AL",NA,NA,NA, 499,"sn94053256", -88.188625,  31.853210, -87.32471,  31.52794,NA,NA
"1142",14437,"Waterbury evening Democrat ","Waterbury, Connecticut", -73.05150, 41.558152,"Waterbury","Connecticut","4/24/1894",1894, 4,24,"seq-1","https://articleextractor.org/pages/14437/ct_gum_ver01/sn94053256/1894/04/24/ed-1/seq-1/1","Cherokee, KS","NA, NA","NA, NA","Cherokee","KS",NA,NA,NA,NA,NA, 500,"sn94053256", -94.808850,  37.345887,NA,NA,NA,NA
"1143",14439,"Waterbury evening Democrat ","Waterbury, Connecticut", -73.05150, 41.558152,"Waterbury","Connecticut","8/15/1895",1895, 8,15,"seq-4","https://articleextractor.org/pages/14439/ct_gum_ver01/sn94053256/1895/08/15/ed-1/seq-4/1","Fulton, MO","Laurel, DE","NA, NA","Fulton","MO","Laurel","DE",NA,NA,NA, 501,"sn94053256", -91.947959,  38.846708, -75.57131,  38.55650,NA,NA
"1144",14440,"The Bridgeport times and evening farmer. ","Bridgeport, Connecticut", -73.18944, 41.179226,"Bridgeport","Connecticut","4/6/1918",1918, 4, 6,"seq-1","https://articleextractor.org/pages/14440/ct_haddam_ver01/sn92051227/1918/04/06/ed-1/seq-1/1","Collinsville, IL","NA, NA","NA, NA","Collinsville","IL",NA,NA,NA,NA,NA, 502,"sn92051227", -89.984548,  38.670327,NA,NA,NA,NA
"1145",14442,"The San Francisco call ","San Francisco , California",-122.41942, 37.774929,"San Francisco ","California","10/2/1895",1895,10, 2,"seq-1","https://articleextractor.org/pages/14442/curiv_dogtown_ver01/sn85066387/1895/10/02/ed-1/seq-1/1","Trinity County, CA","NA, NA","NA, NA","Trinity County","CA",NA,NA,NA,NA,NA, 503,"sn85066387",-123.062255,  40.632948,NA,NA,NA,NA
"1146",14443,"The San Francisco call ","San Francisco , California",-122.41942, 37.774929,"San Francisco ","California","11/18/1895",1895,11,18,"seq-2","https://articleextractor.org/pages/14443/curiv_dogtown_ver01/sn85066387/1895/11/18/ed-1/seq-2/1","Frederick, MD","NA, NA","NA, NA","Frederick","MD",NA,NA,NA,NA,NA, 504,"sn85066387", -77.410541,  39.414269,NA,NA,NA,NA
"1147",14444,"The San Francisco call ","San Francisco , California",-122.41942, 37.774929,"San Francisco ","California","2/27/1896",1896, 2,27,"seq-1","https://articleextractor.org/pages/14444/curiv_dogtown_ver01/sn85066387/1896/02/27/ed-1/seq-1/1","Wichita Falls, TX","NA, NA","NA, NA","Wichita Falls","TX",NA,NA,NA,NA,NA, 505,"sn85066387", -98.493387,  33.913708,NA,NA,NA,NA
"1148",14445,"Daily Los Angeles herald ","Los Angeles , California",-118.24264, 34.054908,"Los Angeles ","California","1/27/1883",1883, 1,27,"seq-2","https://articleextractor.org/pages/14445/curiv_inskip_ver01/sn85042459/1883/01/27/ed-1/seq-2/1","Wichita, KS","NA, NA","NA, NA","Wichita","KS",NA,NA,NA,NA,NA, 506,"sn85042459", -97.330053,  37.687176,NA,NA,NA,NA
"1149",14446,"The San Francisco call ","San Francisco , California",-122.41942, 37.774929,"San Francisco ","California","8/30/1904",1904, 8,30,"seq-1","https://articleextractor.org/pages/14446/curiv_darwin_ver01/sn85066387/1904/08/30/ed-1/seq-1/1","Laramie, WY","Portal, GA","NA, NA","Laramie","WY","Portal","GA",NA,NA,NA, 507,"sn85066387",-105.591101,  41.311367, -81.93234,  32.53822,NA,NA
"1150",14446,"The San Francisco call ","San Francisco , California",-122.41942, 37.774929,"San Francisco ","California","8/30/1904",1904, 8,30,"seq-1","https://articleextractor.org/pages/14446/curiv_darwin_ver01/sn85066387/1904/08/30/ed-1/seq-1/1","Laramie, WY","Portal, GA","NA, NA","Laramie","WY","Portal","GA",NA,NA,NA, 508,"sn85066387",-105.591101,  41.311367, -81.93234,  32.53822,NA,NA
"1151",14447,"Los Angeles daily herald ","Los Angeles , California",-118.24264, 34.054908,"Los Angeles ","California","9/26/1889",1889, 9,26,"seq-3","https://articleextractor.org/pages/14447/curiv_keswick_ver01/sn85042460/1889/09/26/ed-1/seq-3/1","Winona, MS","NA, NA","NA, NA","Winona","MS",NA,NA,NA,NA,NA, 509,"sn85042460", -89.728137,  33.482068,NA,NA,NA,NA
"1152",14448,"Sacramento daily record-union ","Sacramento , California",-121.49440, 38.581572,"Sacramento ","California","3/14/1889",1889, 3,14,"seq-2","https://articleextractor.org/pages/14448/curiv_mojave_ver01/sn82014381/1889/03/14/ed-1/seq-2/1","Charleston, SC","NA, NA","NA, NA","Charleston","SC",NA,NA,NA,NA,"Mob attempted violence but seems to have been unsuccessful", 510,"sn82014381", -79.931051,  32.776475,NA,NA,NA,NA
"1153",14449,"Sacramento daily record-union ","Sacramento , California",-121.49440, 38.581572,"Sacramento ","California","9/28/1889",1889, 9,28,"seq-1","https://articleextractor.org/pages/14449/curiv_mojave_ver01/sn82014381/1889/09/28/ed-1/seq-1/1","Marshalltown, IA","Birmingham, AL","NA, NA","Marshalltown","IA","Birmingham","AL",NA,NA,"Mob gathered outside jail but was not successful", 511,"sn82014381", -92.908037,  42.049467, -86.81036,  33.51859,NA,NA
"1154",14450,"The herald ","Los Angeles , California",-118.24264, 34.054908,"Los Angeles ","California","2/13/1896",1896, 2,13,"seq-1","https://articleextractor.org/pages/14450/curiv_moonstone_ver01/sn85042461/1896/02/13/ed-1/seq-1/1","Sullivan, IL","NA, NA","NA, NA","Sullivan","IL",NA,NA,NA,NA,NA, 512,"sn85042461", -88.607839,  39.599479,NA,NA,NA,NA
"1155",14453,"The record-union ","Sacramento, California",-121.49440, 38.581572,"Sacramento","California","4/30/1895",1895, 4,30,"seq-1","https://articleextractor.org/pages/14453/curiv_pescadero_ver01/sn82015104/1895/04/30/ed-1/seq-1/1","Butler County, AL","NA, NA","NA, NA","Butler County","AL",NA,NA,NA,NA,NA, 514,"sn82015104", -86.661108,  31.676028,NA,NA,NA,NA
"1156",14455,"Evening journal ","Wilmington, Delaware", -75.54839, 39.744655,"Wilmington","Delaware","9/4/1891",1891, 9, 4,"seq-1","https://articleextractor.org/pages/14455/deu_arden_ver01/sn85042354/1891/09/04/ed-1/seq-1/1","Elizabeth, NJ","NA, NA","NA, NA","Elizabeth","NJ",NA,NA,NA,NA,"Mob threatened to lynch man", 516,"sn85042354", -74.210701,  40.663992,NA,NA,NA,NA
"1157",14457,"Los Angeles herald ","Los Angeles , California",-118.24264, 34.054908,"Los Angeles ","California","3/4/1910",1910, 3, 4,"seq-3","https://articleextractor.org/pages/14457/curiv_rubidoux_ver01/sn85042462/1910/03/04/ed-1/seq-3/1","Dallas, TX","NA, NA","NA, NA","Dallas","TX",NA,NA,NA,NA,NA, 518,"sn85042462", -96.796988,  32.776664,NA,NA,NA,NA
"1158",14458,"Evening journal ","Wilmington, Delaware", -75.54839, 39.744655,"Wilmington","Delaware","1/27/1896",1896, 1,27,"seq-2","https://articleextractor.org/pages/14458/deu_arden_ver01/sn85042354/1896/01/27/ed-1/seq-2/1","Vilas, KS","Sullivan, IN","NA, NA","Vilas","KS","Sullivan","IN",NA,NA,"There were multiple mobs that formed, the first when they found him in the Red Hills and the second after he was turned over to authorities in Vilas", 519,"sn85042354", -95.586370,  37.654215, -87.40585,  39.09532,NA,NA
"1159",14459,"The Cheyenne daily leader ","Cheyenne, Wyoming",-104.82025, 41.139981,"Cheyenne","Wyoming","10/11/1891",1891,10,11,"seq-1","https://articleextractor.org/pages/14459/wyu_calpet_ver02/sn86072173/1891/10/11/ed-1/seq-1/1","Omaha, NE","NA, NA","NA, NA","Omaha","NE",NA,NA,NA,NA,NA, 520,"sn86072173", -95.934503,  41.256537,NA,NA,NA,NA
"1160",14462,"Casper daily tribune ","Casper, Wyoming",-106.29808, 42.848709,"Casper","Wyoming","12/23/1920",1920,12,23,"seq-1","https://articleextractor.org/pages/14462/wyu_frannie_ver01/sn86072160/1920/12/23/ed-1/seq-1/1","Fort Worth, TX","NA, NA","NA, NA","Fort Worth","TX",NA,NA,NA,NA,NA, 521,"sn86072160", -97.330766,  32.755488,NA,NA,NA,NA
"1161",14463,"Casper daily tribune ","Casper, Wyoming",-106.29808, 42.848709,"Casper","Wyoming","1/4/1921",1921, 1, 4,"seq-1","https://articleextractor.org/pages/14463/wyu_frannie_ver01/sn86072160/1921/01/04/ed-1/seq-1/1","Meridian, MS","NA, NA","NA, NA","Meridian","MS",NA,NA,NA,NA,NA, 522,"sn86072160", -88.703656,  32.364310,NA,NA,NA,NA
"1162",14465,"Casper daily tribune ","Casper, Wyoming",-106.29808, 42.848709,"Casper","Wyoming","2/2/1922",1922, 2, 2,"seq-1","https://articleextractor.org/pages/14465/wyu_greybull_ver01/sn86072160/1922/02/02/ed-1/seq-1/1","Crystal Springs, MS","NA, NA","NA, NA","Crystal Springs","MS",NA,NA,NA,NA,NA, 524,"sn86072160", -90.357035,  31.987378,NA,NA,NA,NA
"1163",14470,"The Cheyenne daily leader ","Cheyenne, Wyoming",-104.82025, 41.139981,"Cheyenne","Wyoming","3/8/1882",1882, 3, 8,"seq-1","https://articleextractor.org/pages/14470/wyu_calpet_ver02/sn84022149/1882/03/08/ed-1/seq-1/1","Franklin, KY","NA, NA","NA, NA","Franklin","KY",NA,NA,NA,NA,NA, 525,"sn84022149", -86.578557,  36.718786,NA,NA,NA,NA
"1164",14471,"The Cheyenne daily leader ","Cheyenne, Wyoming",-104.82025, 41.139981,"Cheyenne","Wyoming","10/27/1883",1883,10,27,"seq-4","https://articleextractor.org/pages/14471/wyu_calpet_ver02/sn84022149/1883/10/27/ed-1/seq-4/1","Cheyenne, WY","NA, NA","NA, NA","Cheyenne","WY",NA,NA,NA,NA,NA, 526,"sn84022149",-104.820246,  41.139981,NA,NA,NA,NA
"1165",14473,"The Cheyenne daily leader ","Cheyenne, Wyoming",-104.82025, 41.139981,"Cheyenne","Wyoming","6/15/1888",1888, 6,15,"seq-1","https://articleextractor.org/pages/14473/wyu_calpet_ver02/sn86072173/1888/06/15/ed-1/seq-1/1","Monarch, CO","NA, NA","NA, NA","Monarch","CO",NA,NA,NA,NA,NA, 527,"sn86072173",-106.293919,  38.552602,NA,NA,NA,NA
"1166",14474,"Wheeling register ","Wheeling, West Virginia", -80.72092, 40.063962,"Wheeling","West Virginia","7/26/1879",1879, 7,26,"seq-1","https://articleextractor.org/pages/14474/wvu_nova_ver02/sn86092518/1879/07/26/ed-1/seq-1/1","Waco, TX","NA, NA","NA, NA","Waco","TX",NA,NA,NA,NA,"Says the arrest that prompted the mob violence happened in a ""neighboring county""", 528,"sn86092518", -97.146670,  31.549333,NA,NA,NA,NA
"1167",14478,"Wheeling register ","Wheeling, West Virginia", -80.72092, 40.063962,"Wheeling","West Virginia","2/5/1884",1884, 2, 5,"seq-1","https://articleextractor.org/pages/14478/wvu_nova_ver02/sn86092518/1884/02/05/ed-1/seq-1/1","Rendville, OH","NA, NA","NA, NA","Rendville","OH",NA,NA,NA,NA,NA, 531,"sn86092518", -82.090977,  39.619514,NA,NA,NA,NA
"1168",14478,"Wheeling register ","Wheeling, West Virginia", -80.72092, 40.063962,"Wheeling","West Virginia","2/5/1884",1884, 2, 5,"seq-1","https://articleextractor.org/pages/14478/wvu_nova_ver02/sn86092518/1884/02/05/ed-1/seq-1/1","Rendville, OH","NA, NA","NA, NA","Rendville","OH",NA,NA,NA,NA,NA, 532,"sn86092518", -82.090977,  39.619514,NA,NA,NA,NA
"1169",14480,"Wheeling register ","Wheeling, West Virginia", -80.72092, 40.063962,"Wheeling","West Virginia","9/18/1886",1886, 9,18,"seq-1","https://articleextractor.org/pages/14480/wvu_odona_ver04/sn86092518/1886/09/18/ed-1/seq-1/1","Millen, GA","NA, NA","NA, NA","Millen","GA",NA,NA,NA,NA,NA, 533,"sn86092518", -81.949281,  32.804051,NA,NA,NA,NA
"1170",14482,"The McDowell times ","Keystone, West Virginia", -81.45094, 37.414837,"Keystone","West Virginia","11/21/1913",1913,11,21,"seq-3","https://articleextractor.org/pages/14482/wvu_phaser_ver02/sn86092050/1913/11/21/ed-1/seq-3/1","Dyersburg, TN","NA, NA","NA, NA","Dyersburg","TN",NA,NA,NA,NA,NA, 534,"sn86092050", -89.385628,  36.034516,NA,NA,NA,NA
"1171",14485,"The McDowell times ","Keystone, West Virginia", -81.45094, 37.414837,"Keystone","West Virginia","10/5/1917",1917,10, 5,"seq-1","https://articleextractor.org/pages/14485/wvu_phaser_ver02/sn86092050/1917/10/05/ed-1/seq-1/2","Goose Creek, TX","NA, NA","NA, NA","Goose Creek","TX",NA,NA,NA,NA,NA, 535,"sn86092050", -94.963663,  29.733748,NA,NA,NA,NA
"1172",14487,"Wheeling register ","Wheeling, West Virginia", -80.72092, 40.063962,"Wheeling","West Virginia","4/25/1888",1888, 4,25,"seq-1","https://articleextractor.org/pages/14487/wvu_odona_ver04/sn86092518/1888/04/25/ed-1/seq-1/2","Birmingham, AL","NA, NA","NA, NA","Birmingham","AL",NA,NA,NA,NA,NA, 537,"sn86092518", -86.810357,  33.518589,NA,NA,NA,NA
"1173",14488,"Wheeling register ","Wheeling, West Virginia", -80.72092, 40.063962,"Wheeling","West Virginia","6/30/1882",1882, 6,30,"seq-4","https://articleextractor.org/pages/14488/wvu_nova_ver02/sn86092518/1882/06/30/ed-1/seq-4/2","Dallas, TX","NA, NA","NA, NA","Dallas","TX",NA,NA,NA,NA,NA, 538,"sn86092518", -96.796988,  32.776664,NA,NA,NA,NA
"1174",14489,"Wheeling register ","Wheeling, West Virginia", -80.72092, 40.063962,"Wheeling","West Virginia","2/2/1881",1881, 2, 2,"seq-1","https://articleextractor.org/pages/14489/wvu_nova_ver02/sn86092518/1881/02/02/ed-1/seq-1/2","Burke County, GA","NA, NA","NA, NA","Burke County","GA",NA,NA,NA,NA,NA, 539,"sn86092518", -81.953481,  33.088805,NA,NA,NA,NA
"1175",14490,"Wheeling register ","Wheeling, West Virginia", -80.72092, 40.063962,"Wheeling","West Virginia","5/15/1885",1885, 5,15,"seq-1","https://articleextractor.org/pages/14490/wvu_odona_ver04/sn86092518/1885/05/15/ed-1/seq-1/2","Bibb County or Chilton County, AL","NA, NA","NA, NA","Bibb County or Chilton County","AL",NA,NA,NA,NA,"Article talks about a race war going on in these counties, partially fueled by a recent lynching, but it does not get more specific than naming these two counties.", 540,"sn86092518", -86.661108,  32.944392,NA,NA,NA,NA
"1176",14495,"The Calhoun chronicle ","Grantsville, West Virginia", -81.09595, 38.923420,"Grantsville","West Virginia","3/23/1922",1922, 3,23,"seq-1","https://articleextractor.org/pages/14495/wvu_moore_ver01/sn85059591/1922/03/23/ed-1/seq-1/1","Atlanta, GA","NA, NA","NA, NA","Atlanta","GA",NA,NA,NA,NA,NA, 541,"sn85059591", -84.387684,  33.748752,NA,NA,NA,NA
"1177",14496,"The Calhoun chronicle ","Grantsville, West Virginia", -81.09595, 38.923420,"Grantsville","West Virginia","7/13/1922",1922, 7,13,"seq-1","https://articleextractor.org/pages/14496/wvu_moore_ver01/sn85059591/1922/07/13/ed-1/seq-1/1","Morgantown, WV","Lanes Bridge, GA","NA, NA","Morgantown","WV","Lanes Bridge","GA",NA,NA,"Severely beaten by crowd of 300 men but unclear if he was killed", 542,"sn85059591", -79.955897,  39.629526, -81.98289,  31.73800,NA,NA
"1178",14497,"The Calhoun chronicle ","Grantsville, West Virginia", -81.09595, 38.923420,"Grantsville","West Virginia","7/19/1923",1923, 7,19,"seq-1","https://articleextractor.org/pages/14497/wvu_moore_ver01/sn85059591/1923/07/19/ed-1/seq-1/1","Conshohocken, PA","NA, NA","NA, NA","Conshohocken","PA",NA,NA,NA,NA,"Mob of 2,000 people surrounded jail and threatened to lynch prisoner", 543,"sn85059591", -75.301571,  40.079277,NA,NA,NA,NA
"1179",14503,"The Wheeling intelligencer ","Wheeling, West Virginia", -80.72092, 40.063962,"Wheeling","West Virginia","3/8/1922",1922, 3, 8,"seq-1","https://articleextractor.org/pages/14503/wvu_klingon_ver01/sn86092536/1922/03/08/ed-1/seq-1/1","Aberdeen, MS","NA, NA","NA, NA","Aberdeen","MS",NA,NA,NA,NA,"Report says it was ten miles north of there", 545,"sn86092536", -88.543655,  33.825114,NA,NA,NA,NA
"1180",14505,"The advocate ","Charleston, West Virginia", -81.63262, 38.349820,"Charleston","West Virginia","7/2/1908",1908, 7, 2,"seq-1","https://articleextractor.org/pages/14505/wvu_lincoln_ver01/sn85059812/1908/07/02/ed-1/seq-1/1","Waycross, GA","NA, NA","NA, NA","Waycross","GA",NA,NA,NA,NA,NA, 546,"sn85059812", -82.354018,  31.213551,NA,NA,NA,NA
"1181",14509,"The World ","Martinsburg, West Virginia", -77.96389, 39.456210,"Martinsburg","West Virginia","5/12/1893",1893, 5,12,"seq-1","https://articleextractor.org/pages/14509/wvu_hogan_ver01/sn85059538/1893/05/12/ed-1/seq-1/1","Laurens, SC","NA, NA","NA, NA","Laurens","SC",NA,NA,NA,NA,NA, 547,"sn85059538", -82.014260,  34.499012,NA,NA,NA,NA
"1182",14510,"Wheeling register ","Wheeling, West Virginia", -80.72092, 40.063962,"Wheeling","West Virginia","6/2/1893",1893, 6, 2,"seq-1","https://articleextractor.org/pages/14510/wvu_holt_ver01/sn86092518/1893/06/02/ed-1/seq-1/1","Ft. Madison, SC","NA, NA","NA, NA","Ft. Madison","SC",NA,NA,NA,NA,NA, 548,"sn86092518", -83.207935,  34.632320,NA,NA,NA,NA
"1183",14511,"Wheeling register ","Wheeling, West Virginia", -80.72092, 40.063962,"Wheeling","West Virginia","6/5/1893",1893, 6, 5,"seq-2","https://articleextractor.org/pages/14511/wvu_holt_ver01/sn86092518/1893/06/05/ed-1/seq-2/1","Decatur, IL","NA, NA","NA, NA","Decatur","IL",NA,NA,NA,NA,NA, 549,"sn86092518", -88.954800,  39.840315,NA,NA,NA,NA
"1184",14517,"Pioneer press ","Martinsburg, West Virginia", -77.96389, 39.456210,"Martinsburg","West Virginia","11/30/1912",1912,11,30,"seq-1","https://articleextractor.org/pages/14517/wvu_gorn_ver01/sn83025146/1912/11/30/ed-1/seq-1/1","Pleasant Ridge, AR","NA, NA","NA, NA","Pleasant Ridge","AR",NA,NA,NA,NA,"Says posses are pursuing the murderer and that a lynching will likely occur if he is caught", 552,"sn83025146", -92.406544,  34.795924,NA,NA,NA,NA
"1185",14518,"The Wheeling daily intelligencer ","Wheeling, West Virginia", -80.72092, 40.063962,"Wheeling","West Virginia","10/19/1900",1900,10,19,"seq-1","https://articleextractor.org/pages/14518/wvu_hungary_ver01/sn84026844/1900/10/19/ed-1/seq-1/1","Elkton, KY","NA, NA","NA, NA","Elkton","KY",NA,NA,NA,NA,NA, 553,"sn84026844", -87.154167,  36.810043,NA,NA,NA,NA
"1186",14524,"Wheeling register ","Wheeling, West Virginia", -80.72092, 40.063962,"Wheeling","West Virginia","9/12/1889",1889, 9,12,"seq-1","https://articleextractor.org/pages/14524/wvu_gore_ver01/sn86092518/1889/09/12/ed-1/seq-1/1","Morgantown, NC","Lafayette, LA","Charleston, MS","Morgantown","NC","Lafayette","LA","Charleston","MS",NA, 555,"sn86092518", -81.684819,  35.745407, -92.01984,  30.22409, -90.05676,  34.00678
"1187",14525,"Wheeling register ","Wheeling, West Virginia", -80.72092, 40.063962,"Wheeling","West Virginia","6/30/1892",1892, 6,30,"seq-1","https://articleextractor.org/pages/14525/wvu_gore_ver01/sn86092518/1892/06/30/ed-1/seq-1/1","Woodbury, TN","Newton, TN","NA, NA","Woodbury","TN","Newton","TN",NA,NA,NA, 556,"sn86092518", -86.071657,  35.827567, -85.21246,  35.79479,NA,NA
"1188",14525,"Wheeling register ","Wheeling, West Virginia", -80.72092, 40.063962,"Wheeling","West Virginia","6/30/1892",1892, 6,30,"seq-1","https://articleextractor.org/pages/14525/wvu_gore_ver01/sn86092518/1892/06/30/ed-1/seq-1/1","Woodbury, TN","Newton, TN","NA, NA","Woodbury","TN","Newton","TN",NA,NA,NA, 557,"sn86092518", -86.071657,  35.827567, -85.21246,  35.79479,NA,NA
"1189",14525,"Wheeling register ","Wheeling, West Virginia", -80.72092, 40.063962,"Wheeling","West Virginia","6/30/1892",1892, 6,30,"seq-1","https://articleextractor.org/pages/14525/wvu_gore_ver01/sn86092518/1892/06/30/ed-1/seq-1/1","Woodbury, TN","Newton, TN","NA, NA","Woodbury","TN","Newton","TN",NA,NA,NA, 558,"sn86092518", -86.071657,  35.827567, -85.21246,  35.79479,NA,NA
"1190",14526,"Wheeling register ","Wheeling, West Virginia", -80.72092, 40.063962,"Wheeling","West Virginia","1/25/1897",1897, 1,25,"seq-5","https://articleextractor.org/pages/14526/wvu_isner_ver01/sn86092518/1897/01/25/ed-1/seq-5/1","Tallahassee, FL","NA, NA","NA, NA","Tallahassee","FL",NA,NA,NA,NA,NA, 559,"sn86092518", -84.280623,  30.438183,NA,NA,NA,NA
"1191",14528,"The Wheeling intelligencer ","Wheeling, West Virginia", -80.72092, 40.063962,"Wheeling","West Virginia","12/20/1919",1919,12,20,"seq-1","https://articleextractor.org/pages/14528/wvu_iconia_ver01/sn86092536/1919/12/20/ed-1/seq-1/1","Chapmanville, WV","NA, NA","NA, NA","Chapmanville","WV",NA,NA,NA,NA,NA, 561,"sn86092536", -82.017350,  37.973711,NA,NA,NA,NA
"1192",14531,"The Wheeling daily intelligencer ","Wheeling, West Virginia", -80.72092, 40.063962,"Wheeling","West Virginia","8/4/1893",1893, 8, 4,"seq-7","https://articleextractor.org/pages/14531/wvu_france_ver01/sn84026844/1893/08/04/ed-1/seq-7/1","Ohio County, KY","NA, NA","NA, NA","Ohio County","KY",NA,NA,NA,NA,NA, 562,"sn84026844", -86.822034,  37.510852,NA,NA,NA,NA
"1193",14533,"The Wheeling daily intelligencer ","Wheeling, West Virginia", -80.72092, 40.063962,"Wheeling","West Virginia","6/30/1892",1892, 6,30,"seq-6","https://articleextractor.org/pages/14533/wvu_france_ver01/sn84026844/1892/06/30/ed-1/seq-6/1","Newton, TN","NA, NA","NA, NA","Newton","TN",NA,NA,NA,NA,"Plans to lynch man in 12 hours", 563,"sn84026844", -85.212464,  35.794789,NA,NA,NA,NA
"1194",14534,"The Wheeling daily intelligencer ","Wheeling, West Virginia", -80.72092, 40.063962,"Wheeling","West Virginia","4/18/1884",1884, 4,18,"seq-1","https://articleextractor.org/pages/14534/wvu_france_ver01/sn84026844/1884/04/18/ed-1/seq-1/1","Gadsden, AL","NA, NA","NA, NA","Gadsden","AL",NA,NA,NA,NA,"Threats of lynching", 564,"sn84026844", -86.006639,  34.014264,NA,NA,NA,NA
"1195",14534,"The Wheeling daily intelligencer ","Wheeling, West Virginia", -80.72092, 40.063962,"Wheeling","West Virginia","4/18/1884",1884, 4,18,"seq-1","https://articleextractor.org/pages/14534/wvu_france_ver01/sn84026844/1884/04/18/ed-1/seq-1/1","Gadsden, AL","NA, NA","NA, NA","Gadsden","AL",NA,NA,NA,NA,"Threats of lynching", 565,"sn84026844", -86.006639,  34.014264,NA,NA,NA,NA
"1196",14535,"The Wheeling daily intelligencer ","Wheeling, West Virginia", -80.72092, 40.063962,"Wheeling","West Virginia","9/5/1881",1881, 9, 5,"seq-1","https://articleextractor.org/pages/14535/wvu_france_ver01/sn84026844/1881/09/05/ed-1/seq-1/1","Gongola, IL","NA, NA","NA, NA","Gongola","IL",NA,NA,NA,NA,"Gongola does not appear to be a town that exists anymore, but it seems as though it may be what is now known as Dongola", 566,"sn84026844",NA,NA,NA,NA,NA,NA
"1197",14541,"Martinsburg independent ","Martinsburg, West Virginia", -77.96389, 39.456210,"Martinsburg","West Virginia","4/28/1888",1888, 4,28,"seq-1","https://articleextractor.org/pages/14541/wvu_faldo_ver01/sn84038206/1888/04/28/ed-1/seq-1/1","Bessemer, AL","NA, NA","NA, NA","Bessemer","AL",NA,NA,NA,NA,NA, 568,"sn84038206", -86.954437,  33.401777,NA,NA,NA,NA
"1198",14542,"Evening journal ","Martinsburg, West Virginia", -77.96389, 39.456210,"Martinsburg","West Virginia","9/7/1912",1912, 9, 7,"seq-5","https://articleextractor.org/pages/14542/wvu_faldo_ver01/sn85059585/1912/09/07/ed-1/seq-5/1","Princeton, WV","NA, NA","NA, NA","Princeton","WV",NA,NA,NA,NA,NA, 569,"sn85059585", -81.102592,  37.366229,NA,NA,NA,NA
"1199",14543,"The Wheeling daily register ","Wheeling, West Virginia", -80.72092, 40.063962,"Wheeling","West Virginia","8/17/1874",1874, 8,17,"seq-3","https://articleextractor.org/pages/14543/wvu_enterprise_ver02/sn84026847/1874/08/17/ed-1/seq-3/1","Martinsburg, WV","NA, NA","NA, NA","Martinsburg","WV",NA,NA,NA,NA,NA, 570,"sn84026847", -77.963887,  39.456210,NA,NA,NA,NA
"1200",14544,"Bluefield evening leader ","Bluefield, West Virginia", -81.22232, 37.269840,"Bluefield","West Virginia","9/2/1910",1910, 9, 2,"seq-1","https://articleextractor.org/pages/14544/wvu_ellis_ver01/sn86092066/1910/09/02/ed-1/seq-1/1","Jackson, MS","NA, NA","NA, NA","Jackson","MS",NA,NA,NA,NA,NA, 571,"sn86092066", -90.184810,  32.298757,NA,NA,NA,NA
"1201",14544,"Bluefield evening leader ","Bluefield, West Virginia", -81.22232, 37.269840,"Bluefield","West Virginia","9/2/1910",1910, 9, 2,"seq-1","https://articleextractor.org/pages/14544/wvu_ellis_ver01/sn86092066/1910/09/02/ed-1/seq-1/1","Beasley Gap, GA","NA, NA","NA, NA","Beasley Gap","GA",NA,NA,NA,NA,"Threats of lynching", 571,"sn86092066", -84.597154,  34.348982,NA,NA,NA,NA
"1202",14546,"Bluefield evening leader ","Bluefield, West Virginia", -81.22232, 37.269840,"Bluefield","West Virginia","10/10/1906",1906,10,10,"seq-5","https://articleextractor.org/pages/14546/wvu_ellis_ver01/sn86092066/1906/10/10/ed-1/seq-5/1","Livingston County, KY","NA, NA","NA, NA","Livingston County","KY",NA,NA,NA,NA,NA, 572,"sn86092066", -88.362785,  37.243135,NA,NA,NA,NA
"1203",14547,"Martinsburg independent ","Martinsburg, West Virginia", -77.96389, 39.456210,"Martinsburg","West Virginia","2/18/1899",1899, 2,18,"seq-2","https://articleextractor.org/pages/14547/wvu_duval_ver01/sn84038206/1899/02/18/ed-1/seq-2/1","Leesburg, GA","NA, NA","NA, NA","Leesburg","GA",NA,NA,NA,NA,NA, 573,"sn84038206", -84.170742,  31.732116,NA,NA,NA,NA
"1204",14548,"The Fairmont West Virginian. ","Fairmont, West Virginia", -80.14258, 39.485085,"Fairmont","West Virginia","3/14/1913",1913, 3,14,"seq-1","https://articleextractor.org/pages/14548/wvu_dolphy_ver01/sn86092557/1913/03/14/ed-1/seq-1/1","Coatsville, PA","NA, NA","NA, NA","Coatsville","PA",NA,NA,NA,NA,NA, 574,"sn86092557", -75.823836,  39.983162,NA,NA,NA,NA
"1205",14551,"The Wheeling daily intelligencer ","Wheeling, West Virginia", -80.72092, 40.063962,"Wheeling","West Virginia","12/7/1893",1893,12, 7,"seq-1","https://articleextractor.org/pages/14551/wvu_denmark_ver01/sn84026844/1893/12/07/ed-1/seq-1/1","Berlin, AL","NA, NA","NA, NA","Berlin","AL",NA,NA,NA,NA,NA, 575,"sn84026844", -86.742541,  34.178519,NA,NA,NA,NA
"1206",14552,"The Fairmont West Virginian. ","Fairmont, West Virginia", -80.14258, 39.485085,"Fairmont","West Virginia","11/26/1913",1913,11,26,"seq-6","https://articleextractor.org/pages/14552/wvu_dolphy_ver01/sn86092557/1913/11/26/ed-1/seq-6/1","Princeton, WV","NA, NA","NA, NA","Princeton","WV",NA,NA,NA,NA,NA, 576,"sn86092557", -81.102592,  37.366229,NA,NA,NA,NA
"1207",14555,"Martinsburg independent ","Martinsburg, West Virginia", -77.96389, 39.456210,"Martinsburg","West Virginia","7/2/1892",1892, 7, 2,"seq-2","https://articleextractor.org/pages/14555/wvu_duval_ver01/sn84038206/1892/07/02/ed-1/seq-2/1","Woodbury, TN","NA, NA","NA, NA","Woodbury","TN",NA,NA,NA,NA,NA, 578,"sn84038206", -86.071657,  35.827567,NA,NA,NA,NA
"1208",14556,"Martinsburg herald ","Martinsburg, West Virginia", -77.96389, 39.456210,"Martinsburg","West Virginia","8/12/1899",1899, 8,12,"seq-5","https://articleextractor.org/pages/14556/wvu_casper_ver01/sn85059533/1899/08/12/ed-1/seq-5/1","Alexandria, VA","NA, NA","NA, NA","Alexandria","VA",NA,NA,NA,NA,NA, 579,"sn85059533", -77.046921,  38.804836,NA,NA,NA,NA
"1209",14557,"Martinsburg herald ","Martinsburg, West Virginia", -77.96389, 39.456210,"Martinsburg","West Virginia","1/31/1903",1903, 1,31,"seq-2","https://articleextractor.org/pages/14557/wvu_casper_ver01/sn85059533/1903/01/31/ed-1/seq-2/1","Madison, WV","NA, NA","NA, NA","Madison","WV",NA,NA,NA,NA,NA, 580,"sn85059533", -81.819289,  38.067045,NA,NA,NA,NA
"1210",14558,"The Wheeling daily register ","Wheeling, West Virginia", -80.72092, 40.063962,"Wheeling","West Virginia","9/16/1865",1865, 9,16,"seq-2","https://articleextractor.org/pages/14558/wvu_chekhov_ver01/sn84026847/1865/09/16/ed-1/seq-2/1","Knoxville, TN","NA, NA","NA, NA","Knoxville","TN",NA,NA,NA,NA,NA, 581,"sn84026847", -83.920739,  35.960638,NA,NA,NA,NA
"1211",14559,"The Wheeling daily register ","Wheeling, West Virginia", -80.72092, 40.063962,"Wheeling","West Virginia","6/7/1867",1867, 6, 7,"seq-1","https://articleextractor.org/pages/14559/wvu_chekhov_ver01/sn84026847/1867/06/07/ed-1/seq-1/1","Oil City, PA","NA, NA","NA, NA","Oil City","PA",NA,NA,NA,NA,"Riot almost turned into a lynching", 582,"sn84026847", -79.706441,  41.433948,NA,NA,NA,NA
"1212",14560,"The Wheeling intelligencer ","Wheeling, West Virginia", -80.72092, 40.063962,"Wheeling","West Virginia","4/27/1916",1916, 4,27,"seq-1","https://articleextractor.org/pages/14560/wvu_dawson_ver01/sn86092536/1916/04/27/ed-1/seq-1/1","Lawrence, KS","NA, NA","NA, NA","Lawrence","KS",NA,NA,NA,NA,NA, 583,"sn86092536", -95.235250,  38.971669,NA,NA,NA,NA
"1213",14561,"The Wheeling daily intelligencer ","Wheeling, West Virginia", -80.72092, 40.063962,"Wheeling","West Virginia","5/12/1888",1888, 5,12,"seq-1","https://articleextractor.org/pages/14561/wvu_denmark_ver01/sn84026844/1888/05/12/ed-1/seq-1/1","Bowling Green, KY","NA, NA","NA, NA","Bowling Green","KY",NA,NA,NA,NA,NA, 584,"sn84026844", -86.480804,  36.968522,NA,NA,NA,NA
"1214",14563,"The Wheeling daily intelligencer ","Wheeling, West Virginia", -80.72092, 40.063962,"Wheeling","West Virginia","10/11/1893",1893,10,11,"seq-4","https://articleextractor.org/pages/14563/wvu_denmark_ver01/sn84026844/1893/10/11/ed-1/seq-4/1","Martinsburg, WV","NA, NA","NA, NA","Martinsburg","WV",NA,NA,NA,NA,NA, 585,"sn84026844", -77.963887,  39.456210,NA,NA,NA,NA
"1215",14564,"The Wheeling intelligencer ","Wheeling, West Virginia", -80.72092, 40.063962,"Wheeling","West Virginia","4/21/1911",1911, 4,21,"seq-1","https://articleextractor.org/pages/14564/wvu_boreman_ver01/sn86092536/1911/04/21/ed-1/seq-1/1","Cumberland, MD","NA, NA","NA, NA","Cumberland","MD",NA,NA,NA,NA,"Article talks about an expected lynching", 586,"sn86092536", -78.762518,  39.652865,NA,NA,NA,NA
"1216",14565,"The Wheeling intelligencer ","Wheeling, West Virginia", -80.72092, 40.063962,"Wheeling","West Virginia","10/9/1911",1911,10, 9,"seq-1","https://articleextractor.org/pages/14565/wvu_boreman_ver01/sn86092536/1911/10/09/ed-1/seq-1/1","Waynesville, NC","NA, NA","NA, NA","Waynesville","NC",NA,NA,NA,NA,"Threats of lynching by mob", 587,"sn86092536", -82.988748,  35.488715,NA,NA,NA,NA
"1217",14566,"The Wheeling intelligencer ","Wheeling, West Virginia", -80.72092, 40.063962,"Wheeling","West Virginia","1/1/1912",1912, 1, 1,"seq-1","https://articleextractor.org/pages/14566/wvu_boreman_ver01/sn86092536/1912/01/01/ed-1/seq-1/1","Oklahoma City, OK","NA, NA","NA, NA","Oklahoma City","OK",NA,NA,NA,NA,NA, 588,"sn86092536", -97.516428,  35.467560,NA,NA,NA,NA
"1218",14569,"The Wheeling intelligencer ","Wheeling, West Virginia", -80.72092, 40.063962,"Wheeling","West Virginia","1/31/1913",1913, 1,31,"seq-10","https://articleextractor.org/pages/14569/wvu_boreman_ver01/sn86092536/1913/01/31/ed-1/seq-10/1","Drew, MS","NA, NA","NA, NA","Drew","MS",NA,NA,NA,NA,NA, 591,"sn86092536", -90.526481,  33.809558,NA,NA,NA,NA
"1219",14570,"The Wheeling intelligencer ","Wheeling, West Virginia", -80.72092, 40.063962,"Wheeling","West Virginia","3/30/1912",1912, 3,30,"seq-4","https://articleextractor.org/pages/14570/wvu_boreman_ver01/sn86092536/1912/03/30/ed-1/seq-4/1","Blackburg, SC","NA, NA","NA, NA","Blackburg","SC",NA,NA,NA,NA,NA, 592,"sn86092536", -81.515925,  35.121241,NA,NA,NA,NA
"1220",14571,"The Fairmont West Virginian. ","Fairmont, West Virginia", -80.14258, 39.485085,"Fairmont","West Virginia","8/8/1906",1906, 8, 8,"seq-5","https://articleextractor.org/pages/14571/wvu_brubeck_ver02/sn86092557/1906/08/08/ed-1/seq-5/1","Greensboro, NC","Salisbury, NC","NA, NA","Greensboro","NC","Salisbury","NC",NA,NA,NA, 593,"sn86092557", -79.791975,  36.072635, -80.47423,  35.67097,NA,NA
"1221",14574,"The Wheeling daily intelligencer ","Wheeling, West Virginia", -80.72092, 40.063962,"Wheeling","West Virginia","5/1/1867",1867, 5, 1,"seq-3","https://articleextractor.org/pages/14574/wvu_belgium_ver01/sn84026844/1867/05/01/ed-1/seq-3/1","Seymour, IN","NA, NA","NA, NA","Seymour","IN",NA,NA,NA,NA,NA, 595,"sn84026844", -85.890255,  38.959220,NA,NA,NA,NA
"1222",14633,"River Falls journal ","River Falls, Wisconsin", -92.62381, 44.861356,"River Falls","Wisconsin","1/6/1898",1898, 1, 6,"seq-2","https://articleextractor.org/pages/14633/whi_hegmeister_ver01/sn85033255/1898/01/06/ed-1/seq-2/1","Sherrill, AR","Glendore, MS","NA, NA","Sherrill","AR","Glendore","MS",NA,NA,NA, 665,"sn85033255", -91.951459,  34.384887, -90.29314,  33.82928,NA,NA
"1223",14633,"River Falls journal ","River Falls, Wisconsin", -92.62381, 44.861356,"River Falls","Wisconsin","1/6/1898",1898, 1, 6,"seq-2","https://articleextractor.org/pages/14633/whi_hegmeister_ver01/sn85033255/1898/01/06/ed-1/seq-2/1","Sherrill, AR","Glendore, MS","NA, NA","Sherrill","AR","Glendore","MS",NA,NA,NA, 666,"sn85033255", -91.951459,  34.384887, -90.29314,  33.82928,NA,NA
"1224",14634,"River Falls journal ","River Falls, Wisconsin", -92.62381, 44.861356,"River Falls","Wisconsin","2/24/1898",1898, 2,24,"seq-2","https://articleextractor.org/pages/14634/whi_hegmeister_ver01/sn85033255/1898/02/24/ed-1/seq-2/1","Blanch, AL","Lake City, SC","Crooked Creek, AR","Blanch","AL","Lake City","SC","Crooked Creek","AR",NA, 667,"sn85033255",NA,NA, -79.75535,  33.87100, -92.79912,  36.19686
"1225",14634,"River Falls journal ","River Falls, Wisconsin", -92.62381, 44.861356,"River Falls","Wisconsin","2/24/1898",1898, 2,24,"seq-2","https://articleextractor.org/pages/14634/whi_hegmeister_ver01/sn85033255/1898/02/24/ed-1/seq-2/1","Blanch, AL","Lake City, SC","Crooked Creek, AR","Blanch","AL","Lake City","SC","Crooked Creek","AR",NA, 668,"sn85033255",NA,NA, -79.75535,  33.87100, -92.79912,  36.19686
"1226",14635,"The Manitowoc pilot ","Manitowoc, Wisconsin", -87.65758, 44.088606,"Manitowoc","Wisconsin","9/24/1903",1903, 9,24,"seq-2","https://articleextractor.org/pages/14635/whi_harriet_ver01/sn85033139/1903/09/24/ed-1/seq-2/1","Luxora, AR","NA, NA","NA, NA","Luxora","AR",NA,NA,NA,NA,NA, 669,"sn85033139", -89.928227,  35.755826,NA,NA,NA,NA
"1227",14636,"The Manitowoc pilot ","Manitowoc, Wisconsin", -87.65758, 44.088606,"Manitowoc","Wisconsin","1/11/1900",1900, 1,11,"seq-10","https://articleextractor.org/pages/14636/whi_harriet_ver01/sn85033139/1900/01/11/ed-1/seq-10/1","Ripley, TN","NA, NA","NA, NA","Ripley","TN",NA,NA,NA,NA,NA, 670,"sn85033139", -89.529797,  35.745355,NA,NA,NA,NA
"1228",14636,"The Manitowoc pilot ","Manitowoc, Wisconsin", -87.65758, 44.088606,"Manitowoc","Wisconsin","1/11/1900",1900, 1,11,"seq-10","https://articleextractor.org/pages/14636/whi_harriet_ver01/sn85033139/1900/01/11/ed-1/seq-10/1","Ripley, TN","NA, NA","NA, NA","Ripley","TN",NA,NA,NA,NA,NA, 671,"sn85033139", -89.529797,  35.745355,NA,NA,NA,NA
"1229",14636,"The Manitowoc pilot ","Manitowoc, Wisconsin", -87.65758, 44.088606,"Manitowoc","Wisconsin","1/11/1900",1900, 1,11,"seq-10","https://articleextractor.org/pages/14636/whi_harriet_ver01/sn85033139/1900/01/11/ed-1/seq-10/1","Ripley, TN","NA, NA","NA, NA","Ripley","TN",NA,NA,NA,NA,NA, 672,"sn85033139", -89.529797,  35.745355,NA,NA,NA,NA
"1230",14636,"The Manitowoc pilot ","Manitowoc, Wisconsin", -87.65758, 44.088606,"Manitowoc","Wisconsin","1/11/1900",1900, 1,11,"seq-10","https://articleextractor.org/pages/14636/whi_harriet_ver01/sn85033139/1900/01/11/ed-1/seq-10/1","Ripley, TN","NA, NA","NA, NA","Ripley","TN",NA,NA,NA,NA,NA, 673,"sn85033139", -89.529797,  35.745355,NA,NA,NA,NA
"1231",14636,"The Manitowoc pilot ","Manitowoc, Wisconsin", -87.65758, 44.088606,"Manitowoc","Wisconsin","1/11/1900",1900, 1,11,"seq-10","https://articleextractor.org/pages/14636/whi_harriet_ver01/sn85033139/1900/01/11/ed-1/seq-10/1","Ripley, TN","NA, NA","NA, NA","Ripley","TN",NA,NA,NA,NA,NA, 674,"sn85033139", -89.529797,  35.745355,NA,NA,NA,NA
"1232",14637,"Wauwatosa news ","Wauwatosa, Wisconsin", -88.00759, 43.049457,"Wauwatosa","Wisconsin","7/15/1910",1910, 7,15,"seq-2","https://articleextractor.org/pages/14637/whi_grindylow_ver01/sn86086499/1910/07/15/ed-1/seq-2/1","Newark, OH","NA, NA","NA, NA","Newark","OH",NA,NA,NA,NA,NA, 675,"sn86086499", -82.401264,  40.058121,NA,NA,NA,NA
"1233",14638,"The Manitowoc pilot ","Manitowoc, Wisconsin", -87.65758, 44.088606,"Manitowoc","Wisconsin","9/23/1897",1897, 9,23,"seq-2","https://articleextractor.org/pages/14638/whi_grace_ver01/sn85033139/1897/09/23/ed-1/seq-2/1","Versailles, IN","Mexico (international news), NA","NA, NA","Versailles","IN","Mexico (international news)",NA,NA,NA,"""General news"" brief about governor of IN vowing to bring lynch mob to justice", 676,"sn85033139", -85.251903,  39.071999,-102.55278,  23.63450,NA,NA
"1234",14638,"The Manitowoc pilot ","Manitowoc, Wisconsin", -87.65758, 44.088606,"Manitowoc","Wisconsin","9/23/1897",1897, 9,23,"seq-2","https://articleextractor.org/pages/14638/whi_grace_ver01/sn85033139/1897/09/23/ed-1/seq-2/1","Versailles, IN","NA, NA","NA, NA","Versailles","IN",NA,NA,NA,NA,"This is an update on a lynching that took place in Indiana -- the governor has vowed to bring lynch mob to justice", 676,"sn85033139", -85.251903,  39.071999,NA,NA,NA,NA
"1235",14638,"The Manitowoc pilot ","Manitowoc, Wisconsin", -87.65758, 44.088606,"Manitowoc","Wisconsin","9/23/1897",1897, 9,23,"seq-2","https://articleextractor.org/pages/14638/whi_grace_ver01/sn85033139/1897/09/23/ed-1/seq-2/1","Versailles, IN","Mexico (international news), NA","NA, NA","Versailles","IN","Mexico (international news)",NA,NA,NA,"""General news"" brief about governor of IN vowing to bring lynch mob to justice", 677,"sn85033139", -85.251903,  39.071999,-102.55278,  23.63450,NA,NA
"1236",14638,"The Manitowoc pilot ","Manitowoc, Wisconsin", -87.65758, 44.088606,"Manitowoc","Wisconsin","9/23/1897",1897, 9,23,"seq-2","https://articleextractor.org/pages/14638/whi_grace_ver01/sn85033139/1897/09/23/ed-1/seq-2/1","Versailles, IN","NA, NA","NA, NA","Versailles","IN",NA,NA,NA,NA,"This is an update on a lynching that took place in Indiana -- the governor has vowed to bring lynch mob to justice", 677,"sn85033139", -85.251903,  39.071999,NA,NA,NA,NA
"1237",14639,"The Manitowoc pilot ","Manitowoc, Wisconsin", -87.65758, 44.088606,"Manitowoc","Wisconsin","7/20/1893",1893, 7,20,"seq-2","https://articleextractor.org/pages/14639/whi_grace_ver01/sn85033139/1893/07/20/ed-1/seq-2/1","NA, KY","NA, NA","NA, NA",NA,"KY",NA,NA,NA,NA,"Paragraph about how a Black man who was lynched in KY was the wrong man.", 678,"sn85033139", 106.150007,  22.726562,NA,NA,NA,NA
"1238",14639,"The Manitowoc pilot ","Manitowoc, Wisconsin", -87.65758, 44.088606,"Manitowoc","Wisconsin","7/20/1893",1893, 7,20,"seq-2","https://articleextractor.org/pages/14639/whi_grace_ver01/sn85033139/1893/07/20/ed-1/seq-2/1","NA, VA","NA, NA","NA, NA",NA,"VA",NA,NA,NA,NA,"Victim survived lynching and was later captured in Norfolk, VA", 678,"sn85033139", -78.656894,  37.431573,NA,NA,NA,NA
"1239",14639,"The Manitowoc pilot ","Manitowoc, Wisconsin", -87.65758, 44.088606,"Manitowoc","Wisconsin","7/20/1893",1893, 7,20,"seq-2","https://articleextractor.org/pages/14639/whi_grace_ver01/sn85033139/1893/07/20/ed-1/seq-2/1","NA, KY","NA, NA","NA, NA",NA,"KY",NA,NA,NA,NA,"Paragraph about how a Black man who was lynched in KY was the wrong man.", 679,"sn85033139", 106.150007,  22.726562,NA,NA,NA,NA
"1240",14639,"The Manitowoc pilot ","Manitowoc, Wisconsin", -87.65758, 44.088606,"Manitowoc","Wisconsin","7/20/1893",1893, 7,20,"seq-2","https://articleextractor.org/pages/14639/whi_grace_ver01/sn85033139/1893/07/20/ed-1/seq-2/1","NA, VA","NA, NA","NA, NA",NA,"VA",NA,NA,NA,NA,"Victim survived lynching and was later captured in Norfolk, VA", 679,"sn85033139", -78.656894,  37.431573,NA,NA,NA,NA
"1241",14640,"The Manitowoc pilot ","Manitowoc, Wisconsin", -87.65758, 44.088606,"Manitowoc","Wisconsin","1/28/1892",1892, 1,28,"seq-4","https://articleextractor.org/pages/14640/whi_grace_ver01/sn85033139/1892/01/28/ed-1/seq-4/1","NA, NA","NA, NA","NA, NA",NA,NA,NA,NA,NA,NA,"not actually a lynching - I think it's a joke about lynch law.", 680,"sn85033139",NA,NA,NA,NA,NA,NA
"1242",14641,"River Falls journal ","River Falls, Wisconsin", -92.62381, 44.861356,"River Falls","Wisconsin","2/15/1900",1900, 2,15,"seq-2","https://articleextractor.org/pages/14641/whi_hegmeister_ver01/sn85033255/1900/02/15/ed-1/seq-2/1","Port Arthur, TX","NA, NA","NA, NA","Port Arthur","TX",NA,NA,NA,NA,NA, 681,"sn85033255", -93.939947,  29.884950,NA,NA,NA,NA
"1243",14642,"River Falls journal ","River Falls, Wisconsin", -92.62381, 44.861356,"River Falls","Wisconsin","6/9/1904",1904, 6, 9,"seq-2","https://articleextractor.org/pages/14642/whi_hegmeister_ver01/sn85033255/1904/06/09/ed-1/seq-2/1","Trail Lake, MI","NA, NA","NA, NA","Trail Lake","MI",NA,NA,NA,NA,"three victims", 682,"sn85033255", -89.231099,  46.247853,NA,NA,NA,NA
"1244",14643,"River Falls journal ","River Falls, Wisconsin", -92.62381, 44.861356,"River Falls","Wisconsin","10/22/1903",1903,10,22,"seq-2","https://articleextractor.org/pages/14643/whi_hegmeister_ver01/sn85033255/1903/10/22/ed-1/seq-2/1","NA, NA","Hamilton, MT","Kevil, KY",NA,NA,"Hamilton","MT","Kevil","KY","first article is not a lynching", 683,"sn85033255",NA,NA,-114.15482,  46.24714, -88.88673,  37.08505
"1245",14643,"River Falls journal ","River Falls, Wisconsin", -92.62381, 44.861356,"River Falls","Wisconsin","10/22/1903",1903,10,22,"seq-2","https://articleextractor.org/pages/14643/whi_hegmeister_ver01/sn85033255/1903/10/22/ed-1/seq-2/1","Hamilton, MT","NA, NA","NA, NA","Hamilton","MT",NA,NA,NA,NA,NA, 683,"sn85033255",-114.154816,  46.247144,NA,NA,NA,NA
"1246",14643,"River Falls journal ","River Falls, Wisconsin", -92.62381, 44.861356,"River Falls","Wisconsin","10/22/1903",1903,10,22,"seq-2","https://articleextractor.org/pages/14643/whi_hegmeister_ver01/sn85033255/1903/10/22/ed-1/seq-2/1","Kevil, KY","NA, NA","NA, NA","Kevil","KY",NA,NA,NA,NA,NA, 683,"sn85033255", -88.886727,  37.085054,NA,NA,NA,NA
"1247",14643,"River Falls journal ","River Falls, Wisconsin", -92.62381, 44.861356,"River Falls","Wisconsin","10/22/1903",1903,10,22,"seq-2","https://articleextractor.org/pages/14643/whi_hegmeister_ver01/sn85033255/1903/10/22/ed-1/seq-2/1","NA, NA","Hamilton, MT","Kevil, KY",NA,NA,"Hamilton","MT","Kevil","KY","first article is not a lynching", 684,"sn85033255",NA,NA,-114.15482,  46.24714, -88.88673,  37.08505
"1248",14643,"River Falls journal ","River Falls, Wisconsin", -92.62381, 44.861356,"River Falls","Wisconsin","10/22/1903",1903,10,22,"seq-2","https://articleextractor.org/pages/14643/whi_hegmeister_ver01/sn85033255/1903/10/22/ed-1/seq-2/1","Hamilton, MT","NA, NA","NA, NA","Hamilton","MT",NA,NA,NA,NA,NA, 684,"sn85033255",-114.154816,  46.247144,NA,NA,NA,NA
"1249",14643,"River Falls journal ","River Falls, Wisconsin", -92.62381, 44.861356,"River Falls","Wisconsin","10/22/1903",1903,10,22,"seq-2","https://articleextractor.org/pages/14643/whi_hegmeister_ver01/sn85033255/1903/10/22/ed-1/seq-2/1","Kevil, KY","NA, NA","NA, NA","Kevil","KY",NA,NA,NA,NA,NA, 684,"sn85033255", -88.886727,  37.085054,NA,NA,NA,NA
"1250",14643,"River Falls journal ","River Falls, Wisconsin", -92.62381, 44.861356,"River Falls","Wisconsin","10/22/1903",1903,10,22,"seq-2","https://articleextractor.org/pages/14643/whi_hegmeister_ver01/sn85033255/1903/10/22/ed-1/seq-2/1","NA, NA","Hamilton, MT","Kevil, KY",NA,NA,"Hamilton","MT","Kevil","KY","first article is not a lynching", 685,"sn85033255",NA,NA,-114.15482,  46.24714, -88.88673,  37.08505
"1251",14643,"River Falls journal ","River Falls, Wisconsin", -92.62381, 44.861356,"River Falls","Wisconsin","10/22/1903",1903,10,22,"seq-2","https://articleextractor.org/pages/14643/whi_hegmeister_ver01/sn85033255/1903/10/22/ed-1/seq-2/1","Hamilton, MT","NA, NA","NA, NA","Hamilton","MT",NA,NA,NA,NA,NA, 685,"sn85033255",-114.154816,  46.247144,NA,NA,NA,NA
"1252",14643,"River Falls journal ","River Falls, Wisconsin", -92.62381, 44.861356,"River Falls","Wisconsin","10/22/1903",1903,10,22,"seq-2","https://articleextractor.org/pages/14643/whi_hegmeister_ver01/sn85033255/1903/10/22/ed-1/seq-2/1","Kevil, KY","NA, NA","NA, NA","Kevil","KY",NA,NA,NA,NA,NA, 685,"sn85033255", -88.886727,  37.085054,NA,NA,NA,NA
"1253",14644,"River Falls journal ","River Falls, Wisconsin", -92.62381, 44.861356,"River Falls","Wisconsin","6/4/1903",1903, 6, 4,"seq-2","https://articleextractor.org/pages/14644/whi_hegmeister_ver01/sn85033255/1903/06/04/ed-1/seq-2/1","Newcastle, WY","NA, NA","NA, NA","Newcastle","WY",NA,NA,NA,NA,NA, 686,"sn85033255",-104.204941,  43.854700,NA,NA,NA,NA
"1254",14645,"River Falls journal ","River Falls, Wisconsin", -92.62381, 44.861356,"River Falls","Wisconsin","7/19/1900",1900, 7,19,"seq-2","https://articleextractor.org/pages/14645/whi_hegmeister_ver01/sn85033255/1900/07/19/ed-1/seq-2/1","Cresswell, AL","NA, NA","NA, NA","Cresswell","AL",NA,NA,NA,NA,NA, 687,"sn85033255", -86.902298,  32.318231,NA,NA,NA,NA
"1255",14646,"The Manitowoc pilot ","Manitowoc, Wisconsin", -87.65758, 44.088606,"Manitowoc","Wisconsin","10/14/1869",1869,10,14,"seq-1","https://articleextractor.org/pages/14646/whi_grace_ver01/sn85033139/1869/10/14/ed-1/seq-1/1","Somerville, TN","NA, NA","NA, NA","Somerville","TN",NA,NA,NA,NA,"Taken from jail by a mob and hung, doesn't use the word lynch and doesn't say whether he died (I assume he did though)", 688,"sn85033139", -89.350071,  35.243697,NA,NA,NA,NA
"1256",14647,"Vilas County news ","Eagle River, Wisconsin", -89.24430, 45.917176,"Eagle River","Wisconsin","8/29/1904",1904, 8,29,"seq-2","https://articleextractor.org/pages/14647/whi_clearwater_ver01/sn85040613/1904/08/29/ed-1/seq-2/1","Statesboro, GA","NA, NA","NA, NA","Statesboro","GA",NA,NA,NA,NA,"Says it took place ""near"" Statesboro. One person was lynched, two shot, and ""several whipped.""", 689,"sn85040613", -81.783167,  32.448788,NA,NA,NA,NA
"1257",14649,"Watertown republican ","Watertown, Wisconsin", -88.72899, 43.194721,"Watertown","Wisconsin","3/13/1895",1895, 3,13,"seq-2","https://articleextractor.org/pages/14649/whi_dorothy_ver01/sn85033295/1895/03/13/ed-1/seq-2/1","NA, NA","NA, NA","NA, NA",NA,NA,NA,NA,NA,NA,"Not a lynching - story is about the governor of Ohio defending the National Guard firing on a lynch mob.", 691,"sn85033295",NA,NA,NA,NA,NA,NA
"1258",14649,"Watertown republican ","Watertown, Wisconsin", -88.72899, 43.194721,"Watertown","Wisconsin","3/13/1895",1895, 3,13,"seq-2","https://articleextractor.org/pages/14649/whi_dorothy_ver01/sn85033295/1895/03/13/ed-1/seq-2/1","NA, NA","NA, NA","NA, NA",NA,NA,NA,NA,NA,NA,"Not a lynching, but the last line is ""...considerable excitement exists, there being some talk of lynching.""", 691,"sn85033295",NA,NA,NA,NA,NA,NA
"1259",14649,"Watertown republican ","Watertown, Wisconsin", -88.72899, 43.194721,"Watertown","Wisconsin","3/13/1895",1895, 3,13,"seq-2","https://articleextractor.org/pages/14649/whi_dorothy_ver01/sn85033295/1895/03/13/ed-1/seq-2/1","NA, NA","NA, NA","NA, NA",NA,NA,NA,NA,NA,NA,"Not a lynching -- it's a story about a church attack in Bulgaria.", 691,"sn85033295",NA,NA,NA,NA,NA,NA
"1260",14649,"Watertown republican ","Watertown, Wisconsin", -88.72899, 43.194721,"Watertown","Wisconsin","3/13/1895",1895, 3,13,"seq-2","https://articleextractor.org/pages/14649/whi_dorothy_ver01/sn85033295/1895/03/13/ed-1/seq-2/1","NA, NA","NA, NA","NA, NA",NA,NA,NA,NA,NA,NA,"Not a lynching - story is about the governor of Ohio defending the National Guard firing on a lynch mob.", 692,"sn85033295",NA,NA,NA,NA,NA,NA
"1261",14649,"Watertown republican ","Watertown, Wisconsin", -88.72899, 43.194721,"Watertown","Wisconsin","3/13/1895",1895, 3,13,"seq-2","https://articleextractor.org/pages/14649/whi_dorothy_ver01/sn85033295/1895/03/13/ed-1/seq-2/1","NA, NA","NA, NA","NA, NA",NA,NA,NA,NA,NA,NA,"Not a lynching, but the last line is ""...considerable excitement exists, there being some talk of lynching.""", 692,"sn85033295",NA,NA,NA,NA,NA,NA
"1262",14649,"Watertown republican ","Watertown, Wisconsin", -88.72899, 43.194721,"Watertown","Wisconsin","3/13/1895",1895, 3,13,"seq-2","https://articleextractor.org/pages/14649/whi_dorothy_ver01/sn85033295/1895/03/13/ed-1/seq-2/1","NA, NA","NA, NA","NA, NA",NA,NA,NA,NA,NA,NA,"Not a lynching -- it's a story about a church attack in Bulgaria.", 692,"sn85033295",NA,NA,NA,NA,NA,NA
"1263",14649,"Watertown republican ","Watertown, Wisconsin", -88.72899, 43.194721,"Watertown","Wisconsin","3/13/1895",1895, 3,13,"seq-2","https://articleextractor.org/pages/14649/whi_dorothy_ver01/sn85033295/1895/03/13/ed-1/seq-2/1","NA, NA","NA, NA","NA, NA",NA,NA,NA,NA,NA,NA,"Not a lynching - story is about the governor of Ohio defending the National Guard firing on a lynch mob.", 693,"sn85033295",NA,NA,NA,NA,NA,NA
"1264",14649,"Watertown republican ","Watertown, Wisconsin", -88.72899, 43.194721,"Watertown","Wisconsin","3/13/1895",1895, 3,13,"seq-2","https://articleextractor.org/pages/14649/whi_dorothy_ver01/sn85033295/1895/03/13/ed-1/seq-2/1","NA, NA","NA, NA","NA, NA",NA,NA,NA,NA,NA,NA,"Not a lynching, but the last line is ""...considerable excitement exists, there being some talk of lynching.""", 693,"sn85033295",NA,NA,NA,NA,NA,NA
"1265",14649,"Watertown republican ","Watertown, Wisconsin", -88.72899, 43.194721,"Watertown","Wisconsin","3/13/1895",1895, 3,13,"seq-2","https://articleextractor.org/pages/14649/whi_dorothy_ver01/sn85033295/1895/03/13/ed-1/seq-2/1","NA, NA","NA, NA","NA, NA",NA,NA,NA,NA,NA,NA,"Not a lynching -- it's a story about a church attack in Bulgaria.", 693,"sn85033295",NA,NA,NA,NA,NA,NA
"1266",14650,"Watertown republican ","Watertown, Wisconsin", -88.72899, 43.194721,"Watertown","Wisconsin","4/8/1896",1896, 4, 8,"seq-2","https://articleextractor.org/pages/14650/whi_dorothy_ver01/sn85033295/1896/04/08/ed-1/seq-2/1","Clinton, IL","NA, NA","NA, NA","Clinton","IL",NA,NA,NA,NA,"Not a lynching -- intended lynching did not succeed.", 694,"sn85033295", -88.964525,  40.153648,NA,NA,NA,NA
"1267",14652,"Watertown republican ","Watertown, Wisconsin", -88.72899, 43.194721,"Watertown","Wisconsin","12/22/1897",1897,12,22,"seq-3","https://articleextractor.org/pages/14652/whi_dorothy_ver01/sn85033295/1897/12/22/ed-1/seq-3/1","NA, NA","NA, NA","NA, NA",NA,NA,NA,NA,NA,NA,"This is a report on recent hangings. The first two were confirmed legal executions, and the third one is a little more unclear but also sounds like an execution.", 695,"sn85033295",NA,NA,NA,NA,NA,NA
"1268",14653,"The Washburn times ","Washburn, Wisconsin", -90.89491, 46.673272,"Washburn","Wisconsin","2/20/1901",1901, 2,20,"seq-6","https://articleextractor.org/pages/14653/whi_doxy_ver01/sn85040437/1901/02/20/ed-1/seq-6/1","NA, NA","NA, NA","NA, NA",NA,NA,NA,NA,NA,NA,"Not a lynching -- ""Mob Threatens to Lynch"" in Hazelton, IN", 696,"sn85040437",NA,NA,NA,NA,NA,NA
